{
  "address": "0x2Dfe36db05c14647A2a0eBCd02fAc3F3258E4DdF",
  "abi": [
    {
      "inputs": [],
      "stateMutability": "nonpayable",
      "type": "constructor"
    },
    {
      "anonymous": false,
      "inputs": [
        {
          "indexed": false,
          "internalType": "string",
          "name": "action",
          "type": "string"
        },
        {
          "indexed": false,
          "internalType": "bool",
          "name": "pauseState",
          "type": "bool"
        }
      ],
      "name": "ActionPaused",
      "type": "event"
    },
    {
      "anonymous": false,
      "inputs": [
        {
          "indexed": false,
          "internalType": "contract CToken",
          "name": "cToken",
          "type": "address"
        },
        {
          "indexed": false,
          "internalType": "string",
          "name": "action",
          "type": "string"
        },
        {
          "indexed": false,
          "internalType": "bool",
          "name": "pauseState",
          "type": "bool"
        }
      ],
      "name": "ActionPaused",
      "type": "event"
    },
    {
      "anonymous": false,
      "inputs": [
        {
          "indexed": true,
          "internalType": "address",
          "name": "user",
          "type": "address"
        },
        {
          "indexed": false,
          "internalType": "uint256",
          "name": "oldCompAccrued",
          "type": "uint256"
        },
        {
          "indexed": false,
          "internalType": "uint256",
          "name": "newCompAccrued",
          "type": "uint256"
        }
      ],
      "name": "CompAccruedAdjusted",
      "type": "event"
    },
    {
      "anonymous": false,
      "inputs": [
        {
          "indexed": true,
          "internalType": "contract CToken",
          "name": "cToken",
          "type": "address"
        },
        {
          "indexed": false,
          "internalType": "uint256",
          "name": "newSpeed",
          "type": "uint256"
        }
      ],
      "name": "CompBorrowSpeedUpdated",
      "type": "event"
    },
    {
      "anonymous": false,
      "inputs": [
        {
          "indexed": false,
          "internalType": "address",
          "name": "recipient",
          "type": "address"
        },
        {
          "indexed": false,
          "internalType": "uint256",
          "name": "amount",
          "type": "uint256"
        }
      ],
      "name": "CompGranted",
      "type": "event"
    },
    {
      "anonymous": false,
      "inputs": [
        {
          "indexed": true,
          "internalType": "address",
          "name": "user",
          "type": "address"
        },
        {
          "indexed": false,
          "internalType": "uint256",
          "name": "oldCompReceivable",
          "type": "uint256"
        },
        {
          "indexed": false,
          "internalType": "uint256",
          "name": "newCompReceivable",
          "type": "uint256"
        }
      ],
      "name": "CompReceivableUpdated",
      "type": "event"
    },
    {
      "anonymous": false,
      "inputs": [
        {
          "indexed": true,
          "internalType": "contract CToken",
          "name": "cToken",
          "type": "address"
        },
        {
          "indexed": false,
          "internalType": "uint256",
          "name": "newSpeed",
          "type": "uint256"
        }
      ],
      "name": "CompSupplySpeedUpdated",
      "type": "event"
    },
    {
      "anonymous": false,
      "inputs": [
        {
          "indexed": true,
          "internalType": "address",
          "name": "contributor",
          "type": "address"
        },
        {
          "indexed": false,
          "internalType": "uint256",
          "name": "newSpeed",
          "type": "uint256"
        }
      ],
      "name": "ContributorCompSpeedUpdated",
      "type": "event"
    },
    {
      "anonymous": false,
      "inputs": [
        {
          "indexed": true,
          "internalType": "contract CToken",
          "name": "cToken",
          "type": "address"
        },
        {
          "indexed": true,
          "internalType": "address",
          "name": "borrower",
          "type": "address"
        },
        {
          "indexed": false,
          "internalType": "uint256",
          "name": "compDelta",
          "type": "uint256"
        },
        {
          "indexed": false,
          "internalType": "uint256",
          "name": "compBorrowIndex",
          "type": "uint256"
        }
      ],
      "name": "DistributedBorrowerComp",
      "type": "event"
    },
    {
      "anonymous": false,
      "inputs": [
        {
          "indexed": true,
          "internalType": "contract CToken",
          "name": "cToken",
          "type": "address"
        },
        {
          "indexed": true,
          "internalType": "address",
          "name": "supplier",
          "type": "address"
        },
        {
          "indexed": false,
          "internalType": "uint256",
          "name": "compDelta",
          "type": "uint256"
        },
        {
          "indexed": false,
          "internalType": "uint256",
          "name": "compSupplyIndex",
          "type": "uint256"
        }
      ],
      "name": "DistributedSupplierComp",
      "type": "event"
    },
    {
      "anonymous": false,
      "inputs": [
        {
          "indexed": false,
          "internalType": "uint256",
          "name": "error",
          "type": "uint256"
        },
        {
          "indexed": false,
          "internalType": "uint256",
          "name": "info",
          "type": "uint256"
        },
        {
          "indexed": false,
          "internalType": "uint256",
          "name": "detail",
          "type": "uint256"
        }
      ],
      "name": "Failure",
      "type": "event"
    },
    {
      "anonymous": false,
      "inputs": [
        {
          "indexed": false,
          "internalType": "contract CToken",
          "name": "cToken",
          "type": "address"
        },
        {
          "indexed": false,
          "internalType": "address",
          "name": "account",
          "type": "address"
        }
      ],
      "name": "MarketEntered",
      "type": "event"
    },
    {
      "anonymous": false,
      "inputs": [
        {
          "indexed": false,
          "internalType": "contract CToken",
          "name": "cToken",
          "type": "address"
        },
        {
          "indexed": false,
          "internalType": "address",
          "name": "account",
          "type": "address"
        }
      ],
      "name": "MarketExited",
      "type": "event"
    },
    {
      "anonymous": false,
      "inputs": [
        {
          "indexed": false,
          "internalType": "contract CToken",
          "name": "cToken",
          "type": "address"
        }
      ],
      "name": "MarketListed",
      "type": "event"
    },
    {
      "anonymous": false,
      "inputs": [
        {
          "indexed": true,
          "internalType": "contract CToken",
          "name": "cToken",
          "type": "address"
        },
        {
          "indexed": false,
          "internalType": "uint256",
          "name": "newBorrowCap",
          "type": "uint256"
        }
      ],
      "name": "NewBorrowCap",
      "type": "event"
    },
    {
      "anonymous": false,
      "inputs": [
        {
          "indexed": false,
          "internalType": "address",
          "name": "oldBorrowCapGuardian",
          "type": "address"
        },
        {
          "indexed": false,
          "internalType": "address",
          "name": "newBorrowCapGuardian",
          "type": "address"
        }
      ],
      "name": "NewBorrowCapGuardian",
      "type": "event"
    },
    {
      "anonymous": false,
      "inputs": [
        {
          "indexed": false,
          "internalType": "uint256",
          "name": "oldCloseFactorMantissa",
          "type": "uint256"
        },
        {
          "indexed": false,
          "internalType": "uint256",
          "name": "newCloseFactorMantissa",
          "type": "uint256"
        }
      ],
      "name": "NewCloseFactor",
      "type": "event"
    },
    {
      "anonymous": false,
      "inputs": [
        {
          "indexed": false,
          "internalType": "contract CToken",
          "name": "cToken",
          "type": "address"
        },
        {
          "indexed": false,
          "internalType": "uint256",
          "name": "oldCollateralFactorMantissa",
          "type": "uint256"
        },
        {
          "indexed": false,
          "internalType": "uint256",
          "name": "newCollateralFactorMantissa",
          "type": "uint256"
        }
      ],
      "name": "NewCollateralFactor",
      "type": "event"
    },
    {
      "anonymous": false,
      "inputs": [
        {
          "indexed": false,
          "internalType": "uint256",
          "name": "oldLiquidationIncentiveMantissa",
          "type": "uint256"
        },
        {
          "indexed": false,
          "internalType": "uint256",
          "name": "newLiquidationIncentiveMantissa",
          "type": "uint256"
        }
      ],
      "name": "NewLiquidationIncentive",
      "type": "event"
    },
    {
      "anonymous": false,
      "inputs": [
        {
          "indexed": false,
          "internalType": "address",
          "name": "oldPauseGuardian",
          "type": "address"
        },
        {
          "indexed": false,
          "internalType": "address",
          "name": "newPauseGuardian",
          "type": "address"
        }
      ],
      "name": "NewPauseGuardian",
      "type": "event"
    },
    {
      "anonymous": false,
      "inputs": [
        {
          "indexed": false,
          "internalType": "contract PriceOracle",
          "name": "oldPriceOracle",
          "type": "address"
        },
        {
          "indexed": false,
          "internalType": "contract PriceOracle",
          "name": "newPriceOracle",
          "type": "address"
        }
      ],
      "name": "NewPriceOracle",
      "type": "event"
    },
    {
      "inputs": [
        {
          "internalType": "contract Unitroller",
          "name": "unitroller",
          "type": "address"
        }
      ],
      "name": "_become",
      "outputs": [],
      "stateMutability": "nonpayable",
      "type": "function"
    },
    {
      "inputs": [],
      "name": "_borrowGuardianPaused",
      "outputs": [
        {
          "internalType": "bool",
          "name": "",
          "type": "bool"
        }
      ],
      "stateMutability": "view",
      "type": "function"
    },
    {
      "inputs": [
        {
          "internalType": "address",
          "name": "recipient",
          "type": "address"
        },
        {
          "internalType": "uint256",
          "name": "amount",
          "type": "uint256"
        }
      ],
      "name": "_grantComp",
      "outputs": [],
      "stateMutability": "nonpayable",
      "type": "function"
    },
    {
      "inputs": [],
      "name": "_mintGuardianPaused",
      "outputs": [
        {
          "internalType": "bool",
          "name": "",
          "type": "bool"
        }
      ],
      "stateMutability": "view",
      "type": "function"
    },
    {
      "inputs": [
        {
          "internalType": "address",
          "name": "newBorrowCapGuardian",
          "type": "address"
        }
      ],
      "name": "_setBorrowCapGuardian",
      "outputs": [],
      "stateMutability": "nonpayable",
      "type": "function"
    },
    {
      "inputs": [
        {
          "internalType": "contract CToken",
          "name": "cToken",
          "type": "address"
        },
        {
          "internalType": "bool",
          "name": "state",
          "type": "bool"
        }
      ],
      "name": "_setBorrowPaused",
      "outputs": [
        {
          "internalType": "bool",
          "name": "",
          "type": "bool"
        }
      ],
      "stateMutability": "nonpayable",
      "type": "function"
    },
    {
      "inputs": [
        {
          "internalType": "uint256",
          "name": "newCloseFactorMantissa",
          "type": "uint256"
        }
      ],
      "name": "_setCloseFactor",
      "outputs": [
        {
          "internalType": "uint256",
          "name": "",
          "type": "uint256"
        }
      ],
      "stateMutability": "nonpayable",
      "type": "function"
    },
    {
      "inputs": [
        {
          "internalType": "contract CToken",
          "name": "cToken",
          "type": "address"
        },
        {
          "internalType": "uint256",
          "name": "newCollateralFactorMantissa",
          "type": "uint256"
        }
      ],
      "name": "_setCollateralFactor",
      "outputs": [
        {
          "internalType": "uint256",
          "name": "",
          "type": "uint256"
        }
      ],
      "stateMutability": "nonpayable",
      "type": "function"
    },
    {
      "inputs": [
        {
          "internalType": "contract CToken[]",
          "name": "cTokens",
          "type": "address[]"
        },
        {
          "internalType": "uint256[]",
          "name": "supplySpeeds",
          "type": "uint256[]"
        },
        {
          "internalType": "uint256[]",
          "name": "borrowSpeeds",
          "type": "uint256[]"
        }
      ],
      "name": "_setCompSpeeds",
      "outputs": [],
      "stateMutability": "nonpayable",
      "type": "function"
    },
    {
      "inputs": [
        {
          "internalType": "address",
          "name": "contributor",
          "type": "address"
        },
        {
          "internalType": "uint256",
          "name": "compSpeed",
          "type": "uint256"
        }
      ],
      "name": "_setContributorCompSpeed",
      "outputs": [],
      "stateMutability": "nonpayable",
      "type": "function"
    },
    {
      "inputs": [
        {
          "internalType": "uint256",
          "name": "newLiquidationIncentiveMantissa",
          "type": "uint256"
        }
      ],
      "name": "_setLiquidationIncentive",
      "outputs": [
        {
          "internalType": "uint256",
          "name": "",
          "type": "uint256"
        }
      ],
      "stateMutability": "nonpayable",
      "type": "function"
    },
    {
      "inputs": [
        {
          "internalType": "contract CToken[]",
          "name": "cTokens",
          "type": "address[]"
        },
        {
          "internalType": "uint256[]",
          "name": "newBorrowCaps",
          "type": "uint256[]"
        }
      ],
      "name": "_setMarketBorrowCaps",
      "outputs": [],
      "stateMutability": "nonpayable",
      "type": "function"
    },
    {
      "inputs": [
        {
          "internalType": "contract CToken",
          "name": "cToken",
          "type": "address"
        },
        {
          "internalType": "bool",
          "name": "state",
          "type": "bool"
        }
      ],
      "name": "_setMintPaused",
      "outputs": [
        {
          "internalType": "bool",
          "name": "",
          "type": "bool"
        }
      ],
      "stateMutability": "nonpayable",
      "type": "function"
    },
    {
      "inputs": [
        {
          "internalType": "address",
          "name": "newPauseGuardian",
          "type": "address"
        }
      ],
      "name": "_setPauseGuardian",
      "outputs": [
        {
          "internalType": "uint256",
          "name": "",
          "type": "uint256"
        }
      ],
      "stateMutability": "nonpayable",
      "type": "function"
    },
    {
      "inputs": [
        {
          "internalType": "contract PriceOracle",
          "name": "newOracle",
          "type": "address"
        }
      ],
      "name": "_setPriceOracle",
      "outputs": [
        {
          "internalType": "uint256",
          "name": "",
          "type": "uint256"
        }
      ],
      "stateMutability": "nonpayable",
      "type": "function"
    },
    {
      "inputs": [
        {
          "internalType": "bool",
          "name": "state",
          "type": "bool"
        }
      ],
      "name": "_setSeizePaused",
      "outputs": [
        {
          "internalType": "bool",
          "name": "",
          "type": "bool"
        }
      ],
      "stateMutability": "nonpayable",
      "type": "function"
    },
    {
      "inputs": [
        {
          "internalType": "bool",
          "name": "state",
          "type": "bool"
        }
      ],
      "name": "_setTransferPaused",
      "outputs": [
        {
          "internalType": "bool",
          "name": "",
          "type": "bool"
        }
      ],
      "stateMutability": "nonpayable",
      "type": "function"
    },
    {
      "inputs": [
        {
          "internalType": "contract CToken",
          "name": "cToken",
          "type": "address"
        }
      ],
      "name": "_supportMarket",
      "outputs": [
        {
          "internalType": "uint256",
          "name": "",
          "type": "uint256"
        }
      ],
      "stateMutability": "nonpayable",
      "type": "function"
    },
    {
      "inputs": [
        {
          "internalType": "address",
          "name": "",
          "type": "address"
        },
        {
          "internalType": "uint256",
          "name": "",
          "type": "uint256"
        }
      ],
      "name": "accountAssets",
      "outputs": [
        {
          "internalType": "contract CToken",
          "name": "",
          "type": "address"
        }
      ],
      "stateMutability": "view",
      "type": "function"
    },
    {
      "inputs": [],
      "name": "admin",
      "outputs": [
        {
          "internalType": "address",
          "name": "",
          "type": "address"
        }
      ],
      "stateMutability": "view",
      "type": "function"
    },
    {
      "inputs": [
        {
          "internalType": "uint256",
          "name": "",
          "type": "uint256"
        }
      ],
      "name": "allMarkets",
      "outputs": [
        {
          "internalType": "contract CToken",
          "name": "",
          "type": "address"
        }
      ],
      "stateMutability": "view",
      "type": "function"
    },
    {
      "inputs": [
        {
          "internalType": "address",
          "name": "cToken",
          "type": "address"
        },
        {
          "internalType": "address",
          "name": "borrower",
          "type": "address"
        },
        {
          "internalType": "uint256",
          "name": "borrowAmount",
          "type": "uint256"
        }
      ],
      "name": "borrowAllowed",
      "outputs": [
        {
          "internalType": "uint256",
          "name": "",
          "type": "uint256"
        }
      ],
      "stateMutability": "nonpayable",
      "type": "function"
    },
    {
      "inputs": [],
      "name": "borrowCapGuardian",
      "outputs": [
        {
          "internalType": "address",
          "name": "",
          "type": "address"
        }
      ],
      "stateMutability": "view",
      "type": "function"
    },
    {
      "inputs": [
        {
          "internalType": "address",
          "name": "",
          "type": "address"
        }
      ],
      "name": "borrowCaps",
      "outputs": [
        {
          "internalType": "uint256",
          "name": "",
          "type": "uint256"
        }
      ],
      "stateMutability": "view",
      "type": "function"
    },
    {
      "inputs": [
        {
          "internalType": "address",
          "name": "",
          "type": "address"
        }
      ],
      "name": "borrowGuardianPaused",
      "outputs": [
        {
          "internalType": "bool",
          "name": "",
          "type": "bool"
        }
      ],
      "stateMutability": "view",
      "type": "function"
    },
    {
      "inputs": [
        {
          "internalType": "address",
          "name": "cToken",
          "type": "address"
        },
        {
          "internalType": "address",
          "name": "borrower",
          "type": "address"
        },
        {
          "internalType": "uint256",
          "name": "borrowAmount",
          "type": "uint256"
        }
      ],
      "name": "borrowVerify",
      "outputs": [],
      "stateMutability": "nonpayable",
      "type": "function"
    },
    {
      "inputs": [
        {
          "internalType": "address",
          "name": "account",
          "type": "address"
        },
        {
          "internalType": "contract CToken",
          "name": "cToken",
          "type": "address"
        }
      ],
      "name": "checkMembership",
      "outputs": [
        {
          "internalType": "bool",
          "name": "",
          "type": "bool"
        }
      ],
      "stateMutability": "view",
      "type": "function"
    },
    {
      "inputs": [
        {
          "internalType": "address",
          "name": "holder",
          "type": "address"
        },
        {
          "internalType": "contract CToken[]",
          "name": "cTokens",
          "type": "address[]"
        }
      ],
      "name": "claimComp",
      "outputs": [],
      "stateMutability": "nonpayable",
      "type": "function"
    },
    {
      "inputs": [
        {
          "internalType": "address[]",
          "name": "holders",
          "type": "address[]"
        },
        {
          "internalType": "contract CToken[]",
          "name": "cTokens",
          "type": "address[]"
        },
        {
          "internalType": "bool",
          "name": "borrowers",
          "type": "bool"
        },
        {
          "internalType": "bool",
          "name": "suppliers",
          "type": "bool"
        }
      ],
      "name": "claimComp",
      "outputs": [],
      "stateMutability": "nonpayable",
      "type": "function"
    },
    {
      "inputs": [
        {
          "internalType": "address",
          "name": "holder",
          "type": "address"
        }
      ],
      "name": "claimComp",
      "outputs": [],
      "stateMutability": "nonpayable",
      "type": "function"
    },
    {
      "inputs": [],
      "name": "closeFactorMantissa",
      "outputs": [
        {
          "internalType": "uint256",
          "name": "",
          "type": "uint256"
        }
      ],
      "stateMutability": "view",
      "type": "function"
    },
    {
      "inputs": [
        {
          "internalType": "address",
          "name": "",
          "type": "address"
        }
      ],
      "name": "compAccrued",
      "outputs": [
        {
          "internalType": "uint256",
          "name": "",
          "type": "uint256"
        }
      ],
      "stateMutability": "view",
      "type": "function"
    },
    {
      "inputs": [
        {
          "internalType": "address",
          "name": "",
          "type": "address"
        }
      ],
      "name": "compBorrowSpeeds",
      "outputs": [
        {
          "internalType": "uint256",
          "name": "",
          "type": "uint256"
        }
      ],
      "stateMutability": "view",
      "type": "function"
    },
    {
      "inputs": [
        {
          "internalType": "address",
          "name": "",
          "type": "address"
        }
      ],
      "name": "compBorrowState",
      "outputs": [
        {
          "internalType": "uint224",
          "name": "index",
          "type": "uint224"
        },
        {
          "internalType": "uint32",
          "name": "block",
          "type": "uint32"
        }
      ],
      "stateMutability": "view",
      "type": "function"
    },
    {
      "inputs": [
        {
          "internalType": "address",
          "name": "",
          "type": "address"
        },
        {
          "internalType": "address",
          "name": "",
          "type": "address"
        }
      ],
      "name": "compBorrowerIndex",
      "outputs": [
        {
          "internalType": "uint256",
          "name": "",
          "type": "uint256"
        }
      ],
      "stateMutability": "view",
      "type": "function"
    },
    {
      "inputs": [
        {
          "internalType": "address",
          "name": "",
          "type": "address"
        }
      ],
      "name": "compContributorSpeeds",
      "outputs": [
        {
          "internalType": "uint256",
          "name": "",
          "type": "uint256"
        }
      ],
      "stateMutability": "view",
      "type": "function"
    },
    {
      "inputs": [],
      "name": "compInitialIndex",
      "outputs": [
        {
          "internalType": "uint224",
          "name": "",
          "type": "uint224"
        }
      ],
      "stateMutability": "view",
      "type": "function"
    },
    {
      "inputs": [],
      "name": "compRate",
      "outputs": [
        {
          "internalType": "uint256",
          "name": "",
          "type": "uint256"
        }
      ],
      "stateMutability": "view",
      "type": "function"
    },
    {
      "inputs": [
        {
          "internalType": "address",
          "name": "",
          "type": "address"
        }
      ],
      "name": "compReceivable",
      "outputs": [
        {
          "internalType": "uint256",
          "name": "",
          "type": "uint256"
        }
      ],
      "stateMutability": "view",
      "type": "function"
    },
    {
      "inputs": [
        {
          "internalType": "address",
          "name": "",
          "type": "address"
        }
      ],
      "name": "compSpeeds",
      "outputs": [
        {
          "internalType": "uint256",
          "name": "",
          "type": "uint256"
        }
      ],
      "stateMutability": "view",
      "type": "function"
    },
    {
      "inputs": [
        {
          "internalType": "address",
          "name": "",
          "type": "address"
        },
        {
          "internalType": "address",
          "name": "",
          "type": "address"
        }
      ],
      "name": "compSupplierIndex",
      "outputs": [
        {
          "internalType": "uint256",
          "name": "",
          "type": "uint256"
        }
      ],
      "stateMutability": "view",
      "type": "function"
    },
    {
      "inputs": [
        {
          "internalType": "address",
          "name": "",
          "type": "address"
        }
      ],
      "name": "compSupplySpeeds",
      "outputs": [
        {
          "internalType": "uint256",
          "name": "",
          "type": "uint256"
        }
      ],
      "stateMutability": "view",
      "type": "function"
    },
    {
      "inputs": [
        {
          "internalType": "address",
          "name": "",
          "type": "address"
        }
      ],
      "name": "compSupplyState",
      "outputs": [
        {
          "internalType": "uint224",
          "name": "index",
          "type": "uint224"
        },
        {
          "internalType": "uint32",
          "name": "block",
          "type": "uint32"
        }
      ],
      "stateMutability": "view",
      "type": "function"
    },
    {
      "inputs": [],
      "name": "comptrollerImplementation",
      "outputs": [
        {
          "internalType": "address",
          "name": "",
          "type": "address"
        }
      ],
      "stateMutability": "view",
      "type": "function"
    },
    {
      "inputs": [
        {
          "internalType": "address[]",
          "name": "cTokens",
          "type": "address[]"
        }
      ],
      "name": "enterMarkets",
      "outputs": [
        {
          "internalType": "uint256[]",
          "name": "",
          "type": "uint256[]"
        }
      ],
      "stateMutability": "nonpayable",
      "type": "function"
    },
    {
      "inputs": [
        {
          "internalType": "address",
          "name": "cTokenAddress",
          "type": "address"
        }
      ],
      "name": "exitMarket",
      "outputs": [
        {
          "internalType": "uint256",
          "name": "",
          "type": "uint256"
        }
      ],
      "stateMutability": "nonpayable",
      "type": "function"
    },
    {
      "inputs": [
        {
          "internalType": "address[]",
          "name": "affectedUsers",
          "type": "address[]"
        },
        {
          "internalType": "uint256[]",
          "name": "amounts",
          "type": "uint256[]"
        }
      ],
      "name": "fixBadAccruals",
      "outputs": [],
      "stateMutability": "nonpayable",
      "type": "function"
    },
    {
      "inputs": [
        {
          "internalType": "address",
          "name": "account",
          "type": "address"
        }
      ],
      "name": "getAccountLiquidity",
      "outputs": [
        {
          "internalType": "uint256",
          "name": "",
          "type": "uint256"
        },
        {
          "internalType": "uint256",
          "name": "",
          "type": "uint256"
        },
        {
          "internalType": "uint256",
          "name": "",
          "type": "uint256"
        }
      ],
      "stateMutability": "view",
      "type": "function"
    },
    {
      "inputs": [],
      "name": "getAllMarkets",
      "outputs": [
        {
          "internalType": "contract CToken[]",
          "name": "",
          "type": "address[]"
        }
      ],
      "stateMutability": "view",
      "type": "function"
    },
    {
      "inputs": [
        {
          "internalType": "address",
          "name": "account",
          "type": "address"
        }
      ],
      "name": "getAssetsIn",
      "outputs": [
        {
          "internalType": "contract CToken[]",
          "name": "",
          "type": "address[]"
        }
      ],
      "stateMutability": "view",
      "type": "function"
    },
    {
      "inputs": [],
      "name": "getBlockNumber",
      "outputs": [
        {
          "internalType": "uint256",
          "name": "",
          "type": "uint256"
        }
      ],
      "stateMutability": "view",
      "type": "function"
    },
    {
      "inputs": [],
      "name": "getCompAddress",
      "outputs": [
        {
          "internalType": "address",
          "name": "",
          "type": "address"
        }
      ],
      "stateMutability": "view",
      "type": "function"
    },
    {
      "inputs": [
        {
          "internalType": "address",
          "name": "account",
          "type": "address"
        },
        {
          "internalType": "address",
          "name": "cTokenModify",
          "type": "address"
        },
        {
          "internalType": "uint256",
          "name": "redeemTokens",
          "type": "uint256"
        },
        {
          "internalType": "uint256",
          "name": "borrowAmount",
          "type": "uint256"
        }
      ],
      "name": "getHypotheticalAccountLiquidity",
      "outputs": [
        {
          "internalType": "uint256",
          "name": "",
          "type": "uint256"
        },
        {
          "internalType": "uint256",
          "name": "",
          "type": "uint256"
        },
        {
          "internalType": "uint256",
          "name": "",
          "type": "uint256"
        }
      ],
      "stateMutability": "view",
      "type": "function"
    },
    {
      "inputs": [],
      "name": "isComptroller",
      "outputs": [
        {
          "internalType": "bool",
          "name": "",
          "type": "bool"
        }
      ],
      "stateMutability": "view",
      "type": "function"
    },
    {
      "inputs": [
        {
          "internalType": "contract CToken",
          "name": "cToken",
          "type": "address"
        }
      ],
      "name": "isDeprecated",
      "outputs": [
        {
          "internalType": "bool",
          "name": "",
          "type": "bool"
        }
      ],
      "stateMutability": "view",
      "type": "function"
    },
    {
      "inputs": [
        {
          "internalType": "address",
          "name": "",
          "type": "address"
        }
      ],
      "name": "lastContributorBlock",
      "outputs": [
        {
          "internalType": "uint256",
          "name": "",
          "type": "uint256"
        }
      ],
      "stateMutability": "view",
      "type": "function"
    },
    {
      "inputs": [
        {
          "internalType": "address",
          "name": "cTokenBorrowed",
          "type": "address"
        },
        {
          "internalType": "address",
          "name": "cTokenCollateral",
          "type": "address"
        },
        {
          "internalType": "address",
          "name": "liquidator",
          "type": "address"
        },
        {
          "internalType": "address",
          "name": "borrower",
          "type": "address"
        },
        {
          "internalType": "uint256",
          "name": "repayAmount",
          "type": "uint256"
        }
      ],
      "name": "liquidateBorrowAllowed",
      "outputs": [
        {
          "internalType": "uint256",
          "name": "",
          "type": "uint256"
        }
      ],
      "stateMutability": "nonpayable",
      "type": "function"
    },
    {
      "inputs": [
        {
          "internalType": "address",
          "name": "cTokenBorrowed",
          "type": "address"
        },
        {
          "internalType": "address",
          "name": "cTokenCollateral",
          "type": "address"
        },
        {
          "internalType": "address",
          "name": "liquidator",
          "type": "address"
        },
        {
          "internalType": "address",
          "name": "borrower",
          "type": "address"
        },
        {
          "internalType": "uint256",
          "name": "actualRepayAmount",
          "type": "uint256"
        },
        {
          "internalType": "uint256",
          "name": "seizeTokens",
          "type": "uint256"
        }
      ],
      "name": "liquidateBorrowVerify",
      "outputs": [],
      "stateMutability": "nonpayable",
      "type": "function"
    },
    {
      "inputs": [
        {
          "internalType": "address",
          "name": "cTokenBorrowed",
          "type": "address"
        },
        {
          "internalType": "address",
          "name": "cTokenCollateral",
          "type": "address"
        },
        {
          "internalType": "uint256",
          "name": "actualRepayAmount",
          "type": "uint256"
        }
      ],
      "name": "liquidateCalculateSeizeTokens",
      "outputs": [
        {
          "internalType": "uint256",
          "name": "",
          "type": "uint256"
        },
        {
          "internalType": "uint256",
          "name": "",
          "type": "uint256"
        }
      ],
      "stateMutability": "view",
      "type": "function"
    },
    {
      "inputs": [],
      "name": "liquidationIncentiveMantissa",
      "outputs": [
        {
          "internalType": "uint256",
          "name": "",
          "type": "uint256"
        }
      ],
      "stateMutability": "view",
      "type": "function"
    },
    {
      "inputs": [
        {
          "internalType": "address",
          "name": "",
          "type": "address"
        }
      ],
      "name": "markets",
      "outputs": [
        {
          "internalType": "bool",
          "name": "isListed",
          "type": "bool"
        },
        {
          "internalType": "uint256",
          "name": "collateralFactorMantissa",
          "type": "uint256"
        },
        {
          "internalType": "bool",
          "name": "isComped",
          "type": "bool"
        }
      ],
      "stateMutability": "view",
      "type": "function"
    },
    {
      "inputs": [],
      "name": "maxAssets",
      "outputs": [
        {
          "internalType": "uint256",
          "name": "",
          "type": "uint256"
        }
      ],
      "stateMutability": "view",
      "type": "function"
    },
    {
      "inputs": [
        {
          "internalType": "address",
          "name": "cToken",
          "type": "address"
        },
        {
          "internalType": "address",
          "name": "minter",
          "type": "address"
        },
        {
          "internalType": "uint256",
          "name": "mintAmount",
          "type": "uint256"
        }
      ],
      "name": "mintAllowed",
      "outputs": [
        {
          "internalType": "uint256",
          "name": "",
          "type": "uint256"
        }
      ],
      "stateMutability": "nonpayable",
      "type": "function"
    },
    {
      "inputs": [
        {
          "internalType": "address",
          "name": "",
          "type": "address"
        }
      ],
      "name": "mintGuardianPaused",
      "outputs": [
        {
          "internalType": "bool",
          "name": "",
          "type": "bool"
        }
      ],
      "stateMutability": "view",
      "type": "function"
    },
    {
      "inputs": [
        {
          "internalType": "address",
          "name": "cToken",
          "type": "address"
        },
        {
          "internalType": "address",
          "name": "minter",
          "type": "address"
        },
        {
          "internalType": "uint256",
          "name": "actualMintAmount",
          "type": "uint256"
        },
        {
          "internalType": "uint256",
          "name": "mintTokens",
          "type": "uint256"
        }
      ],
      "name": "mintVerify",
      "outputs": [],
      "stateMutability": "nonpayable",
      "type": "function"
    },
    {
      "inputs": [],
      "name": "oracle",
      "outputs": [
        {
          "internalType": "contract PriceOracle",
          "name": "",
          "type": "address"
        }
      ],
      "stateMutability": "view",
      "type": "function"
    },
    {
      "inputs": [],
      "name": "pauseGuardian",
      "outputs": [
        {
          "internalType": "address",
          "name": "",
          "type": "address"
        }
      ],
      "stateMutability": "view",
      "type": "function"
    },
    {
      "inputs": [],
      "name": "pendingAdmin",
      "outputs": [
        {
          "internalType": "address",
          "name": "",
          "type": "address"
        }
      ],
      "stateMutability": "view",
      "type": "function"
    },
    {
      "inputs": [],
      "name": "pendingComptrollerImplementation",
      "outputs": [
        {
          "internalType": "address",
          "name": "",
          "type": "address"
        }
      ],
      "stateMutability": "view",
      "type": "function"
    },
    {
      "inputs": [],
      "name": "proposal65FixExecuted",
      "outputs": [
        {
          "internalType": "bool",
          "name": "",
          "type": "bool"
        }
      ],
      "stateMutability": "view",
      "type": "function"
    },
    {
      "inputs": [
        {
          "internalType": "address",
          "name": "cToken",
          "type": "address"
        },
        {
          "internalType": "address",
          "name": "redeemer",
          "type": "address"
        },
        {
          "internalType": "uint256",
          "name": "redeemTokens",
          "type": "uint256"
        }
      ],
      "name": "redeemAllowed",
      "outputs": [
        {
          "internalType": "uint256",
          "name": "",
          "type": "uint256"
        }
      ],
      "stateMutability": "nonpayable",
      "type": "function"
    },
    {
      "inputs": [
        {
          "internalType": "address",
          "name": "cToken",
          "type": "address"
        },
        {
          "internalType": "address",
          "name": "redeemer",
          "type": "address"
        },
        {
          "internalType": "uint256",
          "name": "redeemAmount",
          "type": "uint256"
        },
        {
          "internalType": "uint256",
          "name": "redeemTokens",
          "type": "uint256"
        }
      ],
      "name": "redeemVerify",
      "outputs": [],
      "stateMutability": "nonpayable",
      "type": "function"
    },
    {
      "inputs": [
        {
          "internalType": "address",
          "name": "cToken",
          "type": "address"
        },
        {
          "internalType": "address",
          "name": "payer",
          "type": "address"
        },
        {
          "internalType": "address",
          "name": "borrower",
          "type": "address"
        },
        {
          "internalType": "uint256",
          "name": "repayAmount",
          "type": "uint256"
        }
      ],
      "name": "repayBorrowAllowed",
      "outputs": [
        {
          "internalType": "uint256",
          "name": "",
          "type": "uint256"
        }
      ],
      "stateMutability": "nonpayable",
      "type": "function"
    },
    {
      "inputs": [
        {
          "internalType": "address",
          "name": "cToken",
          "type": "address"
        },
        {
          "internalType": "address",
          "name": "payer",
          "type": "address"
        },
        {
          "internalType": "address",
          "name": "borrower",
          "type": "address"
        },
        {
          "internalType": "uint256",
          "name": "actualRepayAmount",
          "type": "uint256"
        },
        {
          "internalType": "uint256",
          "name": "borrowerIndex",
          "type": "uint256"
        }
      ],
      "name": "repayBorrowVerify",
      "outputs": [],
      "stateMutability": "nonpayable",
      "type": "function"
    },
    {
      "inputs": [
        {
          "internalType": "address",
          "name": "cTokenCollateral",
          "type": "address"
        },
        {
          "internalType": "address",
          "name": "cTokenBorrowed",
          "type": "address"
        },
        {
          "internalType": "address",
          "name": "liquidator",
          "type": "address"
        },
        {
          "internalType": "address",
          "name": "borrower",
          "type": "address"
        },
        {
          "internalType": "uint256",
          "name": "seizeTokens",
          "type": "uint256"
        }
      ],
      "name": "seizeAllowed",
      "outputs": [
        {
          "internalType": "uint256",
          "name": "",
          "type": "uint256"
        }
      ],
      "stateMutability": "nonpayable",
      "type": "function"
    },
    {
      "inputs": [],
      "name": "seizeGuardianPaused",
      "outputs": [
        {
          "internalType": "bool",
          "name": "",
          "type": "bool"
        }
      ],
      "stateMutability": "view",
      "type": "function"
    },
    {
      "inputs": [
        {
          "internalType": "address",
          "name": "cTokenCollateral",
          "type": "address"
        },
        {
          "internalType": "address",
          "name": "cTokenBorrowed",
          "type": "address"
        },
        {
          "internalType": "address",
          "name": "liquidator",
          "type": "address"
        },
        {
          "internalType": "address",
          "name": "borrower",
          "type": "address"
        },
        {
          "internalType": "uint256",
          "name": "seizeTokens",
          "type": "uint256"
        }
      ],
      "name": "seizeVerify",
      "outputs": [],
      "stateMutability": "nonpayable",
      "type": "function"
    },
    {
      "inputs": [
        {
          "internalType": "address",
          "name": "cToken",
          "type": "address"
        },
        {
          "internalType": "address",
          "name": "src",
          "type": "address"
        },
        {
          "internalType": "address",
          "name": "dst",
          "type": "address"
        },
        {
          "internalType": "uint256",
          "name": "transferTokens",
          "type": "uint256"
        }
      ],
      "name": "transferAllowed",
      "outputs": [
        {
          "internalType": "uint256",
          "name": "",
          "type": "uint256"
        }
      ],
      "stateMutability": "nonpayable",
      "type": "function"
    },
    {
      "inputs": [],
      "name": "transferGuardianPaused",
      "outputs": [
        {
          "internalType": "bool",
          "name": "",
          "type": "bool"
        }
      ],
      "stateMutability": "view",
      "type": "function"
    },
    {
      "inputs": [
        {
          "internalType": "address",
          "name": "cToken",
          "type": "address"
        },
        {
          "internalType": "address",
          "name": "src",
          "type": "address"
        },
        {
          "internalType": "address",
          "name": "dst",
          "type": "address"
        },
        {
          "internalType": "uint256",
          "name": "transferTokens",
          "type": "uint256"
        }
      ],
      "name": "transferVerify",
      "outputs": [],
      "stateMutability": "nonpayable",
      "type": "function"
    },
    {
      "inputs": [
        {
          "internalType": "address",
          "name": "contributor",
          "type": "address"
        }
      ],
      "name": "updateContributorRewards",
      "outputs": [],
      "stateMutability": "nonpayable",
      "type": "function"
    }
  ],
  "transactionHash": "0x26e9c8cc52d718981ad8ffabf03bcaa5ce11bdb700e07df4ab21a6577e69d3f7",
  "receipt": {
    "to": null,
    "from": "0xFb59Ce8986943163F14C590755b29dB2998F2322",
    "contractAddress": "0x2Dfe36db05c14647A2a0eBCd02fAc3F3258E4DdF",
    "transactionIndex": 1,
    "gasUsed": "4732009",
    "logsBloom": "0x00000000000000000000000000000000000000000000000000000000000000000000000000000000000000000000000000000000000000000000000000000000000000000000000000000000000000000000000000000000000000000000000000000000000000000000000000000000000000000000000000000000000000000000000000000000000000000000000000000000000000000000000000000000000000000000000000000000000000000000000000000000000000000000000000000000000000000000000000000000000000000000000000000000000000000000000000000000000000000000000000000000000000000000000000000000",
    "blockHash": "0x93e8b3fd642691815c5d7cada2bc3adf3022f50234465f65b7d7e4611f3e0c43",
    "transactionHash": "0x26e9c8cc52d718981ad8ffabf03bcaa5ce11bdb700e07df4ab21a6577e69d3f7",
    "logs": [],
    "blockNumber": 3802131,
    "cumulativeGasUsed": "5014759",
    "status": 1,
    "byzantium": true
  },
  "args": [],
  "numDeployments": 1,
  "solcInputHash": "d6ea044bc3f68680d21cd82f6e28effc",
  "metadata": "{\"compiler\":{\"version\":\"0.8.10+commit.fc410830\"},\"language\":\"Solidity\",\"output\":{\"abi\":[{\"inputs\":[],\"stateMutability\":\"nonpayable\",\"type\":\"constructor\"},{\"anonymous\":false,\"inputs\":[{\"indexed\":false,\"internalType\":\"string\",\"name\":\"action\",\"type\":\"string\"},{\"indexed\":false,\"internalType\":\"bool\",\"name\":\"pauseState\",\"type\":\"bool\"}],\"name\":\"ActionPaused\",\"type\":\"event\"},{\"anonymous\":false,\"inputs\":[{\"indexed\":false,\"internalType\":\"contract CToken\",\"name\":\"cToken\",\"type\":\"address\"},{\"indexed\":false,\"internalType\":\"string\",\"name\":\"action\",\"type\":\"string\"},{\"indexed\":false,\"internalType\":\"bool\",\"name\":\"pauseState\",\"type\":\"bool\"}],\"name\":\"ActionPaused\",\"type\":\"event\"},{\"anonymous\":false,\"inputs\":[{\"indexed\":true,\"internalType\":\"address\",\"name\":\"user\",\"type\":\"address\"},{\"indexed\":false,\"internalType\":\"uint256\",\"name\":\"oldCompAccrued\",\"type\":\"uint256\"},{\"indexed\":false,\"internalType\":\"uint256\",\"name\":\"newCompAccrued\",\"type\":\"uint256\"}],\"name\":\"CompAccruedAdjusted\",\"type\":\"event\"},{\"anonymous\":false,\"inputs\":[{\"indexed\":true,\"internalType\":\"contract CToken\",\"name\":\"cToken\",\"type\":\"address\"},{\"indexed\":false,\"internalType\":\"uint256\",\"name\":\"newSpeed\",\"type\":\"uint256\"}],\"name\":\"CompBorrowSpeedUpdated\",\"type\":\"event\"},{\"anonymous\":false,\"inputs\":[{\"indexed\":false,\"internalType\":\"address\",\"name\":\"recipient\",\"type\":\"address\"},{\"indexed\":false,\"internalType\":\"uint256\",\"name\":\"amount\",\"type\":\"uint256\"}],\"name\":\"CompGranted\",\"type\":\"event\"},{\"anonymous\":false,\"inputs\":[{\"indexed\":true,\"internalType\":\"address\",\"name\":\"user\",\"type\":\"address\"},{\"indexed\":false,\"internalType\":\"uint256\",\"name\":\"oldCompReceivable\",\"type\":\"uint256\"},{\"indexed\":false,\"internalType\":\"uint256\",\"name\":\"newCompReceivable\",\"type\":\"uint256\"}],\"name\":\"CompReceivableUpdated\",\"type\":\"event\"},{\"anonymous\":false,\"inputs\":[{\"indexed\":true,\"internalType\":\"contract CToken\",\"name\":\"cToken\",\"type\":\"address\"},{\"indexed\":false,\"internalType\":\"uint256\",\"name\":\"newSpeed\",\"type\":\"uint256\"}],\"name\":\"CompSupplySpeedUpdated\",\"type\":\"event\"},{\"anonymous\":false,\"inputs\":[{\"indexed\":true,\"internalType\":\"address\",\"name\":\"contributor\",\"type\":\"address\"},{\"indexed\":false,\"internalType\":\"uint256\",\"name\":\"newSpeed\",\"type\":\"uint256\"}],\"name\":\"ContributorCompSpeedUpdated\",\"type\":\"event\"},{\"anonymous\":false,\"inputs\":[{\"indexed\":true,\"internalType\":\"contract CToken\",\"name\":\"cToken\",\"type\":\"address\"},{\"indexed\":true,\"internalType\":\"address\",\"name\":\"borrower\",\"type\":\"address\"},{\"indexed\":false,\"internalType\":\"uint256\",\"name\":\"compDelta\",\"type\":\"uint256\"},{\"indexed\":false,\"internalType\":\"uint256\",\"name\":\"compBorrowIndex\",\"type\":\"uint256\"}],\"name\":\"DistributedBorrowerComp\",\"type\":\"event\"},{\"anonymous\":false,\"inputs\":[{\"indexed\":true,\"internalType\":\"contract CToken\",\"name\":\"cToken\",\"type\":\"address\"},{\"indexed\":true,\"internalType\":\"address\",\"name\":\"supplier\",\"type\":\"address\"},{\"indexed\":false,\"internalType\":\"uint256\",\"name\":\"compDelta\",\"type\":\"uint256\"},{\"indexed\":false,\"internalType\":\"uint256\",\"name\":\"compSupplyIndex\",\"type\":\"uint256\"}],\"name\":\"DistributedSupplierComp\",\"type\":\"event\"},{\"anonymous\":false,\"inputs\":[{\"indexed\":false,\"internalType\":\"uint256\",\"name\":\"error\",\"type\":\"uint256\"},{\"indexed\":false,\"internalType\":\"uint256\",\"name\":\"info\",\"type\":\"uint256\"},{\"indexed\":false,\"internalType\":\"uint256\",\"name\":\"detail\",\"type\":\"uint256\"}],\"name\":\"Failure\",\"type\":\"event\"},{\"anonymous\":false,\"inputs\":[{\"indexed\":false,\"internalType\":\"contract CToken\",\"name\":\"cToken\",\"type\":\"address\"},{\"indexed\":false,\"internalType\":\"address\",\"name\":\"account\",\"type\":\"address\"}],\"name\":\"MarketEntered\",\"type\":\"event\"},{\"anonymous\":false,\"inputs\":[{\"indexed\":false,\"internalType\":\"contract CToken\",\"name\":\"cToken\",\"type\":\"address\"},{\"indexed\":false,\"internalType\":\"address\",\"name\":\"account\",\"type\":\"address\"}],\"name\":\"MarketExited\",\"type\":\"event\"},{\"anonymous\":false,\"inputs\":[{\"indexed\":false,\"internalType\":\"contract CToken\",\"name\":\"cToken\",\"type\":\"address\"}],\"name\":\"MarketListed\",\"type\":\"event\"},{\"anonymous\":false,\"inputs\":[{\"indexed\":true,\"internalType\":\"contract CToken\",\"name\":\"cToken\",\"type\":\"address\"},{\"indexed\":false,\"internalType\":\"uint256\",\"name\":\"newBorrowCap\",\"type\":\"uint256\"}],\"name\":\"NewBorrowCap\",\"type\":\"event\"},{\"anonymous\":false,\"inputs\":[{\"indexed\":false,\"internalType\":\"address\",\"name\":\"oldBorrowCapGuardian\",\"type\":\"address\"},{\"indexed\":false,\"internalType\":\"address\",\"name\":\"newBorrowCapGuardian\",\"type\":\"address\"}],\"name\":\"NewBorrowCapGuardian\",\"type\":\"event\"},{\"anonymous\":false,\"inputs\":[{\"indexed\":false,\"internalType\":\"uint256\",\"name\":\"oldCloseFactorMantissa\",\"type\":\"uint256\"},{\"indexed\":false,\"internalType\":\"uint256\",\"name\":\"newCloseFactorMantissa\",\"type\":\"uint256\"}],\"name\":\"NewCloseFactor\",\"type\":\"event\"},{\"anonymous\":false,\"inputs\":[{\"indexed\":false,\"internalType\":\"contract CToken\",\"name\":\"cToken\",\"type\":\"address\"},{\"indexed\":false,\"internalType\":\"uint256\",\"name\":\"oldCollateralFactorMantissa\",\"type\":\"uint256\"},{\"indexed\":false,\"internalType\":\"uint256\",\"name\":\"newCollateralFactorMantissa\",\"type\":\"uint256\"}],\"name\":\"NewCollateralFactor\",\"type\":\"event\"},{\"anonymous\":false,\"inputs\":[{\"indexed\":false,\"internalType\":\"uint256\",\"name\":\"oldLiquidationIncentiveMantissa\",\"type\":\"uint256\"},{\"indexed\":false,\"internalType\":\"uint256\",\"name\":\"newLiquidationIncentiveMantissa\",\"type\":\"uint256\"}],\"name\":\"NewLiquidationIncentive\",\"type\":\"event\"},{\"anonymous\":false,\"inputs\":[{\"indexed\":false,\"internalType\":\"address\",\"name\":\"oldPauseGuardian\",\"type\":\"address\"},{\"indexed\":false,\"internalType\":\"address\",\"name\":\"newPauseGuardian\",\"type\":\"address\"}],\"name\":\"NewPauseGuardian\",\"type\":\"event\"},{\"anonymous\":false,\"inputs\":[{\"indexed\":false,\"internalType\":\"contract PriceOracle\",\"name\":\"oldPriceOracle\",\"type\":\"address\"},{\"indexed\":false,\"internalType\":\"contract PriceOracle\",\"name\":\"newPriceOracle\",\"type\":\"address\"}],\"name\":\"NewPriceOracle\",\"type\":\"event\"},{\"inputs\":[{\"internalType\":\"contract Unitroller\",\"name\":\"unitroller\",\"type\":\"address\"}],\"name\":\"_become\",\"outputs\":[],\"stateMutability\":\"nonpayable\",\"type\":\"function\"},{\"inputs\":[],\"name\":\"_borrowGuardianPaused\",\"outputs\":[{\"internalType\":\"bool\",\"name\":\"\",\"type\":\"bool\"}],\"stateMutability\":\"view\",\"type\":\"function\"},{\"inputs\":[{\"internalType\":\"address\",\"name\":\"recipient\",\"type\":\"address\"},{\"internalType\":\"uint256\",\"name\":\"amount\",\"type\":\"uint256\"}],\"name\":\"_grantComp\",\"outputs\":[],\"stateMutability\":\"nonpayable\",\"type\":\"function\"},{\"inputs\":[],\"name\":\"_mintGuardianPaused\",\"outputs\":[{\"internalType\":\"bool\",\"name\":\"\",\"type\":\"bool\"}],\"stateMutability\":\"view\",\"type\":\"function\"},{\"inputs\":[{\"internalType\":\"address\",\"name\":\"newBorrowCapGuardian\",\"type\":\"address\"}],\"name\":\"_setBorrowCapGuardian\",\"outputs\":[],\"stateMutability\":\"nonpayable\",\"type\":\"function\"},{\"inputs\":[{\"internalType\":\"contract CToken\",\"name\":\"cToken\",\"type\":\"address\"},{\"internalType\":\"bool\",\"name\":\"state\",\"type\":\"bool\"}],\"name\":\"_setBorrowPaused\",\"outputs\":[{\"internalType\":\"bool\",\"name\":\"\",\"type\":\"bool\"}],\"stateMutability\":\"nonpayable\",\"type\":\"function\"},{\"inputs\":[{\"internalType\":\"uint256\",\"name\":\"newCloseFactorMantissa\",\"type\":\"uint256\"}],\"name\":\"_setCloseFactor\",\"outputs\":[{\"internalType\":\"uint256\",\"name\":\"\",\"type\":\"uint256\"}],\"stateMutability\":\"nonpayable\",\"type\":\"function\"},{\"inputs\":[{\"internalType\":\"contract CToken\",\"name\":\"cToken\",\"type\":\"address\"},{\"internalType\":\"uint256\",\"name\":\"newCollateralFactorMantissa\",\"type\":\"uint256\"}],\"name\":\"_setCollateralFactor\",\"outputs\":[{\"internalType\":\"uint256\",\"name\":\"\",\"type\":\"uint256\"}],\"stateMutability\":\"nonpayable\",\"type\":\"function\"},{\"inputs\":[{\"internalType\":\"contract CToken[]\",\"name\":\"cTokens\",\"type\":\"address[]\"},{\"internalType\":\"uint256[]\",\"name\":\"supplySpeeds\",\"type\":\"uint256[]\"},{\"internalType\":\"uint256[]\",\"name\":\"borrowSpeeds\",\"type\":\"uint256[]\"}],\"name\":\"_setCompSpeeds\",\"outputs\":[],\"stateMutability\":\"nonpayable\",\"type\":\"function\"},{\"inputs\":[{\"internalType\":\"address\",\"name\":\"contributor\",\"type\":\"address\"},{\"internalType\":\"uint256\",\"name\":\"compSpeed\",\"type\":\"uint256\"}],\"name\":\"_setContributorCompSpeed\",\"outputs\":[],\"stateMutability\":\"nonpayable\",\"type\":\"function\"},{\"inputs\":[{\"internalType\":\"uint256\",\"name\":\"newLiquidationIncentiveMantissa\",\"type\":\"uint256\"}],\"name\":\"_setLiquidationIncentive\",\"outputs\":[{\"internalType\":\"uint256\",\"name\":\"\",\"type\":\"uint256\"}],\"stateMutability\":\"nonpayable\",\"type\":\"function\"},{\"inputs\":[{\"internalType\":\"contract CToken[]\",\"name\":\"cTokens\",\"type\":\"address[]\"},{\"internalType\":\"uint256[]\",\"name\":\"newBorrowCaps\",\"type\":\"uint256[]\"}],\"name\":\"_setMarketBorrowCaps\",\"outputs\":[],\"stateMutability\":\"nonpayable\",\"type\":\"function\"},{\"inputs\":[{\"internalType\":\"contract CToken\",\"name\":\"cToken\",\"type\":\"address\"},{\"internalType\":\"bool\",\"name\":\"state\",\"type\":\"bool\"}],\"name\":\"_setMintPaused\",\"outputs\":[{\"internalType\":\"bool\",\"name\":\"\",\"type\":\"bool\"}],\"stateMutability\":\"nonpayable\",\"type\":\"function\"},{\"inputs\":[{\"internalType\":\"address\",\"name\":\"newPauseGuardian\",\"type\":\"address\"}],\"name\":\"_setPauseGuardian\",\"outputs\":[{\"internalType\":\"uint256\",\"name\":\"\",\"type\":\"uint256\"}],\"stateMutability\":\"nonpayable\",\"type\":\"function\"},{\"inputs\":[{\"internalType\":\"contract PriceOracle\",\"name\":\"newOracle\",\"type\":\"address\"}],\"name\":\"_setPriceOracle\",\"outputs\":[{\"internalType\":\"uint256\",\"name\":\"\",\"type\":\"uint256\"}],\"stateMutability\":\"nonpayable\",\"type\":\"function\"},{\"inputs\":[{\"internalType\":\"bool\",\"name\":\"state\",\"type\":\"bool\"}],\"name\":\"_setSeizePaused\",\"outputs\":[{\"internalType\":\"bool\",\"name\":\"\",\"type\":\"bool\"}],\"stateMutability\":\"nonpayable\",\"type\":\"function\"},{\"inputs\":[{\"internalType\":\"bool\",\"name\":\"state\",\"type\":\"bool\"}],\"name\":\"_setTransferPaused\",\"outputs\":[{\"internalType\":\"bool\",\"name\":\"\",\"type\":\"bool\"}],\"stateMutability\":\"nonpayable\",\"type\":\"function\"},{\"inputs\":[{\"internalType\":\"contract CToken\",\"name\":\"cToken\",\"type\":\"address\"}],\"name\":\"_supportMarket\",\"outputs\":[{\"internalType\":\"uint256\",\"name\":\"\",\"type\":\"uint256\"}],\"stateMutability\":\"nonpayable\",\"type\":\"function\"},{\"inputs\":[{\"internalType\":\"address\",\"name\":\"\",\"type\":\"address\"},{\"internalType\":\"uint256\",\"name\":\"\",\"type\":\"uint256\"}],\"name\":\"accountAssets\",\"outputs\":[{\"internalType\":\"contract CToken\",\"name\":\"\",\"type\":\"address\"}],\"stateMutability\":\"view\",\"type\":\"function\"},{\"inputs\":[],\"name\":\"admin\",\"outputs\":[{\"internalType\":\"address\",\"name\":\"\",\"type\":\"address\"}],\"stateMutability\":\"view\",\"type\":\"function\"},{\"inputs\":[{\"internalType\":\"uint256\",\"name\":\"\",\"type\":\"uint256\"}],\"name\":\"allMarkets\",\"outputs\":[{\"internalType\":\"contract CToken\",\"name\":\"\",\"type\":\"address\"}],\"stateMutability\":\"view\",\"type\":\"function\"},{\"inputs\":[{\"internalType\":\"address\",\"name\":\"cToken\",\"type\":\"address\"},{\"internalType\":\"address\",\"name\":\"borrower\",\"type\":\"address\"},{\"internalType\":\"uint256\",\"name\":\"borrowAmount\",\"type\":\"uint256\"}],\"name\":\"borrowAllowed\",\"outputs\":[{\"internalType\":\"uint256\",\"name\":\"\",\"type\":\"uint256\"}],\"stateMutability\":\"nonpayable\",\"type\":\"function\"},{\"inputs\":[],\"name\":\"borrowCapGuardian\",\"outputs\":[{\"internalType\":\"address\",\"name\":\"\",\"type\":\"address\"}],\"stateMutability\":\"view\",\"type\":\"function\"},{\"inputs\":[{\"internalType\":\"address\",\"name\":\"\",\"type\":\"address\"}],\"name\":\"borrowCaps\",\"outputs\":[{\"internalType\":\"uint256\",\"name\":\"\",\"type\":\"uint256\"}],\"stateMutability\":\"view\",\"type\":\"function\"},{\"inputs\":[{\"internalType\":\"address\",\"name\":\"\",\"type\":\"address\"}],\"name\":\"borrowGuardianPaused\",\"outputs\":[{\"internalType\":\"bool\",\"name\":\"\",\"type\":\"bool\"}],\"stateMutability\":\"view\",\"type\":\"function\"},{\"inputs\":[{\"internalType\":\"address\",\"name\":\"cToken\",\"type\":\"address\"},{\"internalType\":\"address\",\"name\":\"borrower\",\"type\":\"address\"},{\"internalType\":\"uint256\",\"name\":\"borrowAmount\",\"type\":\"uint256\"}],\"name\":\"borrowVerify\",\"outputs\":[],\"stateMutability\":\"nonpayable\",\"type\":\"function\"},{\"inputs\":[{\"internalType\":\"address\",\"name\":\"account\",\"type\":\"address\"},{\"internalType\":\"contract CToken\",\"name\":\"cToken\",\"type\":\"address\"}],\"name\":\"checkMembership\",\"outputs\":[{\"internalType\":\"bool\",\"name\":\"\",\"type\":\"bool\"}],\"stateMutability\":\"view\",\"type\":\"function\"},{\"inputs\":[{\"internalType\":\"address\",\"name\":\"holder\",\"type\":\"address\"},{\"internalType\":\"contract CToken[]\",\"name\":\"cTokens\",\"type\":\"address[]\"}],\"name\":\"claimComp\",\"outputs\":[],\"stateMutability\":\"nonpayable\",\"type\":\"function\"},{\"inputs\":[{\"internalType\":\"address[]\",\"name\":\"holders\",\"type\":\"address[]\"},{\"internalType\":\"contract CToken[]\",\"name\":\"cTokens\",\"type\":\"address[]\"},{\"internalType\":\"bool\",\"name\":\"borrowers\",\"type\":\"bool\"},{\"internalType\":\"bool\",\"name\":\"suppliers\",\"type\":\"bool\"}],\"name\":\"claimComp\",\"outputs\":[],\"stateMutability\":\"nonpayable\",\"type\":\"function\"},{\"inputs\":[{\"internalType\":\"address\",\"name\":\"holder\",\"type\":\"address\"}],\"name\":\"claimComp\",\"outputs\":[],\"stateMutability\":\"nonpayable\",\"type\":\"function\"},{\"inputs\":[],\"name\":\"closeFactorMantissa\",\"outputs\":[{\"internalType\":\"uint256\",\"name\":\"\",\"type\":\"uint256\"}],\"stateMutability\":\"view\",\"type\":\"function\"},{\"inputs\":[{\"internalType\":\"address\",\"name\":\"\",\"type\":\"address\"}],\"name\":\"compAccrued\",\"outputs\":[{\"internalType\":\"uint256\",\"name\":\"\",\"type\":\"uint256\"}],\"stateMutability\":\"view\",\"type\":\"function\"},{\"inputs\":[{\"internalType\":\"address\",\"name\":\"\",\"type\":\"address\"}],\"name\":\"compBorrowSpeeds\",\"outputs\":[{\"internalType\":\"uint256\",\"name\":\"\",\"type\":\"uint256\"}],\"stateMutability\":\"view\",\"type\":\"function\"},{\"inputs\":[{\"internalType\":\"address\",\"name\":\"\",\"type\":\"address\"}],\"name\":\"compBorrowState\",\"outputs\":[{\"internalType\":\"uint224\",\"name\":\"index\",\"type\":\"uint224\"},{\"internalType\":\"uint32\",\"name\":\"block\",\"type\":\"uint32\"}],\"stateMutability\":\"view\",\"type\":\"function\"},{\"inputs\":[{\"internalType\":\"address\",\"name\":\"\",\"type\":\"address\"},{\"internalType\":\"address\",\"name\":\"\",\"type\":\"address\"}],\"name\":\"compBorrowerIndex\",\"outputs\":[{\"internalType\":\"uint256\",\"name\":\"\",\"type\":\"uint256\"}],\"stateMutability\":\"view\",\"type\":\"function\"},{\"inputs\":[{\"internalType\":\"address\",\"name\":\"\",\"type\":\"address\"}],\"name\":\"compContributorSpeeds\",\"outputs\":[{\"internalType\":\"uint256\",\"name\":\"\",\"type\":\"uint256\"}],\"stateMutability\":\"view\",\"type\":\"function\"},{\"inputs\":[],\"name\":\"compInitialIndex\",\"outputs\":[{\"internalType\":\"uint224\",\"name\":\"\",\"type\":\"uint224\"}],\"stateMutability\":\"view\",\"type\":\"function\"},{\"inputs\":[],\"name\":\"compRate\",\"outputs\":[{\"internalType\":\"uint256\",\"name\":\"\",\"type\":\"uint256\"}],\"stateMutability\":\"view\",\"type\":\"function\"},{\"inputs\":[{\"internalType\":\"address\",\"name\":\"\",\"type\":\"address\"}],\"name\":\"compReceivable\",\"outputs\":[{\"internalType\":\"uint256\",\"name\":\"\",\"type\":\"uint256\"}],\"stateMutability\":\"view\",\"type\":\"function\"},{\"inputs\":[{\"internalType\":\"address\",\"name\":\"\",\"type\":\"address\"}],\"name\":\"compSpeeds\",\"outputs\":[{\"internalType\":\"uint256\",\"name\":\"\",\"type\":\"uint256\"}],\"stateMutability\":\"view\",\"type\":\"function\"},{\"inputs\":[{\"internalType\":\"address\",\"name\":\"\",\"type\":\"address\"},{\"internalType\":\"address\",\"name\":\"\",\"type\":\"address\"}],\"name\":\"compSupplierIndex\",\"outputs\":[{\"internalType\":\"uint256\",\"name\":\"\",\"type\":\"uint256\"}],\"stateMutability\":\"view\",\"type\":\"function\"},{\"inputs\":[{\"internalType\":\"address\",\"name\":\"\",\"type\":\"address\"}],\"name\":\"compSupplySpeeds\",\"outputs\":[{\"internalType\":\"uint256\",\"name\":\"\",\"type\":\"uint256\"}],\"stateMutability\":\"view\",\"type\":\"function\"},{\"inputs\":[{\"internalType\":\"address\",\"name\":\"\",\"type\":\"address\"}],\"name\":\"compSupplyState\",\"outputs\":[{\"internalType\":\"uint224\",\"name\":\"index\",\"type\":\"uint224\"},{\"internalType\":\"uint32\",\"name\":\"block\",\"type\":\"uint32\"}],\"stateMutability\":\"view\",\"type\":\"function\"},{\"inputs\":[],\"name\":\"comptrollerImplementation\",\"outputs\":[{\"internalType\":\"address\",\"name\":\"\",\"type\":\"address\"}],\"stateMutability\":\"view\",\"type\":\"function\"},{\"inputs\":[{\"internalType\":\"address[]\",\"name\":\"cTokens\",\"type\":\"address[]\"}],\"name\":\"enterMarkets\",\"outputs\":[{\"internalType\":\"uint256[]\",\"name\":\"\",\"type\":\"uint256[]\"}],\"stateMutability\":\"nonpayable\",\"type\":\"function\"},{\"inputs\":[{\"internalType\":\"address\",\"name\":\"cTokenAddress\",\"type\":\"address\"}],\"name\":\"exitMarket\",\"outputs\":[{\"internalType\":\"uint256\",\"name\":\"\",\"type\":\"uint256\"}],\"stateMutability\":\"nonpayable\",\"type\":\"function\"},{\"inputs\":[{\"internalType\":\"address[]\",\"name\":\"affectedUsers\",\"type\":\"address[]\"},{\"internalType\":\"uint256[]\",\"name\":\"amounts\",\"type\":\"uint256[]\"}],\"name\":\"fixBadAccruals\",\"outputs\":[],\"stateMutability\":\"nonpayable\",\"type\":\"function\"},{\"inputs\":[{\"internalType\":\"address\",\"name\":\"account\",\"type\":\"address\"}],\"name\":\"getAccountLiquidity\",\"outputs\":[{\"internalType\":\"uint256\",\"name\":\"\",\"type\":\"uint256\"},{\"internalType\":\"uint256\",\"name\":\"\",\"type\":\"uint256\"},{\"internalType\":\"uint256\",\"name\":\"\",\"type\":\"uint256\"}],\"stateMutability\":\"view\",\"type\":\"function\"},{\"inputs\":[],\"name\":\"getAllMarkets\",\"outputs\":[{\"internalType\":\"contract CToken[]\",\"name\":\"\",\"type\":\"address[]\"}],\"stateMutability\":\"view\",\"type\":\"function\"},{\"inputs\":[{\"internalType\":\"address\",\"name\":\"account\",\"type\":\"address\"}],\"name\":\"getAssetsIn\",\"outputs\":[{\"internalType\":\"contract CToken[]\",\"name\":\"\",\"type\":\"address[]\"}],\"stateMutability\":\"view\",\"type\":\"function\"},{\"inputs\":[],\"name\":\"getBlockNumber\",\"outputs\":[{\"internalType\":\"uint256\",\"name\":\"\",\"type\":\"uint256\"}],\"stateMutability\":\"view\",\"type\":\"function\"},{\"inputs\":[],\"name\":\"getCompAddress\",\"outputs\":[{\"internalType\":\"address\",\"name\":\"\",\"type\":\"address\"}],\"stateMutability\":\"view\",\"type\":\"function\"},{\"inputs\":[{\"internalType\":\"address\",\"name\":\"account\",\"type\":\"address\"},{\"internalType\":\"address\",\"name\":\"cTokenModify\",\"type\":\"address\"},{\"internalType\":\"uint256\",\"name\":\"redeemTokens\",\"type\":\"uint256\"},{\"internalType\":\"uint256\",\"name\":\"borrowAmount\",\"type\":\"uint256\"}],\"name\":\"getHypotheticalAccountLiquidity\",\"outputs\":[{\"internalType\":\"uint256\",\"name\":\"\",\"type\":\"uint256\"},{\"internalType\":\"uint256\",\"name\":\"\",\"type\":\"uint256\"},{\"internalType\":\"uint256\",\"name\":\"\",\"type\":\"uint256\"}],\"stateMutability\":\"view\",\"type\":\"function\"},{\"inputs\":[],\"name\":\"isComptroller\",\"outputs\":[{\"internalType\":\"bool\",\"name\":\"\",\"type\":\"bool\"}],\"stateMutability\":\"view\",\"type\":\"function\"},{\"inputs\":[{\"internalType\":\"contract CToken\",\"name\":\"cToken\",\"type\":\"address\"}],\"name\":\"isDeprecated\",\"outputs\":[{\"internalType\":\"bool\",\"name\":\"\",\"type\":\"bool\"}],\"stateMutability\":\"view\",\"type\":\"function\"},{\"inputs\":[{\"internalType\":\"address\",\"name\":\"\",\"type\":\"address\"}],\"name\":\"lastContributorBlock\",\"outputs\":[{\"internalType\":\"uint256\",\"name\":\"\",\"type\":\"uint256\"}],\"stateMutability\":\"view\",\"type\":\"function\"},{\"inputs\":[{\"internalType\":\"address\",\"name\":\"cTokenBorrowed\",\"type\":\"address\"},{\"internalType\":\"address\",\"name\":\"cTokenCollateral\",\"type\":\"address\"},{\"internalType\":\"address\",\"name\":\"liquidator\",\"type\":\"address\"},{\"internalType\":\"address\",\"name\":\"borrower\",\"type\":\"address\"},{\"internalType\":\"uint256\",\"name\":\"repayAmount\",\"type\":\"uint256\"}],\"name\":\"liquidateBorrowAllowed\",\"outputs\":[{\"internalType\":\"uint256\",\"name\":\"\",\"type\":\"uint256\"}],\"stateMutability\":\"nonpayable\",\"type\":\"function\"},{\"inputs\":[{\"internalType\":\"address\",\"name\":\"cTokenBorrowed\",\"type\":\"address\"},{\"internalType\":\"address\",\"name\":\"cTokenCollateral\",\"type\":\"address\"},{\"internalType\":\"address\",\"name\":\"liquidator\",\"type\":\"address\"},{\"internalType\":\"address\",\"name\":\"borrower\",\"type\":\"address\"},{\"internalType\":\"uint256\",\"name\":\"actualRepayAmount\",\"type\":\"uint256\"},{\"internalType\":\"uint256\",\"name\":\"seizeTokens\",\"type\":\"uint256\"}],\"name\":\"liquidateBorrowVerify\",\"outputs\":[],\"stateMutability\":\"nonpayable\",\"type\":\"function\"},{\"inputs\":[{\"internalType\":\"address\",\"name\":\"cTokenBorrowed\",\"type\":\"address\"},{\"internalType\":\"address\",\"name\":\"cTokenCollateral\",\"type\":\"address\"},{\"internalType\":\"uint256\",\"name\":\"actualRepayAmount\",\"type\":\"uint256\"}],\"name\":\"liquidateCalculateSeizeTokens\",\"outputs\":[{\"internalType\":\"uint256\",\"name\":\"\",\"type\":\"uint256\"},{\"internalType\":\"uint256\",\"name\":\"\",\"type\":\"uint256\"}],\"stateMutability\":\"view\",\"type\":\"function\"},{\"inputs\":[],\"name\":\"liquidationIncentiveMantissa\",\"outputs\":[{\"internalType\":\"uint256\",\"name\":\"\",\"type\":\"uint256\"}],\"stateMutability\":\"view\",\"type\":\"function\"},{\"inputs\":[{\"internalType\":\"address\",\"name\":\"\",\"type\":\"address\"}],\"name\":\"markets\",\"outputs\":[{\"internalType\":\"bool\",\"name\":\"isListed\",\"type\":\"bool\"},{\"internalType\":\"uint256\",\"name\":\"collateralFactorMantissa\",\"type\":\"uint256\"},{\"internalType\":\"bool\",\"name\":\"isComped\",\"type\":\"bool\"}],\"stateMutability\":\"view\",\"type\":\"function\"},{\"inputs\":[],\"name\":\"maxAssets\",\"outputs\":[{\"internalType\":\"uint256\",\"name\":\"\",\"type\":\"uint256\"}],\"stateMutability\":\"view\",\"type\":\"function\"},{\"inputs\":[{\"internalType\":\"address\",\"name\":\"cToken\",\"type\":\"address\"},{\"internalType\":\"address\",\"name\":\"minter\",\"type\":\"address\"},{\"internalType\":\"uint256\",\"name\":\"mintAmount\",\"type\":\"uint256\"}],\"name\":\"mintAllowed\",\"outputs\":[{\"internalType\":\"uint256\",\"name\":\"\",\"type\":\"uint256\"}],\"stateMutability\":\"nonpayable\",\"type\":\"function\"},{\"inputs\":[{\"internalType\":\"address\",\"name\":\"\",\"type\":\"address\"}],\"name\":\"mintGuardianPaused\",\"outputs\":[{\"internalType\":\"bool\",\"name\":\"\",\"type\":\"bool\"}],\"stateMutability\":\"view\",\"type\":\"function\"},{\"inputs\":[{\"internalType\":\"address\",\"name\":\"cToken\",\"type\":\"address\"},{\"internalType\":\"address\",\"name\":\"minter\",\"type\":\"address\"},{\"internalType\":\"uint256\",\"name\":\"actualMintAmount\",\"type\":\"uint256\"},{\"internalType\":\"uint256\",\"name\":\"mintTokens\",\"type\":\"uint256\"}],\"name\":\"mintVerify\",\"outputs\":[],\"stateMutability\":\"nonpayable\",\"type\":\"function\"},{\"inputs\":[],\"name\":\"oracle\",\"outputs\":[{\"internalType\":\"contract PriceOracle\",\"name\":\"\",\"type\":\"address\"}],\"stateMutability\":\"view\",\"type\":\"function\"},{\"inputs\":[],\"name\":\"pauseGuardian\",\"outputs\":[{\"internalType\":\"address\",\"name\":\"\",\"type\":\"address\"}],\"stateMutability\":\"view\",\"type\":\"function\"},{\"inputs\":[],\"name\":\"pendingAdmin\",\"outputs\":[{\"internalType\":\"address\",\"name\":\"\",\"type\":\"address\"}],\"stateMutability\":\"view\",\"type\":\"function\"},{\"inputs\":[],\"name\":\"pendingComptrollerImplementation\",\"outputs\":[{\"internalType\":\"address\",\"name\":\"\",\"type\":\"address\"}],\"stateMutability\":\"view\",\"type\":\"function\"},{\"inputs\":[],\"name\":\"proposal65FixExecuted\",\"outputs\":[{\"internalType\":\"bool\",\"name\":\"\",\"type\":\"bool\"}],\"stateMutability\":\"view\",\"type\":\"function\"},{\"inputs\":[{\"internalType\":\"address\",\"name\":\"cToken\",\"type\":\"address\"},{\"internalType\":\"address\",\"name\":\"redeemer\",\"type\":\"address\"},{\"internalType\":\"uint256\",\"name\":\"redeemTokens\",\"type\":\"uint256\"}],\"name\":\"redeemAllowed\",\"outputs\":[{\"internalType\":\"uint256\",\"name\":\"\",\"type\":\"uint256\"}],\"stateMutability\":\"nonpayable\",\"type\":\"function\"},{\"inputs\":[{\"internalType\":\"address\",\"name\":\"cToken\",\"type\":\"address\"},{\"internalType\":\"address\",\"name\":\"redeemer\",\"type\":\"address\"},{\"internalType\":\"uint256\",\"name\":\"redeemAmount\",\"type\":\"uint256\"},{\"internalType\":\"uint256\",\"name\":\"redeemTokens\",\"type\":\"uint256\"}],\"name\":\"redeemVerify\",\"outputs\":[],\"stateMutability\":\"nonpayable\",\"type\":\"function\"},{\"inputs\":[{\"internalType\":\"address\",\"name\":\"cToken\",\"type\":\"address\"},{\"internalType\":\"address\",\"name\":\"payer\",\"type\":\"address\"},{\"internalType\":\"address\",\"name\":\"borrower\",\"type\":\"address\"},{\"internalType\":\"uint256\",\"name\":\"repayAmount\",\"type\":\"uint256\"}],\"name\":\"repayBorrowAllowed\",\"outputs\":[{\"internalType\":\"uint256\",\"name\":\"\",\"type\":\"uint256\"}],\"stateMutability\":\"nonpayable\",\"type\":\"function\"},{\"inputs\":[{\"internalType\":\"address\",\"name\":\"cToken\",\"type\":\"address\"},{\"internalType\":\"address\",\"name\":\"payer\",\"type\":\"address\"},{\"internalType\":\"address\",\"name\":\"borrower\",\"type\":\"address\"},{\"internalType\":\"uint256\",\"name\":\"actualRepayAmount\",\"type\":\"uint256\"},{\"internalType\":\"uint256\",\"name\":\"borrowerIndex\",\"type\":\"uint256\"}],\"name\":\"repayBorrowVerify\",\"outputs\":[],\"stateMutability\":\"nonpayable\",\"type\":\"function\"},{\"inputs\":[{\"internalType\":\"address\",\"name\":\"cTokenCollateral\",\"type\":\"address\"},{\"internalType\":\"address\",\"name\":\"cTokenBorrowed\",\"type\":\"address\"},{\"internalType\":\"address\",\"name\":\"liquidator\",\"type\":\"address\"},{\"internalType\":\"address\",\"name\":\"borrower\",\"type\":\"address\"},{\"internalType\":\"uint256\",\"name\":\"seizeTokens\",\"type\":\"uint256\"}],\"name\":\"seizeAllowed\",\"outputs\":[{\"internalType\":\"uint256\",\"name\":\"\",\"type\":\"uint256\"}],\"stateMutability\":\"nonpayable\",\"type\":\"function\"},{\"inputs\":[],\"name\":\"seizeGuardianPaused\",\"outputs\":[{\"internalType\":\"bool\",\"name\":\"\",\"type\":\"bool\"}],\"stateMutability\":\"view\",\"type\":\"function\"},{\"inputs\":[{\"internalType\":\"address\",\"name\":\"cTokenCollateral\",\"type\":\"address\"},{\"internalType\":\"address\",\"name\":\"cTokenBorrowed\",\"type\":\"address\"},{\"internalType\":\"address\",\"name\":\"liquidator\",\"type\":\"address\"},{\"internalType\":\"address\",\"name\":\"borrower\",\"type\":\"address\"},{\"internalType\":\"uint256\",\"name\":\"seizeTokens\",\"type\":\"uint256\"}],\"name\":\"seizeVerify\",\"outputs\":[],\"stateMutability\":\"nonpayable\",\"type\":\"function\"},{\"inputs\":[{\"internalType\":\"address\",\"name\":\"cToken\",\"type\":\"address\"},{\"internalType\":\"address\",\"name\":\"src\",\"type\":\"address\"},{\"internalType\":\"address\",\"name\":\"dst\",\"type\":\"address\"},{\"internalType\":\"uint256\",\"name\":\"transferTokens\",\"type\":\"uint256\"}],\"name\":\"transferAllowed\",\"outputs\":[{\"internalType\":\"uint256\",\"name\":\"\",\"type\":\"uint256\"}],\"stateMutability\":\"nonpayable\",\"type\":\"function\"},{\"inputs\":[],\"name\":\"transferGuardianPaused\",\"outputs\":[{\"internalType\":\"bool\",\"name\":\"\",\"type\":\"bool\"}],\"stateMutability\":\"view\",\"type\":\"function\"},{\"inputs\":[{\"internalType\":\"address\",\"name\":\"cToken\",\"type\":\"address\"},{\"internalType\":\"address\",\"name\":\"src\",\"type\":\"address\"},{\"internalType\":\"address\",\"name\":\"dst\",\"type\":\"address\"},{\"internalType\":\"uint256\",\"name\":\"transferTokens\",\"type\":\"uint256\"}],\"name\":\"transferVerify\",\"outputs\":[],\"stateMutability\":\"nonpayable\",\"type\":\"function\"},{\"inputs\":[{\"internalType\":\"address\",\"name\":\"contributor\",\"type\":\"address\"}],\"name\":\"updateContributorRewards\",\"outputs\":[],\"stateMutability\":\"nonpayable\",\"type\":\"function\"}],\"devdoc\":{\"author\":\"Compound\",\"kind\":\"dev\",\"methods\":{\"_grantComp(address,uint256)\":{\"details\":\"Note: If there is not enough COMP, we do not perform the transfer all.\",\"params\":{\"amount\":\"The amount of COMP to (possibly) transfer\",\"recipient\":\"The address of the recipient to transfer COMP to\"}},\"_setBorrowCapGuardian(address)\":{\"params\":{\"newBorrowCapGuardian\":\"The address of the new Borrow Cap Guardian\"}},\"_setCloseFactor(uint256)\":{\"details\":\"Admin function to set closeFactor\",\"params\":{\"newCloseFactorMantissa\":\"New close factor, scaled by 1e18\"},\"returns\":{\"_0\":\"uint 0=success, otherwise a failure\"}},\"_setCollateralFactor(address,uint256)\":{\"details\":\"Admin function to set per-market collateralFactor\",\"params\":{\"cToken\":\"The market to set the factor on\",\"newCollateralFactorMantissa\":\"The new collateral factor, scaled by 1e18\"},\"returns\":{\"_0\":\"uint 0=success, otherwise a failure. (See ErrorReporter for details)\"}},\"_setCompSpeeds(address[],uint256[],uint256[])\":{\"params\":{\"borrowSpeeds\":\"New borrow-side COMP speed for the corresponding market.\",\"cTokens\":\"The markets whose COMP speed to update.\",\"supplySpeeds\":\"New supply-side COMP speed for the corresponding market.\"}},\"_setContributorCompSpeed(address,uint256)\":{\"params\":{\"compSpeed\":\"New COMP speed for contributor\",\"contributor\":\"The contributor whose COMP speed to update\"}},\"_setLiquidationIncentive(uint256)\":{\"details\":\"Admin function to set liquidationIncentive\",\"params\":{\"newLiquidationIncentiveMantissa\":\"New liquidationIncentive scaled by 1e18\"},\"returns\":{\"_0\":\"uint 0=success, otherwise a failure. (See ErrorReporter for details)\"}},\"_setMarketBorrowCaps(address[],uint256[])\":{\"details\":\"Admin or borrowCapGuardian function to set the borrow caps. A borrow cap of 0 corresponds to unlimited borrowing.\",\"params\":{\"cTokens\":\"The addresses of the markets (tokens) to change the borrow caps for\",\"newBorrowCaps\":\"The new borrow cap values in underlying to be set. A value of 0 corresponds to unlimited borrowing.\"}},\"_setPauseGuardian(address)\":{\"params\":{\"newPauseGuardian\":\"The address of the new Pause Guardian\"},\"returns\":{\"_0\":\"uint 0=success, otherwise a failure. (See enum Error for details)\"}},\"_setPriceOracle(address)\":{\"details\":\"Admin function to set a new price oracle\",\"returns\":{\"_0\":\"uint 0=success, otherwise a failure (see ErrorReporter.sol for details)\"}},\"_supportMarket(address)\":{\"details\":\"Admin function to set isListed and add support for the market\",\"params\":{\"cToken\":\"The address of the market (token) to list\"},\"returns\":{\"_0\":\"uint 0=success, otherwise a failure. (See enum Error for details)\"}},\"borrowAllowed(address,address,uint256)\":{\"params\":{\"borrowAmount\":\"The amount of underlying the account would borrow\",\"borrower\":\"The account which would borrow the asset\",\"cToken\":\"The market to verify the borrow against\"},\"returns\":{\"_0\":\"0 if the borrow is allowed, otherwise a semi-opaque error code (See ErrorReporter.sol)\"}},\"borrowVerify(address,address,uint256)\":{\"params\":{\"borrowAmount\":\"The amount of the underlying asset requested to borrow\",\"borrower\":\"The address borrowing the underlying\",\"cToken\":\"Asset whose underlying is being borrowed\"}},\"checkMembership(address,address)\":{\"params\":{\"account\":\"The address of the account to check\",\"cToken\":\"The cToken to check\"},\"returns\":{\"_0\":\"True if the account is in the asset, otherwise false.\"}},\"claimComp(address)\":{\"params\":{\"holder\":\"The address to claim COMP for\"}},\"claimComp(address,address[])\":{\"params\":{\"cTokens\":\"The list of markets to claim COMP in\",\"holder\":\"The address to claim COMP for\"}},\"claimComp(address[],address[],bool,bool)\":{\"params\":{\"borrowers\":\"Whether or not to claim COMP earned by borrowing\",\"cTokens\":\"The list of markets to claim COMP in\",\"holders\":\"The addresses to claim COMP for\",\"suppliers\":\"Whether or not to claim COMP earned by supplying\"}},\"enterMarkets(address[])\":{\"params\":{\"cTokens\":\"The list of addresses of the cToken markets to be enabled\"},\"returns\":{\"_0\":\"Success indicator for whether each corresponding market was entered\"}},\"exitMarket(address)\":{\"details\":\"Sender must not have an outstanding borrow balance in the asset,  or be providing necessary collateral for an outstanding borrow.\",\"params\":{\"cTokenAddress\":\"The address of the asset to be removed\"},\"returns\":{\"_0\":\"Whether or not the account successfully exited the market\"}},\"getAccountLiquidity(address)\":{\"returns\":{\"_0\":\"(possible error code (semi-opaque), account liquidity in excess of collateral requirements,          account shortfall below collateral requirements)\"}},\"getAllMarkets()\":{\"details\":\"The automatic getter may be used to access an individual market.\",\"returns\":{\"_0\":\"The list of market addresses\"}},\"getAssetsIn(address)\":{\"params\":{\"account\":\"The address of the account to pull assets for\"},\"returns\":{\"_0\":\"A dynamic list with the assets the account has entered\"}},\"getCompAddress()\":{\"returns\":{\"_0\":\"The address of MARE\"}},\"getHypotheticalAccountLiquidity(address,address,uint256,uint256)\":{\"params\":{\"account\":\"The account to determine liquidity for\",\"borrowAmount\":\"The amount of underlying to hypothetically borrow\",\"cTokenModify\":\"The market to hypothetically redeem/borrow in\",\"redeemTokens\":\"The number of tokens to hypothetically redeem\"},\"returns\":{\"_0\":\"(possible error code (semi-opaque), hypothetical account liquidity in excess of collateral requirements,          hypothetical account shortfall below collateral requirements)\"}},\"isDeprecated(address)\":{\"details\":\"All borrows in a deprecated cToken market can be immediately liquidated\",\"params\":{\"cToken\":\"The market to check if deprecated\"}},\"liquidateBorrowAllowed(address,address,address,address,uint256)\":{\"params\":{\"borrower\":\"The address of the borrower\",\"cTokenBorrowed\":\"Asset which was borrowed by the borrower\",\"cTokenCollateral\":\"Asset which was used as collateral and will be seized\",\"liquidator\":\"The address repaying the borrow and seizing the collateral\",\"repayAmount\":\"The amount of underlying being repaid\"}},\"liquidateBorrowVerify(address,address,address,address,uint256,uint256)\":{\"params\":{\"actualRepayAmount\":\"The amount of underlying being repaid\",\"borrower\":\"The address of the borrower\",\"cTokenBorrowed\":\"Asset which was borrowed by the borrower\",\"cTokenCollateral\":\"Asset which was used as collateral and will be seized\",\"liquidator\":\"The address repaying the borrow and seizing the collateral\"}},\"liquidateCalculateSeizeTokens(address,address,uint256)\":{\"details\":\"Used in liquidation (called in cToken.liquidateBorrowFresh)\",\"params\":{\"actualRepayAmount\":\"The amount of cTokenBorrowed underlying to convert into cTokenCollateral tokens\",\"cTokenBorrowed\":\"The address of the borrowed cToken\",\"cTokenCollateral\":\"The address of the collateral cToken\"},\"returns\":{\"_0\":\"(errorCode, number of cTokenCollateral tokens to be seized in a liquidation)\"}},\"mintAllowed(address,address,uint256)\":{\"params\":{\"cToken\":\"The market to verify the mint against\",\"mintAmount\":\"The amount of underlying being supplied to the market in exchange for tokens\",\"minter\":\"The account which would get the minted tokens\"},\"returns\":{\"_0\":\"0 if the mint is allowed, otherwise a semi-opaque error code (See ErrorReporter.sol)\"}},\"mintVerify(address,address,uint256,uint256)\":{\"params\":{\"actualMintAmount\":\"The amount of the underlying asset being minted\",\"cToken\":\"Asset being minted\",\"mintTokens\":\"The number of tokens being minted\",\"minter\":\"The address minting the tokens\"}},\"redeemAllowed(address,address,uint256)\":{\"params\":{\"cToken\":\"The market to verify the redeem against\",\"redeemTokens\":\"The number of cTokens to exchange for the underlying asset in the market\",\"redeemer\":\"The account which would redeem the tokens\"},\"returns\":{\"_0\":\"0 if the redeem is allowed, otherwise a semi-opaque error code (See ErrorReporter.sol)\"}},\"redeemVerify(address,address,uint256,uint256)\":{\"params\":{\"cToken\":\"Asset being redeemed\",\"redeemAmount\":\"The amount of the underlying asset being redeemed\",\"redeemTokens\":\"The number of tokens being redeemed\",\"redeemer\":\"The address redeeming the tokens\"}},\"repayBorrowAllowed(address,address,address,uint256)\":{\"params\":{\"borrower\":\"The account which would borrowed the asset\",\"cToken\":\"The market to verify the repay against\",\"payer\":\"The account which would repay the asset\",\"repayAmount\":\"The amount of the underlying asset the account would repay\"},\"returns\":{\"_0\":\"0 if the repay is allowed, otherwise a semi-opaque error code (See ErrorReporter.sol)\"}},\"repayBorrowVerify(address,address,address,uint256,uint256)\":{\"params\":{\"actualRepayAmount\":\"The amount of underlying being repaid\",\"borrower\":\"The address of the borrower\",\"cToken\":\"Asset being repaid\",\"payer\":\"The address repaying the borrow\"}},\"seizeAllowed(address,address,address,address,uint256)\":{\"params\":{\"borrower\":\"The address of the borrower\",\"cTokenBorrowed\":\"Asset which was borrowed by the borrower\",\"cTokenCollateral\":\"Asset which was used as collateral and will be seized\",\"liquidator\":\"The address repaying the borrow and seizing the collateral\",\"seizeTokens\":\"The number of collateral tokens to seize\"}},\"seizeVerify(address,address,address,address,uint256)\":{\"params\":{\"borrower\":\"The address of the borrower\",\"cTokenBorrowed\":\"Asset which was borrowed by the borrower\",\"cTokenCollateral\":\"Asset which was used as collateral and will be seized\",\"liquidator\":\"The address repaying the borrow and seizing the collateral\",\"seizeTokens\":\"The number of collateral tokens to seize\"}},\"transferAllowed(address,address,address,uint256)\":{\"params\":{\"cToken\":\"The market to verify the transfer against\",\"dst\":\"The account which receives the tokens\",\"src\":\"The account which sources the tokens\",\"transferTokens\":\"The number of cTokens to transfer\"},\"returns\":{\"_0\":\"0 if the transfer is allowed, otherwise a semi-opaque error code (See ErrorReporter.sol)\"}},\"transferVerify(address,address,address,uint256)\":{\"params\":{\"cToken\":\"Asset being transferred\",\"dst\":\"The account which receives the tokens\",\"src\":\"The account which sources the tokens\",\"transferTokens\":\"The number of cTokens to transfer\"}},\"updateContributorRewards(address)\":{\"params\":{\"contributor\":\"The address to calculate contributor rewards for\"}}},\"title\":\"Compound's Comptroller Contract\",\"version\":1},\"userdoc\":{\"events\":{\"ActionPaused(address,string,bool)\":{\"notice\":\"Emitted when an action is paused on a market\"},\"ActionPaused(string,bool)\":{\"notice\":\"Emitted when an action is paused globally\"},\"CompAccruedAdjusted(address,uint256,uint256)\":{\"notice\":\"Emitted when COMP accrued for a user has been manually adjusted.\"},\"CompBorrowSpeedUpdated(address,uint256)\":{\"notice\":\"Emitted when a new borrow-side COMP speed is calculated for a market\"},\"CompGranted(address,uint256)\":{\"notice\":\"Emitted when COMP is granted by admin\"},\"CompReceivableUpdated(address,uint256,uint256)\":{\"notice\":\"Emitted when COMP receivable for a user has been updated.\"},\"CompSupplySpeedUpdated(address,uint256)\":{\"notice\":\"Emitted when a new supply-side COMP speed is calculated for a market\"},\"ContributorCompSpeedUpdated(address,uint256)\":{\"notice\":\"Emitted when a new COMP speed is set for a contributor\"},\"DistributedBorrowerComp(address,address,uint256,uint256)\":{\"notice\":\"Emitted when COMP is distributed to a borrower\"},\"DistributedSupplierComp(address,address,uint256,uint256)\":{\"notice\":\"Emitted when COMP is distributed to a supplier\"},\"MarketEntered(address,address)\":{\"notice\":\"Emitted when an account enters a market\"},\"MarketExited(address,address)\":{\"notice\":\"Emitted when an account exits a market\"},\"MarketListed(address)\":{\"notice\":\"Emitted when an admin supports a market\"},\"NewBorrowCap(address,uint256)\":{\"notice\":\"Emitted when borrow cap for a cToken is changed\"},\"NewBorrowCapGuardian(address,address)\":{\"notice\":\"Emitted when borrow cap guardian is changed\"},\"NewCloseFactor(uint256,uint256)\":{\"notice\":\"Emitted when close factor is changed by admin\"},\"NewCollateralFactor(address,uint256,uint256)\":{\"notice\":\"Emitted when a collateral factor is changed by admin\"},\"NewLiquidationIncentive(uint256,uint256)\":{\"notice\":\"Emitted when liquidation incentive is changed by admin\"},\"NewPauseGuardian(address,address)\":{\"notice\":\"Emitted when pause guardian is changed\"},\"NewPriceOracle(address,address)\":{\"notice\":\"Emitted when price oracle is changed\"}},\"kind\":\"user\",\"methods\":{\"_grantComp(address,uint256)\":{\"notice\":\"Transfer COMP to the recipient\"},\"_setBorrowCapGuardian(address)\":{\"notice\":\"Admin function to change the Borrow Cap Guardian\"},\"_setCloseFactor(uint256)\":{\"notice\":\"Sets the closeFactor used when liquidating borrows\"},\"_setCollateralFactor(address,uint256)\":{\"notice\":\"Sets the collateralFactor for a market\"},\"_setCompSpeeds(address[],uint256[],uint256[])\":{\"notice\":\"Set COMP borrow and supply speeds for the specified markets.\"},\"_setContributorCompSpeed(address,uint256)\":{\"notice\":\"Set COMP speed for a single contributor\"},\"_setLiquidationIncentive(uint256)\":{\"notice\":\"Sets liquidationIncentive\"},\"_setMarketBorrowCaps(address[],uint256[])\":{\"notice\":\"Set the given borrow caps for the given cToken markets. Borrowing that brings total borrows to or above borrow cap will revert.\"},\"_setPauseGuardian(address)\":{\"notice\":\"Admin function to change the Pause Guardian\"},\"_setPriceOracle(address)\":{\"notice\":\"Sets a new price oracle for the comptroller\"},\"_supportMarket(address)\":{\"notice\":\"Add the market to the markets mapping and set it as listed\"},\"accountAssets(address,uint256)\":{\"notice\":\"Per-account mapping of \\\"assets you are in\\\", capped by maxAssets\"},\"admin()\":{\"notice\":\"Administrator for this contract\"},\"allMarkets(uint256)\":{\"notice\":\"A list of all markets\"},\"borrowAllowed(address,address,uint256)\":{\"notice\":\"Checks if the account should be allowed to borrow the underlying asset of the given market\"},\"borrowVerify(address,address,uint256)\":{\"notice\":\"Validates borrow and reverts on rejection. May emit logs.\"},\"checkMembership(address,address)\":{\"notice\":\"Returns whether the given account is entered in the given asset\"},\"claimComp(address)\":{\"notice\":\"Claim all the comp accrued by holder in all markets\"},\"claimComp(address,address[])\":{\"notice\":\"Claim all the comp accrued by holder in the specified markets\"},\"claimComp(address[],address[],bool,bool)\":{\"notice\":\"Claim all comp accrued by the holders\"},\"closeFactorMantissa()\":{\"notice\":\"Multiplier used to calculate the maximum repayAmount when liquidating a borrow\"},\"compAccrued(address)\":{\"notice\":\"The COMP accrued but not yet transferred to each user\"},\"compBorrowSpeeds(address)\":{\"notice\":\"The rate at which comp is distributed to the corresponding borrow market (per block)\"},\"compBorrowState(address)\":{\"notice\":\"The COMP market borrow state for each market\"},\"compBorrowerIndex(address,address)\":{\"notice\":\"The COMP borrow index for each market for each borrower as of the last time they accrued COMP\"},\"compContributorSpeeds(address)\":{\"notice\":\"The portion of COMP that each contributor receives per block\"},\"compInitialIndex()\":{\"notice\":\"The initial COMP index for a market\"},\"compRate()\":{\"notice\":\"The rate at which the flywheel distributes COMP, per block\"},\"compReceivable(address)\":{\"notice\":\"Accounting storage mapping account addresses to how much COMP they owe the protocol.\"},\"compSpeeds(address)\":{\"notice\":\"The portion of compRate that each market currently receives\"},\"compSupplierIndex(address,address)\":{\"notice\":\"The COMP borrow index for each market for each supplier as of the last time they accrued COMP\"},\"compSupplySpeeds(address)\":{\"notice\":\"The rate at which comp is distributed to the corresponding supply market (per block)\"},\"compSupplyState(address)\":{\"notice\":\"The COMP market supply state for each market\"},\"comptrollerImplementation()\":{\"notice\":\"Active brains of Unitroller\"},\"enterMarkets(address[])\":{\"notice\":\"Add assets to be included in account liquidity calculation\"},\"exitMarket(address)\":{\"notice\":\"Removes asset from sender's account liquidity calculation\"},\"fixBadAccruals(address[],uint256[])\":{\"notice\":\"Delete this function after proposal 65 is executed\"},\"getAccountLiquidity(address)\":{\"notice\":\"Determine the current account liquidity wrt collateral requirements\"},\"getAllMarkets()\":{\"notice\":\"Return all of the markets\"},\"getAssetsIn(address)\":{\"notice\":\"Returns the assets an account has entered\"},\"getCompAddress()\":{\"notice\":\"Return the address of the MARE token\"},\"getHypotheticalAccountLiquidity(address,address,uint256,uint256)\":{\"notice\":\"Determine what the account liquidity would be if the given amounts were redeemed/borrowed\"},\"isComptroller()\":{\"notice\":\"Indicator that this is a Comptroller contract (for inspection)\"},\"isDeprecated(address)\":{\"notice\":\"Returns true if the given cToken market has been deprecated\"},\"lastContributorBlock(address)\":{\"notice\":\"Last block at which a contributor's COMP rewards have been allocated\"},\"liquidateBorrowAllowed(address,address,address,address,uint256)\":{\"notice\":\"Checks if the liquidation should be allowed to occur\"},\"liquidateBorrowVerify(address,address,address,address,uint256,uint256)\":{\"notice\":\"Validates liquidateBorrow and reverts on rejection. May emit logs.\"},\"liquidateCalculateSeizeTokens(address,address,uint256)\":{\"notice\":\"Calculate number of tokens of collateral asset to seize given an underlying amount\"},\"liquidationIncentiveMantissa()\":{\"notice\":\"Multiplier representing the discount on collateral that a liquidator receives\"},\"markets(address)\":{\"notice\":\"Official mapping of cTokens -> Market metadata\"},\"maxAssets()\":{\"notice\":\"Max number of assets a single account can participate in (borrow or use as collateral)\"},\"mintAllowed(address,address,uint256)\":{\"notice\":\"Checks if the account should be allowed to mint tokens in the given market\"},\"mintVerify(address,address,uint256,uint256)\":{\"notice\":\"Validates mint and reverts on rejection. May emit logs.\"},\"oracle()\":{\"notice\":\"Oracle which gives the price of any given asset\"},\"pauseGuardian()\":{\"notice\":\"The Pause Guardian can pause certain actions as a safety mechanism.  Actions which allow users to remove their own assets cannot be paused.  Liquidation / seizing / transfer can only be paused globally, not by market.\"},\"pendingAdmin()\":{\"notice\":\"Pending administrator for this contract\"},\"pendingComptrollerImplementation()\":{\"notice\":\"Pending brains of Unitroller\"},\"proposal65FixExecuted()\":{\"notice\":\"Flag indicating whether the function to fix COMP accruals has been executed (RE: proposal 62 bug)\"},\"redeemAllowed(address,address,uint256)\":{\"notice\":\"Checks if the account should be allowed to redeem tokens in the given market\"},\"redeemVerify(address,address,uint256,uint256)\":{\"notice\":\"Validates redeem and reverts on rejection. May emit logs.\"},\"repayBorrowAllowed(address,address,address,uint256)\":{\"notice\":\"Checks if the account should be allowed to repay a borrow in the given market\"},\"repayBorrowVerify(address,address,address,uint256,uint256)\":{\"notice\":\"Validates repayBorrow and reverts on rejection. May emit logs.\"},\"seizeAllowed(address,address,address,address,uint256)\":{\"notice\":\"Checks if the seizing of assets should be allowed to occur\"},\"seizeVerify(address,address,address,address,uint256)\":{\"notice\":\"Validates seize and reverts on rejection. May emit logs.\"},\"transferAllowed(address,address,address,uint256)\":{\"notice\":\"Checks if the account should be allowed to transfer tokens in the given market\"},\"transferVerify(address,address,address,uint256)\":{\"notice\":\"Validates transfer and reverts on rejection. May emit logs.\"},\"updateContributorRewards(address)\":{\"notice\":\"Calculate additional accrued COMP for a contributor since last accrual\"}},\"version\":1}},\"settings\":{\"compilationTarget\":{\"contracts/Comptroller.sol\":\"Comptroller\"},\"evmVersion\":\"london\",\"libraries\":{},\"metadata\":{\"bytecodeHash\":\"ipfs\",\"useLiteralContent\":true},\"optimizer\":{\"enabled\":true,\"runs\":200},\"remappings\":[]},\"sources\":{\"contracts/CToken.sol\":{\"content\":\"// SPDX-License-Identifier: BSD-3-Clause\\npragma solidity ^0.8.10;\\n\\nimport \\\"./ComptrollerInterface.sol\\\";\\nimport \\\"./CTokenInterfaces.sol\\\";\\nimport \\\"./ErrorReporter.sol\\\";\\nimport \\\"./EIP20Interface.sol\\\";\\nimport \\\"./InterestRateModel.sol\\\";\\nimport \\\"./ExponentialNoError.sol\\\";\\n\\n/**\\n * @title Compound's CToken Contract\\n * @notice Abstract base for CTokens\\n * @author Compound\\n */\\nabstract contract CToken is\\n    CTokenInterface,\\n    ExponentialNoError,\\n    TokenErrorReporter\\n{\\n    /**\\n     * @notice Initialize the money market\\n     * @param comptroller_ The address of the Comptroller\\n     * @param interestRateModel_ The address of the interest rate model\\n     * @param initialExchangeRateMantissa_ The initial exchange rate, scaled by 1e18\\n     * @param name_ EIP-20 name of this token\\n     * @param symbol_ EIP-20 symbol of this token\\n     * @param decimals_ EIP-20 decimal precision of this token\\n     */\\n    function initialize(\\n        ComptrollerInterface comptroller_,\\n        InterestRateModel interestRateModel_,\\n        uint256 initialExchangeRateMantissa_,\\n        string memory name_,\\n        string memory symbol_,\\n        uint8 decimals_\\n    ) public {\\n        require(msg.sender == admin, \\\"only admin may initialize the market\\\");\\n        require(\\n            accrualBlockNumber == 0 && borrowIndex == 0,\\n            \\\"market may only be initialized once\\\"\\n        );\\n\\n        // Set initial exchange rate\\n        initialExchangeRateMantissa = initialExchangeRateMantissa_;\\n        require(\\n            initialExchangeRateMantissa > 0,\\n            \\\"initial exchange rate must be greater than zero.\\\"\\n        );\\n\\n        // Set the comptroller\\n        uint256 err = _setComptroller(comptroller_);\\n        require(err == NO_ERROR, \\\"setting comptroller failed\\\");\\n\\n        // Initialize block number and borrow index (block number mocks depend on comptroller being set)\\n        accrualBlockNumber = getBlockNumber();\\n        borrowIndex = mantissaOne;\\n\\n        // Set the interest rate model (depends on block number / borrow index)\\n        err = _setInterestRateModelFresh(interestRateModel_);\\n        require(err == NO_ERROR, \\\"setting interest rate model failed\\\");\\n\\n        name = name_;\\n        symbol = symbol_;\\n        decimals = decimals_;\\n\\n        // The counter starts true to prevent changing it from zero to non-zero (i.e. smaller cost/refund)\\n        _notEntered = true;\\n    }\\n\\n    /**\\n     * @notice Transfer `tokens` tokens from `src` to `dst` by `spender`\\n     * @dev Called by both `transfer` and `transferFrom` internally\\n     * @param spender The address of the account performing the transfer\\n     * @param src The address of the source account\\n     * @param dst The address of the destination account\\n     * @param tokens The number of tokens to transfer\\n     * @return 0 if the transfer succeeded, else revert\\n     */\\n    function transferTokens(\\n        address spender,\\n        address src,\\n        address dst,\\n        uint256 tokens\\n    ) internal returns (uint256) {\\n        /* Fail if transfer not allowed */\\n        uint256 allowed = comptroller.transferAllowed(\\n            address(this),\\n            src,\\n            dst,\\n            tokens\\n        );\\n        if (allowed != 0) {\\n            revert TransferComptrollerRejection(allowed);\\n        }\\n\\n        /* Do not allow self-transfers */\\n        if (src == dst) {\\n            revert TransferNotAllowed();\\n        }\\n\\n        /* Get the allowance, infinite for the account owner */\\n        uint256 startingAllowance = 0;\\n        if (spender == src) {\\n            startingAllowance = type(uint256).max;\\n        } else {\\n            startingAllowance = transferAllowances[src][spender];\\n        }\\n\\n        /* Do the calculations, checking for {under,over}flow */\\n        uint256 allowanceNew = startingAllowance - tokens;\\n        uint256 srcTokensNew = accountTokens[src] - tokens;\\n        uint256 dstTokensNew = accountTokens[dst] + tokens;\\n\\n        /////////////////////////\\n        // EFFECTS & INTERACTIONS\\n        // (No safe failures beyond this point)\\n\\n        accountTokens[src] = srcTokensNew;\\n        accountTokens[dst] = dstTokensNew;\\n\\n        /* Eat some of the allowance (if necessary) */\\n        if (startingAllowance != type(uint256).max) {\\n            transferAllowances[src][spender] = allowanceNew;\\n        }\\n\\n        /* We emit a Transfer event */\\n        emit Transfer(src, dst, tokens);\\n\\n        // unused function\\n        // comptroller.transferVerify(address(this), src, dst, tokens);\\n\\n        return NO_ERROR;\\n    }\\n\\n    /**\\n     * @notice Transfer `amount` tokens from `msg.sender` to `dst`\\n     * @param dst The address of the destination account\\n     * @param amount The number of tokens to transfer\\n     * @return Whether or not the transfer succeeded\\n     */\\n    function transfer(\\n        address dst,\\n        uint256 amount\\n    ) external override nonReentrant returns (bool) {\\n        return transferTokens(msg.sender, msg.sender, dst, amount) == NO_ERROR;\\n    }\\n\\n    /**\\n     * @notice Transfer `amount` tokens from `src` to `dst`\\n     * @param src The address of the source account\\n     * @param dst The address of the destination account\\n     * @param amount The number of tokens to transfer\\n     * @return Whether or not the transfer succeeded\\n     */\\n    function transferFrom(\\n        address src,\\n        address dst,\\n        uint256 amount\\n    ) external override nonReentrant returns (bool) {\\n        return transferTokens(msg.sender, src, dst, amount) == NO_ERROR;\\n    }\\n\\n    /**\\n     * @notice Approve `spender` to transfer up to `amount` from `src`\\n     * @dev This will overwrite the approval amount for `spender`\\n     *  and is subject to issues noted [here](https://eips.ethereum.org/EIPS/eip-20#approve)\\n     * @param spender The address of the account which may transfer tokens\\n     * @param amount The number of tokens that are approved (uint256.max means infinite)\\n     * @return Whether or not the approval succeeded\\n     */\\n    function approve(\\n        address spender,\\n        uint256 amount\\n    ) external override returns (bool) {\\n        address src = msg.sender;\\n        transferAllowances[src][spender] = amount;\\n        emit Approval(src, spender, amount);\\n        return true;\\n    }\\n\\n    /**\\n     * @notice Get the current allowance from `owner` for `spender`\\n     * @param owner The address of the account which owns the tokens to be spent\\n     * @param spender The address of the account which may transfer tokens\\n     * @return The number of tokens allowed to be spent (-1 means infinite)\\n     */\\n    function allowance(\\n        address owner,\\n        address spender\\n    ) external view override returns (uint256) {\\n        return transferAllowances[owner][spender];\\n    }\\n\\n    /**\\n     * @notice Get the token balance of the `owner`\\n     * @param owner The address of the account to query\\n     * @return The number of tokens owned by `owner`\\n     */\\n    function balanceOf(address owner) external view override returns (uint256) {\\n        return accountTokens[owner];\\n    }\\n\\n    /**\\n     * @notice Get the underlying balance of the `owner`\\n     * @dev This also accrues interest in a transaction\\n     * @param owner The address of the account to query\\n     * @return The amount of underlying owned by `owner`\\n     */\\n    function balanceOfUnderlying(\\n        address owner\\n    ) external override returns (uint256) {\\n        Exp memory exchangeRate = Exp({mantissa: exchangeRateCurrent()});\\n        return mul_ScalarTruncate(exchangeRate, accountTokens[owner]);\\n    }\\n\\n    /**\\n     * @notice Get a snapshot of the account's balances, and the cached exchange rate\\n     * @dev This is used by comptroller to more efficiently perform liquidity checks.\\n     * @param account Address of the account to snapshot\\n     * @return (possible error, token balance, borrow balance, exchange rate mantissa)\\n     */\\n    function getAccountSnapshot(\\n        address account\\n    ) external view override returns (uint256, uint256, uint256, uint256) {\\n        return (\\n            NO_ERROR,\\n            accountTokens[account],\\n            borrowBalanceStoredInternal(account),\\n            exchangeRateStoredInternal()\\n        );\\n    }\\n\\n    /**\\n     * @dev Function to simply retrieve block number\\n     *  This exists mainly for inheriting test contracts to stub this result.\\n     */\\n    function getBlockNumber() internal view virtual returns (uint256) {\\n        return block.timestamp;\\n    }\\n\\n    /**\\n     * @notice Returns the current per-block borrow interest rate for this cToken\\n     * @return The borrow interest rate per block, scaled by 1e18\\n     */\\n    function borrowRatePerBlock() external view override returns (uint256) {\\n        return\\n            interestRateModel.getBorrowRate(\\n                getCashPrior(),\\n                totalBorrows,\\n                totalReserves\\n            );\\n    }\\n\\n    /**\\n     * @notice Returns the current per-block supply interest rate for this cToken\\n     * @return The supply interest rate per block, scaled by 1e18\\n     */\\n    function supplyRatePerBlock() external view override returns (uint256) {\\n        return\\n            interestRateModel.getSupplyRate(\\n                getCashPrior(),\\n                totalBorrows,\\n                totalReserves,\\n                reserveFactorMantissa\\n            );\\n    }\\n\\n    /**\\n     * @notice Returns the current total borrows plus accrued interest\\n     * @return The total borrows with interest\\n     */\\n    function totalBorrowsCurrent()\\n        external\\n        override\\n        nonReentrant\\n        returns (uint256)\\n    {\\n        accrueInterest();\\n        return totalBorrows;\\n    }\\n\\n    /**\\n     * @notice Accrue interest to updated borrowIndex and then calculate account's borrow balance using the updated borrowIndex\\n     * @param account The address whose balance should be calculated after updating borrowIndex\\n     * @return The calculated balance\\n     */\\n    function borrowBalanceCurrent(\\n        address account\\n    ) external override nonReentrant returns (uint256) {\\n        accrueInterest();\\n        return borrowBalanceStored(account);\\n    }\\n\\n    /**\\n     * @notice Return the borrow balance of account based on stored data\\n     * @param account The address whose balance should be calculated\\n     * @return The calculated balance\\n     */\\n    function borrowBalanceStored(\\n        address account\\n    ) public view override returns (uint256) {\\n        return borrowBalanceStoredInternal(account);\\n    }\\n\\n    /**\\n     * @notice Return the borrow balance of account based on stored data\\n     * @param account The address whose balance should be calculated\\n     * @return (error code, the calculated balance or 0 if error code is non-zero)\\n     */\\n    function borrowBalanceStoredInternal(\\n        address account\\n    ) internal view returns (uint256) {\\n        /* Get borrowBalance and borrowIndex */\\n        BorrowSnapshot storage borrowSnapshot = accountBorrows[account];\\n\\n        /* If borrowBalance = 0 then borrowIndex is likely also 0.\\n         * Rather than failing the calculation with a division by 0, we immediately return 0 in this case.\\n         */\\n        if (borrowSnapshot.principal == 0) {\\n            return 0;\\n        }\\n\\n        /* Calculate new borrow balance using the interest index:\\n         *  recentBorrowBalance = borrower.borrowBalance * market.borrowIndex / borrower.borrowIndex\\n         */\\n        uint256 principalTimesIndex = borrowSnapshot.principal * borrowIndex;\\n        return principalTimesIndex / borrowSnapshot.interestIndex;\\n    }\\n\\n    /**\\n     * @notice Accrue interest then return the up-to-date exchange rate\\n     * @return Calculated exchange rate scaled by 1e18\\n     */\\n    function exchangeRateCurrent()\\n        public\\n        override\\n        nonReentrant\\n        returns (uint256)\\n    {\\n        accrueInterest();\\n        return exchangeRateStored();\\n    }\\n\\n    /**\\n     * @notice Calculates the exchange rate from the underlying to the CToken\\n     * @dev This function does not accrue interest before calculating the exchange rate\\n     * @return Calculated exchange rate scaled by 1e18\\n     */\\n    function exchangeRateStored() public view override returns (uint256) {\\n        return exchangeRateStoredInternal();\\n    }\\n\\n    /**\\n     * @notice Calculates the exchange rate from the underlying to the CToken\\n     * @dev This function does not accrue interest before calculating the exchange rate\\n     * @return calculated exchange rate scaled by 1e18\\n     */\\n    function exchangeRateStoredInternal()\\n        internal\\n        view\\n        virtual\\n        returns (uint256)\\n    {\\n        uint256 _totalSupply = totalSupply;\\n        if (_totalSupply == 0) {\\n            /*\\n             * If there are no tokens minted:\\n             *  exchangeRate = initialExchangeRate\\n             */\\n            return initialExchangeRateMantissa;\\n        } else {\\n            /*\\n             * Otherwise:\\n             *  exchangeRate = (totalCash + totalBorrows - totalReserves) / totalSupply\\n             */\\n            uint256 totalCash = getCashPrior();\\n            uint256 cashPlusBorrowsMinusReserves = totalCash +\\n                totalBorrows -\\n                totalReserves;\\n            uint256 exchangeRate = (cashPlusBorrowsMinusReserves * expScale) /\\n                _totalSupply;\\n\\n            return exchangeRate;\\n        }\\n    }\\n\\n    /**\\n     * @notice Get cash balance of this cToken in the underlying asset\\n     * @return The quantity of underlying asset owned by this contract\\n     */\\n    function getCash() external view override returns (uint256) {\\n        return getCashPrior();\\n    }\\n\\n    /**\\n     * @notice Applies accrued interest to total borrows and reserves\\n     * @dev This calculates interest accrued from the last checkpointed block\\n     *   up to the current block and writes new checkpoint to storage.\\n     */\\n    function accrueInterest() public virtual override returns (uint256) {\\n        /* Remember the initial block number */\\n        uint256 currentBlockNumber = getBlockNumber();\\n        uint256 accrualBlockNumberPrior = accrualBlockNumber;\\n\\n        /* Short-circuit accumulating 0 interest */\\n        if (accrualBlockNumberPrior == currentBlockNumber) {\\n            return NO_ERROR;\\n        }\\n\\n        /* Read the previous values out of storage */\\n        uint256 cashPrior = getCashPrior();\\n        uint256 borrowsPrior = totalBorrows;\\n        uint256 reservesPrior = totalReserves;\\n        uint256 borrowIndexPrior = borrowIndex;\\n\\n        /* Calculate the current borrow interest rate */\\n        uint256 borrowRateMantissa = interestRateModel.getBorrowRate(\\n            cashPrior,\\n            borrowsPrior,\\n            reservesPrior\\n        );\\n        require(\\n            borrowRateMantissa <= borrowRateMaxMantissa,\\n            \\\"borrow rate is absurdly high\\\"\\n        );\\n\\n        /* Calculate the number of blocks elapsed since the last accrual */\\n        uint256 blockDelta = currentBlockNumber - accrualBlockNumberPrior;\\n\\n        /*\\n         * Calculate the interest accumulated into borrows and reserves and the new index:\\n         *  simpleInterestFactor = borrowRate * blockDelta\\n         *  interestAccumulated = simpleInterestFactor * totalBorrows\\n         *  totalBorrowsNew = interestAccumulated + totalBorrows\\n         *  totalReservesNew = interestAccumulated * reserveFactor + totalReserves\\n         *  borrowIndexNew = simpleInterestFactor * borrowIndex + borrowIndex\\n         */\\n\\n        Exp memory simpleInterestFactor = mul_(\\n            Exp({mantissa: borrowRateMantissa}),\\n            blockDelta\\n        );\\n        uint256 interestAccumulated = mul_ScalarTruncate(\\n            simpleInterestFactor,\\n            borrowsPrior\\n        );\\n        uint256 totalBorrowsNew = interestAccumulated + borrowsPrior;\\n        uint256 totalReservesNew = mul_ScalarTruncateAddUInt(\\n            Exp({mantissa: reserveFactorMantissa}),\\n            interestAccumulated,\\n            reservesPrior\\n        );\\n        uint256 borrowIndexNew = mul_ScalarTruncateAddUInt(\\n            simpleInterestFactor,\\n            borrowIndexPrior,\\n            borrowIndexPrior\\n        );\\n\\n        /////////////////////////\\n        // EFFECTS & INTERACTIONS\\n        // (No safe failures beyond this point)\\n\\n        /* We write the previously calculated values into storage */\\n        accrualBlockNumber = currentBlockNumber;\\n        borrowIndex = borrowIndexNew;\\n        totalBorrows = totalBorrowsNew;\\n        totalReserves = totalReservesNew;\\n\\n        /* We emit an AccrueInterest event */\\n        emit AccrueInterest(\\n            cashPrior,\\n            interestAccumulated,\\n            borrowIndexNew,\\n            totalBorrowsNew\\n        );\\n\\n        return NO_ERROR;\\n    }\\n\\n    /**\\n     * @notice Sender supplies assets into the market and receives cTokens in exchange\\n     * @dev Accrues interest whether or not the operation succeeds, unless reverted\\n     * @param mintAmount The amount of the underlying asset to supply\\n     */\\n    function mintInternal(uint256 mintAmount) internal nonReentrant {\\n        accrueInterest();\\n        // mintFresh emits the actual Mint event if successful and logs on errors, so we don't need to\\n        mintFresh(msg.sender, mintAmount);\\n    }\\n\\n    /**\\n     * @notice User supplies assets into the market and receives cTokens in exchange\\n     * @dev Assumes interest has already been accrued up to the current block\\n     * @param minter The address of the account which is supplying the assets\\n     * @param mintAmount The amount of the underlying asset to supply\\n     */\\n    function mintFresh(address minter, uint256 mintAmount) internal {\\n        /* Fail if mint not allowed */\\n        uint256 allowed = comptroller.mintAllowed(\\n            address(this),\\n            minter,\\n            mintAmount\\n        );\\n        if (allowed != 0) {\\n            revert MintComptrollerRejection(allowed);\\n        }\\n\\n        /* Verify market's block number equals current block number */\\n        if (accrualBlockNumber != getBlockNumber()) {\\n            revert MintFreshnessCheck();\\n        }\\n\\n        Exp memory exchangeRate = Exp({mantissa: exchangeRateStoredInternal()});\\n\\n        /////////////////////////\\n        // EFFECTS & INTERACTIONS\\n        // (No safe failures beyond this point)\\n\\n        /*\\n         *  We call `doTransferIn` for the minter and the mintAmount.\\n         *  Note: The cToken must handle variations between ERC-20 and ETH underlying.\\n         *  `doTransferIn` reverts if anything goes wrong, since we can't be sure if\\n         *  side-effects occurred. The function returns the amount actually transferred,\\n         *  in case of a fee. On success, the cToken holds an additional `actualMintAmount`\\n         *  of cash.\\n         */\\n        uint256 actualMintAmount = doTransferIn(minter, mintAmount);\\n\\n        /*\\n         * We get the current exchange rate and calculate the number of cTokens to be minted:\\n         *  mintTokens = actualMintAmount / exchangeRate\\n         */\\n\\n        uint256 mintTokens = div_(actualMintAmount, exchangeRate);\\n\\n        /*\\n         * We calculate the new total supply of cTokens and minter token balance, checking for overflow:\\n         *  totalSupplyNew = totalSupply + mintTokens\\n         *  accountTokensNew = accountTokens[minter] + mintTokens\\n         * And write them into storage\\n         */\\n        totalSupply = totalSupply + mintTokens;\\n        accountTokens[minter] = accountTokens[minter] + mintTokens;\\n\\n        /* We emit a Mint event, and a Transfer event */\\n        emit Mint(minter, actualMintAmount, mintTokens);\\n        emit Transfer(address(this), minter, mintTokens);\\n\\n        /* We call the defense hook */\\n        // unused function\\n        // comptroller.mintVerify(address(this), minter, actualMintAmount, mintTokens);\\n    }\\n\\n    /**\\n     * @notice Sender redeems cTokens in exchange for the underlying asset\\n     * @dev Accrues interest whether or not the operation succeeds, unless reverted\\n     * @param redeemTokens The number of cTokens to redeem into underlying\\n     */\\n    function redeemInternal(uint256 redeemTokens) internal nonReentrant {\\n        accrueInterest();\\n        // redeemFresh emits redeem-specific logs on errors, so we don't need to\\n        redeemFresh(payable(msg.sender), redeemTokens, 0);\\n    }\\n\\n    /**\\n     * @notice Sender redeems cTokens in exchange for a specified amount of underlying asset\\n     * @dev Accrues interest whether or not the operation succeeds, unless reverted\\n     * @param redeemAmount The amount of underlying to receive from redeeming cTokens\\n     */\\n    function redeemUnderlyingInternal(\\n        uint256 redeemAmount\\n    ) internal nonReentrant {\\n        accrueInterest();\\n        // redeemFresh emits redeem-specific logs on errors, so we don't need to\\n        redeemFresh(payable(msg.sender), 0, redeemAmount);\\n    }\\n\\n    /**\\n     * @notice User redeems cTokens in exchange for the underlying asset\\n     * @dev Assumes interest has already been accrued up to the current block\\n     * @param redeemer The address of the account which is redeeming the tokens\\n     * @param redeemTokensIn The number of cTokens to redeem into underlying (only one of redeemTokensIn or redeemAmountIn may be non-zero)\\n     * @param redeemAmountIn The number of underlying tokens to receive from redeeming cTokens (only one of redeemTokensIn or redeemAmountIn may be non-zero)\\n     */\\n    function redeemFresh(\\n        address payable redeemer,\\n        uint256 redeemTokensIn,\\n        uint256 redeemAmountIn\\n    ) internal {\\n        require(\\n            redeemTokensIn == 0 || redeemAmountIn == 0,\\n            \\\"one of redeemTokensIn or redeemAmountIn must be zero\\\"\\n        );\\n\\n        /* exchangeRate = invoke Exchange Rate Stored() */\\n        Exp memory exchangeRate = Exp({mantissa: exchangeRateStoredInternal()});\\n\\n        uint256 redeemTokens;\\n        uint256 redeemAmount;\\n        /* If redeemTokensIn > 0: */\\n        if (redeemTokensIn > 0) {\\n            /*\\n             * We calculate the exchange rate and the amount of underlying to be redeemed:\\n             *  redeemTokens = redeemTokensIn\\n             *  redeemAmount = redeemTokensIn x exchangeRateCurrent\\n             */\\n            redeemTokens = redeemTokensIn;\\n            redeemAmount = mul_ScalarTruncate(exchangeRate, redeemTokensIn);\\n        } else {\\n            /*\\n             * We get the current exchange rate and calculate the amount to be redeemed:\\n             *  redeemTokens = redeemAmountIn / exchangeRate\\n             *  redeemAmount = redeemAmountIn\\n             */\\n            redeemTokens = div_(redeemAmountIn, exchangeRate);\\n            redeemAmount = redeemAmountIn;\\n        }\\n\\n        /* Fail if redeem not allowed */\\n        uint256 allowed = comptroller.redeemAllowed(\\n            address(this),\\n            redeemer,\\n            redeemTokens\\n        );\\n        if (allowed != 0) {\\n            revert RedeemComptrollerRejection(allowed);\\n        }\\n\\n        /* Verify market's block number equals current block number */\\n        if (accrualBlockNumber != getBlockNumber()) {\\n            revert RedeemFreshnessCheck();\\n        }\\n\\n        /* Fail gracefully if protocol has insufficient cash */\\n        if (getCashPrior() < redeemAmount) {\\n            revert RedeemTransferOutNotPossible();\\n        }\\n\\n        /////////////////////////\\n        // EFFECTS & INTERACTIONS\\n        // (No safe failures beyond this point)\\n\\n        /*\\n         * We write the previously calculated values into storage.\\n         *  Note: Avoid token reentrancy attacks by writing reduced supply before external transfer.\\n         */\\n        totalSupply = totalSupply - redeemTokens;\\n        accountTokens[redeemer] = accountTokens[redeemer] - redeemTokens;\\n\\n        /*\\n         * We invoke doTransferOut for the redeemer and the redeemAmount.\\n         *  Note: The cToken must handle variations between ERC-20 and ETH underlying.\\n         *  On success, the cToken has redeemAmount less of cash.\\n         *  doTransferOut reverts if anything goes wrong, since we can't be sure if side effects occurred.\\n         */\\n        doTransferOut(redeemer, redeemAmount);\\n\\n        /* We emit a Transfer event, and a Redeem event */\\n        emit Transfer(redeemer, address(this), redeemTokens);\\n        emit Redeem(redeemer, redeemAmount, redeemTokens);\\n\\n        /* We call the defense hook */\\n        comptroller.redeemVerify(\\n            address(this),\\n            redeemer,\\n            redeemAmount,\\n            redeemTokens\\n        );\\n    }\\n\\n    /**\\n     * @notice Sender borrows assets from the protocol to their own address\\n     * @param borrowAmount The amount of the underlying asset to borrow\\n     */\\n    function borrowInternal(uint256 borrowAmount) internal nonReentrant {\\n        accrueInterest();\\n        // borrowFresh emits borrow-specific logs on errors, so we don't need to\\n        borrowFresh(payable(msg.sender), borrowAmount);\\n    }\\n\\n    /**\\n     * @notice Users borrow assets from the protocol to their own address\\n     * @param borrowAmount The amount of the underlying asset to borrow\\n     */\\n    function borrowFresh(\\n        address payable borrower,\\n        uint256 borrowAmount\\n    ) internal {\\n        /* Fail if borrow not allowed */\\n        uint256 allowed = comptroller.borrowAllowed(\\n            address(this),\\n            borrower,\\n            borrowAmount\\n        );\\n        if (allowed != 0) {\\n            revert BorrowComptrollerRejection(allowed);\\n        }\\n\\n        /* Verify market's block number equals current block number */\\n        if (accrualBlockNumber != getBlockNumber()) {\\n            revert BorrowFreshnessCheck();\\n        }\\n\\n        /* Fail gracefully if protocol has insufficient underlying cash */\\n        if (getCashPrior() < borrowAmount) {\\n            revert BorrowCashNotAvailable();\\n        }\\n\\n        /*\\n         * We calculate the new borrower and total borrow balances, failing on overflow:\\n         *  accountBorrowNew = accountBorrow + borrowAmount\\n         *  totalBorrowsNew = totalBorrows + borrowAmount\\n         */\\n        uint256 accountBorrowsPrev = borrowBalanceStoredInternal(borrower);\\n        uint256 accountBorrowsNew = accountBorrowsPrev + borrowAmount;\\n        uint256 totalBorrowsNew = totalBorrows + borrowAmount;\\n\\n        /////////////////////////\\n        // EFFECTS & INTERACTIONS\\n        // (No safe failures beyond this point)\\n\\n        /*\\n         * We write the previously calculated values into storage.\\n         *  Note: Avoid token reentrancy attacks by writing increased borrow before external transfer.\\n        `*/\\n        accountBorrows[borrower].principal = accountBorrowsNew;\\n        accountBorrows[borrower].interestIndex = borrowIndex;\\n        totalBorrows = totalBorrowsNew;\\n\\n        /*\\n         * We invoke doTransferOut for the borrower and the borrowAmount.\\n         *  Note: The cToken must handle variations between ERC-20 and ETH underlying.\\n         *  On success, the cToken borrowAmount less of cash.\\n         *  doTransferOut reverts if anything goes wrong, since we can't be sure if side effects occurred.\\n         */\\n        doTransferOut(borrower, borrowAmount);\\n\\n        /* We emit a Borrow event */\\n        emit Borrow(borrower, borrowAmount, accountBorrowsNew, totalBorrowsNew);\\n    }\\n\\n    /**\\n     * @notice Sender repays their own borrow\\n     * @param repayAmount The amount to repay, or -1 for the full outstanding amount\\n     */\\n    function repayBorrowInternal(uint256 repayAmount) internal nonReentrant {\\n        accrueInterest();\\n        // repayBorrowFresh emits repay-borrow-specific logs on errors, so we don't need to\\n        repayBorrowFresh(msg.sender, msg.sender, repayAmount);\\n    }\\n\\n    /**\\n     * @notice Sender repays a borrow belonging to borrower\\n     * @param borrower the account with the debt being payed off\\n     * @param repayAmount The amount to repay, or -1 for the full outstanding amount\\n     */\\n    function repayBorrowBehalfInternal(\\n        address borrower,\\n        uint256 repayAmount\\n    ) internal nonReentrant {\\n        accrueInterest();\\n        // repayBorrowFresh emits repay-borrow-specific logs on errors, so we don't need to\\n        repayBorrowFresh(msg.sender, borrower, repayAmount);\\n    }\\n\\n    /**\\n     * @notice Borrows are repaid by another user (possibly the borrower).\\n     * @param payer the account paying off the borrow\\n     * @param borrower the account with the debt being payed off\\n     * @param repayAmount the amount of underlying tokens being returned, or -1 for the full outstanding amount\\n     * @return (uint) the actual repayment amount.\\n     */\\n    function repayBorrowFresh(\\n        address payer,\\n        address borrower,\\n        uint256 repayAmount\\n    ) internal returns (uint256) {\\n        /* Fail if repayBorrow not allowed */\\n        uint256 allowed = comptroller.repayBorrowAllowed(\\n            address(this),\\n            payer,\\n            borrower,\\n            repayAmount\\n        );\\n        if (allowed != 0) {\\n            revert RepayBorrowComptrollerRejection(allowed);\\n        }\\n\\n        /* Verify market's block number equals current block number */\\n        if (accrualBlockNumber != getBlockNumber()) {\\n            revert RepayBorrowFreshnessCheck();\\n        }\\n\\n        /* We fetch the amount the borrower owes, with accumulated interest */\\n        uint256 accountBorrowsPrev = borrowBalanceStoredInternal(borrower);\\n\\n        /* If repayAmount == -1, repayAmount = accountBorrows */\\n        uint256 repayAmountFinal = repayAmount == type(uint256).max\\n            ? accountBorrowsPrev\\n            : repayAmount;\\n\\n        /////////////////////////\\n        // EFFECTS & INTERACTIONS\\n        // (No safe failures beyond this point)\\n\\n        /*\\n         * We call doTransferIn for the payer and the repayAmount\\n         *  Note: The cToken must handle variations between ERC-20 and ETH underlying.\\n         *  On success, the cToken holds an additional repayAmount of cash.\\n         *  doTransferIn reverts if anything goes wrong, since we can't be sure if side effects occurred.\\n         *   it returns the amount actually transferred, in case of a fee.\\n         */\\n        uint256 actualRepayAmount = doTransferIn(payer, repayAmountFinal);\\n\\n        /*\\n         * We calculate the new borrower and total borrow balances, failing on underflow:\\n         *  accountBorrowsNew = accountBorrows - actualRepayAmount\\n         *  totalBorrowsNew = totalBorrows - actualRepayAmount\\n         */\\n        uint256 accountBorrowsNew = accountBorrowsPrev - actualRepayAmount;\\n        uint256 totalBorrowsNew = totalBorrows - actualRepayAmount;\\n\\n        /* We write the previously calculated values into storage */\\n        accountBorrows[borrower].principal = accountBorrowsNew;\\n        accountBorrows[borrower].interestIndex = borrowIndex;\\n        totalBorrows = totalBorrowsNew;\\n\\n        /* We emit a RepayBorrow event */\\n        emit RepayBorrow(\\n            payer,\\n            borrower,\\n            actualRepayAmount,\\n            accountBorrowsNew,\\n            totalBorrowsNew\\n        );\\n\\n        return actualRepayAmount;\\n    }\\n\\n    /**\\n     * @notice The sender liquidates the borrowers collateral.\\n     *  The collateral seized is transferred to the liquidator.\\n     * @param borrower The borrower of this cToken to be liquidated\\n     * @param cTokenCollateral The market in which to seize collateral from the borrower\\n     * @param repayAmount The amount of the underlying borrowed asset to repay\\n     */\\n    function liquidateBorrowInternal(\\n        address borrower,\\n        uint256 repayAmount,\\n        CTokenInterface cTokenCollateral\\n    ) internal nonReentrant {\\n        accrueInterest();\\n\\n        uint256 error = cTokenCollateral.accrueInterest();\\n        if (error != NO_ERROR) {\\n            // accrueInterest emits logs on errors, but we still want to log the fact that an attempted liquidation failed\\n            revert LiquidateAccrueCollateralInterestFailed(error);\\n        }\\n\\n        // liquidateBorrowFresh emits borrow-specific logs on errors, so we don't need to\\n        liquidateBorrowFresh(\\n            msg.sender,\\n            borrower,\\n            repayAmount,\\n            cTokenCollateral\\n        );\\n    }\\n\\n    /**\\n     * @notice The liquidator liquidates the borrowers collateral.\\n     *  The collateral seized is transferred to the liquidator.\\n     * @param borrower The borrower of this cToken to be liquidated\\n     * @param liquidator The address repaying the borrow and seizing collateral\\n     * @param cTokenCollateral The market in which to seize collateral from the borrower\\n     * @param repayAmount The amount of the underlying borrowed asset to repay\\n     */\\n    function liquidateBorrowFresh(\\n        address liquidator,\\n        address borrower,\\n        uint256 repayAmount,\\n        CTokenInterface cTokenCollateral\\n    ) internal {\\n        /* Fail if liquidate not allowed */\\n        uint256 allowed = comptroller.liquidateBorrowAllowed(\\n            address(this),\\n            address(cTokenCollateral),\\n            liquidator,\\n            borrower,\\n            repayAmount\\n        );\\n        if (allowed != 0) {\\n            revert LiquidateComptrollerRejection(allowed);\\n        }\\n\\n        /* Verify market's block number equals current block number */\\n        if (accrualBlockNumber != getBlockNumber()) {\\n            revert LiquidateFreshnessCheck();\\n        }\\n\\n        /* Verify cTokenCollateral market's block number equals current block number */\\n        if (cTokenCollateral.accrualBlockNumber() != getBlockNumber()) {\\n            revert LiquidateCollateralFreshnessCheck();\\n        }\\n\\n        /* Fail if borrower = liquidator */\\n        if (borrower == liquidator) {\\n            revert LiquidateLiquidatorIsBorrower();\\n        }\\n\\n        /* Fail if repayAmount = 0 */\\n        if (repayAmount == 0) {\\n            revert LiquidateCloseAmountIsZero();\\n        }\\n\\n        /* Fail if repayAmount = -1 */\\n        if (repayAmount == type(uint256).max) {\\n            revert LiquidateCloseAmountIsUintMax();\\n        }\\n\\n        /* Fail if repayBorrow fails */\\n        uint256 actualRepayAmount = repayBorrowFresh(\\n            liquidator,\\n            borrower,\\n            repayAmount\\n        );\\n\\n        /////////////////////////\\n        // EFFECTS & INTERACTIONS\\n        // (No safe failures beyond this point)\\n\\n        /* We calculate the number of collateral tokens that will be seized */\\n        (uint256 amountSeizeError, uint256 seizeTokens) = comptroller\\n            .liquidateCalculateSeizeTokens(\\n                address(this),\\n                address(cTokenCollateral),\\n                actualRepayAmount\\n            );\\n        require(\\n            amountSeizeError == NO_ERROR,\\n            \\\"LIQUIDATE_COMPTROLLER_CALCULATE_AMOUNT_SEIZE_FAILED\\\"\\n        );\\n\\n        /* Revert if borrower collateral token balance < seizeTokens */\\n        require(\\n            cTokenCollateral.balanceOf(borrower) >= seizeTokens,\\n            \\\"LIQUIDATE_SEIZE_TOO_MUCH\\\"\\n        );\\n\\n        // If this is also the collateral, run seizeInternal to avoid re-entrancy, otherwise make an external call\\n        if (address(cTokenCollateral) == address(this)) {\\n            seizeInternal(address(this), liquidator, borrower, seizeTokens);\\n        } else {\\n            require(\\n                cTokenCollateral.seize(liquidator, borrower, seizeTokens) ==\\n                    NO_ERROR,\\n                \\\"token seizure failed\\\"\\n            );\\n        }\\n\\n        /* We emit a LiquidateBorrow event */\\n        emit LiquidateBorrow(\\n            liquidator,\\n            borrower,\\n            actualRepayAmount,\\n            address(cTokenCollateral),\\n            seizeTokens\\n        );\\n    }\\n\\n    /**\\n     * @notice Transfers collateral tokens (this market) to the liquidator.\\n     * @dev Will fail unless called by another cToken during the process of liquidation.\\n     *  Its absolutely critical to use msg.sender as the borrowed cToken and not a parameter.\\n     * @param liquidator The account receiving seized collateral\\n     * @param borrower The account having collateral seized\\n     * @param seizeTokens The number of cTokens to seize\\n     * @return uint 0=success, otherwise a failure (see ErrorReporter.sol for details)\\n     */\\n    function seize(\\n        address liquidator,\\n        address borrower,\\n        uint256 seizeTokens\\n    ) external override nonReentrant returns (uint256) {\\n        seizeInternal(msg.sender, liquidator, borrower, seizeTokens);\\n\\n        return NO_ERROR;\\n    }\\n\\n    /**\\n     * @notice Transfers collateral tokens (this market) to the liquidator.\\n     * @dev Called only during an in-kind liquidation, or by liquidateBorrow during the liquidation of another CToken.\\n     *  Its absolutely critical to use msg.sender as the seizer cToken and not a parameter.\\n     * @param seizerToken The contract seizing the collateral (i.e. borrowed cToken)\\n     * @param liquidator The account receiving seized collateral\\n     * @param borrower The account having collateral seized\\n     * @param seizeTokens The number of cTokens to seize\\n     */\\n    function seizeInternal(\\n        address seizerToken,\\n        address liquidator,\\n        address borrower,\\n        uint256 seizeTokens\\n    ) internal {\\n        /* Fail if seize not allowed */\\n        uint256 allowed = comptroller.seizeAllowed(\\n            address(this),\\n            seizerToken,\\n            liquidator,\\n            borrower,\\n            seizeTokens\\n        );\\n        if (allowed != 0) {\\n            revert LiquidateSeizeComptrollerRejection(allowed);\\n        }\\n\\n        /* Fail if borrower = liquidator */\\n        if (borrower == liquidator) {\\n            revert LiquidateSeizeLiquidatorIsBorrower();\\n        }\\n\\n        /*\\n         * We calculate the new borrower and liquidator token balances, failing on underflow/overflow:\\n         *  borrowerTokensNew = accountTokens[borrower] - seizeTokens\\n         *  liquidatorTokensNew = accountTokens[liquidator] + seizeTokens\\n         */\\n        uint256 protocolSeizeTokens = mul_(\\n            seizeTokens,\\n            Exp({mantissa: protocolSeizeShareMantissa})\\n        );\\n        uint256 liquidatorSeizeTokens = seizeTokens - protocolSeizeTokens;\\n        Exp memory exchangeRate = Exp({mantissa: exchangeRateStoredInternal()});\\n        uint256 protocolSeizeAmount = mul_ScalarTruncate(\\n            exchangeRate,\\n            protocolSeizeTokens\\n        );\\n        uint256 totalReservesNew = totalReserves + protocolSeizeAmount;\\n\\n        /////////////////////////\\n        // EFFECTS & INTERACTIONS\\n        // (No safe failures beyond this point)\\n\\n        /* We write the calculated values into storage */\\n        totalReserves = totalReservesNew;\\n        totalSupply = totalSupply - protocolSeizeTokens;\\n        accountTokens[borrower] = accountTokens[borrower] - seizeTokens;\\n        accountTokens[liquidator] =\\n            accountTokens[liquidator] +\\n            liquidatorSeizeTokens;\\n\\n        /* Emit a Transfer event */\\n        emit Transfer(borrower, liquidator, liquidatorSeizeTokens);\\n        emit Transfer(borrower, address(this), protocolSeizeTokens);\\n        emit ReservesAdded(\\n            address(this),\\n            protocolSeizeAmount,\\n            totalReservesNew\\n        );\\n    }\\n\\n    /*** Admin Functions ***/\\n\\n    /**\\n     * @notice Begins transfer of admin rights. The newPendingAdmin must call `_acceptAdmin` to finalize the transfer.\\n     * @dev Admin function to begin change of admin. The newPendingAdmin must call `_acceptAdmin` to finalize the transfer.\\n     * @param newPendingAdmin New pending admin.\\n     * @return uint 0=success, otherwise a failure (see ErrorReporter.sol for details)\\n     */\\n    function _setPendingAdmin(\\n        address payable newPendingAdmin\\n    ) external override returns (uint256) {\\n        // Check caller = admin\\n        if (msg.sender != admin) {\\n            revert SetPendingAdminOwnerCheck();\\n        }\\n\\n        // Save current value, if any, for inclusion in log\\n        address oldPendingAdmin = pendingAdmin;\\n\\n        // Store pendingAdmin with value newPendingAdmin\\n        pendingAdmin = newPendingAdmin;\\n\\n        // Emit NewPendingAdmin(oldPendingAdmin, newPendingAdmin)\\n        emit NewPendingAdmin(oldPendingAdmin, newPendingAdmin);\\n\\n        return NO_ERROR;\\n    }\\n\\n    /**\\n     * @notice Accepts transfer of admin rights. msg.sender must be pendingAdmin\\n     * @dev Admin function for pending admin to accept role and update admin\\n     * @return uint 0=success, otherwise a failure (see ErrorReporter.sol for details)\\n     */\\n    function _acceptAdmin() external override returns (uint256) {\\n        // Check caller is pendingAdmin and pendingAdmin \\u2260 address(0)\\n        if (msg.sender != pendingAdmin || msg.sender == address(0)) {\\n            revert AcceptAdminPendingAdminCheck();\\n        }\\n\\n        // Save current values for inclusion in log\\n        address oldAdmin = admin;\\n        address oldPendingAdmin = pendingAdmin;\\n\\n        // Store admin with value pendingAdmin\\n        admin = pendingAdmin;\\n\\n        // Clear the pending value\\n        pendingAdmin = payable(address(0));\\n\\n        emit NewAdmin(oldAdmin, admin);\\n        emit NewPendingAdmin(oldPendingAdmin, pendingAdmin);\\n\\n        return NO_ERROR;\\n    }\\n\\n    /**\\n     * @notice Sets a new comptroller for the market\\n     * @dev Admin function to set a new comptroller\\n     * @return uint 0=success, otherwise a failure (see ErrorReporter.sol for details)\\n     */\\n    function _setComptroller(\\n        ComptrollerInterface newComptroller\\n    ) public override returns (uint256) {\\n        // Check caller is admin\\n        if (msg.sender != admin) {\\n            revert SetComptrollerOwnerCheck();\\n        }\\n\\n        ComptrollerInterface oldComptroller = comptroller;\\n        // Ensure invoke comptroller.isComptroller() returns true\\n        require(newComptroller.isComptroller(), \\\"marker method returned false\\\");\\n\\n        // Set market's comptroller to newComptroller\\n        comptroller = newComptroller;\\n\\n        // Emit NewComptroller(oldComptroller, newComptroller)\\n        emit NewComptroller(oldComptroller, newComptroller);\\n\\n        return NO_ERROR;\\n    }\\n\\n    /**\\n     * @notice accrues interest and sets a new reserve factor for the protocol using _setReserveFactorFresh\\n     * @dev Admin function to accrue interest and set a new reserve factor\\n     * @return uint 0=success, otherwise a failure (see ErrorReporter.sol for details)\\n     */\\n    function _setReserveFactor(\\n        uint256 newReserveFactorMantissa\\n    ) external override nonReentrant returns (uint256) {\\n        accrueInterest();\\n        // _setReserveFactorFresh emits reserve-factor-specific logs on errors, so we don't need to.\\n        return _setReserveFactorFresh(newReserveFactorMantissa);\\n    }\\n\\n    /**\\n     * @notice Sets a new reserve factor for the protocol (*requires fresh interest accrual)\\n     * @dev Admin function to set a new reserve factor\\n     * @return uint 0=success, otherwise a failure (see ErrorReporter.sol for details)\\n     */\\n    function _setReserveFactorFresh(\\n        uint256 newReserveFactorMantissa\\n    ) internal returns (uint256) {\\n        // Check caller is admin\\n        if (msg.sender != admin) {\\n            revert SetReserveFactorAdminCheck();\\n        }\\n\\n        // Verify market's block number equals current block number\\n        if (accrualBlockNumber != getBlockNumber()) {\\n            revert SetReserveFactorFreshCheck();\\n        }\\n\\n        // Check newReserveFactor \\u2264 maxReserveFactor\\n        if (newReserveFactorMantissa > reserveFactorMaxMantissa) {\\n            revert SetReserveFactorBoundsCheck();\\n        }\\n\\n        uint256 oldReserveFactorMantissa = reserveFactorMantissa;\\n        reserveFactorMantissa = newReserveFactorMantissa;\\n\\n        emit NewReserveFactor(\\n            oldReserveFactorMantissa,\\n            newReserveFactorMantissa\\n        );\\n\\n        return NO_ERROR;\\n    }\\n\\n    /**\\n     * @notice Accrues interest and reduces reserves by transferring from msg.sender\\n     * @param addAmount Amount of addition to reserves\\n     * @return uint 0=success, otherwise a failure (see ErrorReporter.sol for details)\\n     */\\n    function _addReservesInternal(\\n        uint256 addAmount\\n    ) internal nonReentrant returns (uint256) {\\n        accrueInterest();\\n\\n        // _addReservesFresh emits reserve-addition-specific logs on errors, so we don't need to.\\n        _addReservesFresh(addAmount);\\n        return NO_ERROR;\\n    }\\n\\n    /**\\n     * @notice Add reserves by transferring from caller\\n     * @dev Requires fresh interest accrual\\n     * @param addAmount Amount of addition to reserves\\n     * @return (uint, uint) An error code (0=success, otherwise a failure (see ErrorReporter.sol for details)) and the actual amount added, net token fees\\n     */\\n    function _addReservesFresh(\\n        uint256 addAmount\\n    ) internal returns (uint256, uint256) {\\n        // totalReserves + actualAddAmount\\n        uint256 totalReservesNew;\\n        uint256 actualAddAmount;\\n\\n        // We fail gracefully unless market's block number equals current block number\\n        if (accrualBlockNumber != getBlockNumber()) {\\n            revert AddReservesFactorFreshCheck(actualAddAmount);\\n        }\\n\\n        /////////////////////////\\n        // EFFECTS & INTERACTIONS\\n        // (No safe failures beyond this point)\\n\\n        /*\\n         * We call doTransferIn for the caller and the addAmount\\n         *  Note: The cToken must handle variations between ERC-20 and ETH underlying.\\n         *  On success, the cToken holds an additional addAmount of cash.\\n         *  doTransferIn reverts if anything goes wrong, since we can't be sure if side effects occurred.\\n         *  it returns the amount actually transferred, in case of a fee.\\n         */\\n\\n        actualAddAmount = doTransferIn(msg.sender, addAmount);\\n\\n        totalReservesNew = totalReserves + actualAddAmount;\\n\\n        // Store reserves[n+1] = reserves[n] + actualAddAmount\\n        totalReserves = totalReservesNew;\\n\\n        /* Emit NewReserves(admin, actualAddAmount, reserves[n+1]) */\\n        emit ReservesAdded(msg.sender, actualAddAmount, totalReservesNew);\\n\\n        /* Return (NO_ERROR, actualAddAmount) */\\n        return (NO_ERROR, actualAddAmount);\\n    }\\n\\n    /**\\n     * @notice Accrues interest and reduces reserves by transferring to admin\\n     * @param reduceAmount Amount of reduction to reserves\\n     * @return uint 0=success, otherwise a failure (see ErrorReporter.sol for details)\\n     */\\n    function _reduceReserves(\\n        uint256 reduceAmount\\n    ) external override nonReentrant returns (uint256) {\\n        accrueInterest();\\n        // _reduceReservesFresh emits reserve-reduction-specific logs on errors, so we don't need to.\\n        return _reduceReservesFresh(reduceAmount);\\n    }\\n\\n    /**\\n     * @notice Reduces reserves by transferring to admin\\n     * @dev Requires fresh interest accrual\\n     * @param reduceAmount Amount of reduction to reserves\\n     * @return uint 0=success, otherwise a failure (see ErrorReporter.sol for details)\\n     */\\n    function _reduceReservesFresh(\\n        uint256 reduceAmount\\n    ) internal returns (uint256) {\\n        // totalReserves - reduceAmount\\n        uint256 totalReservesNew;\\n\\n        // Check caller is admin\\n        if (msg.sender != admin) {\\n            revert ReduceReservesAdminCheck();\\n        }\\n\\n        // We fail gracefully unless market's block number equals current block number\\n        if (accrualBlockNumber != getBlockNumber()) {\\n            revert ReduceReservesFreshCheck();\\n        }\\n\\n        // Fail gracefully if protocol has insufficient underlying cash\\n        if (getCashPrior() < reduceAmount) {\\n            revert ReduceReservesCashNotAvailable();\\n        }\\n\\n        // Check reduceAmount \\u2264 reserves[n] (totalReserves)\\n        if (reduceAmount > totalReserves) {\\n            revert ReduceReservesCashValidation();\\n        }\\n\\n        /////////////////////////\\n        // EFFECTS & INTERACTIONS\\n        // (No safe failures beyond this point)\\n\\n        totalReservesNew = totalReserves - reduceAmount;\\n\\n        // Store reserves[n+1] = reserves[n] - reduceAmount\\n        totalReserves = totalReservesNew;\\n\\n        // doTransferOut reverts if anything goes wrong, since we can't be sure if side effects occurred.\\n        doTransferOut(admin, reduceAmount);\\n\\n        emit ReservesReduced(admin, reduceAmount, totalReservesNew);\\n\\n        return NO_ERROR;\\n    }\\n\\n    /**\\n     * @notice accrues interest and updates the interest rate model using _setInterestRateModelFresh\\n     * @dev Admin function to accrue interest and update the interest rate model\\n     * @param newInterestRateModel the new interest rate model to use\\n     * @return uint 0=success, otherwise a failure (see ErrorReporter.sol for details)\\n     */\\n    function _setInterestRateModel(\\n        InterestRateModel newInterestRateModel\\n    ) public override returns (uint256) {\\n        accrueInterest();\\n        // _setInterestRateModelFresh emits interest-rate-model-update-specific logs on errors, so we don't need to.\\n        return _setInterestRateModelFresh(newInterestRateModel);\\n    }\\n\\n    /**\\n     * @notice updates the interest rate model (*requires fresh interest accrual)\\n     * @dev Admin function to update the interest rate model\\n     * @param newInterestRateModel the new interest rate model to use\\n     * @return uint 0=success, otherwise a failure (see ErrorReporter.sol for details)\\n     */\\n    function _setInterestRateModelFresh(\\n        InterestRateModel newInterestRateModel\\n    ) internal returns (uint256) {\\n        // Used to store old model for use in the event that is emitted on success\\n        InterestRateModel oldInterestRateModel;\\n\\n        // Check caller is admin\\n        if (msg.sender != admin) {\\n            revert SetInterestRateModelOwnerCheck();\\n        }\\n\\n        // We fail gracefully unless market's block number equals current block number\\n        if (accrualBlockNumber != getBlockNumber()) {\\n            revert SetInterestRateModelFreshCheck();\\n        }\\n\\n        // Track the market's current interest rate model\\n        oldInterestRateModel = interestRateModel;\\n\\n        // Ensure invoke newInterestRateModel.isInterestRateModel() returns true\\n        require(\\n            newInterestRateModel.isInterestRateModel(),\\n            \\\"marker method returned false\\\"\\n        );\\n\\n        // Set the interest rate model to newInterestRateModel\\n        interestRateModel = newInterestRateModel;\\n\\n        // Emit NewMarketInterestRateModel(oldInterestRateModel, newInterestRateModel)\\n        emit NewMarketInterestRateModel(\\n            oldInterestRateModel,\\n            newInterestRateModel\\n        );\\n\\n        return NO_ERROR;\\n    }\\n\\n    /*** Safe Token ***/\\n\\n    /**\\n     * @notice Gets balance of this contract in terms of the underlying\\n     * @dev This excludes the value of the current message, if any\\n     * @return The quantity of underlying owned by this contract\\n     */\\n    function getCashPrior() internal view virtual returns (uint256);\\n\\n    /**\\n     * @dev Performs a transfer in, reverting upon failure. Returns the amount actually transferred to the protocol, in case of a fee.\\n     *  This may revert due to insufficient balance or insufficient allowance.\\n     */\\n    function doTransferIn(\\n        address from,\\n        uint256 amount\\n    ) internal virtual returns (uint256);\\n\\n    /**\\n     * @dev Performs a transfer out, ideally returning an explanatory error code upon failure rather than reverting.\\n     *  If caller has not called checked protocol's balance, may revert due to insufficient cash held in the contract.\\n     *  If caller has checked protocol's balance, and verified it is >= amount, this should not revert in normal conditions.\\n     */\\n    function doTransferOut(address payable to, uint256 amount) internal virtual;\\n\\n    /*** Reentrancy Guard ***/\\n\\n    /**\\n     * @dev Prevents a contract from calling itself, directly or indirectly.\\n     */\\n    modifier nonReentrant() {\\n        require(_notEntered, \\\"re-entered\\\");\\n        _notEntered = false;\\n        _;\\n        _notEntered = true; // get a gas-refund post-Istanbul\\n    }\\n}\\n\",\"keccak256\":\"0x609e4149b89ca9fdc8a92b18b65819cc5a65aab17ad7158820d7af6973ca63dd\",\"license\":\"BSD-3-Clause\"},\"contracts/CTokenInterfaces.sol\":{\"content\":\"// SPDX-License-Identifier: BSD-3-Clause\\npragma solidity ^0.8.10;\\n\\nimport \\\"./ComptrollerInterface.sol\\\";\\nimport \\\"./InterestRateModel.sol\\\";\\nimport \\\"./EIP20NonStandardInterface.sol\\\";\\nimport \\\"./ErrorReporter.sol\\\";\\n\\ncontract CTokenStorage {\\n    /**\\n     * @dev Guard variable for re-entrancy checks\\n     */\\n    bool internal _notEntered;\\n\\n    /**\\n     * @notice EIP-20 token name for this token\\n     */\\n    string public name;\\n\\n    /**\\n     * @notice EIP-20 token symbol for this token\\n     */\\n    string public symbol;\\n\\n    /**\\n     * @notice EIP-20 token decimals for this token\\n     */\\n    uint8 public decimals;\\n\\n    // Maximum borrow rate that can ever be applied (.0005% / block)\\n    uint internal constant borrowRateMaxMantissa = 0.0005e16;\\n\\n    // Maximum fraction of interest that can be set aside for reserves\\n    uint internal constant reserveFactorMaxMantissa = 1e18;\\n\\n    /**\\n     * @notice Administrator for this contract\\n     */\\n    address payable public admin;\\n\\n    /**\\n     * @notice Pending administrator for this contract\\n     */\\n    address payable public pendingAdmin;\\n\\n    /**\\n     * @notice Contract which oversees inter-cToken operations\\n     */\\n    ComptrollerInterface public comptroller;\\n\\n    /**\\n     * @notice Model which tells what the current interest rate should be\\n     */\\n    InterestRateModel public interestRateModel;\\n\\n    // Initial exchange rate used when minting the first CTokens (used when totalSupply = 0)\\n    uint internal initialExchangeRateMantissa;\\n\\n    /**\\n     * @notice Fraction of interest currently set aside for reserves\\n     */\\n    uint public reserveFactorMantissa;\\n\\n    /**\\n     * @notice Block number that interest was last accrued at\\n     */\\n    uint public accrualBlockNumber;\\n\\n    /**\\n     * @notice Accumulator of the total earned interest rate since the opening of the market\\n     */\\n    uint public borrowIndex;\\n\\n    /**\\n     * @notice Total amount of outstanding borrows of the underlying in this market\\n     */\\n    uint public totalBorrows;\\n\\n    /**\\n     * @notice Total amount of reserves of the underlying held in this market\\n     */\\n    uint public totalReserves;\\n\\n    /**\\n     * @notice Total number of tokens in circulation\\n     */\\n    uint public totalSupply;\\n\\n    // Official record of token balances for each account\\n    mapping(address => uint) internal accountTokens;\\n\\n    // Approved token transfer amounts on behalf of others\\n    mapping(address => mapping(address => uint)) internal transferAllowances;\\n\\n    /**\\n     * @notice Container for borrow balance information\\n     * @member principal Total balance (with accrued interest), after applying the most recent balance-changing action\\n     * @member interestIndex Global borrowIndex as of the most recent balance-changing action\\n     */\\n    struct BorrowSnapshot {\\n        uint principal;\\n        uint interestIndex;\\n    }\\n\\n    // Mapping of account addresses to outstanding borrow balances\\n    mapping(address => BorrowSnapshot) internal accountBorrows;\\n\\n    /**\\n     * @notice Share of seized collateral that is added to reserves\\n     */\\n    uint public constant protocolSeizeShareMantissa = 2.8e16; //2.8%\\n}\\n\\nabstract contract CTokenInterface is CTokenStorage {\\n    /**\\n     * @notice Indicator that this is a CToken contract (for inspection)\\n     */\\n    bool public constant isCToken = true;\\n\\n    /*** Market Events ***/\\n\\n    /**\\n     * @notice Event emitted when interest is accrued\\n     */\\n    event AccrueInterest(\\n        uint cashPrior,\\n        uint interestAccumulated,\\n        uint borrowIndex,\\n        uint totalBorrows\\n    );\\n\\n    /**\\n     * @notice Event emitted when tokens are minted\\n     */\\n    event Mint(address minter, uint mintAmount, uint mintTokens);\\n\\n    /**\\n     * @notice Event emitted when tokens are redeemed\\n     */\\n    event Redeem(address redeemer, uint redeemAmount, uint redeemTokens);\\n\\n    /**\\n     * @notice Event emitted when underlying is borrowed\\n     */\\n    event Borrow(\\n        address borrower,\\n        uint borrowAmount,\\n        uint accountBorrows,\\n        uint totalBorrows\\n    );\\n\\n    /**\\n     * @notice Event emitted when a borrow is repaid\\n     */\\n    event RepayBorrow(\\n        address payer,\\n        address borrower,\\n        uint repayAmount,\\n        uint accountBorrows,\\n        uint totalBorrows\\n    );\\n\\n    /**\\n     * @notice Event emitted when a borrow is liquidated\\n     */\\n    event LiquidateBorrow(\\n        address liquidator,\\n        address borrower,\\n        uint repayAmount,\\n        address cTokenCollateral,\\n        uint seizeTokens\\n    );\\n\\n    /*** Admin Events ***/\\n\\n    /**\\n     * @notice Event emitted when pendingAdmin is changed\\n     */\\n    event NewPendingAdmin(address oldPendingAdmin, address newPendingAdmin);\\n\\n    /**\\n     * @notice Event emitted when pendingAdmin is accepted, which means admin is updated\\n     */\\n    event NewAdmin(address oldAdmin, address newAdmin);\\n\\n    /**\\n     * @notice Event emitted when comptroller is changed\\n     */\\n    event NewComptroller(\\n        ComptrollerInterface oldComptroller,\\n        ComptrollerInterface newComptroller\\n    );\\n\\n    /**\\n     * @notice Event emitted when interestRateModel is changed\\n     */\\n    event NewMarketInterestRateModel(\\n        InterestRateModel oldInterestRateModel,\\n        InterestRateModel newInterestRateModel\\n    );\\n\\n    /**\\n     * @notice Event emitted when the reserve factor is changed\\n     */\\n    event NewReserveFactor(\\n        uint oldReserveFactorMantissa,\\n        uint newReserveFactorMantissa\\n    );\\n\\n    /**\\n     * @notice Event emitted when the reserves are added\\n     */\\n    event ReservesAdded(\\n        address benefactor,\\n        uint addAmount,\\n        uint newTotalReserves\\n    );\\n\\n    /**\\n     * @notice Event emitted when the reserves are reduced\\n     */\\n    event ReservesReduced(\\n        address admin,\\n        uint reduceAmount,\\n        uint newTotalReserves\\n    );\\n\\n    /**\\n     * @notice EIP20 Transfer event\\n     */\\n    event Transfer(address indexed from, address indexed to, uint amount);\\n\\n    /**\\n     * @notice EIP20 Approval event\\n     */\\n    event Approval(address indexed owner, address indexed spender, uint amount);\\n\\n    /*** User Interface ***/\\n\\n    function transfer(address dst, uint amount) external virtual returns (bool);\\n\\n    function transferFrom(\\n        address src,\\n        address dst,\\n        uint amount\\n    ) external virtual returns (bool);\\n\\n    function approve(\\n        address spender,\\n        uint amount\\n    ) external virtual returns (bool);\\n\\n    function allowance(\\n        address owner,\\n        address spender\\n    ) external view virtual returns (uint);\\n\\n    function balanceOf(address owner) external view virtual returns (uint);\\n\\n    function balanceOfUnderlying(address owner) external virtual returns (uint);\\n\\n    function getAccountSnapshot(\\n        address account\\n    ) external view virtual returns (uint, uint, uint, uint);\\n\\n    function borrowRatePerBlock() external view virtual returns (uint);\\n\\n    function supplyRatePerBlock() external view virtual returns (uint);\\n\\n    function totalBorrowsCurrent() external virtual returns (uint);\\n\\n    function borrowBalanceCurrent(\\n        address account\\n    ) external virtual returns (uint);\\n\\n    function borrowBalanceStored(\\n        address account\\n    ) external view virtual returns (uint);\\n\\n    function exchangeRateCurrent() external virtual returns (uint);\\n\\n    function exchangeRateStored() external view virtual returns (uint);\\n\\n    function getCash() external view virtual returns (uint);\\n\\n    function accrueInterest() external virtual returns (uint);\\n\\n    function seize(\\n        address liquidator,\\n        address borrower,\\n        uint seizeTokens\\n    ) external virtual returns (uint);\\n\\n    /*** Admin Functions ***/\\n\\n    function _setPendingAdmin(\\n        address payable newPendingAdmin\\n    ) external virtual returns (uint);\\n\\n    function _acceptAdmin() external virtual returns (uint);\\n\\n    function _setComptroller(\\n        ComptrollerInterface newComptroller\\n    ) external virtual returns (uint);\\n\\n    function _setReserveFactor(\\n        uint newReserveFactorMantissa\\n    ) external virtual returns (uint);\\n\\n    function _reduceReserves(uint reduceAmount) external virtual returns (uint);\\n\\n    function _setInterestRateModel(\\n        InterestRateModel newInterestRateModel\\n    ) external virtual returns (uint);\\n}\\n\\ncontract CErc20Storage {\\n    /**\\n     * @notice Underlying asset for this CToken\\n     */\\n    address public underlying;\\n}\\n\\nabstract contract CErc20Interface is CErc20Storage {\\n    /*** User Interface ***/\\n\\n    function mint(uint mintAmount) external virtual returns (uint);\\n\\n    function redeem(uint redeemTokens) external virtual returns (uint);\\n\\n    function redeemUnderlying(\\n        uint redeemAmount\\n    ) external virtual returns (uint);\\n\\n    function borrow(uint borrowAmount) external virtual returns (uint);\\n\\n    function repayBorrow(uint repayAmount) external virtual returns (uint);\\n\\n    function repayBorrowBehalf(\\n        address borrower,\\n        uint repayAmount\\n    ) external virtual returns (uint);\\n\\n    function liquidateBorrow(\\n        address borrower,\\n        uint repayAmount,\\n        CTokenInterface cTokenCollateral\\n    ) external virtual returns (uint);\\n\\n    function sweepToken(EIP20NonStandardInterface token) external virtual;\\n\\n    /*** Admin Functions ***/\\n\\n    function _addReserves(uint addAmount) external virtual returns (uint);\\n}\\n\\ncontract CDelegationStorage {\\n    /**\\n     * @notice Implementation address for this contract\\n     */\\n    address public implementation;\\n}\\n\\nabstract contract CDelegatorInterface is CDelegationStorage {\\n    /**\\n     * @notice Emitted when implementation is changed\\n     */\\n    event NewImplementation(\\n        address oldImplementation,\\n        address newImplementation\\n    );\\n\\n    /**\\n     * @notice Called by the admin to update the implementation of the delegator\\n     * @param implementation_ The address of the new implementation for delegation\\n     * @param allowResign Flag to indicate whether to call _resignImplementation on the old implementation\\n     * @param becomeImplementationData The encoded bytes data to be passed to _becomeImplementation\\n     */\\n    function _setImplementation(\\n        address implementation_,\\n        bool allowResign,\\n        bytes memory becomeImplementationData\\n    ) external virtual;\\n}\\n\\nabstract contract CDelegateInterface is CDelegationStorage {\\n    /**\\n     * @notice Called by the delegator on a delegate to initialize it for duty\\n     * @dev Should revert if any issues arise which make it unfit for delegation\\n     * @param data The encoded bytes data for any initialization\\n     */\\n    function _becomeImplementation(bytes memory data) external virtual;\\n\\n    /**\\n     * @notice Called by the delegator on a delegate to forfeit its responsibility\\n     */\\n    function _resignImplementation() external virtual;\\n}\\n\",\"keccak256\":\"0x76a4d573740d78dda5e06b36de05f1a2271132025712cbe2c9c178a30b17597b\",\"license\":\"BSD-3-Clause\"},\"contracts/Comptroller.sol\":{\"content\":\"// SPDX-License-Identifier: BSD-3-Clause\\npragma solidity ^0.8.10;\\n\\nimport \\\"./CToken.sol\\\";\\nimport \\\"./ErrorReporter.sol\\\";\\nimport \\\"./PriceOracle.sol\\\";\\nimport \\\"./ComptrollerInterface.sol\\\";\\nimport \\\"./ComptrollerStorage.sol\\\";\\nimport \\\"./Unitroller.sol\\\";\\nimport \\\"./Governance/Comp.sol\\\";\\n\\n/**\\n * @title Compound's Comptroller Contract\\n * @author Compound\\n */\\ncontract Comptroller is\\n    ComptrollerV7Storage,\\n    ComptrollerInterface,\\n    ComptrollerErrorReporter,\\n    ExponentialNoError\\n{\\n    /// @notice Emitted when an admin supports a market\\n    event MarketListed(CToken cToken);\\n\\n    /// @notice Emitted when an account enters a market\\n    event MarketEntered(CToken cToken, address account);\\n\\n    /// @notice Emitted when an account exits a market\\n    event MarketExited(CToken cToken, address account);\\n\\n    /// @notice Emitted when close factor is changed by admin\\n    event NewCloseFactor(\\n        uint256 oldCloseFactorMantissa,\\n        uint256 newCloseFactorMantissa\\n    );\\n\\n    /// @notice Emitted when a collateral factor is changed by admin\\n    event NewCollateralFactor(\\n        CToken cToken,\\n        uint256 oldCollateralFactorMantissa,\\n        uint256 newCollateralFactorMantissa\\n    );\\n\\n    /// @notice Emitted when liquidation incentive is changed by admin\\n    event NewLiquidationIncentive(\\n        uint256 oldLiquidationIncentiveMantissa,\\n        uint256 newLiquidationIncentiveMantissa\\n    );\\n\\n    /// @notice Emitted when price oracle is changed\\n    event NewPriceOracle(\\n        PriceOracle oldPriceOracle,\\n        PriceOracle newPriceOracle\\n    );\\n\\n    /// @notice Emitted when pause guardian is changed\\n    event NewPauseGuardian(address oldPauseGuardian, address newPauseGuardian);\\n\\n    /// @notice Emitted when an action is paused globally\\n    event ActionPaused(string action, bool pauseState);\\n\\n    /// @notice Emitted when an action is paused on a market\\n    event ActionPaused(CToken cToken, string action, bool pauseState);\\n\\n    /// @notice Emitted when a new borrow-side COMP speed is calculated for a market\\n    event CompBorrowSpeedUpdated(CToken indexed cToken, uint256 newSpeed);\\n\\n    /// @notice Emitted when a new supply-side COMP speed is calculated for a market\\n    event CompSupplySpeedUpdated(CToken indexed cToken, uint256 newSpeed);\\n\\n    /// @notice Emitted when a new COMP speed is set for a contributor\\n    event ContributorCompSpeedUpdated(\\n        address indexed contributor,\\n        uint256 newSpeed\\n    );\\n\\n    /// @notice Emitted when COMP is distributed to a supplier\\n    event DistributedSupplierComp(\\n        CToken indexed cToken,\\n        address indexed supplier,\\n        uint256 compDelta,\\n        uint256 compSupplyIndex\\n    );\\n\\n    /// @notice Emitted when COMP is distributed to a borrower\\n    event DistributedBorrowerComp(\\n        CToken indexed cToken,\\n        address indexed borrower,\\n        uint256 compDelta,\\n        uint256 compBorrowIndex\\n    );\\n\\n    /// @notice Emitted when borrow cap for a cToken is changed\\n    event NewBorrowCap(CToken indexed cToken, uint256 newBorrowCap);\\n\\n    /// @notice Emitted when borrow cap guardian is changed\\n    event NewBorrowCapGuardian(\\n        address oldBorrowCapGuardian,\\n        address newBorrowCapGuardian\\n    );\\n\\n    /// @notice Emitted when COMP is granted by admin\\n    event CompGranted(address recipient, uint256 amount);\\n\\n    /// @notice Emitted when COMP accrued for a user has been manually adjusted.\\n    event CompAccruedAdjusted(\\n        address indexed user,\\n        uint256 oldCompAccrued,\\n        uint256 newCompAccrued\\n    );\\n\\n    /// @notice Emitted when COMP receivable for a user has been updated.\\n    event CompReceivableUpdated(\\n        address indexed user,\\n        uint256 oldCompReceivable,\\n        uint256 newCompReceivable\\n    );\\n\\n    /// @notice The initial COMP index for a market\\n    uint224 public constant compInitialIndex = 1e36;\\n\\n    // closeFactorMantissa must be strictly greater than this value\\n    uint256 internal constant closeFactorMinMantissa = 0.05e18; // 0.05\\n\\n    // closeFactorMantissa must not exceed this value\\n    uint256 internal constant closeFactorMaxMantissa = 0.9e18; // 0.9\\n\\n    // No collateralFactorMantissa may exceed this value\\n    uint256 internal constant collateralFactorMaxMantissa = 0.9e18; // 0.9\\n\\n    constructor() {\\n        admin = msg.sender;\\n    }\\n\\n    /*** Assets You Are In ***/\\n\\n    /**\\n     * @notice Returns the assets an account has entered\\n     * @param account The address of the account to pull assets for\\n     * @return A dynamic list with the assets the account has entered\\n     */\\n    function getAssetsIn(\\n        address account\\n    ) external view returns (CToken[] memory) {\\n        CToken[] memory assetsIn = accountAssets[account];\\n\\n        return assetsIn;\\n    }\\n\\n    /**\\n     * @notice Returns whether the given account is entered in the given asset\\n     * @param account The address of the account to check\\n     * @param cToken The cToken to check\\n     * @return True if the account is in the asset, otherwise false.\\n     */\\n    function checkMembership(\\n        address account,\\n        CToken cToken\\n    ) external view returns (bool) {\\n        return markets[address(cToken)].accountMembership[account];\\n    }\\n\\n    /**\\n     * @notice Add assets to be included in account liquidity calculation\\n     * @param cTokens The list of addresses of the cToken markets to be enabled\\n     * @return Success indicator for whether each corresponding market was entered\\n     */\\n    function enterMarkets(\\n        address[] memory cTokens\\n    ) public override returns (uint256[] memory) {\\n        uint256 len = cTokens.length;\\n\\n        uint256[] memory results = new uint256[](len);\\n        for (uint256 i = 0; i < len; i++) {\\n            CToken cToken = CToken(cTokens[i]);\\n\\n            results[i] = uint256(addToMarketInternal(cToken, msg.sender));\\n        }\\n\\n        return results;\\n    }\\n\\n    /**\\n     * @notice Add the market to the borrower's \\\"assets in\\\" for liquidity calculations\\n     * @param cToken The market to enter\\n     * @param borrower The address of the account to modify\\n     * @return Success indicator for whether the market was entered\\n     */\\n    function addToMarketInternal(\\n        CToken cToken,\\n        address borrower\\n    ) internal returns (Error) {\\n        Market storage marketToJoin = markets[address(cToken)];\\n\\n        if (!marketToJoin.isListed) {\\n            // market is not listed, cannot join\\n            return Error.MARKET_NOT_LISTED;\\n        }\\n\\n        if (marketToJoin.accountMembership[borrower] == true) {\\n            // already joined\\n            return Error.NO_ERROR;\\n        }\\n\\n        // survived the gauntlet, add to list\\n        // NOTE: we store these somewhat redundantly as a significant optimization\\n        //  this avoids having to iterate through the list for the most common use cases\\n        //  that is, only when we need to perform liquidity checks\\n        //  and not whenever we want to check if an account is in a particular market\\n        marketToJoin.accountMembership[borrower] = true;\\n        accountAssets[borrower].push(cToken);\\n\\n        emit MarketEntered(cToken, borrower);\\n\\n        return Error.NO_ERROR;\\n    }\\n\\n    /**\\n     * @notice Removes asset from sender's account liquidity calculation\\n     * @dev Sender must not have an outstanding borrow balance in the asset,\\n     *  or be providing necessary collateral for an outstanding borrow.\\n     * @param cTokenAddress The address of the asset to be removed\\n     * @return Whether or not the account successfully exited the market\\n     */\\n    function exitMarket(\\n        address cTokenAddress\\n    ) external override returns (uint256) {\\n        CToken cToken = CToken(cTokenAddress);\\n        /* Get sender tokensHeld and amountOwed underlying from the cToken */\\n        (uint256 oErr, uint256 tokensHeld, uint256 amountOwed, ) = cToken\\n            .getAccountSnapshot(msg.sender);\\n        require(oErr == 0, \\\"exitMarket: getAccountSnapshot failed\\\"); // semi-opaque error code\\n\\n        /* Fail if the sender has a borrow balance */\\n        if (amountOwed != 0) {\\n            return\\n                fail(\\n                    Error.NONZERO_BORROW_BALANCE,\\n                    FailureInfo.EXIT_MARKET_BALANCE_OWED\\n                );\\n        }\\n\\n        /* Fail if the sender is not permitted to redeem all of their tokens */\\n        uint256 allowed = redeemAllowedInternal(\\n            cTokenAddress,\\n            msg.sender,\\n            tokensHeld\\n        );\\n        if (allowed != 0) {\\n            return\\n                failOpaque(\\n                    Error.REJECTION,\\n                    FailureInfo.EXIT_MARKET_REJECTION,\\n                    allowed\\n                );\\n        }\\n\\n        Market storage marketToExit = markets[address(cToken)];\\n\\n        /* Return true if the sender is not already \\u2018in\\u2019 the market */\\n        if (!marketToExit.accountMembership[msg.sender]) {\\n            return uint256(Error.NO_ERROR);\\n        }\\n\\n        /* Set cToken account membership to false */\\n        delete marketToExit.accountMembership[msg.sender];\\n\\n        /* Delete cToken from the account\\u2019s list of assets */\\n        // load into memory for faster iteration\\n        CToken[] memory userAssetList = accountAssets[msg.sender];\\n        uint256 len = userAssetList.length;\\n        uint256 assetIndex = len;\\n        for (uint256 i = 0; i < len; i++) {\\n            if (userAssetList[i] == cToken) {\\n                assetIndex = i;\\n                break;\\n            }\\n        }\\n\\n        // We *must* have found the asset in the list or our redundant data structure is broken\\n        assert(assetIndex < len);\\n\\n        // copy last item in list to location of item to be removed, reduce length by 1\\n        CToken[] storage storedList = accountAssets[msg.sender];\\n        storedList[assetIndex] = storedList[storedList.length - 1];\\n        storedList.pop();\\n\\n        emit MarketExited(cToken, msg.sender);\\n\\n        return uint256(Error.NO_ERROR);\\n    }\\n\\n    /*** Policy Hooks ***/\\n\\n    /**\\n     * @notice Checks if the account should be allowed to mint tokens in the given market\\n     * @param cToken The market to verify the mint against\\n     * @param minter The account which would get the minted tokens\\n     * @param mintAmount The amount of underlying being supplied to the market in exchange for tokens\\n     * @return 0 if the mint is allowed, otherwise a semi-opaque error code (See ErrorReporter.sol)\\n     */\\n    function mintAllowed(\\n        address cToken,\\n        address minter,\\n        uint256 mintAmount\\n    ) external override returns (uint256) {\\n        // Pausing is a very serious situation - we revert to sound the alarms\\n        require(!mintGuardianPaused[cToken], \\\"mint is paused\\\");\\n\\n        // Shh - currently unused\\n        minter;\\n        mintAmount;\\n\\n        if (!markets[cToken].isListed) {\\n            return uint256(Error.MARKET_NOT_LISTED);\\n        }\\n\\n        // Keep the flywheel moving\\n        updateCompSupplyIndex(cToken);\\n        distributeSupplierComp(cToken, minter);\\n\\n        return uint256(Error.NO_ERROR);\\n    }\\n\\n    /**\\n     * @notice Validates mint and reverts on rejection. May emit logs.\\n     * @param cToken Asset being minted\\n     * @param minter The address minting the tokens\\n     * @param actualMintAmount The amount of the underlying asset being minted\\n     * @param mintTokens The number of tokens being minted\\n     */\\n    function mintVerify(\\n        address cToken,\\n        address minter,\\n        uint256 actualMintAmount,\\n        uint256 mintTokens\\n    ) external override {\\n        // Shh - currently unused\\n        cToken;\\n        minter;\\n        actualMintAmount;\\n        mintTokens;\\n\\n        // Shh - we don't ever want this hook to be marked pure\\n        if (false) {\\n            maxAssets = maxAssets;\\n        }\\n    }\\n\\n    /**\\n     * @notice Checks if the account should be allowed to redeem tokens in the given market\\n     * @param cToken The market to verify the redeem against\\n     * @param redeemer The account which would redeem the tokens\\n     * @param redeemTokens The number of cTokens to exchange for the underlying asset in the market\\n     * @return 0 if the redeem is allowed, otherwise a semi-opaque error code (See ErrorReporter.sol)\\n     */\\n    function redeemAllowed(\\n        address cToken,\\n        address redeemer,\\n        uint256 redeemTokens\\n    ) external override returns (uint256) {\\n        uint256 allowed = redeemAllowedInternal(cToken, redeemer, redeemTokens);\\n        if (allowed != uint256(Error.NO_ERROR)) {\\n            return allowed;\\n        }\\n\\n        // Keep the flywheel moving\\n        updateCompSupplyIndex(cToken);\\n        distributeSupplierComp(cToken, redeemer);\\n\\n        return uint256(Error.NO_ERROR);\\n    }\\n\\n    function redeemAllowedInternal(\\n        address cToken,\\n        address redeemer,\\n        uint256 redeemTokens\\n    ) internal view returns (uint256) {\\n        if (!markets[cToken].isListed) {\\n            return uint256(Error.MARKET_NOT_LISTED);\\n        }\\n\\n        /* If the redeemer is not 'in' the market, then we can bypass the liquidity check */\\n        if (!markets[cToken].accountMembership[redeemer]) {\\n            return uint256(Error.NO_ERROR);\\n        }\\n\\n        /* Otherwise, perform a hypothetical liquidity check to guard against shortfall */\\n        (\\n            Error err,\\n            ,\\n            uint256 shortfall\\n        ) = getHypotheticalAccountLiquidityInternal(\\n                redeemer,\\n                CToken(cToken),\\n                redeemTokens,\\n                0\\n            );\\n        if (err != Error.NO_ERROR) {\\n            return uint256(err);\\n        }\\n        if (shortfall > 0) {\\n            return uint256(Error.INSUFFICIENT_LIQUIDITY);\\n        }\\n\\n        return uint256(Error.NO_ERROR);\\n    }\\n\\n    /**\\n     * @notice Validates redeem and reverts on rejection. May emit logs.\\n     * @param cToken Asset being redeemed\\n     * @param redeemer The address redeeming the tokens\\n     * @param redeemAmount The amount of the underlying asset being redeemed\\n     * @param redeemTokens The number of tokens being redeemed\\n     */\\n    function redeemVerify(\\n        address cToken,\\n        address redeemer,\\n        uint256 redeemAmount,\\n        uint256 redeemTokens\\n    ) external override {\\n        // Shh - currently unused\\n        cToken;\\n        redeemer;\\n\\n        // Require tokens is zero or amount is also zero\\n        if (redeemTokens == 0 && redeemAmount > 0) {\\n            revert(\\\"redeemTokens zero\\\");\\n        }\\n    }\\n\\n    /**\\n     * @notice Checks if the account should be allowed to borrow the underlying asset of the given market\\n     * @param cToken The market to verify the borrow against\\n     * @param borrower The account which would borrow the asset\\n     * @param borrowAmount The amount of underlying the account would borrow\\n     * @return 0 if the borrow is allowed, otherwise a semi-opaque error code (See ErrorReporter.sol)\\n     */\\n    function borrowAllowed(\\n        address cToken,\\n        address borrower,\\n        uint256 borrowAmount\\n    ) external override returns (uint256) {\\n        // Pausing is a very serious situation - we revert to sound the alarms\\n        require(!borrowGuardianPaused[cToken], \\\"borrow is paused\\\");\\n\\n        if (!markets[cToken].isListed) {\\n            return uint256(Error.MARKET_NOT_LISTED);\\n        }\\n\\n        if (!markets[cToken].accountMembership[borrower]) {\\n            // only cTokens may call borrowAllowed if borrower not in market\\n            require(msg.sender == cToken, \\\"sender must be cToken\\\");\\n\\n            // attempt to add borrower to the market\\n            Error err = addToMarketInternal(CToken(msg.sender), borrower);\\n            if (err != Error.NO_ERROR) {\\n                return uint256(err);\\n            }\\n\\n            // it should be impossible to break the important invariant\\n            assert(markets[cToken].accountMembership[borrower]);\\n        }\\n\\n        if (oracle.getUnderlyingPrice(CToken(cToken)) == 0) {\\n            return uint256(Error.PRICE_ERROR);\\n        }\\n\\n        uint256 borrowCap = borrowCaps[cToken];\\n        // Borrow cap of 0 corresponds to unlimited borrowing\\n        if (borrowCap != 0) {\\n            uint256 totalBorrows = CToken(cToken).totalBorrows();\\n            uint256 nextTotalBorrows = add_(totalBorrows, borrowAmount);\\n            require(nextTotalBorrows < borrowCap, \\\"market borrow cap reached\\\");\\n        }\\n\\n        (\\n            Error err,\\n            ,\\n            uint256 shortfall\\n        ) = getHypotheticalAccountLiquidityInternal(\\n                borrower,\\n                CToken(cToken),\\n                0,\\n                borrowAmount\\n            );\\n        if (err != Error.NO_ERROR) {\\n            return uint256(err);\\n        }\\n        if (shortfall > 0) {\\n            return uint256(Error.INSUFFICIENT_LIQUIDITY);\\n        }\\n\\n        // Keep the flywheel moving\\n        Exp memory borrowIndex = Exp({mantissa: CToken(cToken).borrowIndex()});\\n        updateCompBorrowIndex(cToken, borrowIndex);\\n        distributeBorrowerComp(cToken, borrower, borrowIndex);\\n\\n        return uint256(Error.NO_ERROR);\\n    }\\n\\n    /**\\n     * @notice Validates borrow and reverts on rejection. May emit logs.\\n     * @param cToken Asset whose underlying is being borrowed\\n     * @param borrower The address borrowing the underlying\\n     * @param borrowAmount The amount of the underlying asset requested to borrow\\n     */\\n    function borrowVerify(\\n        address cToken,\\n        address borrower,\\n        uint256 borrowAmount\\n    ) external override {\\n        // Shh - currently unused\\n        cToken;\\n        borrower;\\n        borrowAmount;\\n\\n        // Shh - we don't ever want this hook to be marked pure\\n        if (false) {\\n            maxAssets = maxAssets;\\n        }\\n    }\\n\\n    /**\\n     * @notice Checks if the account should be allowed to repay a borrow in the given market\\n     * @param cToken The market to verify the repay against\\n     * @param payer The account which would repay the asset\\n     * @param borrower The account which would borrowed the asset\\n     * @param repayAmount The amount of the underlying asset the account would repay\\n     * @return 0 if the repay is allowed, otherwise a semi-opaque error code (See ErrorReporter.sol)\\n     */\\n    function repayBorrowAllowed(\\n        address cToken,\\n        address payer,\\n        address borrower,\\n        uint256 repayAmount\\n    ) external override returns (uint256) {\\n        // Shh - currently unused\\n        payer;\\n        borrower;\\n        repayAmount;\\n\\n        if (!markets[cToken].isListed) {\\n            return uint256(Error.MARKET_NOT_LISTED);\\n        }\\n\\n        // Keep the flywheel moving\\n        Exp memory borrowIndex = Exp({mantissa: CToken(cToken).borrowIndex()});\\n        updateCompBorrowIndex(cToken, borrowIndex);\\n        distributeBorrowerComp(cToken, borrower, borrowIndex);\\n\\n        return uint256(Error.NO_ERROR);\\n    }\\n\\n    /**\\n     * @notice Validates repayBorrow and reverts on rejection. May emit logs.\\n     * @param cToken Asset being repaid\\n     * @param payer The address repaying the borrow\\n     * @param borrower The address of the borrower\\n     * @param actualRepayAmount The amount of underlying being repaid\\n     */\\n    function repayBorrowVerify(\\n        address cToken,\\n        address payer,\\n        address borrower,\\n        uint256 actualRepayAmount,\\n        uint256 borrowerIndex\\n    ) external override {\\n        // Shh - currently unused\\n        cToken;\\n        payer;\\n        borrower;\\n        actualRepayAmount;\\n        borrowerIndex;\\n\\n        // Shh - we don't ever want this hook to be marked pure\\n        if (false) {\\n            maxAssets = maxAssets;\\n        }\\n    }\\n\\n    /**\\n     * @notice Checks if the liquidation should be allowed to occur\\n     * @param cTokenBorrowed Asset which was borrowed by the borrower\\n     * @param cTokenCollateral Asset which was used as collateral and will be seized\\n     * @param liquidator The address repaying the borrow and seizing the collateral\\n     * @param borrower The address of the borrower\\n     * @param repayAmount The amount of underlying being repaid\\n     */\\n    function liquidateBorrowAllowed(\\n        address cTokenBorrowed,\\n        address cTokenCollateral,\\n        address liquidator,\\n        address borrower,\\n        uint256 repayAmount\\n    ) external override returns (uint256) {\\n        // Shh - currently unused\\n        liquidator;\\n\\n        if (\\n            !markets[cTokenBorrowed].isListed ||\\n            !markets[cTokenCollateral].isListed\\n        ) {\\n            return uint256(Error.MARKET_NOT_LISTED);\\n        }\\n\\n        uint256 borrowBalance = CToken(cTokenBorrowed).borrowBalanceStored(\\n            borrower\\n        );\\n\\n        /* allow accounts to be liquidated if the market is deprecated */\\n        if (isDeprecated(CToken(cTokenBorrowed))) {\\n            require(\\n                borrowBalance >= repayAmount,\\n                \\\"Can not repay more than the total borrow\\\"\\n            );\\n        } else {\\n            /* The borrower must have shortfall in order to be liquidatable */\\n            (Error err, , uint256 shortfall) = getAccountLiquidityInternal(\\n                borrower\\n            );\\n            if (err != Error.NO_ERROR) {\\n                return uint256(err);\\n            }\\n\\n            if (shortfall == 0) {\\n                return uint256(Error.INSUFFICIENT_SHORTFALL);\\n            }\\n\\n            /* The liquidator may not repay more than what is allowed by the closeFactor */\\n            uint256 maxClose = mul_ScalarTruncate(\\n                Exp({mantissa: closeFactorMantissa}),\\n                borrowBalance\\n            );\\n            if (repayAmount > maxClose) {\\n                return uint256(Error.TOO_MUCH_REPAY);\\n            }\\n        }\\n        return uint256(Error.NO_ERROR);\\n    }\\n\\n    /**\\n     * @notice Validates liquidateBorrow and reverts on rejection. May emit logs.\\n     * @param cTokenBorrowed Asset which was borrowed by the borrower\\n     * @param cTokenCollateral Asset which was used as collateral and will be seized\\n     * @param liquidator The address repaying the borrow and seizing the collateral\\n     * @param borrower The address of the borrower\\n     * @param actualRepayAmount The amount of underlying being repaid\\n     */\\n    function liquidateBorrowVerify(\\n        address cTokenBorrowed,\\n        address cTokenCollateral,\\n        address liquidator,\\n        address borrower,\\n        uint256 actualRepayAmount,\\n        uint256 seizeTokens\\n    ) external override {\\n        // Shh - currently unused\\n        cTokenBorrowed;\\n        cTokenCollateral;\\n        liquidator;\\n        borrower;\\n        actualRepayAmount;\\n        seizeTokens;\\n\\n        // Shh - we don't ever want this hook to be marked pure\\n        if (false) {\\n            maxAssets = maxAssets;\\n        }\\n    }\\n\\n    /**\\n     * @notice Checks if the seizing of assets should be allowed to occur\\n     * @param cTokenCollateral Asset which was used as collateral and will be seized\\n     * @param cTokenBorrowed Asset which was borrowed by the borrower\\n     * @param liquidator The address repaying the borrow and seizing the collateral\\n     * @param borrower The address of the borrower\\n     * @param seizeTokens The number of collateral tokens to seize\\n     */\\n    function seizeAllowed(\\n        address cTokenCollateral,\\n        address cTokenBorrowed,\\n        address liquidator,\\n        address borrower,\\n        uint256 seizeTokens\\n    ) external override returns (uint256) {\\n        // Pausing is a very serious situation - we revert to sound the alarms\\n        require(!seizeGuardianPaused, \\\"seize is paused\\\");\\n\\n        // Shh - currently unused\\n        seizeTokens;\\n\\n        if (\\n            !markets[cTokenCollateral].isListed ||\\n            !markets[cTokenBorrowed].isListed\\n        ) {\\n            return uint256(Error.MARKET_NOT_LISTED);\\n        }\\n\\n        if (\\n            CToken(cTokenCollateral).comptroller() !=\\n            CToken(cTokenBorrowed).comptroller()\\n        ) {\\n            return uint256(Error.COMPTROLLER_MISMATCH);\\n        }\\n\\n        // Keep the flywheel moving\\n        updateCompSupplyIndex(cTokenCollateral);\\n        distributeSupplierComp(cTokenCollateral, borrower);\\n        distributeSupplierComp(cTokenCollateral, liquidator);\\n\\n        return uint256(Error.NO_ERROR);\\n    }\\n\\n    /**\\n     * @notice Validates seize and reverts on rejection. May emit logs.\\n     * @param cTokenCollateral Asset which was used as collateral and will be seized\\n     * @param cTokenBorrowed Asset which was borrowed by the borrower\\n     * @param liquidator The address repaying the borrow and seizing the collateral\\n     * @param borrower The address of the borrower\\n     * @param seizeTokens The number of collateral tokens to seize\\n     */\\n    function seizeVerify(\\n        address cTokenCollateral,\\n        address cTokenBorrowed,\\n        address liquidator,\\n        address borrower,\\n        uint256 seizeTokens\\n    ) external override {\\n        // Shh - currently unused\\n        cTokenCollateral;\\n        cTokenBorrowed;\\n        liquidator;\\n        borrower;\\n        seizeTokens;\\n\\n        // Shh - we don't ever want this hook to be marked pure\\n        if (false) {\\n            maxAssets = maxAssets;\\n        }\\n    }\\n\\n    /**\\n     * @notice Checks if the account should be allowed to transfer tokens in the given market\\n     * @param cToken The market to verify the transfer against\\n     * @param src The account which sources the tokens\\n     * @param dst The account which receives the tokens\\n     * @param transferTokens The number of cTokens to transfer\\n     * @return 0 if the transfer is allowed, otherwise a semi-opaque error code (See ErrorReporter.sol)\\n     */\\n    function transferAllowed(\\n        address cToken,\\n        address src,\\n        address dst,\\n        uint256 transferTokens\\n    ) external override returns (uint256) {\\n        // Pausing is a very serious situation - we revert to sound the alarms\\n        require(!transferGuardianPaused, \\\"transfer is paused\\\");\\n\\n        // Currently the only consideration is whether or not\\n        //  the src is allowed to redeem this many tokens\\n        uint256 allowed = redeemAllowedInternal(cToken, src, transferTokens);\\n        if (allowed != uint256(Error.NO_ERROR)) {\\n            return allowed;\\n        }\\n\\n        // Keep the flywheel moving\\n        updateCompSupplyIndex(cToken);\\n        distributeSupplierComp(cToken, src);\\n        distributeSupplierComp(cToken, dst);\\n\\n        return uint256(Error.NO_ERROR);\\n    }\\n\\n    /**\\n     * @notice Validates transfer and reverts on rejection. May emit logs.\\n     * @param cToken Asset being transferred\\n     * @param src The account which sources the tokens\\n     * @param dst The account which receives the tokens\\n     * @param transferTokens The number of cTokens to transfer\\n     */\\n    function transferVerify(\\n        address cToken,\\n        address src,\\n        address dst,\\n        uint256 transferTokens\\n    ) external override {\\n        // Shh - currently unused\\n        cToken;\\n        src;\\n        dst;\\n        transferTokens;\\n\\n        // Shh - we don't ever want this hook to be marked pure\\n        if (false) {\\n            maxAssets = maxAssets;\\n        }\\n    }\\n\\n    /*** Liquidity/Liquidation Calculations ***/\\n\\n    /**\\n     * @dev Local vars for avoiding stack-depth limits in calculating account liquidity.\\n     *  Note that `cTokenBalance` is the number of cTokens the account owns in the market,\\n     *  whereas `borrowBalance` is the amount of underlying that the account has borrowed.\\n     */\\n    struct AccountLiquidityLocalVars {\\n        uint256 sumCollateral;\\n        uint256 sumBorrowPlusEffects;\\n        uint256 cTokenBalance;\\n        uint256 borrowBalance;\\n        uint256 exchangeRateMantissa;\\n        uint256 oraclePriceMantissa;\\n        Exp collateralFactor;\\n        Exp exchangeRate;\\n        Exp oraclePrice;\\n        Exp tokensToDenom;\\n    }\\n\\n    /**\\n     * @notice Determine the current account liquidity wrt collateral requirements\\n     * @return (possible error code (semi-opaque),\\n                account liquidity in excess of collateral requirements,\\n     *          account shortfall below collateral requirements)\\n     */\\n    function getAccountLiquidity(\\n        address account\\n    ) public view returns (uint256, uint256, uint256) {\\n        (\\n            Error err,\\n            uint256 liquidity,\\n            uint256 shortfall\\n        ) = getHypotheticalAccountLiquidityInternal(\\n                account,\\n                CToken(address(0)),\\n                0,\\n                0\\n            );\\n\\n        return (uint256(err), liquidity, shortfall);\\n    }\\n\\n    /**\\n     * @notice Determine the current account liquidity wrt collateral requirements\\n     * @return (possible error code,\\n                account liquidity in excess of collateral requirements,\\n     *          account shortfall below collateral requirements)\\n     */\\n    function getAccountLiquidityInternal(\\n        address account\\n    ) internal view returns (Error, uint256, uint256) {\\n        return\\n            getHypotheticalAccountLiquidityInternal(\\n                account,\\n                CToken(address(0)),\\n                0,\\n                0\\n            );\\n    }\\n\\n    /**\\n     * @notice Determine what the account liquidity would be if the given amounts were redeemed/borrowed\\n     * @param cTokenModify The market to hypothetically redeem/borrow in\\n     * @param account The account to determine liquidity for\\n     * @param redeemTokens The number of tokens to hypothetically redeem\\n     * @param borrowAmount The amount of underlying to hypothetically borrow\\n     * @return (possible error code (semi-opaque),\\n                hypothetical account liquidity in excess of collateral requirements,\\n     *          hypothetical account shortfall below collateral requirements)\\n     */\\n    function getHypotheticalAccountLiquidity(\\n        address account,\\n        address cTokenModify,\\n        uint256 redeemTokens,\\n        uint256 borrowAmount\\n    ) public view returns (uint256, uint256, uint256) {\\n        (\\n            Error err,\\n            uint256 liquidity,\\n            uint256 shortfall\\n        ) = getHypotheticalAccountLiquidityInternal(\\n                account,\\n                CToken(cTokenModify),\\n                redeemTokens,\\n                borrowAmount\\n            );\\n        return (uint256(err), liquidity, shortfall);\\n    }\\n\\n    /**\\n     * @notice Determine what the account liquidity would be if the given amounts were redeemed/borrowed\\n     * @param cTokenModify The market to hypothetically redeem/borrow in\\n     * @param account The account to determine liquidity for\\n     * @param redeemTokens The number of tokens to hypothetically redeem\\n     * @param borrowAmount The amount of underlying to hypothetically borrow\\n     * @dev Note that we calculate the exchangeRateStored for each collateral cToken using stored data,\\n     *  without calculating accumulated interest.\\n     * @return (possible error code,\\n                hypothetical account liquidity in excess of collateral requirements,\\n     *          hypothetical account shortfall below collateral requirements)\\n     */\\n    function getHypotheticalAccountLiquidityInternal(\\n        address account,\\n        CToken cTokenModify,\\n        uint256 redeemTokens,\\n        uint256 borrowAmount\\n    ) internal view returns (Error, uint256, uint256) {\\n        AccountLiquidityLocalVars memory vars; // Holds all our calculation results\\n        uint256 oErr;\\n\\n        // For each asset the account is in\\n        CToken[] memory assets = accountAssets[account];\\n        for (uint256 i = 0; i < assets.length; i++) {\\n            CToken asset = assets[i];\\n\\n            // Read the balances and exchange rate from the cToken\\n            (\\n                oErr,\\n                vars.cTokenBalance,\\n                vars.borrowBalance,\\n                vars.exchangeRateMantissa\\n            ) = asset.getAccountSnapshot(account);\\n            if (oErr != 0) {\\n                // semi-opaque error code, we assume NO_ERROR == 0 is invariant between upgrades\\n                return (Error.SNAPSHOT_ERROR, 0, 0);\\n            }\\n            vars.collateralFactor = Exp({\\n                mantissa: markets[address(asset)].collateralFactorMantissa\\n            });\\n            vars.exchangeRate = Exp({mantissa: vars.exchangeRateMantissa});\\n\\n            // Get the normalized price of the asset\\n            vars.oraclePriceMantissa = oracle.getUnderlyingPrice(asset);\\n            if (vars.oraclePriceMantissa == 0) {\\n                return (Error.PRICE_ERROR, 0, 0);\\n            }\\n            vars.oraclePrice = Exp({mantissa: vars.oraclePriceMantissa});\\n\\n            // Pre-compute a conversion factor from tokens -> ether (normalized price value)\\n            vars.tokensToDenom = mul_(\\n                mul_(vars.collateralFactor, vars.exchangeRate),\\n                vars.oraclePrice\\n            );\\n\\n            // sumCollateral += tokensToDenom * cTokenBalance\\n            vars.sumCollateral = mul_ScalarTruncateAddUInt(\\n                vars.tokensToDenom,\\n                vars.cTokenBalance,\\n                vars.sumCollateral\\n            );\\n\\n            // sumBorrowPlusEffects += oraclePrice * borrowBalance\\n            vars.sumBorrowPlusEffects = mul_ScalarTruncateAddUInt(\\n                vars.oraclePrice,\\n                vars.borrowBalance,\\n                vars.sumBorrowPlusEffects\\n            );\\n\\n            // Calculate effects of interacting with cTokenModify\\n            if (asset == cTokenModify) {\\n                // redeem effect\\n                // sumBorrowPlusEffects += tokensToDenom * redeemTokens\\n                vars.sumBorrowPlusEffects = mul_ScalarTruncateAddUInt(\\n                    vars.tokensToDenom,\\n                    redeemTokens,\\n                    vars.sumBorrowPlusEffects\\n                );\\n\\n                // borrow effect\\n                // sumBorrowPlusEffects += oraclePrice * borrowAmount\\n                vars.sumBorrowPlusEffects = mul_ScalarTruncateAddUInt(\\n                    vars.oraclePrice,\\n                    borrowAmount,\\n                    vars.sumBorrowPlusEffects\\n                );\\n            }\\n        }\\n\\n        // These are safe, as the underflow condition is checked first\\n        if (vars.sumCollateral > vars.sumBorrowPlusEffects) {\\n            return (\\n                Error.NO_ERROR,\\n                vars.sumCollateral - vars.sumBorrowPlusEffects,\\n                0\\n            );\\n        } else {\\n            return (\\n                Error.NO_ERROR,\\n                0,\\n                vars.sumBorrowPlusEffects - vars.sumCollateral\\n            );\\n        }\\n    }\\n\\n    /**\\n     * @notice Calculate number of tokens of collateral asset to seize given an underlying amount\\n     * @dev Used in liquidation (called in cToken.liquidateBorrowFresh)\\n     * @param cTokenBorrowed The address of the borrowed cToken\\n     * @param cTokenCollateral The address of the collateral cToken\\n     * @param actualRepayAmount The amount of cTokenBorrowed underlying to convert into cTokenCollateral tokens\\n     * @return (errorCode, number of cTokenCollateral tokens to be seized in a liquidation)\\n     */\\n    function liquidateCalculateSeizeTokens(\\n        address cTokenBorrowed,\\n        address cTokenCollateral,\\n        uint256 actualRepayAmount\\n    ) external view override returns (uint256, uint256) {\\n        /* Read oracle prices for borrowed and collateral markets */\\n        uint256 priceBorrowedMantissa = oracle.getUnderlyingPrice(\\n            CToken(cTokenBorrowed)\\n        );\\n        uint256 priceCollateralMantissa = oracle.getUnderlyingPrice(\\n            CToken(cTokenCollateral)\\n        );\\n        if (priceBorrowedMantissa == 0 || priceCollateralMantissa == 0) {\\n            return (uint256(Error.PRICE_ERROR), 0);\\n        }\\n\\n        /*\\n         * Get the exchange rate and calculate the number of collateral tokens to seize:\\n         *  seizeAmount = actualRepayAmount * liquidationIncentive * priceBorrowed / priceCollateral\\n         *  seizeTokens = seizeAmount / exchangeRate\\n         *   = actualRepayAmount * (liquidationIncentive * priceBorrowed) / (priceCollateral * exchangeRate)\\n         */\\n        uint256 exchangeRateMantissa = CToken(cTokenCollateral)\\n            .exchangeRateStored(); // Note: reverts on error\\n        uint256 seizeTokens;\\n        Exp memory numerator;\\n        Exp memory denominator;\\n        Exp memory ratio;\\n\\n        numerator = mul_(\\n            Exp({mantissa: liquidationIncentiveMantissa}),\\n            Exp({mantissa: priceBorrowedMantissa})\\n        );\\n        denominator = mul_(\\n            Exp({mantissa: priceCollateralMantissa}),\\n            Exp({mantissa: exchangeRateMantissa})\\n        );\\n        ratio = div_(numerator, denominator);\\n\\n        seizeTokens = mul_ScalarTruncate(ratio, actualRepayAmount);\\n\\n        return (uint256(Error.NO_ERROR), seizeTokens);\\n    }\\n\\n    /*** Admin Functions ***/\\n\\n    /**\\n     * @notice Sets a new price oracle for the comptroller\\n     * @dev Admin function to set a new price oracle\\n     * @return uint 0=success, otherwise a failure (see ErrorReporter.sol for details)\\n     */\\n    function _setPriceOracle(PriceOracle newOracle) public returns (uint256) {\\n        // Check caller is admin\\n        if (msg.sender != admin) {\\n            return\\n                fail(\\n                    Error.UNAUTHORIZED,\\n                    FailureInfo.SET_PRICE_ORACLE_OWNER_CHECK\\n                );\\n        }\\n\\n        // Track the old oracle for the comptroller\\n        PriceOracle oldOracle = oracle;\\n\\n        // Set comptroller's oracle to newOracle\\n        oracle = newOracle;\\n\\n        // Emit NewPriceOracle(oldOracle, newOracle)\\n        emit NewPriceOracle(oldOracle, newOracle);\\n\\n        return uint256(Error.NO_ERROR);\\n    }\\n\\n    /**\\n     * @notice Sets the closeFactor used when liquidating borrows\\n     * @dev Admin function to set closeFactor\\n     * @param newCloseFactorMantissa New close factor, scaled by 1e18\\n     * @return uint 0=success, otherwise a failure\\n     */\\n    function _setCloseFactor(\\n        uint256 newCloseFactorMantissa\\n    ) external returns (uint256) {\\n        // Check caller is admin\\n        require(msg.sender == admin, \\\"only admin can set close factor\\\");\\n\\n        uint256 oldCloseFactorMantissa = closeFactorMantissa;\\n        closeFactorMantissa = newCloseFactorMantissa;\\n        emit NewCloseFactor(oldCloseFactorMantissa, closeFactorMantissa);\\n\\n        return uint256(Error.NO_ERROR);\\n    }\\n\\n    /**\\n     * @notice Sets the collateralFactor for a market\\n     * @dev Admin function to set per-market collateralFactor\\n     * @param cToken The market to set the factor on\\n     * @param newCollateralFactorMantissa The new collateral factor, scaled by 1e18\\n     * @return uint 0=success, otherwise a failure. (See ErrorReporter for details)\\n     */\\n    function _setCollateralFactor(\\n        CToken cToken,\\n        uint256 newCollateralFactorMantissa\\n    ) external returns (uint256) {\\n        // Check caller is admin\\n        if (msg.sender != admin) {\\n            return\\n                fail(\\n                    Error.UNAUTHORIZED,\\n                    FailureInfo.SET_COLLATERAL_FACTOR_OWNER_CHECK\\n                );\\n        }\\n\\n        // Verify market is listed\\n        Market storage market = markets[address(cToken)];\\n        if (!market.isListed) {\\n            return\\n                fail(\\n                    Error.MARKET_NOT_LISTED,\\n                    FailureInfo.SET_COLLATERAL_FACTOR_NO_EXISTS\\n                );\\n        }\\n\\n        Exp memory newCollateralFactorExp = Exp({\\n            mantissa: newCollateralFactorMantissa\\n        });\\n\\n        // Check collateral factor <= 0.9\\n        Exp memory highLimit = Exp({mantissa: collateralFactorMaxMantissa});\\n        if (lessThanExp(highLimit, newCollateralFactorExp)) {\\n            return\\n                fail(\\n                    Error.INVALID_COLLATERAL_FACTOR,\\n                    FailureInfo.SET_COLLATERAL_FACTOR_VALIDATION\\n                );\\n        }\\n\\n        // If collateral factor != 0, fail if price == 0\\n        if (\\n            newCollateralFactorMantissa != 0 &&\\n            oracle.getUnderlyingPrice(cToken) == 0\\n        ) {\\n            return\\n                fail(\\n                    Error.PRICE_ERROR,\\n                    FailureInfo.SET_COLLATERAL_FACTOR_WITHOUT_PRICE\\n                );\\n        }\\n\\n        // Set market's collateral factor to new collateral factor, remember old value\\n        uint256 oldCollateralFactorMantissa = market.collateralFactorMantissa;\\n        market.collateralFactorMantissa = newCollateralFactorMantissa;\\n\\n        // Emit event with asset, old collateral factor, and new collateral factor\\n        emit NewCollateralFactor(\\n            cToken,\\n            oldCollateralFactorMantissa,\\n            newCollateralFactorMantissa\\n        );\\n\\n        return uint256(Error.NO_ERROR);\\n    }\\n\\n    /**\\n     * @notice Sets liquidationIncentive\\n     * @dev Admin function to set liquidationIncentive\\n     * @param newLiquidationIncentiveMantissa New liquidationIncentive scaled by 1e18\\n     * @return uint 0=success, otherwise a failure. (See ErrorReporter for details)\\n     */\\n    function _setLiquidationIncentive(\\n        uint256 newLiquidationIncentiveMantissa\\n    ) external returns (uint256) {\\n        // Check caller is admin\\n        if (msg.sender != admin) {\\n            return\\n                fail(\\n                    Error.UNAUTHORIZED,\\n                    FailureInfo.SET_LIQUIDATION_INCENTIVE_OWNER_CHECK\\n                );\\n        }\\n\\n        // Save current value for use in log\\n        uint256 oldLiquidationIncentiveMantissa = liquidationIncentiveMantissa;\\n\\n        // Set liquidation incentive to new incentive\\n        liquidationIncentiveMantissa = newLiquidationIncentiveMantissa;\\n\\n        // Emit event with old incentive, new incentive\\n        emit NewLiquidationIncentive(\\n            oldLiquidationIncentiveMantissa,\\n            newLiquidationIncentiveMantissa\\n        );\\n\\n        return uint256(Error.NO_ERROR);\\n    }\\n\\n    /**\\n     * @notice Add the market to the markets mapping and set it as listed\\n     * @dev Admin function to set isListed and add support for the market\\n     * @param cToken The address of the market (token) to list\\n     * @return uint 0=success, otherwise a failure. (See enum Error for details)\\n     */\\n    function _supportMarket(CToken cToken) external returns (uint256) {\\n        if (msg.sender != admin) {\\n            return\\n                fail(\\n                    Error.UNAUTHORIZED,\\n                    FailureInfo.SUPPORT_MARKET_OWNER_CHECK\\n                );\\n        }\\n\\n        if (markets[address(cToken)].isListed) {\\n            return\\n                fail(\\n                    Error.MARKET_ALREADY_LISTED,\\n                    FailureInfo.SUPPORT_MARKET_EXISTS\\n                );\\n        }\\n\\n        cToken.isCToken(); // Sanity check to make sure its really a CToken\\n\\n        // Note that isComped is not in active use anymore\\n        Market storage newMarket = markets[address(cToken)];\\n        newMarket.isListed = true;\\n        newMarket.isComped = false;\\n        newMarket.collateralFactorMantissa = 0;\\n\\n        _addMarketInternal(address(cToken));\\n        _initializeMarket(address(cToken));\\n\\n        emit MarketListed(cToken);\\n\\n        return uint256(Error.NO_ERROR);\\n    }\\n\\n    function _addMarketInternal(address cToken) internal {\\n        for (uint256 i = 0; i < allMarkets.length; i++) {\\n            require(allMarkets[i] != CToken(cToken), \\\"market already added\\\");\\n        }\\n        allMarkets.push(CToken(cToken));\\n    }\\n\\n    function _initializeMarket(address cToken) internal {\\n        uint32 blockNumber = safe32(\\n            getBlockNumber(),\\n            \\\"block number exceeds 32 bits\\\"\\n        );\\n\\n        CompMarketState storage supplyState = compSupplyState[cToken];\\n        CompMarketState storage borrowState = compBorrowState[cToken];\\n\\n        /*\\n         * Update market state indices\\n         */\\n        if (supplyState.index == 0) {\\n            // Initialize supply state index with default value\\n            supplyState.index = compInitialIndex;\\n        }\\n\\n        if (borrowState.index == 0) {\\n            // Initialize borrow state index with default value\\n            borrowState.index = compInitialIndex;\\n        }\\n\\n        /*\\n         * Update market state block numbers\\n         */\\n        supplyState.block = borrowState.block = blockNumber;\\n    }\\n\\n    /**\\n     * @notice Set the given borrow caps for the given cToken markets. Borrowing that brings total borrows to or above borrow cap will revert.\\n     * @dev Admin or borrowCapGuardian function to set the borrow caps. A borrow cap of 0 corresponds to unlimited borrowing.\\n     * @param cTokens The addresses of the markets (tokens) to change the borrow caps for\\n     * @param newBorrowCaps The new borrow cap values in underlying to be set. A value of 0 corresponds to unlimited borrowing.\\n     */\\n    function _setMarketBorrowCaps(\\n        CToken[] calldata cTokens,\\n        uint256[] calldata newBorrowCaps\\n    ) external {\\n        require(\\n            msg.sender == admin || msg.sender == borrowCapGuardian,\\n            \\\"only admin or borrow cap guardian can set borrow caps\\\"\\n        );\\n\\n        uint256 numMarkets = cTokens.length;\\n        uint256 numBorrowCaps = newBorrowCaps.length;\\n\\n        require(\\n            numMarkets != 0 && numMarkets == numBorrowCaps,\\n            \\\"invalid input\\\"\\n        );\\n\\n        for (uint256 i = 0; i < numMarkets; i++) {\\n            borrowCaps[address(cTokens[i])] = newBorrowCaps[i];\\n            emit NewBorrowCap(cTokens[i], newBorrowCaps[i]);\\n        }\\n    }\\n\\n    /**\\n     * @notice Admin function to change the Borrow Cap Guardian\\n     * @param newBorrowCapGuardian The address of the new Borrow Cap Guardian\\n     */\\n    function _setBorrowCapGuardian(address newBorrowCapGuardian) external {\\n        require(msg.sender == admin, \\\"only admin can set borrow cap guardian\\\");\\n\\n        // Save current value for inclusion in log\\n        address oldBorrowCapGuardian = borrowCapGuardian;\\n\\n        // Store borrowCapGuardian with value newBorrowCapGuardian\\n        borrowCapGuardian = newBorrowCapGuardian;\\n\\n        // Emit NewBorrowCapGuardian(OldBorrowCapGuardian, NewBorrowCapGuardian)\\n        emit NewBorrowCapGuardian(oldBorrowCapGuardian, newBorrowCapGuardian);\\n    }\\n\\n    /**\\n     * @notice Admin function to change the Pause Guardian\\n     * @param newPauseGuardian The address of the new Pause Guardian\\n     * @return uint 0=success, otherwise a failure. (See enum Error for details)\\n     */\\n    function _setPauseGuardian(\\n        address newPauseGuardian\\n    ) public returns (uint256) {\\n        if (msg.sender != admin) {\\n            return\\n                fail(\\n                    Error.UNAUTHORIZED,\\n                    FailureInfo.SET_PAUSE_GUARDIAN_OWNER_CHECK\\n                );\\n        }\\n\\n        // Save current value for inclusion in log\\n        address oldPauseGuardian = pauseGuardian;\\n\\n        // Store pauseGuardian with value newPauseGuardian\\n        pauseGuardian = newPauseGuardian;\\n\\n        // Emit NewPauseGuardian(OldPauseGuardian, NewPauseGuardian)\\n        emit NewPauseGuardian(oldPauseGuardian, pauseGuardian);\\n\\n        return uint256(Error.NO_ERROR);\\n    }\\n\\n    function _setMintPaused(CToken cToken, bool state) public returns (bool) {\\n        require(\\n            markets[address(cToken)].isListed,\\n            \\\"cannot pause a market that is not listed\\\"\\n        );\\n        require(\\n            msg.sender == pauseGuardian || msg.sender == admin,\\n            \\\"only pause guardian and admin can pause\\\"\\n        );\\n        require(msg.sender == admin || state == true, \\\"only admin can unpause\\\");\\n\\n        mintGuardianPaused[address(cToken)] = state;\\n        emit ActionPaused(cToken, \\\"Mint\\\", state);\\n        return state;\\n    }\\n\\n    function _setBorrowPaused(CToken cToken, bool state) public returns (bool) {\\n        require(\\n            markets[address(cToken)].isListed,\\n            \\\"cannot pause a market that is not listed\\\"\\n        );\\n        require(\\n            msg.sender == pauseGuardian || msg.sender == admin,\\n            \\\"only pause guardian and admin can pause\\\"\\n        );\\n        require(msg.sender == admin || state == true, \\\"only admin can unpause\\\");\\n\\n        borrowGuardianPaused[address(cToken)] = state;\\n        emit ActionPaused(cToken, \\\"Borrow\\\", state);\\n        return state;\\n    }\\n\\n    function _setTransferPaused(bool state) public returns (bool) {\\n        require(\\n            msg.sender == pauseGuardian || msg.sender == admin,\\n            \\\"only pause guardian and admin can pause\\\"\\n        );\\n        require(msg.sender == admin || state == true, \\\"only admin can unpause\\\");\\n\\n        transferGuardianPaused = state;\\n        emit ActionPaused(\\\"Transfer\\\", state);\\n        return state;\\n    }\\n\\n    function _setSeizePaused(bool state) public returns (bool) {\\n        require(\\n            msg.sender == pauseGuardian || msg.sender == admin,\\n            \\\"only pause guardian and admin can pause\\\"\\n        );\\n        require(msg.sender == admin || state == true, \\\"only admin can unpause\\\");\\n\\n        seizeGuardianPaused = state;\\n        emit ActionPaused(\\\"Seize\\\", state);\\n        return state;\\n    }\\n\\n    function _become(Unitroller unitroller) public {\\n        require(\\n            msg.sender == unitroller.admin(),\\n            \\\"only unitroller admin can change brains\\\"\\n        );\\n        require(\\n            unitroller._acceptImplementation() == 0,\\n            \\\"change not authorized\\\"\\n        );\\n    }\\n\\n    /// @notice Delete this function after proposal 65 is executed\\n    function fixBadAccruals(\\n        address[] calldata affectedUsers,\\n        uint256[] calldata amounts\\n    ) external {\\n        require(msg.sender == admin, \\\"Only admin can call this function\\\"); // Only the timelock can call this function\\n        require(\\n            !proposal65FixExecuted,\\n            \\\"Already executed this one-off function\\\"\\n        ); // Require that this function is only called once\\n        require(affectedUsers.length == amounts.length, \\\"Invalid input\\\");\\n\\n        // Loop variables\\n        address user;\\n        uint256 currentAccrual;\\n        uint256 amountToSubtract;\\n        uint256 newAccrual;\\n\\n        // Iterate through all affected users\\n        for (uint256 i = 0; i < affectedUsers.length; ++i) {\\n            user = affectedUsers[i];\\n            currentAccrual = compAccrued[user];\\n\\n            amountToSubtract = amounts[i];\\n\\n            // The case where the user has claimed and received an incorrect amount of COMP.\\n            // The user has less currently accrued than the amount they incorrectly received.\\n            if (amountToSubtract > currentAccrual) {\\n                // Amount of COMP the user owes the protocol\\n                uint256 accountReceivable = amountToSubtract - currentAccrual; // Underflow safe since amountToSubtract > currentAccrual\\n\\n                uint256 oldReceivable = compReceivable[user];\\n                uint256 newReceivable = add_(oldReceivable, accountReceivable);\\n\\n                // Accounting: record the COMP debt for the user\\n                compReceivable[user] = newReceivable;\\n\\n                emit CompReceivableUpdated(user, oldReceivable, newReceivable);\\n\\n                amountToSubtract = currentAccrual;\\n            }\\n\\n            if (amountToSubtract > 0) {\\n                // Subtract the bad accrual amount from what they have accrued.\\n                // Users will keep whatever they have correctly accrued.\\n                compAccrued[user] = newAccrual = sub_(\\n                    currentAccrual,\\n                    amountToSubtract\\n                );\\n\\n                emit CompAccruedAdjusted(user, currentAccrual, newAccrual);\\n            }\\n        }\\n\\n        proposal65FixExecuted = true; // Makes it so that this function cannot be called again\\n    }\\n\\n    /**\\n     * @notice Checks caller is admin, or this contract is becoming the new implementation\\n     */\\n    function adminOrInitializing() internal view returns (bool) {\\n        return msg.sender == admin || msg.sender == comptrollerImplementation;\\n    }\\n\\n    /*** Comp Distribution ***/\\n\\n    /**\\n     * @notice Set COMP speed for a single market\\n     * @param cToken The market whose COMP speed to update\\n     * @param supplySpeed New supply-side COMP speed for market\\n     * @param borrowSpeed New borrow-side COMP speed for market\\n     */\\n    function setCompSpeedInternal(\\n        CToken cToken,\\n        uint256 supplySpeed,\\n        uint256 borrowSpeed\\n    ) internal {\\n        Market storage market = markets[address(cToken)];\\n        require(market.isListed, \\\"comp market is not listed\\\");\\n\\n        if (compSupplySpeeds[address(cToken)] != supplySpeed) {\\n            // Supply speed updated so let's update supply state to ensure that\\n            //  1. COMP accrued properly for the old speed, and\\n            //  2. COMP accrued at the new speed starts after this block.\\n            updateCompSupplyIndex(address(cToken));\\n\\n            // Update speed and emit event\\n            compSupplySpeeds[address(cToken)] = supplySpeed;\\n            emit CompSupplySpeedUpdated(cToken, supplySpeed);\\n        }\\n\\n        if (compBorrowSpeeds[address(cToken)] != borrowSpeed) {\\n            // Borrow speed updated so let's update borrow state to ensure that\\n            //  1. COMP accrued properly for the old speed, and\\n            //  2. COMP accrued at the new speed starts after this block.\\n            Exp memory borrowIndex = Exp({mantissa: cToken.borrowIndex()});\\n            updateCompBorrowIndex(address(cToken), borrowIndex);\\n\\n            // Update speed and emit event\\n            compBorrowSpeeds[address(cToken)] = borrowSpeed;\\n            emit CompBorrowSpeedUpdated(cToken, borrowSpeed);\\n        }\\n    }\\n\\n    /**\\n     * @notice Accrue COMP to the market by updating the supply index\\n     * @param cToken The market whose supply index to update\\n     * @dev Index is a cumulative sum of the COMP per cToken accrued.\\n     */\\n    function updateCompSupplyIndex(address cToken) internal {\\n        CompMarketState storage supplyState = compSupplyState[cToken];\\n        uint256 supplySpeed = compSupplySpeeds[cToken];\\n        uint32 blockNumber = safe32(\\n            getBlockNumber(),\\n            \\\"block number exceeds 32 bits\\\"\\n        );\\n        uint256 deltaBlocks = sub_(\\n            uint256(blockNumber),\\n            uint256(supplyState.block)\\n        );\\n        if (deltaBlocks > 0 && supplySpeed > 0) {\\n            uint256 supplyTokens = CToken(cToken).totalSupply();\\n            uint256 compAccrued = mul_(deltaBlocks, supplySpeed);\\n            Double memory ratio = supplyTokens > 0\\n                ? fraction(compAccrued, supplyTokens)\\n                : Double({mantissa: 0});\\n            supplyState.index = safe224(\\n                add_(Double({mantissa: supplyState.index}), ratio).mantissa,\\n                \\\"new index exceeds 224 bits\\\"\\n            );\\n            supplyState.block = blockNumber;\\n        } else if (deltaBlocks > 0) {\\n            supplyState.block = blockNumber;\\n        }\\n    }\\n\\n    /**\\n     * @notice Accrue COMP to the market by updating the borrow index\\n     * @param cToken The market whose borrow index to update\\n     * @dev Index is a cumulative sum of the COMP per cToken accrued.\\n     */\\n    function updateCompBorrowIndex(\\n        address cToken,\\n        Exp memory marketBorrowIndex\\n    ) internal {\\n        CompMarketState storage borrowState = compBorrowState[cToken];\\n        uint256 borrowSpeed = compBorrowSpeeds[cToken];\\n        uint32 blockNumber = safe32(\\n            getBlockNumber(),\\n            \\\"block number exceeds 32 bits\\\"\\n        );\\n        uint256 deltaBlocks = sub_(\\n            uint256(blockNumber),\\n            uint256(borrowState.block)\\n        );\\n        if (deltaBlocks > 0 && borrowSpeed > 0) {\\n            uint256 borrowAmount = div_(\\n                CToken(cToken).totalBorrows(),\\n                marketBorrowIndex\\n            );\\n            uint256 compAccrued = mul_(deltaBlocks, borrowSpeed);\\n            Double memory ratio = borrowAmount > 0\\n                ? fraction(compAccrued, borrowAmount)\\n                : Double({mantissa: 0});\\n            borrowState.index = safe224(\\n                add_(Double({mantissa: borrowState.index}), ratio).mantissa,\\n                \\\"new index exceeds 224 bits\\\"\\n            );\\n            borrowState.block = blockNumber;\\n        } else if (deltaBlocks > 0) {\\n            borrowState.block = blockNumber;\\n        }\\n    }\\n\\n    /**\\n     * @notice Calculate COMP accrued by a supplier and possibly transfer it to them\\n     * @param cToken The market in which the supplier is interacting\\n     * @param supplier The address of the supplier to distribute COMP to\\n     */\\n    function distributeSupplierComp(address cToken, address supplier) internal {\\n        // TODO: Don't distribute supplier COMP if the user is not in the supplier market.\\n        // This check should be as gas efficient as possible as distributeSupplierComp is called in many places.\\n        // - We really don't want to call an external contract as that's quite expensive.\\n\\n        CompMarketState storage supplyState = compSupplyState[cToken];\\n        uint256 supplyIndex = supplyState.index;\\n        uint256 supplierIndex = compSupplierIndex[cToken][supplier];\\n\\n        // Update supplier's index to the current index since we are distributing accrued COMP\\n        compSupplierIndex[cToken][supplier] = supplyIndex;\\n\\n        if (supplierIndex == 0 && supplyIndex >= compInitialIndex) {\\n            // Covers the case where users supplied tokens before the market's supply state index was set.\\n            // Rewards the user with COMP accrued from the start of when supplier rewards were first\\n            // set for the market.\\n            supplierIndex = compInitialIndex;\\n        }\\n\\n        // Calculate change in the cumulative sum of the COMP per cToken accrued\\n        Double memory deltaIndex = Double({\\n            mantissa: sub_(supplyIndex, supplierIndex)\\n        });\\n\\n        uint256 supplierTokens = CToken(cToken).balanceOf(supplier);\\n\\n        // Calculate COMP accrued: cTokenAmount * accruedPerCToken\\n        uint256 supplierDelta = mul_(supplierTokens, deltaIndex);\\n\\n        uint256 supplierAccrued = add_(compAccrued[supplier], supplierDelta);\\n        compAccrued[supplier] = supplierAccrued;\\n\\n        emit DistributedSupplierComp(\\n            CToken(cToken),\\n            supplier,\\n            supplierDelta,\\n            supplyIndex\\n        );\\n    }\\n\\n    /**\\n     * @notice Calculate COMP accrued by a borrower and possibly transfer it to them\\n     * @dev Borrowers will not begin to accrue until after the first interaction with the protocol.\\n     * @param cToken The market in which the borrower is interacting\\n     * @param borrower The address of the borrower to distribute COMP to\\n     */\\n    function distributeBorrowerComp(\\n        address cToken,\\n        address borrower,\\n        Exp memory marketBorrowIndex\\n    ) internal {\\n        // TODO: Don't distribute supplier COMP if the user is not in the borrower market.\\n        // This check should be as gas efficient as possible as distributeBorrowerComp is called in many places.\\n        // - We really don't want to call an external contract as that's quite expensive.\\n\\n        CompMarketState storage borrowState = compBorrowState[cToken];\\n        uint256 borrowIndex = borrowState.index;\\n        uint256 borrowerIndex = compBorrowerIndex[cToken][borrower];\\n\\n        // Update borrowers's index to the current index since we are distributing accrued COMP\\n        compBorrowerIndex[cToken][borrower] = borrowIndex;\\n\\n        if (borrowerIndex == 0 && borrowIndex >= compInitialIndex) {\\n            // Covers the case where users borrowed tokens before the market's borrow state index was set.\\n            // Rewards the user with COMP accrued from the start of when borrower rewards were first\\n            // set for the market.\\n            borrowerIndex = compInitialIndex;\\n        }\\n\\n        // Calculate change in the cumulative sum of the COMP per borrowed unit accrued\\n        Double memory deltaIndex = Double({\\n            mantissa: sub_(borrowIndex, borrowerIndex)\\n        });\\n\\n        uint256 borrowerAmount = div_(\\n            CToken(cToken).borrowBalanceStored(borrower),\\n            marketBorrowIndex\\n        );\\n\\n        // Calculate COMP accrued: cTokenAmount * accruedPerBorrowedUnit\\n        uint256 borrowerDelta = mul_(borrowerAmount, deltaIndex);\\n\\n        uint256 borrowerAccrued = add_(compAccrued[borrower], borrowerDelta);\\n        compAccrued[borrower] = borrowerAccrued;\\n\\n        emit DistributedBorrowerComp(\\n            CToken(cToken),\\n            borrower,\\n            borrowerDelta,\\n            borrowIndex\\n        );\\n    }\\n\\n    /**\\n     * @notice Calculate additional accrued COMP for a contributor since last accrual\\n     * @param contributor The address to calculate contributor rewards for\\n     */\\n    function updateContributorRewards(address contributor) public {\\n        uint256 compSpeed = compContributorSpeeds[contributor];\\n        uint256 blockNumber = getBlockNumber();\\n        uint256 deltaBlocks = sub_(\\n            blockNumber,\\n            lastContributorBlock[contributor]\\n        );\\n        if (deltaBlocks > 0 && compSpeed > 0) {\\n            uint256 newAccrued = mul_(deltaBlocks, compSpeed);\\n            uint256 contributorAccrued = add_(\\n                compAccrued[contributor],\\n                newAccrued\\n            );\\n\\n            compAccrued[contributor] = contributorAccrued;\\n            lastContributorBlock[contributor] = blockNumber;\\n        }\\n    }\\n\\n    /**\\n     * @notice Claim all the comp accrued by holder in all markets\\n     * @param holder The address to claim COMP for\\n     */\\n    function claimComp(address holder) public {\\n        return claimComp(holder, allMarkets);\\n    }\\n\\n    /**\\n     * @notice Claim all the comp accrued by holder in the specified markets\\n     * @param holder The address to claim COMP for\\n     * @param cTokens The list of markets to claim COMP in\\n     */\\n    function claimComp(address holder, CToken[] memory cTokens) public {\\n        address[] memory holders = new address[](1);\\n        holders[0] = holder;\\n        claimComp(holders, cTokens, true, true);\\n    }\\n\\n    /**\\n     * @notice Claim all comp accrued by the holders\\n     * @param holders The addresses to claim COMP for\\n     * @param cTokens The list of markets to claim COMP in\\n     * @param borrowers Whether or not to claim COMP earned by borrowing\\n     * @param suppliers Whether or not to claim COMP earned by supplying\\n     */\\n    function claimComp(\\n        address[] memory holders,\\n        CToken[] memory cTokens,\\n        bool borrowers,\\n        bool suppliers\\n    ) public {\\n        for (uint256 i = 0; i < cTokens.length; i++) {\\n            CToken cToken = cTokens[i];\\n            require(markets[address(cToken)].isListed, \\\"market must be listed\\\");\\n            if (borrowers == true) {\\n                Exp memory borrowIndex = Exp({mantissa: cToken.borrowIndex()});\\n                updateCompBorrowIndex(address(cToken), borrowIndex);\\n                for (uint256 j = 0; j < holders.length; j++) {\\n                    distributeBorrowerComp(\\n                        address(cToken),\\n                        holders[j],\\n                        borrowIndex\\n                    );\\n                }\\n            }\\n            if (suppliers == true) {\\n                updateCompSupplyIndex(address(cToken));\\n                for (uint256 j = 0; j < holders.length; j++) {\\n                    distributeSupplierComp(address(cToken), holders[j]);\\n                }\\n            }\\n        }\\n        for (uint256 j = 0; j < holders.length; j++) {\\n            compAccrued[holders[j]] = grantCompInternal(\\n                holders[j],\\n                compAccrued[holders[j]]\\n            );\\n        }\\n    }\\n\\n    /**\\n     * @notice Transfer COMP to the user\\n     * @dev Note: If there is not enough COMP, we do not perform the transfer all.\\n     * @param user The address of the user to transfer COMP to\\n     * @param amount The amount of COMP to (possibly) transfer\\n     * @return The amount of COMP which was NOT transferred to the user\\n     */\\n    function grantCompInternal(\\n        address user,\\n        uint256 amount\\n    ) internal returns (uint256) {\\n        Comp comp = Comp(getCompAddress());\\n        uint256 compRemaining = comp.balanceOf(address(this));\\n        if (amount > 0 && amount <= compRemaining) {\\n            comp.transfer(user, amount);\\n            return 0;\\n        }\\n        return amount;\\n    }\\n\\n    /*** Comp Distribution Admin ***/\\n\\n    /**\\n     * @notice Transfer COMP to the recipient\\n     * @dev Note: If there is not enough COMP, we do not perform the transfer all.\\n     * @param recipient The address of the recipient to transfer COMP to\\n     * @param amount The amount of COMP to (possibly) transfer\\n     */\\n    function _grantComp(address recipient, uint256 amount) public {\\n        require(adminOrInitializing(), \\\"only admin can grant comp\\\");\\n        uint256 amountLeft = grantCompInternal(recipient, amount);\\n        require(amountLeft == 0, \\\"insufficient comp for grant\\\");\\n        emit CompGranted(recipient, amount);\\n    }\\n\\n    /**\\n     * @notice Set COMP borrow and supply speeds for the specified markets.\\n     * @param cTokens The markets whose COMP speed to update.\\n     * @param supplySpeeds New supply-side COMP speed for the corresponding market.\\n     * @param borrowSpeeds New borrow-side COMP speed for the corresponding market.\\n     */\\n    function _setCompSpeeds(\\n        CToken[] memory cTokens,\\n        uint256[] memory supplySpeeds,\\n        uint256[] memory borrowSpeeds\\n    ) public {\\n        require(adminOrInitializing(), \\\"only admin can set comp speed\\\");\\n\\n        uint256 numTokens = cTokens.length;\\n        require(\\n            numTokens == supplySpeeds.length &&\\n                numTokens == borrowSpeeds.length,\\n            \\\"Comptroller::_setCompSpeeds invalid input\\\"\\n        );\\n\\n        for (uint256 i = 0; i < numTokens; ++i) {\\n            setCompSpeedInternal(cTokens[i], supplySpeeds[i], borrowSpeeds[i]);\\n        }\\n    }\\n\\n    /**\\n     * @notice Set COMP speed for a single contributor\\n     * @param contributor The contributor whose COMP speed to update\\n     * @param compSpeed New COMP speed for contributor\\n     */\\n    function _setContributorCompSpeed(\\n        address contributor,\\n        uint256 compSpeed\\n    ) public {\\n        require(adminOrInitializing(), \\\"only admin can set comp speed\\\");\\n\\n        // note that COMP speed could be set to 0 to halt liquidity rewards for a contributor\\n        updateContributorRewards(contributor);\\n        if (compSpeed == 0) {\\n            // release storage\\n            delete lastContributorBlock[contributor];\\n        } else {\\n            lastContributorBlock[contributor] = getBlockNumber();\\n        }\\n        compContributorSpeeds[contributor] = compSpeed;\\n\\n        emit ContributorCompSpeedUpdated(contributor, compSpeed);\\n    }\\n\\n    /**\\n     * @notice Return all of the markets\\n     * @dev The automatic getter may be used to access an individual market.\\n     * @return The list of market addresses\\n     */\\n    function getAllMarkets() public view returns (CToken[] memory) {\\n        return allMarkets;\\n    }\\n\\n    /**\\n     * @notice Returns true if the given cToken market has been deprecated\\n     * @dev All borrows in a deprecated cToken market can be immediately liquidated\\n     * @param cToken The market to check if deprecated\\n     */\\n    function isDeprecated(CToken cToken) public view returns (bool) {\\n        return\\n            markets[address(cToken)].collateralFactorMantissa == 0 &&\\n            borrowGuardianPaused[address(cToken)] == true &&\\n            cToken.reserveFactorMantissa() == 1e18;\\n    }\\n\\n    function getBlockNumber() public view virtual returns (uint256) {\\n        return block.timestamp;\\n    }\\n\\n    /**\\n     * @notice Return the address of the MARE token\\n     * @return The address of MARE\\n     */\\n    function getCompAddress() public view virtual returns (address) {\\n        return 0xd86C8d4279CCaFbec840c782BcC50D201f277419;\\n    }\\n}\\n\",\"keccak256\":\"0x6e39808947548e46b1dff39dae8d30623b4902e43497cb074c7469dd8094d309\",\"license\":\"BSD-3-Clause\"},\"contracts/ComptrollerInterface.sol\":{\"content\":\"// SPDX-License-Identifier: BSD-3-Clause\\npragma solidity ^0.8.10;\\n\\nabstract contract ComptrollerInterface {\\n    /// @notice Indicator that this is a Comptroller contract (for inspection)\\n    bool public constant isComptroller = true;\\n\\n    /*** Assets You Are In ***/\\n\\n    function enterMarkets(\\n        address[] calldata cTokens\\n    ) external virtual returns (uint[] memory);\\n\\n    function exitMarket(address cToken) external virtual returns (uint);\\n\\n    /*** Policy Hooks ***/\\n\\n    function mintAllowed(\\n        address cToken,\\n        address minter,\\n        uint mintAmount\\n    ) external virtual returns (uint);\\n\\n    function mintVerify(\\n        address cToken,\\n        address minter,\\n        uint mintAmount,\\n        uint mintTokens\\n    ) external virtual;\\n\\n    function redeemAllowed(\\n        address cToken,\\n        address redeemer,\\n        uint redeemTokens\\n    ) external virtual returns (uint);\\n\\n    function redeemVerify(\\n        address cToken,\\n        address redeemer,\\n        uint redeemAmount,\\n        uint redeemTokens\\n    ) external virtual;\\n\\n    function borrowAllowed(\\n        address cToken,\\n        address borrower,\\n        uint borrowAmount\\n    ) external virtual returns (uint);\\n\\n    function borrowVerify(\\n        address cToken,\\n        address borrower,\\n        uint borrowAmount\\n    ) external virtual;\\n\\n    function repayBorrowAllowed(\\n        address cToken,\\n        address payer,\\n        address borrower,\\n        uint repayAmount\\n    ) external virtual returns (uint);\\n\\n    function repayBorrowVerify(\\n        address cToken,\\n        address payer,\\n        address borrower,\\n        uint repayAmount,\\n        uint borrowerIndex\\n    ) external virtual;\\n\\n    function liquidateBorrowAllowed(\\n        address cTokenBorrowed,\\n        address cTokenCollateral,\\n        address liquidator,\\n        address borrower,\\n        uint repayAmount\\n    ) external virtual returns (uint);\\n\\n    function liquidateBorrowVerify(\\n        address cTokenBorrowed,\\n        address cTokenCollateral,\\n        address liquidator,\\n        address borrower,\\n        uint repayAmount,\\n        uint seizeTokens\\n    ) external virtual;\\n\\n    function seizeAllowed(\\n        address cTokenCollateral,\\n        address cTokenBorrowed,\\n        address liquidator,\\n        address borrower,\\n        uint seizeTokens\\n    ) external virtual returns (uint);\\n\\n    function seizeVerify(\\n        address cTokenCollateral,\\n        address cTokenBorrowed,\\n        address liquidator,\\n        address borrower,\\n        uint seizeTokens\\n    ) external virtual;\\n\\n    function transferAllowed(\\n        address cToken,\\n        address src,\\n        address dst,\\n        uint transferTokens\\n    ) external virtual returns (uint);\\n\\n    function transferVerify(\\n        address cToken,\\n        address src,\\n        address dst,\\n        uint transferTokens\\n    ) external virtual;\\n\\n    /*** Liquidity/Liquidation Calculations ***/\\n\\n    function liquidateCalculateSeizeTokens(\\n        address cTokenBorrowed,\\n        address cTokenCollateral,\\n        uint repayAmount\\n    ) external view virtual returns (uint, uint);\\n}\\n\",\"keccak256\":\"0xab561397519328ed731d7b88d8d97f3fa2b3884cc8a22336534d2970c21dee55\",\"license\":\"BSD-3-Clause\"},\"contracts/ComptrollerStorage.sol\":{\"content\":\"// SPDX-License-Identifier: BSD-3-Clause\\npragma solidity ^0.8.10;\\n\\nimport \\\"./CToken.sol\\\";\\nimport \\\"./PriceOracle.sol\\\";\\n\\ncontract UnitrollerAdminStorage {\\n    /**\\n     * @notice Administrator for this contract\\n     */\\n    address public admin;\\n\\n    /**\\n     * @notice Pending administrator for this contract\\n     */\\n    address public pendingAdmin;\\n\\n    /**\\n     * @notice Active brains of Unitroller\\n     */\\n    address public comptrollerImplementation;\\n\\n    /**\\n     * @notice Pending brains of Unitroller\\n     */\\n    address public pendingComptrollerImplementation;\\n}\\n\\ncontract ComptrollerV1Storage is UnitrollerAdminStorage {\\n    /**\\n     * @notice Oracle which gives the price of any given asset\\n     */\\n    PriceOracle public oracle;\\n\\n    /**\\n     * @notice Multiplier used to calculate the maximum repayAmount when liquidating a borrow\\n     */\\n    uint256 public closeFactorMantissa;\\n\\n    /**\\n     * @notice Multiplier representing the discount on collateral that a liquidator receives\\n     */\\n    uint256 public liquidationIncentiveMantissa;\\n\\n    /**\\n     * @notice Max number of assets a single account can participate in (borrow or use as collateral)\\n     */\\n    uint256 public maxAssets;\\n\\n    /**\\n     * @notice Per-account mapping of \\\"assets you are in\\\", capped by maxAssets\\n     */\\n    mapping(address => CToken[]) public accountAssets;\\n}\\n\\ncontract ComptrollerV2Storage is ComptrollerV1Storage {\\n    struct Market {\\n        // Whether or not this market is listed\\n        bool isListed;\\n        //  Multiplier representing the most one can borrow against their collateral in this market.\\n        //  For instance, 0.9 to allow borrowing 90% of collateral value.\\n        //  Must be between 0 and 1, and stored as a mantissa.\\n        uint256 collateralFactorMantissa;\\n        // Per-market mapping of \\\"accounts in this asset\\\"\\n        mapping(address => bool) accountMembership;\\n        // Whether or not this market receives COMP\\n        bool isComped;\\n    }\\n\\n    /**\\n     * @notice Official mapping of cTokens -> Market metadata\\n     * @dev Used e.g. to determine if a market is supported\\n     */\\n    mapping(address => Market) public markets;\\n\\n    /**\\n     * @notice The Pause Guardian can pause certain actions as a safety mechanism.\\n     *  Actions which allow users to remove their own assets cannot be paused.\\n     *  Liquidation / seizing / transfer can only be paused globally, not by market.\\n     */\\n    address public pauseGuardian;\\n    bool public _mintGuardianPaused;\\n    bool public _borrowGuardianPaused;\\n    bool public transferGuardianPaused;\\n    bool public seizeGuardianPaused;\\n    mapping(address => bool) public mintGuardianPaused;\\n    mapping(address => bool) public borrowGuardianPaused;\\n}\\n\\ncontract ComptrollerV3Storage is ComptrollerV2Storage {\\n    struct CompMarketState {\\n        // The market's last updated compBorrowIndex or compSupplyIndex\\n        uint224 index;\\n        // The block number the index was last updated at\\n        uint32 block;\\n    }\\n\\n    /// @notice A list of all markets\\n    CToken[] public allMarkets;\\n\\n    /// @notice The rate at which the flywheel distributes COMP, per block\\n    uint256 public compRate;\\n\\n    /// @notice The portion of compRate that each market currently receives\\n    mapping(address => uint256) public compSpeeds;\\n\\n    /// @notice The COMP market supply state for each market\\n    mapping(address => CompMarketState) public compSupplyState;\\n\\n    /// @notice The COMP market borrow state for each market\\n    mapping(address => CompMarketState) public compBorrowState;\\n\\n    /// @notice The COMP borrow index for each market for each supplier as of the last time they accrued COMP\\n    mapping(address => mapping(address => uint256)) public compSupplierIndex;\\n\\n    /// @notice The COMP borrow index for each market for each borrower as of the last time they accrued COMP\\n    mapping(address => mapping(address => uint256)) public compBorrowerIndex;\\n\\n    /// @notice The COMP accrued but not yet transferred to each user\\n    mapping(address => uint256) public compAccrued;\\n}\\n\\ncontract ComptrollerV4Storage is ComptrollerV3Storage {\\n    // @notice The borrowCapGuardian can set borrowCaps to any number for any market. Lowering the borrow cap could disable borrowing on the given market.\\n    address public borrowCapGuardian;\\n\\n    // @notice Borrow caps enforced by borrowAllowed for each cToken address. Defaults to zero which corresponds to unlimited borrowing.\\n    mapping(address => uint256) public borrowCaps;\\n}\\n\\ncontract ComptrollerV5Storage is ComptrollerV4Storage {\\n    /// @notice The portion of COMP that each contributor receives per block\\n    mapping(address => uint256) public compContributorSpeeds;\\n\\n    /// @notice Last block at which a contributor's COMP rewards have been allocated\\n    mapping(address => uint256) public lastContributorBlock;\\n}\\n\\ncontract ComptrollerV6Storage is ComptrollerV5Storage {\\n    /// @notice The rate at which comp is distributed to the corresponding borrow market (per block)\\n    mapping(address => uint256) public compBorrowSpeeds;\\n\\n    /// @notice The rate at which comp is distributed to the corresponding supply market (per block)\\n    mapping(address => uint256) public compSupplySpeeds;\\n}\\n\\ncontract ComptrollerV7Storage is ComptrollerV6Storage {\\n    /// @notice Flag indicating whether the function to fix COMP accruals has been executed (RE: proposal 62 bug)\\n    bool public proposal65FixExecuted;\\n\\n    /// @notice Accounting storage mapping account addresses to how much COMP they owe the protocol.\\n    mapping(address => uint256) public compReceivable;\\n}\\n\",\"keccak256\":\"0x7f0d0a023c56f457dd62d8473d093a354da7b3c7b48dd5eaa4b0fcf3ae955edf\",\"license\":\"BSD-3-Clause\"},\"contracts/EIP20Interface.sol\":{\"content\":\"// SPDX-License-Identifier: BSD-3-Clause\\npragma solidity ^0.8.10;\\n\\n/**\\n * @title ERC 20 Token Standard Interface\\n *  https://eips.ethereum.org/EIPS/eip-20\\n */\\ninterface EIP20Interface {\\n    function name() external view returns (string memory);\\n\\n    function symbol() external view returns (string memory);\\n\\n    function decimals() external view returns (uint8);\\n\\n    /**\\n     * @notice Get the total number of tokens in circulation\\n     * @return The supply of tokens\\n     */\\n    function totalSupply() external view returns (uint256);\\n\\n    /**\\n     * @notice Gets the balance of the specified address\\n     * @param owner The address from which the balance will be retrieved\\n     * @return balance The balance\\n     */\\n    function balanceOf(address owner) external view returns (uint256 balance);\\n\\n    /**\\n     * @notice Transfer `amount` tokens from `msg.sender` to `dst`\\n     * @param dst The address of the destination account\\n     * @param amount The number of tokens to transfer\\n     * @return success Whether or not the transfer succeeded\\n     */\\n    function transfer(\\n        address dst,\\n        uint256 amount\\n    ) external returns (bool success);\\n\\n    /**\\n     * @notice Transfer `amount` tokens from `src` to `dst`\\n     * @param src The address of the source account\\n     * @param dst The address of the destination account\\n     * @param amount The number of tokens to transfer\\n     * @return success Whether or not the transfer succeeded\\n     */\\n    function transferFrom(\\n        address src,\\n        address dst,\\n        uint256 amount\\n    ) external returns (bool success);\\n\\n    /**\\n     * @notice Approve `spender` to transfer up to `amount` from `src`\\n     * @dev This will overwrite the approval amount for `spender`\\n     *  and is subject to issues noted [here](https://eips.ethereum.org/EIPS/eip-20#approve)\\n     * @param spender The address of the account which may transfer tokens\\n     * @param amount The number of tokens that are approved (-1 means infinite)\\n     * @return success Whether or not the approval succeeded\\n     */\\n    function approve(\\n        address spender,\\n        uint256 amount\\n    ) external returns (bool success);\\n\\n    /**\\n     * @notice Get the current allowance from `owner` for `spender`\\n     * @param owner The address of the account which owns the tokens to be spent\\n     * @param spender The address of the account which may transfer tokens\\n     * @return remaining The number of tokens allowed to be spent (-1 means infinite)\\n     */\\n    function allowance(\\n        address owner,\\n        address spender\\n    ) external view returns (uint256 remaining);\\n\\n    event Transfer(address indexed from, address indexed to, uint256 amount);\\n    event Approval(\\n        address indexed owner,\\n        address indexed spender,\\n        uint256 amount\\n    );\\n}\\n\",\"keccak256\":\"0xc58019a1ce3f7f282b5e5d4960922d1f5334872431808fd0c1e777f263871bb8\",\"license\":\"BSD-3-Clause\"},\"contracts/EIP20NonStandardInterface.sol\":{\"content\":\"// SPDX-License-Identifier: BSD-3-Clause\\npragma solidity ^0.8.10;\\n\\n/**\\n * @title EIP20NonStandardInterface\\n * @dev Version of ERC20 with no return values for `transfer` and `transferFrom`\\n *  See https://medium.com/coinmonks/missing-return-value-bug-at-least-130-tokens-affected-d67bf08521ca\\n */\\ninterface EIP20NonStandardInterface {\\n    /**\\n     * @notice Get the total number of tokens in circulation\\n     * @return The supply of tokens\\n     */\\n    function totalSupply() external view returns (uint256);\\n\\n    /**\\n     * @notice Gets the balance of the specified address\\n     * @param owner The address from which the balance will be retrieved\\n     * @return balance The balance\\n     */\\n    function balanceOf(address owner) external view returns (uint256 balance);\\n\\n    ///\\n    /// !!!!!!!!!!!!!!\\n    /// !!! NOTICE !!! `transfer` does not return a value, in violation of the ERC-20 specification\\n    /// !!!!!!!!!!!!!!\\n    ///\\n\\n    /**\\n     * @notice Transfer `amount` tokens from `msg.sender` to `dst`\\n     * @param dst The address of the destination account\\n     * @param amount The number of tokens to transfer\\n     */\\n    function transfer(address dst, uint256 amount) external;\\n\\n    ///\\n    /// !!!!!!!!!!!!!!\\n    /// !!! NOTICE !!! `transferFrom` does not return a value, in violation of the ERC-20 specification\\n    /// !!!!!!!!!!!!!!\\n    ///\\n\\n    /**\\n     * @notice Transfer `amount` tokens from `src` to `dst`\\n     * @param src The address of the source account\\n     * @param dst The address of the destination account\\n     * @param amount The number of tokens to transfer\\n     */\\n    function transferFrom(address src, address dst, uint256 amount) external;\\n\\n    /**\\n     * @notice Approve `spender` to transfer up to `amount` from `src`\\n     * @dev This will overwrite the approval amount for `spender`\\n     *  and is subject to issues noted [here](https://eips.ethereum.org/EIPS/eip-20#approve)\\n     * @param spender The address of the account which may transfer tokens\\n     * @param amount The number of tokens that are approved\\n     * @return success Whether or not the approval succeeded\\n     */\\n    function approve(\\n        address spender,\\n        uint256 amount\\n    ) external returns (bool success);\\n\\n    /**\\n     * @notice Get the current allowance from `owner` for `spender`\\n     * @param owner The address of the account which owns the tokens to be spent\\n     * @param spender The address of the account which may transfer tokens\\n     * @return remaining The number of tokens allowed to be spent\\n     */\\n    function allowance(\\n        address owner,\\n        address spender\\n    ) external view returns (uint256 remaining);\\n\\n    event Transfer(address indexed from, address indexed to, uint256 amount);\\n    event Approval(\\n        address indexed owner,\\n        address indexed spender,\\n        uint256 amount\\n    );\\n}\\n\",\"keccak256\":\"0x5f5e2de8a10d9d9b11c1db605fc44764867e18a11ab5de205fb2cc8637500ae7\",\"license\":\"BSD-3-Clause\"},\"contracts/ErrorReporter.sol\":{\"content\":\"// SPDX-License-Identifier: BSD-3-Clause\\npragma solidity ^0.8.10;\\n\\ncontract ComptrollerErrorReporter {\\n    enum Error {\\n        NO_ERROR,\\n        UNAUTHORIZED,\\n        COMPTROLLER_MISMATCH,\\n        INSUFFICIENT_SHORTFALL,\\n        INSUFFICIENT_LIQUIDITY,\\n        INVALID_CLOSE_FACTOR,\\n        INVALID_COLLATERAL_FACTOR,\\n        INVALID_LIQUIDATION_INCENTIVE,\\n        MARKET_NOT_ENTERED, // no longer possible\\n        MARKET_NOT_LISTED,\\n        MARKET_ALREADY_LISTED,\\n        MATH_ERROR,\\n        NONZERO_BORROW_BALANCE,\\n        PRICE_ERROR,\\n        REJECTION,\\n        SNAPSHOT_ERROR,\\n        TOO_MANY_ASSETS,\\n        TOO_MUCH_REPAY\\n    }\\n\\n    enum FailureInfo {\\n        ACCEPT_ADMIN_PENDING_ADMIN_CHECK,\\n        ACCEPT_PENDING_IMPLEMENTATION_ADDRESS_CHECK,\\n        EXIT_MARKET_BALANCE_OWED,\\n        EXIT_MARKET_REJECTION,\\n        SET_CLOSE_FACTOR_OWNER_CHECK,\\n        SET_CLOSE_FACTOR_VALIDATION,\\n        SET_COLLATERAL_FACTOR_OWNER_CHECK,\\n        SET_COLLATERAL_FACTOR_NO_EXISTS,\\n        SET_COLLATERAL_FACTOR_VALIDATION,\\n        SET_COLLATERAL_FACTOR_WITHOUT_PRICE,\\n        SET_IMPLEMENTATION_OWNER_CHECK,\\n        SET_LIQUIDATION_INCENTIVE_OWNER_CHECK,\\n        SET_LIQUIDATION_INCENTIVE_VALIDATION,\\n        SET_MAX_ASSETS_OWNER_CHECK,\\n        SET_PENDING_ADMIN_OWNER_CHECK,\\n        SET_PENDING_IMPLEMENTATION_OWNER_CHECK,\\n        SET_PRICE_ORACLE_OWNER_CHECK,\\n        SUPPORT_MARKET_EXISTS,\\n        SUPPORT_MARKET_OWNER_CHECK,\\n        SET_PAUSE_GUARDIAN_OWNER_CHECK\\n    }\\n\\n    /**\\n     * @dev `error` corresponds to enum Error; `info` corresponds to enum FailureInfo, and `detail` is an arbitrary\\n     * contract-specific code that enables us to report opaque error codes from upgradeable contracts.\\n     **/\\n    event Failure(uint error, uint info, uint detail);\\n\\n    /**\\n     * @dev use this when reporting a known error from the money market or a non-upgradeable collaborator\\n     */\\n    function fail(Error err, FailureInfo info) internal returns (uint) {\\n        emit Failure(uint(err), uint(info), 0);\\n\\n        return uint(err);\\n    }\\n\\n    /**\\n     * @dev use this when reporting an opaque error from an upgradeable collaborator contract\\n     */\\n    function failOpaque(\\n        Error err,\\n        FailureInfo info,\\n        uint opaqueError\\n    ) internal returns (uint) {\\n        emit Failure(uint(err), uint(info), opaqueError);\\n\\n        return uint(err);\\n    }\\n}\\n\\ncontract TokenErrorReporter {\\n    uint public constant NO_ERROR = 0; // support legacy return codes\\n\\n    error TransferComptrollerRejection(uint256 errorCode);\\n    error TransferNotAllowed();\\n    error TransferNotEnough();\\n    error TransferTooMuch();\\n\\n    error MintComptrollerRejection(uint256 errorCode);\\n    error MintFreshnessCheck();\\n\\n    error RedeemComptrollerRejection(uint256 errorCode);\\n    error RedeemFreshnessCheck();\\n    error RedeemTransferOutNotPossible();\\n\\n    error BorrowComptrollerRejection(uint256 errorCode);\\n    error BorrowFreshnessCheck();\\n    error BorrowCashNotAvailable();\\n\\n    error RepayBorrowComptrollerRejection(uint256 errorCode);\\n    error RepayBorrowFreshnessCheck();\\n\\n    error LiquidateComptrollerRejection(uint256 errorCode);\\n    error LiquidateFreshnessCheck();\\n    error LiquidateCollateralFreshnessCheck();\\n    error LiquidateAccrueBorrowInterestFailed(uint256 errorCode);\\n    error LiquidateAccrueCollateralInterestFailed(uint256 errorCode);\\n    error LiquidateLiquidatorIsBorrower();\\n    error LiquidateCloseAmountIsZero();\\n    error LiquidateCloseAmountIsUintMax();\\n    error LiquidateRepayBorrowFreshFailed(uint256 errorCode);\\n\\n    error LiquidateSeizeComptrollerRejection(uint256 errorCode);\\n    error LiquidateSeizeLiquidatorIsBorrower();\\n\\n    error AcceptAdminPendingAdminCheck();\\n\\n    error SetComptrollerOwnerCheck();\\n    error SetPendingAdminOwnerCheck();\\n\\n    error SetReserveFactorAdminCheck();\\n    error SetReserveFactorFreshCheck();\\n    error SetReserveFactorBoundsCheck();\\n\\n    error AddReservesFactorFreshCheck(uint256 actualAddAmount);\\n\\n    error ReduceReservesAdminCheck();\\n    error ReduceReservesFreshCheck();\\n    error ReduceReservesCashNotAvailable();\\n    error ReduceReservesCashValidation();\\n\\n    error SetInterestRateModelOwnerCheck();\\n    error SetInterestRateModelFreshCheck();\\n}\\n\",\"keccak256\":\"0xfb4dc2989b0af2cceb7eaabe1efc53996665786fc0d84a79ef66b2de722806c0\",\"license\":\"BSD-3-Clause\"},\"contracts/ExponentialNoError.sol\":{\"content\":\"// SPDX-License-Identifier: BSD-3-Clause\\npragma solidity ^0.8.10;\\n\\n/**\\n * @title Exponential module for storing fixed-precision decimals\\n * @author Compound\\n * @notice Exp is a struct which stores decimals with a fixed precision of 18 decimal places.\\n *         Thus, if we wanted to store the 5.1, mantissa would store 5.1e18. That is:\\n *         `Exp({mantissa: 5100000000000000000})`.\\n */\\ncontract ExponentialNoError {\\n    uint constant expScale = 1e18;\\n    uint constant doubleScale = 1e36;\\n    uint constant halfExpScale = expScale / 2;\\n    uint constant mantissaOne = expScale;\\n\\n    struct Exp {\\n        uint mantissa;\\n    }\\n\\n    struct Double {\\n        uint mantissa;\\n    }\\n\\n    /**\\n     * @dev Truncates the given exp to a whole number value.\\n     *      For example, truncate(Exp{mantissa: 15 * expScale}) = 15\\n     */\\n    function truncate(Exp memory exp) internal pure returns (uint) {\\n        // Note: We are not using careful math here as we're performing a division that cannot fail\\n        return exp.mantissa / expScale;\\n    }\\n\\n    /**\\n     * @dev Multiply an Exp by a scalar, then truncate to return an unsigned integer.\\n     */\\n    function mul_ScalarTruncate(\\n        Exp memory a,\\n        uint scalar\\n    ) internal pure returns (uint) {\\n        Exp memory product = mul_(a, scalar);\\n        return truncate(product);\\n    }\\n\\n    /**\\n     * @dev Multiply an Exp by a scalar, truncate, then add an to an unsigned integer, returning an unsigned integer.\\n     */\\n    function mul_ScalarTruncateAddUInt(\\n        Exp memory a,\\n        uint scalar,\\n        uint addend\\n    ) internal pure returns (uint) {\\n        Exp memory product = mul_(a, scalar);\\n        return add_(truncate(product), addend);\\n    }\\n\\n    /**\\n     * @dev Checks if first Exp is less than second Exp.\\n     */\\n    function lessThanExp(\\n        Exp memory left,\\n        Exp memory right\\n    ) internal pure returns (bool) {\\n        return left.mantissa < right.mantissa;\\n    }\\n\\n    /**\\n     * @dev Checks if left Exp <= right Exp.\\n     */\\n    function lessThanOrEqualExp(\\n        Exp memory left,\\n        Exp memory right\\n    ) internal pure returns (bool) {\\n        return left.mantissa <= right.mantissa;\\n    }\\n\\n    /**\\n     * @dev Checks if left Exp > right Exp.\\n     */\\n    function greaterThanExp(\\n        Exp memory left,\\n        Exp memory right\\n    ) internal pure returns (bool) {\\n        return left.mantissa > right.mantissa;\\n    }\\n\\n    /**\\n     * @dev returns true if Exp is exactly zero\\n     */\\n    function isZeroExp(Exp memory value) internal pure returns (bool) {\\n        return value.mantissa == 0;\\n    }\\n\\n    function safe224(\\n        uint n,\\n        string memory errorMessage\\n    ) internal pure returns (uint224) {\\n        require(n < 2 ** 224, errorMessage);\\n        return uint224(n);\\n    }\\n\\n    function safe32(\\n        uint n,\\n        string memory errorMessage\\n    ) internal pure returns (uint32) {\\n        require(n < 2 ** 32, errorMessage);\\n        return uint32(n);\\n    }\\n\\n    function add_(\\n        Exp memory a,\\n        Exp memory b\\n    ) internal pure returns (Exp memory) {\\n        return Exp({mantissa: add_(a.mantissa, b.mantissa)});\\n    }\\n\\n    function add_(\\n        Double memory a,\\n        Double memory b\\n    ) internal pure returns (Double memory) {\\n        return Double({mantissa: add_(a.mantissa, b.mantissa)});\\n    }\\n\\n    function add_(uint a, uint b) internal pure returns (uint) {\\n        return a + b;\\n    }\\n\\n    function sub_(\\n        Exp memory a,\\n        Exp memory b\\n    ) internal pure returns (Exp memory) {\\n        return Exp({mantissa: sub_(a.mantissa, b.mantissa)});\\n    }\\n\\n    function sub_(\\n        Double memory a,\\n        Double memory b\\n    ) internal pure returns (Double memory) {\\n        return Double({mantissa: sub_(a.mantissa, b.mantissa)});\\n    }\\n\\n    function sub_(uint a, uint b) internal pure returns (uint) {\\n        return a - b;\\n    }\\n\\n    function mul_(\\n        Exp memory a,\\n        Exp memory b\\n    ) internal pure returns (Exp memory) {\\n        return Exp({mantissa: mul_(a.mantissa, b.mantissa) / expScale});\\n    }\\n\\n    function mul_(Exp memory a, uint b) internal pure returns (Exp memory) {\\n        return Exp({mantissa: mul_(a.mantissa, b)});\\n    }\\n\\n    function mul_(uint a, Exp memory b) internal pure returns (uint) {\\n        return mul_(a, b.mantissa) / expScale;\\n    }\\n\\n    function mul_(\\n        Double memory a,\\n        Double memory b\\n    ) internal pure returns (Double memory) {\\n        return Double({mantissa: mul_(a.mantissa, b.mantissa) / doubleScale});\\n    }\\n\\n    function mul_(\\n        Double memory a,\\n        uint b\\n    ) internal pure returns (Double memory) {\\n        return Double({mantissa: mul_(a.mantissa, b)});\\n    }\\n\\n    function mul_(uint a, Double memory b) internal pure returns (uint) {\\n        return mul_(a, b.mantissa) / doubleScale;\\n    }\\n\\n    function mul_(uint a, uint b) internal pure returns (uint) {\\n        return a * b;\\n    }\\n\\n    function div_(\\n        Exp memory a,\\n        Exp memory b\\n    ) internal pure returns (Exp memory) {\\n        return Exp({mantissa: div_(mul_(a.mantissa, expScale), b.mantissa)});\\n    }\\n\\n    function div_(Exp memory a, uint b) internal pure returns (Exp memory) {\\n        return Exp({mantissa: div_(a.mantissa, b)});\\n    }\\n\\n    function div_(uint a, Exp memory b) internal pure returns (uint) {\\n        return div_(mul_(a, expScale), b.mantissa);\\n    }\\n\\n    function div_(\\n        Double memory a,\\n        Double memory b\\n    ) internal pure returns (Double memory) {\\n        return\\n            Double({mantissa: div_(mul_(a.mantissa, doubleScale), b.mantissa)});\\n    }\\n\\n    function div_(\\n        Double memory a,\\n        uint b\\n    ) internal pure returns (Double memory) {\\n        return Double({mantissa: div_(a.mantissa, b)});\\n    }\\n\\n    function div_(uint a, Double memory b) internal pure returns (uint) {\\n        return div_(mul_(a, doubleScale), b.mantissa);\\n    }\\n\\n    function div_(uint a, uint b) internal pure returns (uint) {\\n        return a / b;\\n    }\\n\\n    function fraction(uint a, uint b) internal pure returns (Double memory) {\\n        return Double({mantissa: div_(mul_(a, doubleScale), b)});\\n    }\\n}\\n\",\"keccak256\":\"0xdd2743eae171dccf2ba3dbb5f4ee0f206cac2b28901f61f7bb69218f15432e96\",\"license\":\"BSD-3-Clause\"},\"contracts/Governance/Comp.sol\":{\"content\":\"// SPDX-License-Identifier: BSD-3-Clause\\npragma solidity ^0.8.10;\\n\\ncontract Comp {\\n    /// @notice EIP-20 token name for this token\\n    string public constant name = \\\"Compound\\\";\\n\\n    /// @notice EIP-20 token symbol for this token\\n    string public constant symbol = \\\"COMP\\\";\\n\\n    /// @notice EIP-20 token decimals for this token\\n    uint8 public constant decimals = 18;\\n\\n    /// @notice Total number of tokens in circulation\\n    uint256 public constant totalSupply = 10000000e18; // 10 million Comp\\n\\n    /// @notice Allowance amounts on behalf of others\\n    mapping(address => mapping(address => uint96)) internal allowances;\\n\\n    /// @notice Official record of token balances for each account\\n    mapping(address => uint96) internal balances;\\n\\n    /// @notice A record of each accounts delegate\\n    mapping(address => address) public delegates;\\n\\n    /// @notice A checkpoint for marking number of votes from a given block\\n    struct Checkpoint {\\n        uint32 fromBlock;\\n        uint96 votes;\\n    }\\n\\n    /// @notice A record of votes checkpoints for each account, by index\\n    mapping(address => mapping(uint32 => Checkpoint)) public checkpoints;\\n\\n    /// @notice The number of checkpoints for each account\\n    mapping(address => uint32) public numCheckpoints;\\n\\n    /// @notice The EIP-712 typehash for the contract's domain\\n    bytes32 public constant DOMAIN_TYPEHASH =\\n        keccak256(\\n            \\\"EIP712Domain(string name,uint256 chainId,address verifyingContract)\\\"\\n        );\\n\\n    /// @notice The EIP-712 typehash for the delegation struct used by the contract\\n    bytes32 public constant DELEGATION_TYPEHASH =\\n        keccak256(\\\"Delegation(address delegatee,uint256 nonce,uint256 expiry)\\\");\\n\\n    /// @notice A record of states for signing / validating signatures\\n    mapping(address => uint256) public nonces;\\n\\n    /// @notice An event thats emitted when an account changes its delegate\\n    event DelegateChanged(\\n        address indexed delegator,\\n        address indexed fromDelegate,\\n        address indexed toDelegate\\n    );\\n\\n    /// @notice An event thats emitted when a delegate account's vote balance changes\\n    event DelegateVotesChanged(\\n        address indexed delegate,\\n        uint256 previousBalance,\\n        uint256 newBalance\\n    );\\n\\n    /// @notice The standard EIP-20 transfer event\\n    event Transfer(address indexed from, address indexed to, uint256 amount);\\n\\n    /// @notice The standard EIP-20 approval event\\n    event Approval(\\n        address indexed owner,\\n        address indexed spender,\\n        uint256 amount\\n    );\\n\\n    /**\\n     * @notice Construct a new Comp token\\n     * @param account The initial account to grant all the tokens\\n     */\\n    constructor(address account) public {\\n        balances[account] = uint96(totalSupply);\\n        emit Transfer(address(0), account, totalSupply);\\n    }\\n\\n    /**\\n     * @notice Get the number of tokens `spender` is approved to spend on behalf of `account`\\n     * @param account The address of the account holding the funds\\n     * @param spender The address of the account spending the funds\\n     * @return The number of tokens approved\\n     */\\n    function allowance(\\n        address account,\\n        address spender\\n    ) external view returns (uint256) {\\n        return allowances[account][spender];\\n    }\\n\\n    /**\\n     * @notice Approve `spender` to transfer up to `amount` from `src`\\n     * @dev This will overwrite the approval amount for `spender`\\n     *  and is subject to issues noted [here](https://eips.ethereum.org/EIPS/eip-20#approve)\\n     * @param spender The address of the account which may transfer tokens\\n     * @param rawAmount The number of tokens that are approved (2^256-1 means infinite)\\n     * @return Whether or not the approval succeeded\\n     */\\n    function approve(\\n        address spender,\\n        uint256 rawAmount\\n    ) external returns (bool) {\\n        uint96 amount;\\n        if (rawAmount == type(uint256).max) {\\n            amount = type(uint96).max;\\n        } else {\\n            amount = safe96(rawAmount, \\\"Comp::approve: amount exceeds 96 bits\\\");\\n        }\\n\\n        allowances[msg.sender][spender] = amount;\\n\\n        emit Approval(msg.sender, spender, amount);\\n        return true;\\n    }\\n\\n    /**\\n     * @notice Get the number of tokens held by the `account`\\n     * @param account The address of the account to get the balance of\\n     * @return The number of tokens held\\n     */\\n    function balanceOf(address account) external view returns (uint256) {\\n        return balances[account];\\n    }\\n\\n    /**\\n     * @notice Transfer `amount` tokens from `msg.sender` to `dst`\\n     * @param dst The address of the destination account\\n     * @param rawAmount The number of tokens to transfer\\n     * @return Whether or not the transfer succeeded\\n     */\\n    function transfer(address dst, uint256 rawAmount) external returns (bool) {\\n        uint96 amount = safe96(\\n            rawAmount,\\n            \\\"Comp::transfer: amount exceeds 96 bits\\\"\\n        );\\n        _transferTokens(msg.sender, dst, amount);\\n        return true;\\n    }\\n\\n    /**\\n     * @notice Transfer `amount` tokens from `src` to `dst`\\n     * @param src The address of the source account\\n     * @param dst The address of the destination account\\n     * @param rawAmount The number of tokens to transfer\\n     * @return Whether or not the transfer succeeded\\n     */\\n    function transferFrom(\\n        address src,\\n        address dst,\\n        uint256 rawAmount\\n    ) external returns (bool) {\\n        address spender = msg.sender;\\n        uint96 spenderAllowance = allowances[src][spender];\\n        uint96 amount = safe96(\\n            rawAmount,\\n            \\\"Comp::approve: amount exceeds 96 bits\\\"\\n        );\\n\\n        if (spender != src && spenderAllowance != type(uint96).max) {\\n            uint96 newAllowance = sub96(\\n                spenderAllowance,\\n                amount,\\n                \\\"Comp::transferFrom: transfer amount exceeds spender allowance\\\"\\n            );\\n            allowances[src][spender] = newAllowance;\\n\\n            emit Approval(src, spender, newAllowance);\\n        }\\n\\n        _transferTokens(src, dst, amount);\\n        return true;\\n    }\\n\\n    /**\\n     * @notice Delegate votes from `msg.sender` to `delegatee`\\n     * @param delegatee The address to delegate votes to\\n     */\\n    function delegate(address delegatee) public {\\n        return _delegate(msg.sender, delegatee);\\n    }\\n\\n    /**\\n     * @notice Delegates votes from signatory to `delegatee`\\n     * @param delegatee The address to delegate votes to\\n     * @param nonce The contract state required to match the signature\\n     * @param expiry The time at which to expire the signature\\n     * @param v The recovery byte of the signature\\n     * @param r Half of the ECDSA signature pair\\n     * @param s Half of the ECDSA signature pair\\n     */\\n    function delegateBySig(\\n        address delegatee,\\n        uint256 nonce,\\n        uint256 expiry,\\n        uint8 v,\\n        bytes32 r,\\n        bytes32 s\\n    ) public {\\n        bytes32 domainSeparator = keccak256(\\n            abi.encode(\\n                DOMAIN_TYPEHASH,\\n                keccak256(bytes(name)),\\n                getChainId(),\\n                address(this)\\n            )\\n        );\\n        bytes32 structHash = keccak256(\\n            abi.encode(DELEGATION_TYPEHASH, delegatee, nonce, expiry)\\n        );\\n        bytes32 digest = keccak256(\\n            abi.encodePacked(\\\"\\\\x19\\\\x01\\\", domainSeparator, structHash)\\n        );\\n        address signatory = ecrecover(digest, v, r, s);\\n        require(\\n            signatory != address(0),\\n            \\\"Comp::delegateBySig: invalid signature\\\"\\n        );\\n        require(\\n            nonce == nonces[signatory]++,\\n            \\\"Comp::delegateBySig: invalid nonce\\\"\\n        );\\n        require(\\n            block.timestamp <= expiry,\\n            \\\"Comp::delegateBySig: signature expired\\\"\\n        );\\n        return _delegate(signatory, delegatee);\\n    }\\n\\n    /**\\n     * @notice Gets the current votes balance for `account`\\n     * @param account The address to get votes balance\\n     * @return The number of current votes for `account`\\n     */\\n    function getCurrentVotes(address account) external view returns (uint96) {\\n        uint32 nCheckpoints = numCheckpoints[account];\\n        return\\n            nCheckpoints > 0 ? checkpoints[account][nCheckpoints - 1].votes : 0;\\n    }\\n\\n    /**\\n     * @notice Determine the prior number of votes for an account as of a block number\\n     * @dev Block number must be a finalized block or else this function will revert to prevent misinformation.\\n     * @param account The address of the account to check\\n     * @param blockNumber The block number to get the vote balance at\\n     * @return The number of votes the account had as of the given block\\n     */\\n    function getPriorVotes(\\n        address account,\\n        uint256 blockNumber\\n    ) public view returns (uint96) {\\n        require(\\n            blockNumber < block.number,\\n            \\\"Comp::getPriorVotes: not yet determined\\\"\\n        );\\n\\n        uint32 nCheckpoints = numCheckpoints[account];\\n        if (nCheckpoints == 0) {\\n            return 0;\\n        }\\n\\n        // First check most recent balance\\n        if (checkpoints[account][nCheckpoints - 1].fromBlock <= blockNumber) {\\n            return checkpoints[account][nCheckpoints - 1].votes;\\n        }\\n\\n        // Next check implicit zero balance\\n        if (checkpoints[account][0].fromBlock > blockNumber) {\\n            return 0;\\n        }\\n\\n        uint32 lower = 0;\\n        uint32 upper = nCheckpoints - 1;\\n        while (upper > lower) {\\n            uint32 center = upper - (upper - lower) / 2; // ceil, avoiding overflow\\n            Checkpoint memory cp = checkpoints[account][center];\\n            if (cp.fromBlock == blockNumber) {\\n                return cp.votes;\\n            } else if (cp.fromBlock < blockNumber) {\\n                lower = center;\\n            } else {\\n                upper = center - 1;\\n            }\\n        }\\n        return checkpoints[account][lower].votes;\\n    }\\n\\n    function _delegate(address delegator, address delegatee) internal {\\n        address currentDelegate = delegates[delegator];\\n        uint96 delegatorBalance = balances[delegator];\\n        delegates[delegator] = delegatee;\\n\\n        emit DelegateChanged(delegator, currentDelegate, delegatee);\\n\\n        _moveDelegates(currentDelegate, delegatee, delegatorBalance);\\n    }\\n\\n    function _transferTokens(address src, address dst, uint96 amount) internal {\\n        require(\\n            src != address(0),\\n            \\\"Comp::_transferTokens: cannot transfer from the zero address\\\"\\n        );\\n        require(\\n            dst != address(0),\\n            \\\"Comp::_transferTokens: cannot transfer to the zero address\\\"\\n        );\\n\\n        balances[src] = sub96(\\n            balances[src],\\n            amount,\\n            \\\"Comp::_transferTokens: transfer amount exceeds balance\\\"\\n        );\\n        balances[dst] = add96(\\n            balances[dst],\\n            amount,\\n            \\\"Comp::_transferTokens: transfer amount overflows\\\"\\n        );\\n        emit Transfer(src, dst, amount);\\n\\n        _moveDelegates(delegates[src], delegates[dst], amount);\\n    }\\n\\n    function _moveDelegates(\\n        address srcRep,\\n        address dstRep,\\n        uint96 amount\\n    ) internal {\\n        if (srcRep != dstRep && amount > 0) {\\n            if (srcRep != address(0)) {\\n                uint32 srcRepNum = numCheckpoints[srcRep];\\n                uint96 srcRepOld = srcRepNum > 0\\n                    ? checkpoints[srcRep][srcRepNum - 1].votes\\n                    : 0;\\n                uint96 srcRepNew = sub96(\\n                    srcRepOld,\\n                    amount,\\n                    \\\"Comp::_moveVotes: vote amount underflows\\\"\\n                );\\n                _writeCheckpoint(srcRep, srcRepNum, srcRepOld, srcRepNew);\\n            }\\n\\n            if (dstRep != address(0)) {\\n                uint32 dstRepNum = numCheckpoints[dstRep];\\n                uint96 dstRepOld = dstRepNum > 0\\n                    ? checkpoints[dstRep][dstRepNum - 1].votes\\n                    : 0;\\n                uint96 dstRepNew = add96(\\n                    dstRepOld,\\n                    amount,\\n                    \\\"Comp::_moveVotes: vote amount overflows\\\"\\n                );\\n                _writeCheckpoint(dstRep, dstRepNum, dstRepOld, dstRepNew);\\n            }\\n        }\\n    }\\n\\n    function _writeCheckpoint(\\n        address delegatee,\\n        uint32 nCheckpoints,\\n        uint96 oldVotes,\\n        uint96 newVotes\\n    ) internal {\\n        uint32 blockNumber = safe32(\\n            block.number,\\n            \\\"Comp::_writeCheckpoint: block number exceeds 32 bits\\\"\\n        );\\n\\n        if (\\n            nCheckpoints > 0 &&\\n            checkpoints[delegatee][nCheckpoints - 1].fromBlock == blockNumber\\n        ) {\\n            checkpoints[delegatee][nCheckpoints - 1].votes = newVotes;\\n        } else {\\n            checkpoints[delegatee][nCheckpoints] = Checkpoint(\\n                blockNumber,\\n                newVotes\\n            );\\n            numCheckpoints[delegatee] = nCheckpoints + 1;\\n        }\\n\\n        emit DelegateVotesChanged(delegatee, oldVotes, newVotes);\\n    }\\n\\n    function safe32(\\n        uint256 n,\\n        string memory errorMessage\\n    ) internal pure returns (uint32) {\\n        require(n < 2 ** 32, errorMessage);\\n        return uint32(n);\\n    }\\n\\n    function safe96(\\n        uint256 n,\\n        string memory errorMessage\\n    ) internal pure returns (uint96) {\\n        require(n < 2 ** 96, errorMessage);\\n        return uint96(n);\\n    }\\n\\n    function add96(\\n        uint96 a,\\n        uint96 b,\\n        string memory errorMessage\\n    ) internal pure returns (uint96) {\\n        uint96 c = a + b;\\n        require(c >= a, errorMessage);\\n        return c;\\n    }\\n\\n    function sub96(\\n        uint96 a,\\n        uint96 b,\\n        string memory errorMessage\\n    ) internal pure returns (uint96) {\\n        require(b <= a, errorMessage);\\n        return a - b;\\n    }\\n\\n    function getChainId() internal view returns (uint256) {\\n        uint256 chainId;\\n        assembly {\\n            chainId := chainid()\\n        }\\n        return chainId;\\n    }\\n}\\n\",\"keccak256\":\"0x8ea30580d19ae72b096a488538eb6a6de8fe9b08c668e62925d95d4ac228e14c\",\"license\":\"BSD-3-Clause\"},\"contracts/InterestRateModel.sol\":{\"content\":\"// SPDX-License-Identifier: BSD-3-Clause\\npragma solidity ^0.8.10;\\n\\n/**\\n * @title Compound's InterestRateModel Interface\\n * @author Compound\\n */\\nabstract contract InterestRateModel {\\n    /// @notice Indicator that this is an InterestRateModel contract (for inspection)\\n    bool public constant isInterestRateModel = true;\\n\\n    /**\\n     * @notice Calculates the current borrow interest rate per block\\n     * @param cash The total amount of cash the market has\\n     * @param borrows The total amount of borrows the market has outstanding\\n     * @param reserves The total amount of reserves the market has\\n     * @return The borrow rate per block (as a percentage, and scaled by 1e18)\\n     */\\n    function getBorrowRate(\\n        uint cash,\\n        uint borrows,\\n        uint reserves\\n    ) external view virtual returns (uint);\\n\\n    /**\\n     * @notice Calculates the current supply interest rate per block\\n     * @param cash The total amount of cash the market has\\n     * @param borrows The total amount of borrows the market has outstanding\\n     * @param reserves The total amount of reserves the market has\\n     * @param reserveFactorMantissa The current reserve factor the market has\\n     * @return The supply rate per block (as a percentage, and scaled by 1e18)\\n     */\\n    function getSupplyRate(\\n        uint cash,\\n        uint borrows,\\n        uint reserves,\\n        uint reserveFactorMantissa\\n    ) external view virtual returns (uint);\\n}\\n\",\"keccak256\":\"0xf867441de0a49070bd508b664ffe9db5d0cb174d207b928f12478037e6aa6654\",\"license\":\"BSD-3-Clause\"},\"contracts/PriceOracle.sol\":{\"content\":\"// SPDX-License-Identifier: BSD-3-Clause\\npragma solidity ^0.8.10;\\n\\nimport \\\"./CToken.sol\\\";\\n\\nabstract contract PriceOracle {\\n    /// @notice Indicator that this is a PriceOracle contract (for inspection)\\n    bool public constant isPriceOracle = true;\\n\\n    /**\\n     * @notice Get the underlying price of a cToken asset\\n     * @param cToken The cToken to get the underlying price of\\n     * @return The underlying asset price mantissa (scaled by 1e18).\\n     *  Zero means the price is unavailable.\\n     */\\n    function getUnderlyingPrice(\\n        CToken cToken\\n    ) external view virtual returns (uint);\\n}\\n\",\"keccak256\":\"0x2668c070ed3fb58f68ac470817e2f10a9dd8713eb9b11b02601f8aca904b9842\",\"license\":\"BSD-3-Clause\"},\"contracts/Unitroller.sol\":{\"content\":\"// SPDX-License-Identifier: BSD-3-Clause\\npragma solidity ^0.8.10;\\n\\nimport \\\"./ErrorReporter.sol\\\";\\nimport \\\"./ComptrollerStorage.sol\\\";\\n\\n/**\\n * @title ComptrollerCore\\n * @dev Storage for the comptroller is at this address, while execution is delegated to the `comptrollerImplementation`.\\n * CTokens should reference this contract as their comptroller.\\n */\\ncontract Unitroller is UnitrollerAdminStorage, ComptrollerErrorReporter {\\n    /**\\n     * @notice Emitted when pendingComptrollerImplementation is changed\\n     */\\n    event NewPendingImplementation(\\n        address oldPendingImplementation,\\n        address newPendingImplementation\\n    );\\n\\n    /**\\n     * @notice Emitted when pendingComptrollerImplementation is accepted, which means comptroller implementation is updated\\n     */\\n    event NewImplementation(\\n        address oldImplementation,\\n        address newImplementation\\n    );\\n\\n    /**\\n     * @notice Emitted when pendingAdmin is changed\\n     */\\n    event NewPendingAdmin(address oldPendingAdmin, address newPendingAdmin);\\n\\n    /**\\n     * @notice Emitted when pendingAdmin is accepted, which means admin is updated\\n     */\\n    event NewAdmin(address oldAdmin, address newAdmin);\\n\\n    constructor() public {\\n        // Set admin to caller\\n        admin = msg.sender;\\n    }\\n\\n    /*** Admin Functions ***/\\n    function _setPendingImplementation(\\n        address newPendingImplementation\\n    ) public returns (uint) {\\n        if (msg.sender != admin) {\\n            return\\n                fail(\\n                    Error.UNAUTHORIZED,\\n                    FailureInfo.SET_PENDING_IMPLEMENTATION_OWNER_CHECK\\n                );\\n        }\\n\\n        address oldPendingImplementation = pendingComptrollerImplementation;\\n\\n        pendingComptrollerImplementation = newPendingImplementation;\\n\\n        emit NewPendingImplementation(\\n            oldPendingImplementation,\\n            pendingComptrollerImplementation\\n        );\\n\\n        return uint(Error.NO_ERROR);\\n    }\\n\\n    /**\\n     * @notice Accepts new implementation of comptroller. msg.sender must be pendingImplementation\\n     * @dev Admin function for new implementation to accept it's role as implementation\\n     * @return uint 0=success, otherwise a failure (see ErrorReporter.sol for details)\\n     */\\n    function _acceptImplementation() public returns (uint) {\\n        // Check caller is pendingImplementation and pendingImplementation \\u2260 address(0)\\n        if (\\n            msg.sender != pendingComptrollerImplementation ||\\n            pendingComptrollerImplementation == address(0)\\n        ) {\\n            return\\n                fail(\\n                    Error.UNAUTHORIZED,\\n                    FailureInfo.ACCEPT_PENDING_IMPLEMENTATION_ADDRESS_CHECK\\n                );\\n        }\\n\\n        // Save current values for inclusion in log\\n        address oldImplementation = comptrollerImplementation;\\n        address oldPendingImplementation = pendingComptrollerImplementation;\\n\\n        comptrollerImplementation = pendingComptrollerImplementation;\\n\\n        pendingComptrollerImplementation = address(0);\\n\\n        emit NewImplementation(oldImplementation, comptrollerImplementation);\\n        emit NewPendingImplementation(\\n            oldPendingImplementation,\\n            pendingComptrollerImplementation\\n        );\\n\\n        return uint(Error.NO_ERROR);\\n    }\\n\\n    /**\\n     * @notice Begins transfer of admin rights. The newPendingAdmin must call `_acceptAdmin` to finalize the transfer.\\n     * @dev Admin function to begin change of admin. The newPendingAdmin must call `_acceptAdmin` to finalize the transfer.\\n     * @param newPendingAdmin New pending admin.\\n     * @return uint 0=success, otherwise a failure (see ErrorReporter.sol for details)\\n     */\\n    function _setPendingAdmin(address newPendingAdmin) public returns (uint) {\\n        // Check caller = admin\\n        if (msg.sender != admin) {\\n            return\\n                fail(\\n                    Error.UNAUTHORIZED,\\n                    FailureInfo.SET_PENDING_ADMIN_OWNER_CHECK\\n                );\\n        }\\n\\n        // Save current value, if any, for inclusion in log\\n        address oldPendingAdmin = pendingAdmin;\\n\\n        // Store pendingAdmin with value newPendingAdmin\\n        pendingAdmin = newPendingAdmin;\\n\\n        // Emit NewPendingAdmin(oldPendingAdmin, newPendingAdmin)\\n        emit NewPendingAdmin(oldPendingAdmin, newPendingAdmin);\\n\\n        return uint(Error.NO_ERROR);\\n    }\\n\\n    /**\\n     * @notice Accepts transfer of admin rights. msg.sender must be pendingAdmin\\n     * @dev Admin function for pending admin to accept role and update admin\\n     * @return uint 0=success, otherwise a failure (see ErrorReporter.sol for details)\\n     */\\n    function _acceptAdmin() public returns (uint) {\\n        // Check caller is pendingAdmin and pendingAdmin \\u2260 address(0)\\n        if (msg.sender != pendingAdmin || msg.sender == address(0)) {\\n            return\\n                fail(\\n                    Error.UNAUTHORIZED,\\n                    FailureInfo.ACCEPT_ADMIN_PENDING_ADMIN_CHECK\\n                );\\n        }\\n\\n        // Save current values for inclusion in log\\n        address oldAdmin = admin;\\n        address oldPendingAdmin = pendingAdmin;\\n\\n        // Store admin with value pendingAdmin\\n        admin = pendingAdmin;\\n\\n        // Clear the pending value\\n        pendingAdmin = address(0);\\n\\n        emit NewAdmin(oldAdmin, admin);\\n        emit NewPendingAdmin(oldPendingAdmin, pendingAdmin);\\n\\n        return uint(Error.NO_ERROR);\\n    }\\n\\n    /**\\n     * @dev Delegates execution to an implementation contract.\\n     * It returns to the external caller whatever the implementation returns\\n     * or forwards reverts.\\n     */\\n    fallback() external payable {\\n        // delegate all other functions to current implementation\\n        (bool success, ) = comptrollerImplementation.delegatecall(msg.data);\\n\\n        assembly {\\n            let free_mem_ptr := mload(0x40)\\n            returndatacopy(free_mem_ptr, 0, returndatasize())\\n\\n            switch success\\n            case 0 {\\n                revert(free_mem_ptr, returndatasize())\\n            }\\n            default {\\n                return(free_mem_ptr, returndatasize())\\n            }\\n        }\\n    }\\n}\\n\",\"keccak256\":\"0x17e959f9fbe309bcdebb6b1670e6204d9273d84d26126879f3db8f0d7e24a570\",\"license\":\"BSD-3-Clause\"}},\"version\":1}",
  "bytecode": "0x608060405234801561001057600080fd5b50600080546001600160a01b0319163317905561543b806100326000396000f3fe608060405234801561001057600080fd5b506004361061048a5760003560e01c8063731f0c2b11610262578063b21be7fd11610151578063dce15449116100ce578063e9af029211610092578063e9af029214610c04578063eabe7d9114610c17578063ede4edd014610c2a578063f00a7a9214610c3d578063f4a433c014610c4a578063f851a44014610c6a57600080fd5b8063dce1544914610bae578063dcfbc0c714610bc1578063e4028eee14610bd4578063e6653f3d14610be7578063e875544614610bfb57600080fd5b8063c488847b11610115578063c488847b14610b15578063ca0af04314610b3d578063cc7ebdc414610b68578063d02f735114610b88578063da3d454c14610b9b57600080fd5b8063b21be7fd14610a84578063bb82aa5e14610aaf578063bdcdc25814610ac2578063bea6b8b814610ad5578063c299823814610af557600080fd5b806394b2294b116101df578063a8b43948116101a3578063a8b4394814610a2c578063aa90075414610a3f578063abfceffc14610a48578063ac0b0bb714610a68578063b0772d0b14610a7c57600080fd5b806394b2294b146109a9578063986ab838146109b25780639d1b5a0a146109d2578063a76b3fda146109ec578063a7f0e231146109ff57600080fd5b80638c57804e116102265780638c57804e146108b75780638e8f294b146108ef5780638ebf636414610942578063929fe9a11461095557806394543c151461099657600080fd5b8063731f0c2b1461083a578063741b25251461085d5780637dc0d1d01461087057806385b7beb81461088357806387f76303146108a357600080fd5b80634a5844321161037e5780635ec88c79116102fb5780636a56947e116102bf5780636a56947e1461077f5780636aa875b51461078d5780636b79c38d146107ad5780636d154ea5146108095780636d35bf911461082c57600080fd5b80635ec88c79146107205780635f5af1aa146107335780635fc7e71e14610746578063607ef6c1146107595780636810dfa61461076c57600080fd5b806351dff9891161034257806351dff989146106c157806352d84d1e146106d457806355ee1fe1146106e7578063598ee1cb146106fa5780635c7786051461070d57600080fd5b80634a584432146106445780634ada90af146106645780634e79238f1461066d5780634ef4c3e11461069b5780634fd42e17146106ae57600080fd5b8063267822471161040c5780633bcf7ec1116103d05780633bcf7ec1146105ed5780633c94786f1461060057806341c728b91461061457806342cbb15c1461062857806347ef3b3b1461062e57600080fd5b8063267822471461058e57806327efe3cb146105a15780632d70db78146105b4578063317b0b77146105c7578063391957d7146105da57600080fd5b80631d7b33d7116104535780631d7b33d7146104fa5780631ededc911461052857806321af45691461053d57806324008a621461056857806324a3d6221461057b57600080fd5b80627e3dd21461048f57806316b95e8f146104ac57806318c882a5146104c15780631c3db2e0146104d45780631d504dc6146104e7575b600080fd5b610497600181565b60405190151581526020015b60405180910390f35b6104bf6104ba366004614a3c565b610c7d565b005b6104976104cf366004614acb565b610f26565b6104bf6104e2366004614be3565b61105f565b6104bf6104f5366004614c33565b6110c2565b61051a610508366004614c33565b600f6020526000908152604090205481565b6040519081526020016104a3565b6104bf610536366004614c50565b5050505050565b601554610550906001600160a01b031681565b6040516001600160a01b0390911681526020016104a3565b61051a610576366004614cab565b611240565b600a54610550906001600160a01b031681565b600154610550906001600160a01b031681565b6104bf6105af366004614cfc565b6112fe565b6104976105c2366004614d28565b6113f5565b61051a6105d5366004614d45565b6114e5565b6104bf6105e8366004614c33565b61158c565b6104976105fb366004614acb565b611656565b600a5461049790600160a01b900460ff1681565b6104bf610622366004614d5e565b50505050565b4261051a565b6104bf61063c366004614da4565b505050505050565b61051a610652366004614c33565b60166020526000908152604090205481565b61051a60065481565b61068061067b366004614d5e565b611780565b604080519384526020840192909252908201526060016104a3565b61051a6106a9366004614e12565b6117c0565b61051a6106bc366004614d45565b611861565b6104bf6106cf366004614d5e565b6118be565b6105506106e2366004614d45565b61190d565b61051a6106f5366004614c33565b611937565b6104bf610708366004614cfc565b6119b0565b6104bf61071b366004614e12565b505050565b61068061072e366004614c33565b611aa4565b61051a610741366004614c33565b611adf565b61051a610754366004614e53565b611b58565b6104bf610767366004614a3c565b611d27565b6104bf61077a366004614f1b565b611f05565b6104bf610622366004614cab565b61051a61079b366004614c33565b601a6020526000908152604090205481565b6107e56107bb366004614c33565b6010602052600090815260409020546001600160e01b03811690600160e01b900463ffffffff1682565b604080516001600160e01b03909316835263ffffffff9091166020830152016104a3565b610497610817366004614c33565b600c6020526000908152604090205460ff1681565b6104bf610536366004614e53565b610497610848366004614c33565b600b6020526000908152604090205460ff1681565b6104bf61086b366004614c33565b61218f565b600454610550906001600160a01b031681565b61051a610891366004614c33565b601c6020526000908152604090205481565b600a5461049790600160b01b900460ff1681565b6107e56108c5366004614c33565b6011602052600090815260409020546001600160e01b03811690600160e01b900463ffffffff1682565b6109236108fd366004614c33565b60096020526000908152604090208054600182015460039092015460ff91821692911683565b60408051931515845260208401929092521515908201526060016104a3565b610497610950366004614d28565b61223b565b610497610963366004614fa4565b6001600160a01b038082166000908152600960209081526040808320938616835260029093019052205460ff1692915050565b6104976109a4366004614c33565b612322565b61051a60075481565b61051a6109c0366004614c33565b60176020526000908152604090205481565b73d86c8d4279ccafbec840c782bcc50d201f277419610550565b61051a6109fa366004614c33565b6123e1565b610a146a0c097ce7bc90715b34b9f160241b81565b6040516001600160e01b0390911681526020016104a3565b6104bf610a3a36600461502d565b612513565b61051a600e5481565b610a5b610a56366004614c33565b612648565b6040516104a391906150b5565b600a5461049790600160b81b900460ff1681565b610a5b6126be565b61051a610a92366004614fa4565b601260209081526000928352604080842090915290825290205481565b600254610550906001600160a01b031681565b61051a610ad0366004614cab565b612720565b61051a610ae3366004614c33565b60186020526000908152604090205481565b610b08610b03366004615102565b6127ab565b6040516104a39190615137565b610b28610b23366004614e12565b612873565b604080519283526020830191909152016104a3565b61051a610b4b366004614fa4565b601360209081526000928352604080842090915290825290205481565b61051a610b76366004614c33565b60146020526000908152604090205481565b61051a610b96366004614e53565b612a91565b61051a610ba9366004614e12565b612c38565b610550610bbc366004614cfc565b613008565b600354610550906001600160a01b031681565b61051a610be2366004614cfc565b613040565b600a5461049790600160a81b900460ff1681565b61051a60055481565b6104bf610c12366004614c33565b6131d2565b61051a610c25366004614e12565b613236565b61051a610c38366004614c33565b613271565b601b546104979060ff1681565b61051a610c58366004614c33565b60196020526000908152604090205481565b600054610550906001600160a01b031681565b6000546001600160a01b03163314610ce65760405162461bcd60e51b815260206004820152602160248201527f4f6e6c792061646d696e2063616e2063616c6c20746869732066756e6374696f6044820152603760f91b60648201526084015b60405180910390fd5b601b5460ff1615610d485760405162461bcd60e51b815260206004820152602660248201527f416c72656164792065786563757465642074686973206f6e652d6f66662066756044820152653731ba34b7b760d11b6064820152608401610cdd565b828114610d875760405162461bcd60e51b815260206004820152600d60248201526c125b9d985b1a59081a5b9c1d5d609a1b6044820152606401610cdd565b60008060008060005b87811015610f0e57888882818110610daa57610daa61516f565b9050602002016020810190610dbf9190614c33565b6001600160a01b0381166000908152601460205260409020549095509350868682818110610def57610def61516f565b90506020020135925083831115610e93576000610e0c858561519b565b6001600160a01b0387166000908152601c6020526040812054919250610e3282846135d7565b6001600160a01b0389166000818152601c6020908152604091829020849055815186815290810184905292935090917f17fea09d9a7ca41b2f9f9118f18f44848a62e9c70d55dd4385131eb2cf1b7e47910160405180910390a28695505050505b8215610efe57610ea384846135e3565b6001600160a01b038616600081815260146020908152604091829020849055815188815290810184905292945090917f4a5c134e28b537a76546993ea37f3b60d9190476df7356d3842aa40902e20f04910160405180910390a25b610f07816151b2565b9050610d90565b5050601b805460ff1916600117905550505050505050565b6001600160a01b03821660009081526009602052604081205460ff16610f5e5760405162461bcd60e51b8152600401610cdd906151cd565b600a546001600160a01b0316331480610f8157506000546001600160a01b031633145b610f9d5760405162461bcd60e51b8152600401610cdd90615215565b6000546001600160a01b0316331480610fb857506001821515145b610fd45760405162461bcd60e51b8152600401610cdd9061525c565b6001600160a01b0383166000818152600c6020908152604091829020805460ff19168615159081179091558251938452606091840182905260069184019190915265426f72726f7760d01b6080840152908201527f71aec636243f9709bb0007ae15e9afb8150ab01716d75fd7573be5cc096e03b09060a0015b60405180910390a150805b92915050565b6040805160018082528183019092526000916020808301908036833701905050905082816000815181106110955761109561516f565b60200260200101906001600160a01b031690816001600160a01b03168152505061071b8183600180611f05565b806001600160a01b031663f851a4406040518163ffffffff1660e01b8152600401602060405180830381865afa158015611100573d6000803e3d6000fd5b505050506040513d601f19601f82011682018060405250810190611124919061528c565b6001600160a01b0316336001600160a01b0316146111945760405162461bcd60e51b815260206004820152602760248201527f6f6e6c7920756e6974726f6c6c65722061646d696e2063616e206368616e676560448201526620627261696e7360c81b6064820152608401610cdd565b806001600160a01b031663c1e803346040518163ffffffff1660e01b81526004016020604051808303816000875af11580156111d4573d6000803e3d6000fd5b505050506040513d601f19601f820116820180604052508101906111f891906152a9565b1561123d5760405162461bcd60e51b815260206004820152601560248201527418da185b99d9481b9bdd08185d5d1a1bdc9a5e9959605a1b6044820152606401610cdd565b50565b6001600160a01b03841660009081526009602052604081205460ff16611268575060096112f6565b60006040518060200160405280876001600160a01b031663aa5af0fd6040518163ffffffff1660e01b8152600401602060405180830381865afa1580156112b3573d6000803e3d6000fd5b505050506040513d601f19601f820116820180604052508101906112d791906152a9565b905290506112e586826135ef565b6112f08685836137e2565b60009150505b949350505050565b611306613962565b6113525760405162461bcd60e51b815260206004820152601960248201527f6f6e6c792061646d696e2063616e206772616e7420636f6d70000000000000006044820152606401610cdd565b600061135e838361398b565b905080156113ae5760405162461bcd60e51b815260206004820152601b60248201527f696e73756666696369656e7420636f6d7020666f72206772616e7400000000006044820152606401610cdd565b604080516001600160a01b0385168152602081018490527f98b2f82a3a07f223a0be64b3d0f47711c64dccd1feafb94aa28156b38cd9695c910160405180910390a1505050565b600a546000906001600160a01b031633148061141b57506000546001600160a01b031633145b6114375760405162461bcd60e51b8152600401610cdd90615215565b6000546001600160a01b031633148061145257506001821515145b61146e5760405162461bcd60e51b8152600401610cdd9061525c565b600a8054831515600160b81b0260ff60b81b199091161790556040517fef159d9a32b2472e32b098f954f3ce62d232939f1c207070b584df1814de2de0906114d99084906040808252600590820152645365697a6560d81b6060820152901515602082015260800190565b60405180910390a15090565b600080546001600160a01b031633146115405760405162461bcd60e51b815260206004820152601f60248201527f6f6e6c792061646d696e2063616e2073657420636c6f736520666163746f72006044820152606401610cdd565b600580549083905560408051828152602081018590527f3b9670cf975d26958e754b57098eaa2ac914d8d2a31b83257997b9f346110fd991015b60405180910390a160005b9392505050565b6000546001600160a01b031633146115f55760405162461bcd60e51b815260206004820152602660248201527f6f6e6c792061646d696e2063616e2073657420626f72726f772063617020677560448201526530b93234b0b760d11b6064820152608401610cdd565b601580546001600160a01b038381166001600160a01b031983168117909355604080519190921680825260208201939093527feda98690e518e9a05f8ec6837663e188211b2da8f4906648b323f2c1d4434e29910160405180910390a15050565b6001600160a01b03821660009081526009602052604081205460ff1661168e5760405162461bcd60e51b8152600401610cdd906151cd565b600a546001600160a01b03163314806116b157506000546001600160a01b031633145b6116cd5760405162461bcd60e51b8152600401610cdd90615215565b6000546001600160a01b03163314806116e857506001821515145b6117045760405162461bcd60e51b8152600401610cdd9061525c565b6001600160a01b0383166000818152600b6020908152604091829020805460ff19168615159081179091558251938452606091840182905260049184019190915263135a5b9d60e21b6080840152908201527f71aec636243f9709bb0007ae15e9afb8150ab01716d75fd7573be5cc096e03b09060a00161104e565b6000806000806000806117958a8a8a8a613ab0565b9250925092508260118111156117ad576117ad6152c2565b95509093509150505b9450945094915050565b6001600160a01b0383166000908152600b602052604081205460ff161561181a5760405162461bcd60e51b815260206004820152600e60248201526d1b5a5b9d081a5cc81c185d5cd95960921b6044820152606401610cdd565b6001600160a01b03841660009081526009602052604090205460ff166118445760095b9050611585565b61184d84613dde565b6118578484613f56565b6000949350505050565b600080546001600160a01b03163314611880576110596001600b6140f4565b600680549083905560408051828152602081018590527faeba5a6c40a8ac138134bff1aaa65debf25971188a58804bad717f82f0ec1316910161157a565b801580156118cc5750600082115b156106225760405162461bcd60e51b815260206004820152601160248201527072656465656d546f6b656e73207a65726f60781b6044820152606401610cdd565b600d818154811061191d57600080fd5b6000918252602090912001546001600160a01b0316905081565b600080546001600160a01b0316331461195657611059600160106140f4565b600480546001600160a01b038481166001600160a01b031983168117909355604080519190921680825260208201939093527fd52b2b9b7e9ee655fcb95d2e5b9e0c9f69e7ef2b8e9d2d0ea78402d576d22e22910161157a565b6119b8613962565b611a045760405162461bcd60e51b815260206004820152601d60248201527f6f6e6c792061646d696e2063616e2073657420636f6d702073706565640000006044820152606401610cdd565b611a0d8261218f565b80611a30576001600160a01b038216600090815260186020526040812055611a4b565b426001600160a01b0383166000908152601860205260409020555b6001600160a01b03821660008181526017602052604090819020839055517f386537fa92edc3319af95f1f904dcf1900021e4f3f4e08169a577a09076e66b390611a989084815260200190565b60405180910390a25050565b600080600080600080611abb876000806000613ab0565b925092509250826011811115611ad357611ad36152c2565b97919650945092505050565b600080546001600160a01b03163314611afe57611059600160136140f4565b600a80546001600160a01b038481166001600160a01b031983168117909355604080519190921680825260208201939093527f0613b6ee6a04f0d09f390e4d9318894b9f6ac7fd83897cd8d18896ba579c401e910161157a565b6001600160a01b03851660009081526009602052604081205460ff161580611b9957506001600160a01b03851660009081526009602052604090205460ff16155b15611ba85760095b9050611d1e565b6040516395dd919360e01b81526001600160a01b038481166004830152600091908816906395dd919390602401602060405180830381865afa158015611bf2573d6000803e3d6000fd5b505050506040513d601f19601f82011682018060405250810190611c1691906152a9565b9050611c2187612322565b15611c8c5782811015611c875760405162461bcd60e51b815260206004820152602860248201527f43616e206e6f74207265706179206d6f7265207468616e2074686520746f74616044820152676c20626f72726f7760c01b6064820152608401610cdd565b611d18565b600080611c988661416d565b91935090915060009050826011811115611cb457611cb46152c2565b14611cd557816011811115611ccb57611ccb6152c2565b9350505050611d1e565b80611ce1576003611ccb565b6000611cfd60405180602001604052806005548152508561418d565b905080861115611d14576011945050505050611d1e565b5050505b60009150505b95945050505050565b6000546001600160a01b0316331480611d4a57506015546001600160a01b031633145b611db45760405162461bcd60e51b815260206004820152603560248201527f6f6e6c792061646d696e206f7220626f72726f772063617020677561726469616044820152746e2063616e2073657420626f72726f77206361707360581b6064820152608401610cdd565b82818115801590611dc457508082145b611e005760405162461bcd60e51b815260206004820152600d60248201526c1a5b9d985b1a59081a5b9c1d5d609a1b6044820152606401610cdd565b60005b82811015611efc57848482818110611e1d57611e1d61516f565b9050602002013560166000898985818110611e3a57611e3a61516f565b9050602002016020810190611e4f9190614c33565b6001600160a01b03168152602081019190915260400160002055868682818110611e7b57611e7b61516f565b9050602002016020810190611e909190614c33565b6001600160a01b03167f6f1951b2aad10f3fc81b86d91105b413a5b3f847a34bbc5ce1904201b14438f6868684818110611ecc57611ecc61516f565b90506020020135604051611ee291815260200190565b60405180910390a280611ef4816151b2565b915050611e03565b50505050505050565b60005b83518110156120cc576000848281518110611f2557611f2561516f565b6020908102919091018101516001600160a01b0381166000908152600990925260409091205490915060ff16611f955760405162461bcd60e51b81526020600482015260156024820152741b585c9ad95d081b5d5cdd081899481b1a5cdd1959605a1b6044820152606401610cdd565b600184151514156120625760006040518060200160405280836001600160a01b031663aa5af0fd6040518163ffffffff1660e01b8152600401602060405180830381865afa158015611feb573d6000803e3d6000fd5b505050506040513d601f19601f8201168201806040525081019061200f91906152a9565b9052905061201d82826135ef565b60005b875181101561205f5761204d8389838151811061203f5761203f61516f565b6020026020010151846137e2565b80612057816151b2565b915050612020565b50505b600183151514156120b95761207681613dde565b60005b86518110156120b7576120a5828883815181106120985761209861516f565b6020026020010151613f56565b806120af816151b2565b915050612079565b505b50806120c4816151b2565b915050611f08565b5060005b84518110156105365761213a8582815181106120ee576120ee61516f565b60200260200101516014600088858151811061210c5761210c61516f565b60200260200101516001600160a01b03166001600160a01b031681526020019081526020016000205461398b565b601460008784815181106121505761215061516f565b60200260200101516001600160a01b03166001600160a01b03168152602001908152602001600020819055508080612187906151b2565b9150506120d0565b6001600160a01b0381166000908152601760209081526040808320546018909252822054909142916121c29083906135e3565b90506000811180156121d45750600083115b156106225760006121e582856141a5565b6001600160a01b0386166000908152601460205260408120549192509061220c90836135d7565b6001600160a01b0387166000908152601460209081526040808320939093556018905220849055505050505050565b600a546000906001600160a01b031633148061226157506000546001600160a01b031633145b61227d5760405162461bcd60e51b8152600401610cdd90615215565b6000546001600160a01b031633148061229857506001821515145b6122b45760405162461bcd60e51b8152600401610cdd9061525c565b600a8054831515600160b01b0260ff60b01b199091161790556040517fef159d9a32b2472e32b098f954f3ce62d232939f1c207070b584df1814de2de0906114d99084906040808252600890820152672a3930b739b332b960c11b6060820152901515602082015260800190565b6001600160a01b03811660009081526009602052604081206001015415801561236857506001600160a01b0382166000908152600c602052604090205460ff1615156001145b80156110595750816001600160a01b031663173b99046040518163ffffffff1660e01b8152600401602060405180830381865afa1580156123ad573d6000803e3d6000fd5b505050506040513d601f19601f820116820180604052508101906123d191906152a9565b670de0b6b3a76400001492915050565b600080546001600160a01b0316331461240057611059600160126140f4565b6001600160a01b03821660009081526009602052604090205460ff161561242d57611059600a60116140f4565b816001600160a01b031663fe9c44ae6040518163ffffffff1660e01b8152600401602060405180830381865afa15801561246b573d6000803e3d6000fd5b505050506040513d601f19601f8201168201806040525081019061248f91906152d8565b506001600160a01b03821660009081526009602052604081208054600160ff19918216811783556003830180549092169091558101919091556124d1836141b1565b6124da8361429a565b6040516001600160a01b03841681527fcf583bb0c569eb967f806b11601c4cb93c10310485c67add5f8362c2f212321f9060200161157a565b61251b613962565b6125675760405162461bcd60e51b815260206004820152601d60248201527f6f6e6c792061646d696e2063616e2073657420636f6d702073706565640000006044820152606401610cdd565b82518251811480156125795750815181145b6125d75760405162461bcd60e51b815260206004820152602960248201527f436f6d7074726f6c6c65723a3a5f736574436f6d7053706565647320696e76616044820152681b1a59081a5b9c1d5d60ba1b6064820152608401610cdd565b60005b81811015610536576126388582815181106125f7576125f761516f565b60200260200101518583815181106126115761261161516f565b602002602001015185848151811061262b5761262b61516f565b6020026020010151614356565b612641816151b2565b90506125da565b6001600160a01b03811660009081526008602090815260408083208054825181850281018501909352808352606094938301828280156126b157602002820191906000526020600020905b81546001600160a01b03168152600190910190602001808311612693575b5093979650505050505050565b6060600d80548060200260200160405190810160405280929190818152602001828054801561271657602002820191906000526020600020905b81546001600160a01b031681526001909101906020018083116126f8575b5050505050905090565b600a54600090600160b01b900460ff16156127725760405162461bcd60e51b81526020600482015260126024820152711d1c985b9cd9995c881a5cc81c185d5cd95960721b6044820152606401610cdd565b600061277f868685614535565b9050801561278e5790506112f6565b61279786613dde565b6127a18686613f56565b6112f08685613f56565b805160609060008167ffffffffffffffff8111156127cb576127cb614b04565b6040519080825280602002602001820160405280156127f4578160200160208202803683370190505b50905060005b8281101561286b5760008582815181106128165761281661516f565b6020026020010151905061282a81336145ed565b601181111561283b5761283b6152c2565b83838151811061284d5761284d61516f565b60209081029190910101525080612863816151b2565b9150506127fa565b509392505050565b6004805460405163fc57d4df60e01b81526001600160a01b03868116938201939093526000928392839291169063fc57d4df90602401602060405180830381865afa1580156128c6573d6000803e3d6000fd5b505050506040513d601f19601f820116820180604052508101906128ea91906152a9565b6004805460405163fc57d4df60e01b81526001600160a01b038981169382019390935292935060009291169063fc57d4df90602401602060405180830381865afa15801561293c573d6000803e3d6000fd5b505050506040513d601f19601f8201168201806040525081019061296091906152a9565b905081158061296d575080155b1561298157600d6000935093505050612a89565b6000866001600160a01b031663182df0f56040518163ffffffff1660e01b8152600401602060405180830381865afa1580156129c1573d6000803e3d6000fd5b505050506040513d601f19601f820116820180604052508101906129e591906152a9565b905060006129ff6040518060200160405280600081525090565b604080516020808201835260008083528351808301855290815283518083018552600654815284519283019094528882529192612a3b916146e2565b9250612a636040518060200160405280888152506040518060200160405280888152506146e2565b9150612a6f838361472a565b9050612a7b818b61418d565b600099509750505050505050505b935093915050565b600a54600090600160b81b900460ff1615612ae05760405162461bcd60e51b815260206004820152600f60248201526e1cd95a5e99481a5cc81c185d5cd959608a1b6044820152606401610cdd565b6001600160a01b03861660009081526009602052604090205460ff161580612b2157506001600160a01b03851660009081526009602052604090205460ff16155b15612b2d576009611ba1565b846001600160a01b0316635fe3b5676040518163ffffffff1660e01b8152600401602060405180830381865afa158015612b6b573d6000803e3d6000fd5b505050506040513d601f19601f82011682018060405250810190612b8f919061528c565b6001600160a01b0316866001600160a01b0316635fe3b5676040518163ffffffff1660e01b8152600401602060405180830381865afa158015612bd6573d6000803e3d6000fd5b505050506040513d601f19601f82011682018060405250810190612bfa919061528c565b6001600160a01b031614612c0f576002611ba1565b612c1886613dde565b612c228684613f56565b612c2c8685613f56565b60009695505050505050565b6001600160a01b0383166000908152600c602052604081205460ff1615612c945760405162461bcd60e51b815260206004820152601060248201526f189bdc9c9bddc81a5cc81c185d5cd95960821b6044820152606401610cdd565b6001600160a01b03841660009081526009602052604090205460ff16612cbb57600961183d565b6001600160a01b038085166000908152600960209081526040808320938716835260029093019052205460ff16612db857336001600160a01b03851614612d3c5760405162461bcd60e51b815260206004820152601560248201527439b2b73232b91036bab9ba1031329031aa37b5b2b760591b6044820152606401610cdd565b6000612d4833856145ed565b90506000816011811115612d5e57612d5e6152c2565b14612d7d57806011811115612d7557612d756152c2565b915050611585565b6001600160a01b038086166000908152600960209081526040808320938816835260029093019052205460ff16612db657612db66152f5565b505b6004805460405163fc57d4df60e01b81526001600160a01b038781169382019390935291169063fc57d4df90602401602060405180830381865afa158015612e04573d6000803e3d6000fd5b505050506040513d601f19601f82011682018060405250810190612e2891906152a9565b612e3357600d61183d565b6001600160a01b0384166000908152601660205260409020548015612f18576000856001600160a01b03166347bd37186040518163ffffffff1660e01b8152600401602060405180830381865afa158015612e92573d6000803e3d6000fd5b505050506040513d601f19601f82011682018060405250810190612eb691906152a9565b90506000612ec482866135d7565b9050828110612f155760405162461bcd60e51b815260206004820152601960248201527f6d61726b657420626f72726f77206361702072656163686564000000000000006044820152606401610cdd565b50505b600080612f288688600088613ab0565b91935090915060009050826011811115612f4457612f446152c2565b14612f6557816011811115612f5b57612f5b6152c2565b9350505050611585565b8015612f72576004612f5b565b60006040518060200160405280896001600160a01b031663aa5af0fd6040518163ffffffff1660e01b8152600401602060405180830381865afa158015612fbd573d6000803e3d6000fd5b505050506040513d601f19601f82011682018060405250810190612fe191906152a9565b90529050612fef88826135ef565b612ffa8888836137e2565b600098975050505050505050565b6008602052816000526040600020818154811061302457600080fd5b6000918252602090912001546001600160a01b03169150829050565b600080546001600160a01b031633146130665761305f600160066140f4565b9050611059565b6001600160a01b0383166000908152600960205260409020805460ff1661309b57613093600960076140f4565b915050611059565b60408051602080820183528582528251908101909252670c7d713b49da00008252906130c981835190511090565b156130e4576130da600660086140f4565b9350505050611059565b841580159061316057506004805460405163fc57d4df60e01b81526001600160a01b038981169382019390935291169063fc57d4df90602401602060405180830381865afa15801561313a573d6000803e3d6000fd5b505050506040513d601f19601f8201168201806040525081019061315e91906152a9565b155b15613171576130da600d60096140f4565b60018301805490869055604080516001600160a01b0389168152602081018390529081018790527f70483e6592cd5182d45ac970e05bc62cdcc90e9d8ef2c2dbe686cf383bcd7fc59060600160405180910390a16000979650505050505050565b61123d81600d80548060200260200160405190810160405280929190818152602001828054801561322c57602002820191906000526020600020905b81546001600160a01b0316815260019091019060200180831161320e575b505050505061105f565b600080613244858585614535565b90508015613253579050611585565b61325c85613dde565b6132668585613f56565b600095945050505050565b6040516361bfb47160e11b815233600482015260009082908290819081906001600160a01b0385169063c37f68e290602401608060405180830381865afa1580156132c0573d6000803e3d6000fd5b505050506040513d601f19601f820116820180604052508101906132e4919061530b565b50925092509250826000146133495760405162461bcd60e51b815260206004820152602560248201527f657869744d61726b65743a206765744163636f756e74536e617073686f742066604482015264185a5b195960da1b6064820152608401610cdd565b80156133655761335b600c60026140f4565b9695505050505050565b6000613372873385614535565b9050801561339257613387600e600383614764565b979650505050505050565b6001600160a01b0385166000908152600960209081526040808320338452600281019092529091205460ff166133d057600098975050505050505050565b3360009081526002820160209081526040808320805460ff19169055600882528083208054825181850281018501909352808352919290919083018282801561344257602002820191906000526020600020905b81546001600160a01b03168152600190910190602001808311613424575b5050835193945083925060009150505b828110156134a757896001600160a01b03168482815181106134765761347661516f565b60200260200101516001600160a01b03161415613495578091506134a7565b8061349f816151b2565b915050613452565b508181106134b7576134b76152f5565b336000908152600860205260409020805481906134d69060019061519b565b815481106134e6576134e661516f565b9060005260206000200160009054906101000a90046001600160a01b03168183815481106135165761351661516f565b9060005260206000200160006101000a8154816001600160a01b0302191690836001600160a01b031602179055508080548061355457613554615341565b600082815260209020810160001990810180546001600160a01b03191690550190556040517fe699a64c18b07ac5b7301aa273f36a2287239eb9501d81950672794afba29a0d906135bd908c9033906001600160a01b0392831681529116602082015260400190565b60405180910390a160009c9b505050505050505050505050565b60006115858284615357565b6000611585828461519b565b6001600160a01b038216600090815260116020908152604080832060199092528220549091613654425b6040518060400160405280601c81526020017f626c6f636b206e756d62657220657863656564732033322062697473000000008152506147dc565b83549091506000906136769063ffffffff80851691600160e01b9004166135e3565b90506000811180156136885750600083115b156137b75760006136fa876001600160a01b03166347bd37186040518163ffffffff1660e01b8152600401602060405180830381865afa1580156136d0573d6000803e3d6000fd5b505050506040513d601f19601f820116820180604052508101906136f491906152a9565b8761480c565b9050600061370883866141a5565b905060008083116137285760405180602001604052806000815250613732565b613732828461482a565b604080516020810190915288546001600160e01b031681529091506137959061375b9083614865565b5160408051808201909152601a81527f6e657720696e64657820657863656564732032323420626974730000000000006020820152614891565b6001600160e01b0316600160e01b63ffffffff8716021787555061063c915050565b801561063c57835463ffffffff8316600160e01b026001600160e01b03909116178455505050505050565b6001600160a01b03838116600090815260116020908152604080832080546013845282852095881685529490925290912080546001600160e01b039093169081905590918015801561384257506a0c097ce7bc90715b34b9f160241b8210155b1561385857506a0c097ce7bc90715b34b9f160241b5b6000604051806020016040528061386f85856135e3565b90526040516395dd919360e01b81526001600160a01b0388811660048301529192506000916138c291908a16906395dd919390602401602060405180830381865afa1580156136d0573d6000803e3d6000fd5b905060006138d082846148b8565b6001600160a01b038916600090815260146020526040812054919250906138f790836135d7565b6001600160a01b038a811660008181526014602090815260409182902085905581518781529081018b90529394509092918d16917f1fc3ecc087d8d2d15e23d0032af5a47059c3892d003d8e139fdcb6bb327c99a6910160405180910390a350505050505050505050565b600080546001600160a01b031633148061398657506002546001600160a01b031633145b905090565b60008073d86c8d4279ccafbec840c782bcc50d201f2774196040516370a0823160e01b81523060048201529091506000906001600160a01b038316906370a0823190602401602060405180830381865afa1580156139ed573d6000803e3d6000fd5b505050506040513d601f19601f82011682018060405250810190613a1191906152a9565b9050600084118015613a235750808411155b15613aa75760405163a9059cbb60e01b81526001600160a01b0386811660048301526024820186905283169063a9059cbb906044016020604051808303816000875af1158015613a77573d6000803e3d6000fd5b505050506040513d601f19601f82011682018060405250810190613a9b91906152d8565b50600092505050611059565b50919392505050565b6000806000613abd61494e565b6001600160a01b038816600090815260086020908152604080832080548251818502810185019093528083528493830182828015613b2457602002820191906000526020600020905b81546001600160a01b03168152600190910190602001808311613b06575b5050505050905060005b8151811015613d88576000828281518110613b4b57613b4b61516f565b60209081029190910101516040516361bfb47160e11b81526001600160a01b038e811660048301529192509082169063c37f68e290602401608060405180830381865afa158015613ba0573d6000803e3d6000fd5b505050506040513d601f19601f82011682018060405250810190613bc4919061530b565b60808901526060880152604087015293508315613bf057600f60008097509750975050505050506117b6565b60408051602080820183526001600160a01b0384811660008181526009845285902060010154845260c08a01939093528351808301855260808a0151815260e08a015260048054855163fc57d4df60e01b815291820194909452935192169263fc57d4df92602480830193928290030181865afa158015613c75573d6000803e3d6000fd5b505050506040513d601f19601f82011682018060405250810190613c9991906152a9565b60a08601819052613cb957600d60008097509750975050505050506117b6565b604080516020810190915260a0860151815261010086015260c085015160e0860151613cf391613ce8916146e2565b8661010001516146e2565b610120860181905260408601518651613d0d9291906148e1565b855261010085015160608601516020870151613d2a9291906148e1565b60208601526001600160a01b03818116908c161415613d7557613d578561012001518b87602001516148e1565b60208601819052610100860151613d6f918b906148e1565b60208601525b5080613d80816151b2565b915050613b2e565b50602083015183511115613db95760208301518351600091613da99161519b565b60009550955095505050506117b6565b60008084600001518560200151613dd0919061519b565b9550955095505050506117b6565b6001600160a01b0381166000908152601060209081526040808320601a9092528220549091613e0c42613619565b8354909150600090613e2e9063ffffffff80851691600160e01b9004166135e3565b9050600081118015613e405750600083115b15613f2c576000856001600160a01b03166318160ddd6040518163ffffffff1660e01b8152600401602060405180830381865afa158015613e85573d6000803e3d6000fd5b505050506040513d601f19601f82011682018060405250810190613ea991906152a9565b90506000613eb783866141a5565b90506000808311613ed75760405180602001604052806000815250613ee1565b613ee1828461482a565b604080516020810190915288546001600160e01b03168152909150613f0a9061375b9083614865565b6001600160e01b0316600160e01b63ffffffff87160217875550610536915050565b801561053657835463ffffffff8316600160e01b026001600160e01b039091161784555050505050565b6001600160a01b03828116600090815260106020908152604080832080546012845282852095871685529490925290912080546001600160e01b0390931690819055909180158015613fb657506a0c097ce7bc90715b34b9f160241b8210155b15613fcc57506a0c097ce7bc90715b34b9f160241b5b60006040518060200160405280613fe385856135e3565b90526040516370a0823160e01b81526001600160a01b0387811660048301529192506000918816906370a0823190602401602060405180830381865afa158015614031573d6000803e3d6000fd5b505050506040513d601f19601f8201168201806040525081019061405591906152a9565b9050600061406382846148b8565b6001600160a01b0388166000908152601460205260408120549192509061408a90836135d7565b6001600160a01b0389811660008181526014602090815260409182902085905581518781529081018b90529394509092918c16917f2caecd17d02f56fa897705dcc740da2d237c373f70686f4e0d9bd3bf0400ea7a910160405180910390a3505050505050505050565b60007f45b96fe442630264581b197e84bbada861235052c5a1aadfff9ea4e40a969aa0836011811115614129576141296152c2565b83601381111561413b5761413b6152c2565b60408051928352602083019190915260009082015260600160405180910390a1826011811115611585576115856152c2565b6000806000614180846000806000613ab0565b9250925092509193909250565b60008061419a8484614902565b90506112f68161492a565b6000611585828461536f565b60005b600d5481101561424757816001600160a01b0316600d82815481106141db576141db61516f565b6000918252602090912001546001600160a01b031614156142355760405162461bcd60e51b81526020600482015260146024820152731b585c9ad95d08185b1c9958591e48185919195960621b6044820152606401610cdd565b8061423f816151b2565b9150506141b4565b50600d80546001810182556000919091527fd7b6990105719101dabeb77144f2a3385c8033acd3af97e9423a695e81ad1eb50180546001600160a01b0319166001600160a01b0392909216919091179055565b60006142a542613619565b6001600160a01b03831660009081526010602090815260408083206011909252909120815492935090916001600160e01b03166142fb5781546001600160e01b0319166a0c097ce7bc90715b34b9f160241b1782555b80546001600160e01b03166143295780546001600160e01b0319166a0c097ce7bc90715b34b9f160241b1781555b805463ffffffff909316600160e01b026001600160e01b0393841681179091558154909216909117905550565b6001600160a01b0383166000908152600960205260409020805460ff166143bf5760405162461bcd60e51b815260206004820152601960248201527f636f6d70206d61726b6574206973206e6f74206c6973746564000000000000006044820152606401610cdd565b6001600160a01b0384166000908152601a6020526040902054831461443d576143e784613dde565b6001600160a01b0384166000818152601a602052604090819020859055517fdeafccd0c0b768b2529f7dcbbe58e155d6023059150b7490ed4535cc3744b92d906144349086815260200190565b60405180910390a25b6001600160a01b03841660009081526019602052604090205482146106225760006040518060200160405280866001600160a01b031663aa5af0fd6040518163ffffffff1660e01b8152600401602060405180830381865afa1580156144a7573d6000803e3d6000fd5b505050506040513d601f19601f820116820180604052508101906144cb91906152a9565b905290506144d985826135ef565b6001600160a01b03851660008181526019602052604090819020859055517f20af8e791cc98f74b2d7a391c80980ca8e5aebf3d4060bf581997b6acae2e537906145269086815260200190565b60405180910390a25050505050565b6001600160a01b03831660009081526009602052604081205460ff1661455c57600961183d565b6001600160a01b038085166000908152600960209081526040808320938716835260029093019052205460ff1661459457600061183d565b6000806145a48587866000613ab0565b919350909150600090508260118111156145c0576145c06152c2565b146145e0578160118111156145d7576145d76152c2565b92505050611585565b8015612c2c5760046145d7565b6001600160a01b0382166000908152600960205260408120805460ff16614618576009915050611059565b6001600160a01b038316600090815260028201602052604090205460ff1615156001141561464a576000915050611059565b6001600160a01b03838116600081815260028401602090815260408083208054600160ff199091168117909155600883528184208054918201815584529282902090920180546001600160a01b031916948916948517905581519384528301919091527f3ab23ab0d51cccc0c3085aec51f99228625aa1a922b3a8ca89a26b0f2027a1a5910160405180910390a15060009392505050565b6040805160208101909152600081526040518060200160405280670de0b6b3a7640000614717866000015186600001516141a5565b614721919061538e565b90529392505050565b604080516020810190915260008152604051806020016040528061472161475d8660000151670de0b6b3a76400006141a5565b8551614942565b60007f45b96fe442630264581b197e84bbada861235052c5a1aadfff9ea4e40a969aa0846011811115614799576147996152c2565b8460138111156147ab576147ab6152c2565b604080519283526020830191909152810184905260600160405180910390a18360118111156112f6576112f66152c2565b60008164010000000084106148045760405162461bcd60e51b8152600401610cdd91906153b0565b509192915050565b600061158561482384670de0b6b3a76400006141a5565b8351614942565b604080516020810190915260008152604051806020016040528061472161485f866a0c097ce7bc90715b34b9f160241b6141a5565b85614942565b6040805160208101909152600081526040518060200160405280614721856000015185600001516135d7565b600081600160e01b84106148045760405162461bcd60e51b8152600401610cdd91906153b0565b60006a0c097ce7bc90715b34b9f160241b6148d78484600001516141a5565b611585919061538e565b6000806148ee8585614902565b9050611d1e6148fc8261492a565b846135d7565b60408051602081019091526000815260405180602001604052806147218560000151856141a5565b805160009061105990670de0b6b3a76400009061538e565b6000611585828461538e565b60405180610140016040528060008152602001600081526020016000815260200160008152602001600081526020016000815260200161499a6040518060200160405280600081525090565b81526020016149b56040518060200160405280600081525090565b81526020016149d06040518060200160405280600081525090565b81526020016149eb6040518060200160405280600081525090565b905290565b60008083601f840112614a0257600080fd5b50813567ffffffffffffffff811115614a1a57600080fd5b6020830191508360208260051b8501011115614a3557600080fd5b9250929050565b60008060008060408587031215614a5257600080fd5b843567ffffffffffffffff80821115614a6a57600080fd5b614a76888389016149f0565b90965094506020870135915080821115614a8f57600080fd5b50614a9c878288016149f0565b95989497509550505050565b6001600160a01b038116811461123d57600080fd5b801515811461123d57600080fd5b60008060408385031215614ade57600080fd5b8235614ae981614aa8565b91506020830135614af981614abd565b809150509250929050565b634e487b7160e01b600052604160045260246000fd5b604051601f8201601f1916810167ffffffffffffffff81118282101715614b4357614b43614b04565b604052919050565b600067ffffffffffffffff821115614b6557614b65614b04565b5060051b60200190565b600082601f830112614b8057600080fd5b81356020614b95614b9083614b4b565b614b1a565b82815260059290921b84018101918181019086841115614bb457600080fd5b8286015b84811015614bd8578035614bcb81614aa8565b8352918301918301614bb8565b509695505050505050565b60008060408385031215614bf657600080fd5b8235614c0181614aa8565b9150602083013567ffffffffffffffff811115614c1d57600080fd5b614c2985828601614b6f565b9150509250929050565b600060208284031215614c4557600080fd5b813561158581614aa8565b600080600080600060a08688031215614c6857600080fd5b8535614c7381614aa8565b94506020860135614c8381614aa8565b93506040860135614c9381614aa8565b94979396509394606081013594506080013592915050565b60008060008060808587031215614cc157600080fd5b8435614ccc81614aa8565b93506020850135614cdc81614aa8565b92506040850135614cec81614aa8565b9396929550929360600135925050565b60008060408385031215614d0f57600080fd5b8235614d1a81614aa8565b946020939093013593505050565b600060208284031215614d3a57600080fd5b813561158581614abd565b600060208284031215614d5757600080fd5b5035919050565b60008060008060808587031215614d7457600080fd5b8435614d7f81614aa8565b93506020850135614d8f81614aa8565b93969395505050506040820135916060013590565b60008060008060008060c08789031215614dbd57600080fd5b8635614dc881614aa8565b95506020870135614dd881614aa8565b94506040870135614de881614aa8565b93506060870135614df881614aa8565b9598949750929560808101359460a0909101359350915050565b600080600060608486031215614e2757600080fd5b8335614e3281614aa8565b92506020840135614e4281614aa8565b929592945050506040919091013590565b600080600080600060a08688031215614e6b57600080fd5b8535614e7681614aa8565b94506020860135614e8681614aa8565b93506040860135614e9681614aa8565b92506060860135614ea681614aa8565b949793965091946080013592915050565b600082601f830112614ec857600080fd5b81356020614ed8614b9083614b4b565b82815260059290921b84018101918181019086841115614ef757600080fd5b8286015b84811015614bd8578035614f0e81614aa8565b8352918301918301614efb565b60008060008060808587031215614f3157600080fd5b843567ffffffffffffffff80821115614f4957600080fd5b614f5588838901614eb7565b95506020870135915080821115614f6b57600080fd5b50614f7887828801614b6f565b9350506040850135614f8981614abd565b91506060850135614f9981614abd565b939692955090935050565b60008060408385031215614fb757600080fd5b8235614fc281614aa8565b91506020830135614af981614aa8565b600082601f830112614fe357600080fd5b81356020614ff3614b9083614b4b565b82815260059290921b8401810191818101908684111561501257600080fd5b8286015b84811015614bd85780358352918301918301615016565b60008060006060848603121561504257600080fd5b833567ffffffffffffffff8082111561505a57600080fd5b61506687838801614b6f565b9450602086013591508082111561507c57600080fd5b61508887838801614fd2565b9350604086013591508082111561509e57600080fd5b506150ab86828701614fd2565b9150509250925092565b6020808252825182820181905260009190848201906040850190845b818110156150f65783516001600160a01b0316835292840192918401916001016150d1565b50909695505050505050565b60006020828403121561511457600080fd5b813567ffffffffffffffff81111561512b57600080fd5b6112f684828501614eb7565b6020808252825182820181905260009190848201906040850190845b818110156150f657835183529284019291840191600101615153565b634e487b7160e01b600052603260045260246000fd5b634e487b7160e01b600052601160045260246000fd5b6000828210156151ad576151ad615185565b500390565b60006000198214156151c6576151c6615185565b5060010190565b60208082526028908201527f63616e6e6f742070617573652061206d61726b65742074686174206973206e6f6040820152671d081b1a5cdd195960c21b606082015260800190565b60208082526027908201527f6f6e6c7920706175736520677561726469616e20616e642061646d696e2063616040820152666e20706175736560c81b606082015260800190565b6020808252601690820152756f6e6c792061646d696e2063616e20756e706175736560501b604082015260600190565b60006020828403121561529e57600080fd5b815161158581614aa8565b6000602082840312156152bb57600080fd5b5051919050565b634e487b7160e01b600052602160045260246000fd5b6000602082840312156152ea57600080fd5b815161158581614abd565b634e487b7160e01b600052600160045260246000fd5b6000806000806080858703121561532157600080fd5b505082516020840151604085015160609095015191969095509092509050565b634e487b7160e01b600052603160045260246000fd5b6000821982111561536a5761536a615185565b500190565b600081600019048311821515161561538957615389615185565b500290565b6000826153ab57634e487b7160e01b600052601260045260246000fd5b500490565b600060208083528351808285015260005b818110156153dd578581018301518582016040015282016153c1565b818111156153ef576000604083870101525b50601f01601f191692909201604001939250505056fea2646970667358221220e8ebe49b2e7b498ccb9b786dc415308a311b4018cfe83d434e848377b0108e7964736f6c634300080a0033",
  "deployedBytecode": "0x608060405234801561001057600080fd5b506004361061048a5760003560e01c8063731f0c2b11610262578063b21be7fd11610151578063dce15449116100ce578063e9af029211610092578063e9af029214610c04578063eabe7d9114610c17578063ede4edd014610c2a578063f00a7a9214610c3d578063f4a433c014610c4a578063f851a44014610c6a57600080fd5b8063dce1544914610bae578063dcfbc0c714610bc1578063e4028eee14610bd4578063e6653f3d14610be7578063e875544614610bfb57600080fd5b8063c488847b11610115578063c488847b14610b15578063ca0af04314610b3d578063cc7ebdc414610b68578063d02f735114610b88578063da3d454c14610b9b57600080fd5b8063b21be7fd14610a84578063bb82aa5e14610aaf578063bdcdc25814610ac2578063bea6b8b814610ad5578063c299823814610af557600080fd5b806394b2294b116101df578063a8b43948116101a3578063a8b4394814610a2c578063aa90075414610a3f578063abfceffc14610a48578063ac0b0bb714610a68578063b0772d0b14610a7c57600080fd5b806394b2294b146109a9578063986ab838146109b25780639d1b5a0a146109d2578063a76b3fda146109ec578063a7f0e231146109ff57600080fd5b80638c57804e116102265780638c57804e146108b75780638e8f294b146108ef5780638ebf636414610942578063929fe9a11461095557806394543c151461099657600080fd5b8063731f0c2b1461083a578063741b25251461085d5780637dc0d1d01461087057806385b7beb81461088357806387f76303146108a357600080fd5b80634a5844321161037e5780635ec88c79116102fb5780636a56947e116102bf5780636a56947e1461077f5780636aa875b51461078d5780636b79c38d146107ad5780636d154ea5146108095780636d35bf911461082c57600080fd5b80635ec88c79146107205780635f5af1aa146107335780635fc7e71e14610746578063607ef6c1146107595780636810dfa61461076c57600080fd5b806351dff9891161034257806351dff989146106c157806352d84d1e146106d457806355ee1fe1146106e7578063598ee1cb146106fa5780635c7786051461070d57600080fd5b80634a584432146106445780634ada90af146106645780634e79238f1461066d5780634ef4c3e11461069b5780634fd42e17146106ae57600080fd5b8063267822471161040c5780633bcf7ec1116103d05780633bcf7ec1146105ed5780633c94786f1461060057806341c728b91461061457806342cbb15c1461062857806347ef3b3b1461062e57600080fd5b8063267822471461058e57806327efe3cb146105a15780632d70db78146105b4578063317b0b77146105c7578063391957d7146105da57600080fd5b80631d7b33d7116104535780631d7b33d7146104fa5780631ededc911461052857806321af45691461053d57806324008a621461056857806324a3d6221461057b57600080fd5b80627e3dd21461048f57806316b95e8f146104ac57806318c882a5146104c15780631c3db2e0146104d45780631d504dc6146104e7575b600080fd5b610497600181565b60405190151581526020015b60405180910390f35b6104bf6104ba366004614a3c565b610c7d565b005b6104976104cf366004614acb565b610f26565b6104bf6104e2366004614be3565b61105f565b6104bf6104f5366004614c33565b6110c2565b61051a610508366004614c33565b600f6020526000908152604090205481565b6040519081526020016104a3565b6104bf610536366004614c50565b5050505050565b601554610550906001600160a01b031681565b6040516001600160a01b0390911681526020016104a3565b61051a610576366004614cab565b611240565b600a54610550906001600160a01b031681565b600154610550906001600160a01b031681565b6104bf6105af366004614cfc565b6112fe565b6104976105c2366004614d28565b6113f5565b61051a6105d5366004614d45565b6114e5565b6104bf6105e8366004614c33565b61158c565b6104976105fb366004614acb565b611656565b600a5461049790600160a01b900460ff1681565b6104bf610622366004614d5e565b50505050565b4261051a565b6104bf61063c366004614da4565b505050505050565b61051a610652366004614c33565b60166020526000908152604090205481565b61051a60065481565b61068061067b366004614d5e565b611780565b604080519384526020840192909252908201526060016104a3565b61051a6106a9366004614e12565b6117c0565b61051a6106bc366004614d45565b611861565b6104bf6106cf366004614d5e565b6118be565b6105506106e2366004614d45565b61190d565b61051a6106f5366004614c33565b611937565b6104bf610708366004614cfc565b6119b0565b6104bf61071b366004614e12565b505050565b61068061072e366004614c33565b611aa4565b61051a610741366004614c33565b611adf565b61051a610754366004614e53565b611b58565b6104bf610767366004614a3c565b611d27565b6104bf61077a366004614f1b565b611f05565b6104bf610622366004614cab565b61051a61079b366004614c33565b601a6020526000908152604090205481565b6107e56107bb366004614c33565b6010602052600090815260409020546001600160e01b03811690600160e01b900463ffffffff1682565b604080516001600160e01b03909316835263ffffffff9091166020830152016104a3565b610497610817366004614c33565b600c6020526000908152604090205460ff1681565b6104bf610536366004614e53565b610497610848366004614c33565b600b6020526000908152604090205460ff1681565b6104bf61086b366004614c33565b61218f565b600454610550906001600160a01b031681565b61051a610891366004614c33565b601c6020526000908152604090205481565b600a5461049790600160b01b900460ff1681565b6107e56108c5366004614c33565b6011602052600090815260409020546001600160e01b03811690600160e01b900463ffffffff1682565b6109236108fd366004614c33565b60096020526000908152604090208054600182015460039092015460ff91821692911683565b60408051931515845260208401929092521515908201526060016104a3565b610497610950366004614d28565b61223b565b610497610963366004614fa4565b6001600160a01b038082166000908152600960209081526040808320938616835260029093019052205460ff1692915050565b6104976109a4366004614c33565b612322565b61051a60075481565b61051a6109c0366004614c33565b60176020526000908152604090205481565b73d86c8d4279ccafbec840c782bcc50d201f277419610550565b61051a6109fa366004614c33565b6123e1565b610a146a0c097ce7bc90715b34b9f160241b81565b6040516001600160e01b0390911681526020016104a3565b6104bf610a3a36600461502d565b612513565b61051a600e5481565b610a5b610a56366004614c33565b612648565b6040516104a391906150b5565b600a5461049790600160b81b900460ff1681565b610a5b6126be565b61051a610a92366004614fa4565b601260209081526000928352604080842090915290825290205481565b600254610550906001600160a01b031681565b61051a610ad0366004614cab565b612720565b61051a610ae3366004614c33565b60186020526000908152604090205481565b610b08610b03366004615102565b6127ab565b6040516104a39190615137565b610b28610b23366004614e12565b612873565b604080519283526020830191909152016104a3565b61051a610b4b366004614fa4565b601360209081526000928352604080842090915290825290205481565b61051a610b76366004614c33565b60146020526000908152604090205481565b61051a610b96366004614e53565b612a91565b61051a610ba9366004614e12565b612c38565b610550610bbc366004614cfc565b613008565b600354610550906001600160a01b031681565b61051a610be2366004614cfc565b613040565b600a5461049790600160a81b900460ff1681565b61051a60055481565b6104bf610c12366004614c33565b6131d2565b61051a610c25366004614e12565b613236565b61051a610c38366004614c33565b613271565b601b546104979060ff1681565b61051a610c58366004614c33565b60196020526000908152604090205481565b600054610550906001600160a01b031681565b6000546001600160a01b03163314610ce65760405162461bcd60e51b815260206004820152602160248201527f4f6e6c792061646d696e2063616e2063616c6c20746869732066756e6374696f6044820152603760f91b60648201526084015b60405180910390fd5b601b5460ff1615610d485760405162461bcd60e51b815260206004820152602660248201527f416c72656164792065786563757465642074686973206f6e652d6f66662066756044820152653731ba34b7b760d11b6064820152608401610cdd565b828114610d875760405162461bcd60e51b815260206004820152600d60248201526c125b9d985b1a59081a5b9c1d5d609a1b6044820152606401610cdd565b60008060008060005b87811015610f0e57888882818110610daa57610daa61516f565b9050602002016020810190610dbf9190614c33565b6001600160a01b0381166000908152601460205260409020549095509350868682818110610def57610def61516f565b90506020020135925083831115610e93576000610e0c858561519b565b6001600160a01b0387166000908152601c6020526040812054919250610e3282846135d7565b6001600160a01b0389166000818152601c6020908152604091829020849055815186815290810184905292935090917f17fea09d9a7ca41b2f9f9118f18f44848a62e9c70d55dd4385131eb2cf1b7e47910160405180910390a28695505050505b8215610efe57610ea384846135e3565b6001600160a01b038616600081815260146020908152604091829020849055815188815290810184905292945090917f4a5c134e28b537a76546993ea37f3b60d9190476df7356d3842aa40902e20f04910160405180910390a25b610f07816151b2565b9050610d90565b5050601b805460ff1916600117905550505050505050565b6001600160a01b03821660009081526009602052604081205460ff16610f5e5760405162461bcd60e51b8152600401610cdd906151cd565b600a546001600160a01b0316331480610f8157506000546001600160a01b031633145b610f9d5760405162461bcd60e51b8152600401610cdd90615215565b6000546001600160a01b0316331480610fb857506001821515145b610fd45760405162461bcd60e51b8152600401610cdd9061525c565b6001600160a01b0383166000818152600c6020908152604091829020805460ff19168615159081179091558251938452606091840182905260069184019190915265426f72726f7760d01b6080840152908201527f71aec636243f9709bb0007ae15e9afb8150ab01716d75fd7573be5cc096e03b09060a0015b60405180910390a150805b92915050565b6040805160018082528183019092526000916020808301908036833701905050905082816000815181106110955761109561516f565b60200260200101906001600160a01b031690816001600160a01b03168152505061071b8183600180611f05565b806001600160a01b031663f851a4406040518163ffffffff1660e01b8152600401602060405180830381865afa158015611100573d6000803e3d6000fd5b505050506040513d601f19601f82011682018060405250810190611124919061528c565b6001600160a01b0316336001600160a01b0316146111945760405162461bcd60e51b815260206004820152602760248201527f6f6e6c7920756e6974726f6c6c65722061646d696e2063616e206368616e676560448201526620627261696e7360c81b6064820152608401610cdd565b806001600160a01b031663c1e803346040518163ffffffff1660e01b81526004016020604051808303816000875af11580156111d4573d6000803e3d6000fd5b505050506040513d601f19601f820116820180604052508101906111f891906152a9565b1561123d5760405162461bcd60e51b815260206004820152601560248201527418da185b99d9481b9bdd08185d5d1a1bdc9a5e9959605a1b6044820152606401610cdd565b50565b6001600160a01b03841660009081526009602052604081205460ff16611268575060096112f6565b60006040518060200160405280876001600160a01b031663aa5af0fd6040518163ffffffff1660e01b8152600401602060405180830381865afa1580156112b3573d6000803e3d6000fd5b505050506040513d601f19601f820116820180604052508101906112d791906152a9565b905290506112e586826135ef565b6112f08685836137e2565b60009150505b949350505050565b611306613962565b6113525760405162461bcd60e51b815260206004820152601960248201527f6f6e6c792061646d696e2063616e206772616e7420636f6d70000000000000006044820152606401610cdd565b600061135e838361398b565b905080156113ae5760405162461bcd60e51b815260206004820152601b60248201527f696e73756666696369656e7420636f6d7020666f72206772616e7400000000006044820152606401610cdd565b604080516001600160a01b0385168152602081018490527f98b2f82a3a07f223a0be64b3d0f47711c64dccd1feafb94aa28156b38cd9695c910160405180910390a1505050565b600a546000906001600160a01b031633148061141b57506000546001600160a01b031633145b6114375760405162461bcd60e51b8152600401610cdd90615215565b6000546001600160a01b031633148061145257506001821515145b61146e5760405162461bcd60e51b8152600401610cdd9061525c565b600a8054831515600160b81b0260ff60b81b199091161790556040517fef159d9a32b2472e32b098f954f3ce62d232939f1c207070b584df1814de2de0906114d99084906040808252600590820152645365697a6560d81b6060820152901515602082015260800190565b60405180910390a15090565b600080546001600160a01b031633146115405760405162461bcd60e51b815260206004820152601f60248201527f6f6e6c792061646d696e2063616e2073657420636c6f736520666163746f72006044820152606401610cdd565b600580549083905560408051828152602081018590527f3b9670cf975d26958e754b57098eaa2ac914d8d2a31b83257997b9f346110fd991015b60405180910390a160005b9392505050565b6000546001600160a01b031633146115f55760405162461bcd60e51b815260206004820152602660248201527f6f6e6c792061646d696e2063616e2073657420626f72726f772063617020677560448201526530b93234b0b760d11b6064820152608401610cdd565b601580546001600160a01b038381166001600160a01b031983168117909355604080519190921680825260208201939093527feda98690e518e9a05f8ec6837663e188211b2da8f4906648b323f2c1d4434e29910160405180910390a15050565b6001600160a01b03821660009081526009602052604081205460ff1661168e5760405162461bcd60e51b8152600401610cdd906151cd565b600a546001600160a01b03163314806116b157506000546001600160a01b031633145b6116cd5760405162461bcd60e51b8152600401610cdd90615215565b6000546001600160a01b03163314806116e857506001821515145b6117045760405162461bcd60e51b8152600401610cdd9061525c565b6001600160a01b0383166000818152600b6020908152604091829020805460ff19168615159081179091558251938452606091840182905260049184019190915263135a5b9d60e21b6080840152908201527f71aec636243f9709bb0007ae15e9afb8150ab01716d75fd7573be5cc096e03b09060a00161104e565b6000806000806000806117958a8a8a8a613ab0565b9250925092508260118111156117ad576117ad6152c2565b95509093509150505b9450945094915050565b6001600160a01b0383166000908152600b602052604081205460ff161561181a5760405162461bcd60e51b815260206004820152600e60248201526d1b5a5b9d081a5cc81c185d5cd95960921b6044820152606401610cdd565b6001600160a01b03841660009081526009602052604090205460ff166118445760095b9050611585565b61184d84613dde565b6118578484613f56565b6000949350505050565b600080546001600160a01b03163314611880576110596001600b6140f4565b600680549083905560408051828152602081018590527faeba5a6c40a8ac138134bff1aaa65debf25971188a58804bad717f82f0ec1316910161157a565b801580156118cc5750600082115b156106225760405162461bcd60e51b815260206004820152601160248201527072656465656d546f6b656e73207a65726f60781b6044820152606401610cdd565b600d818154811061191d57600080fd5b6000918252602090912001546001600160a01b0316905081565b600080546001600160a01b0316331461195657611059600160106140f4565b600480546001600160a01b038481166001600160a01b031983168117909355604080519190921680825260208201939093527fd52b2b9b7e9ee655fcb95d2e5b9e0c9f69e7ef2b8e9d2d0ea78402d576d22e22910161157a565b6119b8613962565b611a045760405162461bcd60e51b815260206004820152601d60248201527f6f6e6c792061646d696e2063616e2073657420636f6d702073706565640000006044820152606401610cdd565b611a0d8261218f565b80611a30576001600160a01b038216600090815260186020526040812055611a4b565b426001600160a01b0383166000908152601860205260409020555b6001600160a01b03821660008181526017602052604090819020839055517f386537fa92edc3319af95f1f904dcf1900021e4f3f4e08169a577a09076e66b390611a989084815260200190565b60405180910390a25050565b600080600080600080611abb876000806000613ab0565b925092509250826011811115611ad357611ad36152c2565b97919650945092505050565b600080546001600160a01b03163314611afe57611059600160136140f4565b600a80546001600160a01b038481166001600160a01b031983168117909355604080519190921680825260208201939093527f0613b6ee6a04f0d09f390e4d9318894b9f6ac7fd83897cd8d18896ba579c401e910161157a565b6001600160a01b03851660009081526009602052604081205460ff161580611b9957506001600160a01b03851660009081526009602052604090205460ff16155b15611ba85760095b9050611d1e565b6040516395dd919360e01b81526001600160a01b038481166004830152600091908816906395dd919390602401602060405180830381865afa158015611bf2573d6000803e3d6000fd5b505050506040513d601f19601f82011682018060405250810190611c1691906152a9565b9050611c2187612322565b15611c8c5782811015611c875760405162461bcd60e51b815260206004820152602860248201527f43616e206e6f74207265706179206d6f7265207468616e2074686520746f74616044820152676c20626f72726f7760c01b6064820152608401610cdd565b611d18565b600080611c988661416d565b91935090915060009050826011811115611cb457611cb46152c2565b14611cd557816011811115611ccb57611ccb6152c2565b9350505050611d1e565b80611ce1576003611ccb565b6000611cfd60405180602001604052806005548152508561418d565b905080861115611d14576011945050505050611d1e565b5050505b60009150505b95945050505050565b6000546001600160a01b0316331480611d4a57506015546001600160a01b031633145b611db45760405162461bcd60e51b815260206004820152603560248201527f6f6e6c792061646d696e206f7220626f72726f772063617020677561726469616044820152746e2063616e2073657420626f72726f77206361707360581b6064820152608401610cdd565b82818115801590611dc457508082145b611e005760405162461bcd60e51b815260206004820152600d60248201526c1a5b9d985b1a59081a5b9c1d5d609a1b6044820152606401610cdd565b60005b82811015611efc57848482818110611e1d57611e1d61516f565b9050602002013560166000898985818110611e3a57611e3a61516f565b9050602002016020810190611e4f9190614c33565b6001600160a01b03168152602081019190915260400160002055868682818110611e7b57611e7b61516f565b9050602002016020810190611e909190614c33565b6001600160a01b03167f6f1951b2aad10f3fc81b86d91105b413a5b3f847a34bbc5ce1904201b14438f6868684818110611ecc57611ecc61516f565b90506020020135604051611ee291815260200190565b60405180910390a280611ef4816151b2565b915050611e03565b50505050505050565b60005b83518110156120cc576000848281518110611f2557611f2561516f565b6020908102919091018101516001600160a01b0381166000908152600990925260409091205490915060ff16611f955760405162461bcd60e51b81526020600482015260156024820152741b585c9ad95d081b5d5cdd081899481b1a5cdd1959605a1b6044820152606401610cdd565b600184151514156120625760006040518060200160405280836001600160a01b031663aa5af0fd6040518163ffffffff1660e01b8152600401602060405180830381865afa158015611feb573d6000803e3d6000fd5b505050506040513d601f19601f8201168201806040525081019061200f91906152a9565b9052905061201d82826135ef565b60005b875181101561205f5761204d8389838151811061203f5761203f61516f565b6020026020010151846137e2565b80612057816151b2565b915050612020565b50505b600183151514156120b95761207681613dde565b60005b86518110156120b7576120a5828883815181106120985761209861516f565b6020026020010151613f56565b806120af816151b2565b915050612079565b505b50806120c4816151b2565b915050611f08565b5060005b84518110156105365761213a8582815181106120ee576120ee61516f565b60200260200101516014600088858151811061210c5761210c61516f565b60200260200101516001600160a01b03166001600160a01b031681526020019081526020016000205461398b565b601460008784815181106121505761215061516f565b60200260200101516001600160a01b03166001600160a01b03168152602001908152602001600020819055508080612187906151b2565b9150506120d0565b6001600160a01b0381166000908152601760209081526040808320546018909252822054909142916121c29083906135e3565b90506000811180156121d45750600083115b156106225760006121e582856141a5565b6001600160a01b0386166000908152601460205260408120549192509061220c90836135d7565b6001600160a01b0387166000908152601460209081526040808320939093556018905220849055505050505050565b600a546000906001600160a01b031633148061226157506000546001600160a01b031633145b61227d5760405162461bcd60e51b8152600401610cdd90615215565b6000546001600160a01b031633148061229857506001821515145b6122b45760405162461bcd60e51b8152600401610cdd9061525c565b600a8054831515600160b01b0260ff60b01b199091161790556040517fef159d9a32b2472e32b098f954f3ce62d232939f1c207070b584df1814de2de0906114d99084906040808252600890820152672a3930b739b332b960c11b6060820152901515602082015260800190565b6001600160a01b03811660009081526009602052604081206001015415801561236857506001600160a01b0382166000908152600c602052604090205460ff1615156001145b80156110595750816001600160a01b031663173b99046040518163ffffffff1660e01b8152600401602060405180830381865afa1580156123ad573d6000803e3d6000fd5b505050506040513d601f19601f820116820180604052508101906123d191906152a9565b670de0b6b3a76400001492915050565b600080546001600160a01b0316331461240057611059600160126140f4565b6001600160a01b03821660009081526009602052604090205460ff161561242d57611059600a60116140f4565b816001600160a01b031663fe9c44ae6040518163ffffffff1660e01b8152600401602060405180830381865afa15801561246b573d6000803e3d6000fd5b505050506040513d601f19601f8201168201806040525081019061248f91906152d8565b506001600160a01b03821660009081526009602052604081208054600160ff19918216811783556003830180549092169091558101919091556124d1836141b1565b6124da8361429a565b6040516001600160a01b03841681527fcf583bb0c569eb967f806b11601c4cb93c10310485c67add5f8362c2f212321f9060200161157a565b61251b613962565b6125675760405162461bcd60e51b815260206004820152601d60248201527f6f6e6c792061646d696e2063616e2073657420636f6d702073706565640000006044820152606401610cdd565b82518251811480156125795750815181145b6125d75760405162461bcd60e51b815260206004820152602960248201527f436f6d7074726f6c6c65723a3a5f736574436f6d7053706565647320696e76616044820152681b1a59081a5b9c1d5d60ba1b6064820152608401610cdd565b60005b81811015610536576126388582815181106125f7576125f761516f565b60200260200101518583815181106126115761261161516f565b602002602001015185848151811061262b5761262b61516f565b6020026020010151614356565b612641816151b2565b90506125da565b6001600160a01b03811660009081526008602090815260408083208054825181850281018501909352808352606094938301828280156126b157602002820191906000526020600020905b81546001600160a01b03168152600190910190602001808311612693575b5093979650505050505050565b6060600d80548060200260200160405190810160405280929190818152602001828054801561271657602002820191906000526020600020905b81546001600160a01b031681526001909101906020018083116126f8575b5050505050905090565b600a54600090600160b01b900460ff16156127725760405162461bcd60e51b81526020600482015260126024820152711d1c985b9cd9995c881a5cc81c185d5cd95960721b6044820152606401610cdd565b600061277f868685614535565b9050801561278e5790506112f6565b61279786613dde565b6127a18686613f56565b6112f08685613f56565b805160609060008167ffffffffffffffff8111156127cb576127cb614b04565b6040519080825280602002602001820160405280156127f4578160200160208202803683370190505b50905060005b8281101561286b5760008582815181106128165761281661516f565b6020026020010151905061282a81336145ed565b601181111561283b5761283b6152c2565b83838151811061284d5761284d61516f565b60209081029190910101525080612863816151b2565b9150506127fa565b509392505050565b6004805460405163fc57d4df60e01b81526001600160a01b03868116938201939093526000928392839291169063fc57d4df90602401602060405180830381865afa1580156128c6573d6000803e3d6000fd5b505050506040513d601f19601f820116820180604052508101906128ea91906152a9565b6004805460405163fc57d4df60e01b81526001600160a01b038981169382019390935292935060009291169063fc57d4df90602401602060405180830381865afa15801561293c573d6000803e3d6000fd5b505050506040513d601f19601f8201168201806040525081019061296091906152a9565b905081158061296d575080155b1561298157600d6000935093505050612a89565b6000866001600160a01b031663182df0f56040518163ffffffff1660e01b8152600401602060405180830381865afa1580156129c1573d6000803e3d6000fd5b505050506040513d601f19601f820116820180604052508101906129e591906152a9565b905060006129ff6040518060200160405280600081525090565b604080516020808201835260008083528351808301855290815283518083018552600654815284519283019094528882529192612a3b916146e2565b9250612a636040518060200160405280888152506040518060200160405280888152506146e2565b9150612a6f838361472a565b9050612a7b818b61418d565b600099509750505050505050505b935093915050565b600a54600090600160b81b900460ff1615612ae05760405162461bcd60e51b815260206004820152600f60248201526e1cd95a5e99481a5cc81c185d5cd959608a1b6044820152606401610cdd565b6001600160a01b03861660009081526009602052604090205460ff161580612b2157506001600160a01b03851660009081526009602052604090205460ff16155b15612b2d576009611ba1565b846001600160a01b0316635fe3b5676040518163ffffffff1660e01b8152600401602060405180830381865afa158015612b6b573d6000803e3d6000fd5b505050506040513d601f19601f82011682018060405250810190612b8f919061528c565b6001600160a01b0316866001600160a01b0316635fe3b5676040518163ffffffff1660e01b8152600401602060405180830381865afa158015612bd6573d6000803e3d6000fd5b505050506040513d601f19601f82011682018060405250810190612bfa919061528c565b6001600160a01b031614612c0f576002611ba1565b612c1886613dde565b612c228684613f56565b612c2c8685613f56565b60009695505050505050565b6001600160a01b0383166000908152600c602052604081205460ff1615612c945760405162461bcd60e51b815260206004820152601060248201526f189bdc9c9bddc81a5cc81c185d5cd95960821b6044820152606401610cdd565b6001600160a01b03841660009081526009602052604090205460ff16612cbb57600961183d565b6001600160a01b038085166000908152600960209081526040808320938716835260029093019052205460ff16612db857336001600160a01b03851614612d3c5760405162461bcd60e51b815260206004820152601560248201527439b2b73232b91036bab9ba1031329031aa37b5b2b760591b6044820152606401610cdd565b6000612d4833856145ed565b90506000816011811115612d5e57612d5e6152c2565b14612d7d57806011811115612d7557612d756152c2565b915050611585565b6001600160a01b038086166000908152600960209081526040808320938816835260029093019052205460ff16612db657612db66152f5565b505b6004805460405163fc57d4df60e01b81526001600160a01b038781169382019390935291169063fc57d4df90602401602060405180830381865afa158015612e04573d6000803e3d6000fd5b505050506040513d601f19601f82011682018060405250810190612e2891906152a9565b612e3357600d61183d565b6001600160a01b0384166000908152601660205260409020548015612f18576000856001600160a01b03166347bd37186040518163ffffffff1660e01b8152600401602060405180830381865afa158015612e92573d6000803e3d6000fd5b505050506040513d601f19601f82011682018060405250810190612eb691906152a9565b90506000612ec482866135d7565b9050828110612f155760405162461bcd60e51b815260206004820152601960248201527f6d61726b657420626f72726f77206361702072656163686564000000000000006044820152606401610cdd565b50505b600080612f288688600088613ab0565b91935090915060009050826011811115612f4457612f446152c2565b14612f6557816011811115612f5b57612f5b6152c2565b9350505050611585565b8015612f72576004612f5b565b60006040518060200160405280896001600160a01b031663aa5af0fd6040518163ffffffff1660e01b8152600401602060405180830381865afa158015612fbd573d6000803e3d6000fd5b505050506040513d601f19601f82011682018060405250810190612fe191906152a9565b90529050612fef88826135ef565b612ffa8888836137e2565b600098975050505050505050565b6008602052816000526040600020818154811061302457600080fd5b6000918252602090912001546001600160a01b03169150829050565b600080546001600160a01b031633146130665761305f600160066140f4565b9050611059565b6001600160a01b0383166000908152600960205260409020805460ff1661309b57613093600960076140f4565b915050611059565b60408051602080820183528582528251908101909252670c7d713b49da00008252906130c981835190511090565b156130e4576130da600660086140f4565b9350505050611059565b841580159061316057506004805460405163fc57d4df60e01b81526001600160a01b038981169382019390935291169063fc57d4df90602401602060405180830381865afa15801561313a573d6000803e3d6000fd5b505050506040513d601f19601f8201168201806040525081019061315e91906152a9565b155b15613171576130da600d60096140f4565b60018301805490869055604080516001600160a01b0389168152602081018390529081018790527f70483e6592cd5182d45ac970e05bc62cdcc90e9d8ef2c2dbe686cf383bcd7fc59060600160405180910390a16000979650505050505050565b61123d81600d80548060200260200160405190810160405280929190818152602001828054801561322c57602002820191906000526020600020905b81546001600160a01b0316815260019091019060200180831161320e575b505050505061105f565b600080613244858585614535565b90508015613253579050611585565b61325c85613dde565b6132668585613f56565b600095945050505050565b6040516361bfb47160e11b815233600482015260009082908290819081906001600160a01b0385169063c37f68e290602401608060405180830381865afa1580156132c0573d6000803e3d6000fd5b505050506040513d601f19601f820116820180604052508101906132e4919061530b565b50925092509250826000146133495760405162461bcd60e51b815260206004820152602560248201527f657869744d61726b65743a206765744163636f756e74536e617073686f742066604482015264185a5b195960da1b6064820152608401610cdd565b80156133655761335b600c60026140f4565b9695505050505050565b6000613372873385614535565b9050801561339257613387600e600383614764565b979650505050505050565b6001600160a01b0385166000908152600960209081526040808320338452600281019092529091205460ff166133d057600098975050505050505050565b3360009081526002820160209081526040808320805460ff19169055600882528083208054825181850281018501909352808352919290919083018282801561344257602002820191906000526020600020905b81546001600160a01b03168152600190910190602001808311613424575b5050835193945083925060009150505b828110156134a757896001600160a01b03168482815181106134765761347661516f565b60200260200101516001600160a01b03161415613495578091506134a7565b8061349f816151b2565b915050613452565b508181106134b7576134b76152f5565b336000908152600860205260409020805481906134d69060019061519b565b815481106134e6576134e661516f565b9060005260206000200160009054906101000a90046001600160a01b03168183815481106135165761351661516f565b9060005260206000200160006101000a8154816001600160a01b0302191690836001600160a01b031602179055508080548061355457613554615341565b600082815260209020810160001990810180546001600160a01b03191690550190556040517fe699a64c18b07ac5b7301aa273f36a2287239eb9501d81950672794afba29a0d906135bd908c9033906001600160a01b0392831681529116602082015260400190565b60405180910390a160009c9b505050505050505050505050565b60006115858284615357565b6000611585828461519b565b6001600160a01b038216600090815260116020908152604080832060199092528220549091613654425b6040518060400160405280601c81526020017f626c6f636b206e756d62657220657863656564732033322062697473000000008152506147dc565b83549091506000906136769063ffffffff80851691600160e01b9004166135e3565b90506000811180156136885750600083115b156137b75760006136fa876001600160a01b03166347bd37186040518163ffffffff1660e01b8152600401602060405180830381865afa1580156136d0573d6000803e3d6000fd5b505050506040513d601f19601f820116820180604052508101906136f491906152a9565b8761480c565b9050600061370883866141a5565b905060008083116137285760405180602001604052806000815250613732565b613732828461482a565b604080516020810190915288546001600160e01b031681529091506137959061375b9083614865565b5160408051808201909152601a81527f6e657720696e64657820657863656564732032323420626974730000000000006020820152614891565b6001600160e01b0316600160e01b63ffffffff8716021787555061063c915050565b801561063c57835463ffffffff8316600160e01b026001600160e01b03909116178455505050505050565b6001600160a01b03838116600090815260116020908152604080832080546013845282852095881685529490925290912080546001600160e01b039093169081905590918015801561384257506a0c097ce7bc90715b34b9f160241b8210155b1561385857506a0c097ce7bc90715b34b9f160241b5b6000604051806020016040528061386f85856135e3565b90526040516395dd919360e01b81526001600160a01b0388811660048301529192506000916138c291908a16906395dd919390602401602060405180830381865afa1580156136d0573d6000803e3d6000fd5b905060006138d082846148b8565b6001600160a01b038916600090815260146020526040812054919250906138f790836135d7565b6001600160a01b038a811660008181526014602090815260409182902085905581518781529081018b90529394509092918d16917f1fc3ecc087d8d2d15e23d0032af5a47059c3892d003d8e139fdcb6bb327c99a6910160405180910390a350505050505050505050565b600080546001600160a01b031633148061398657506002546001600160a01b031633145b905090565b60008073d86c8d4279ccafbec840c782bcc50d201f2774196040516370a0823160e01b81523060048201529091506000906001600160a01b038316906370a0823190602401602060405180830381865afa1580156139ed573d6000803e3d6000fd5b505050506040513d601f19601f82011682018060405250810190613a1191906152a9565b9050600084118015613a235750808411155b15613aa75760405163a9059cbb60e01b81526001600160a01b0386811660048301526024820186905283169063a9059cbb906044016020604051808303816000875af1158015613a77573d6000803e3d6000fd5b505050506040513d601f19601f82011682018060405250810190613a9b91906152d8565b50600092505050611059565b50919392505050565b6000806000613abd61494e565b6001600160a01b038816600090815260086020908152604080832080548251818502810185019093528083528493830182828015613b2457602002820191906000526020600020905b81546001600160a01b03168152600190910190602001808311613b06575b5050505050905060005b8151811015613d88576000828281518110613b4b57613b4b61516f565b60209081029190910101516040516361bfb47160e11b81526001600160a01b038e811660048301529192509082169063c37f68e290602401608060405180830381865afa158015613ba0573d6000803e3d6000fd5b505050506040513d601f19601f82011682018060405250810190613bc4919061530b565b60808901526060880152604087015293508315613bf057600f60008097509750975050505050506117b6565b60408051602080820183526001600160a01b0384811660008181526009845285902060010154845260c08a01939093528351808301855260808a0151815260e08a015260048054855163fc57d4df60e01b815291820194909452935192169263fc57d4df92602480830193928290030181865afa158015613c75573d6000803e3d6000fd5b505050506040513d601f19601f82011682018060405250810190613c9991906152a9565b60a08601819052613cb957600d60008097509750975050505050506117b6565b604080516020810190915260a0860151815261010086015260c085015160e0860151613cf391613ce8916146e2565b8661010001516146e2565b610120860181905260408601518651613d0d9291906148e1565b855261010085015160608601516020870151613d2a9291906148e1565b60208601526001600160a01b03818116908c161415613d7557613d578561012001518b87602001516148e1565b60208601819052610100860151613d6f918b906148e1565b60208601525b5080613d80816151b2565b915050613b2e565b50602083015183511115613db95760208301518351600091613da99161519b565b60009550955095505050506117b6565b60008084600001518560200151613dd0919061519b565b9550955095505050506117b6565b6001600160a01b0381166000908152601060209081526040808320601a9092528220549091613e0c42613619565b8354909150600090613e2e9063ffffffff80851691600160e01b9004166135e3565b9050600081118015613e405750600083115b15613f2c576000856001600160a01b03166318160ddd6040518163ffffffff1660e01b8152600401602060405180830381865afa158015613e85573d6000803e3d6000fd5b505050506040513d601f19601f82011682018060405250810190613ea991906152a9565b90506000613eb783866141a5565b90506000808311613ed75760405180602001604052806000815250613ee1565b613ee1828461482a565b604080516020810190915288546001600160e01b03168152909150613f0a9061375b9083614865565b6001600160e01b0316600160e01b63ffffffff87160217875550610536915050565b801561053657835463ffffffff8316600160e01b026001600160e01b039091161784555050505050565b6001600160a01b03828116600090815260106020908152604080832080546012845282852095871685529490925290912080546001600160e01b0390931690819055909180158015613fb657506a0c097ce7bc90715b34b9f160241b8210155b15613fcc57506a0c097ce7bc90715b34b9f160241b5b60006040518060200160405280613fe385856135e3565b90526040516370a0823160e01b81526001600160a01b0387811660048301529192506000918816906370a0823190602401602060405180830381865afa158015614031573d6000803e3d6000fd5b505050506040513d601f19601f8201168201806040525081019061405591906152a9565b9050600061406382846148b8565b6001600160a01b0388166000908152601460205260408120549192509061408a90836135d7565b6001600160a01b0389811660008181526014602090815260409182902085905581518781529081018b90529394509092918c16917f2caecd17d02f56fa897705dcc740da2d237c373f70686f4e0d9bd3bf0400ea7a910160405180910390a3505050505050505050565b60007f45b96fe442630264581b197e84bbada861235052c5a1aadfff9ea4e40a969aa0836011811115614129576141296152c2565b83601381111561413b5761413b6152c2565b60408051928352602083019190915260009082015260600160405180910390a1826011811115611585576115856152c2565b6000806000614180846000806000613ab0565b9250925092509193909250565b60008061419a8484614902565b90506112f68161492a565b6000611585828461536f565b60005b600d5481101561424757816001600160a01b0316600d82815481106141db576141db61516f565b6000918252602090912001546001600160a01b031614156142355760405162461bcd60e51b81526020600482015260146024820152731b585c9ad95d08185b1c9958591e48185919195960621b6044820152606401610cdd565b8061423f816151b2565b9150506141b4565b50600d80546001810182556000919091527fd7b6990105719101dabeb77144f2a3385c8033acd3af97e9423a695e81ad1eb50180546001600160a01b0319166001600160a01b0392909216919091179055565b60006142a542613619565b6001600160a01b03831660009081526010602090815260408083206011909252909120815492935090916001600160e01b03166142fb5781546001600160e01b0319166a0c097ce7bc90715b34b9f160241b1782555b80546001600160e01b03166143295780546001600160e01b0319166a0c097ce7bc90715b34b9f160241b1781555b805463ffffffff909316600160e01b026001600160e01b0393841681179091558154909216909117905550565b6001600160a01b0383166000908152600960205260409020805460ff166143bf5760405162461bcd60e51b815260206004820152601960248201527f636f6d70206d61726b6574206973206e6f74206c6973746564000000000000006044820152606401610cdd565b6001600160a01b0384166000908152601a6020526040902054831461443d576143e784613dde565b6001600160a01b0384166000818152601a602052604090819020859055517fdeafccd0c0b768b2529f7dcbbe58e155d6023059150b7490ed4535cc3744b92d906144349086815260200190565b60405180910390a25b6001600160a01b03841660009081526019602052604090205482146106225760006040518060200160405280866001600160a01b031663aa5af0fd6040518163ffffffff1660e01b8152600401602060405180830381865afa1580156144a7573d6000803e3d6000fd5b505050506040513d601f19601f820116820180604052508101906144cb91906152a9565b905290506144d985826135ef565b6001600160a01b03851660008181526019602052604090819020859055517f20af8e791cc98f74b2d7a391c80980ca8e5aebf3d4060bf581997b6acae2e537906145269086815260200190565b60405180910390a25050505050565b6001600160a01b03831660009081526009602052604081205460ff1661455c57600961183d565b6001600160a01b038085166000908152600960209081526040808320938716835260029093019052205460ff1661459457600061183d565b6000806145a48587866000613ab0565b919350909150600090508260118111156145c0576145c06152c2565b146145e0578160118111156145d7576145d76152c2565b92505050611585565b8015612c2c5760046145d7565b6001600160a01b0382166000908152600960205260408120805460ff16614618576009915050611059565b6001600160a01b038316600090815260028201602052604090205460ff1615156001141561464a576000915050611059565b6001600160a01b03838116600081815260028401602090815260408083208054600160ff199091168117909155600883528184208054918201815584529282902090920180546001600160a01b031916948916948517905581519384528301919091527f3ab23ab0d51cccc0c3085aec51f99228625aa1a922b3a8ca89a26b0f2027a1a5910160405180910390a15060009392505050565b6040805160208101909152600081526040518060200160405280670de0b6b3a7640000614717866000015186600001516141a5565b614721919061538e565b90529392505050565b604080516020810190915260008152604051806020016040528061472161475d8660000151670de0b6b3a76400006141a5565b8551614942565b60007f45b96fe442630264581b197e84bbada861235052c5a1aadfff9ea4e40a969aa0846011811115614799576147996152c2565b8460138111156147ab576147ab6152c2565b604080519283526020830191909152810184905260600160405180910390a18360118111156112f6576112f66152c2565b60008164010000000084106148045760405162461bcd60e51b8152600401610cdd91906153b0565b509192915050565b600061158561482384670de0b6b3a76400006141a5565b8351614942565b604080516020810190915260008152604051806020016040528061472161485f866a0c097ce7bc90715b34b9f160241b6141a5565b85614942565b6040805160208101909152600081526040518060200160405280614721856000015185600001516135d7565b600081600160e01b84106148045760405162461bcd60e51b8152600401610cdd91906153b0565b60006a0c097ce7bc90715b34b9f160241b6148d78484600001516141a5565b611585919061538e565b6000806148ee8585614902565b9050611d1e6148fc8261492a565b846135d7565b60408051602081019091526000815260405180602001604052806147218560000151856141a5565b805160009061105990670de0b6b3a76400009061538e565b6000611585828461538e565b60405180610140016040528060008152602001600081526020016000815260200160008152602001600081526020016000815260200161499a6040518060200160405280600081525090565b81526020016149b56040518060200160405280600081525090565b81526020016149d06040518060200160405280600081525090565b81526020016149eb6040518060200160405280600081525090565b905290565b60008083601f840112614a0257600080fd5b50813567ffffffffffffffff811115614a1a57600080fd5b6020830191508360208260051b8501011115614a3557600080fd5b9250929050565b60008060008060408587031215614a5257600080fd5b843567ffffffffffffffff80821115614a6a57600080fd5b614a76888389016149f0565b90965094506020870135915080821115614a8f57600080fd5b50614a9c878288016149f0565b95989497509550505050565b6001600160a01b038116811461123d57600080fd5b801515811461123d57600080fd5b60008060408385031215614ade57600080fd5b8235614ae981614aa8565b91506020830135614af981614abd565b809150509250929050565b634e487b7160e01b600052604160045260246000fd5b604051601f8201601f1916810167ffffffffffffffff81118282101715614b4357614b43614b04565b604052919050565b600067ffffffffffffffff821115614b6557614b65614b04565b5060051b60200190565b600082601f830112614b8057600080fd5b81356020614b95614b9083614b4b565b614b1a565b82815260059290921b84018101918181019086841115614bb457600080fd5b8286015b84811015614bd8578035614bcb81614aa8565b8352918301918301614bb8565b509695505050505050565b60008060408385031215614bf657600080fd5b8235614c0181614aa8565b9150602083013567ffffffffffffffff811115614c1d57600080fd5b614c2985828601614b6f565b9150509250929050565b600060208284031215614c4557600080fd5b813561158581614aa8565b600080600080600060a08688031215614c6857600080fd5b8535614c7381614aa8565b94506020860135614c8381614aa8565b93506040860135614c9381614aa8565b94979396509394606081013594506080013592915050565b60008060008060808587031215614cc157600080fd5b8435614ccc81614aa8565b93506020850135614cdc81614aa8565b92506040850135614cec81614aa8565b9396929550929360600135925050565b60008060408385031215614d0f57600080fd5b8235614d1a81614aa8565b946020939093013593505050565b600060208284031215614d3a57600080fd5b813561158581614abd565b600060208284031215614d5757600080fd5b5035919050565b60008060008060808587031215614d7457600080fd5b8435614d7f81614aa8565b93506020850135614d8f81614aa8565b93969395505050506040820135916060013590565b60008060008060008060c08789031215614dbd57600080fd5b8635614dc881614aa8565b95506020870135614dd881614aa8565b94506040870135614de881614aa8565b93506060870135614df881614aa8565b9598949750929560808101359460a0909101359350915050565b600080600060608486031215614e2757600080fd5b8335614e3281614aa8565b92506020840135614e4281614aa8565b929592945050506040919091013590565b600080600080600060a08688031215614e6b57600080fd5b8535614e7681614aa8565b94506020860135614e8681614aa8565b93506040860135614e9681614aa8565b92506060860135614ea681614aa8565b949793965091946080013592915050565b600082601f830112614ec857600080fd5b81356020614ed8614b9083614b4b565b82815260059290921b84018101918181019086841115614ef757600080fd5b8286015b84811015614bd8578035614f0e81614aa8565b8352918301918301614efb565b60008060008060808587031215614f3157600080fd5b843567ffffffffffffffff80821115614f4957600080fd5b614f5588838901614eb7565b95506020870135915080821115614f6b57600080fd5b50614f7887828801614b6f565b9350506040850135614f8981614abd565b91506060850135614f9981614abd565b939692955090935050565b60008060408385031215614fb757600080fd5b8235614fc281614aa8565b91506020830135614af981614aa8565b600082601f830112614fe357600080fd5b81356020614ff3614b9083614b4b565b82815260059290921b8401810191818101908684111561501257600080fd5b8286015b84811015614bd85780358352918301918301615016565b60008060006060848603121561504257600080fd5b833567ffffffffffffffff8082111561505a57600080fd5b61506687838801614b6f565b9450602086013591508082111561507c57600080fd5b61508887838801614fd2565b9350604086013591508082111561509e57600080fd5b506150ab86828701614fd2565b9150509250925092565b6020808252825182820181905260009190848201906040850190845b818110156150f65783516001600160a01b0316835292840192918401916001016150d1565b50909695505050505050565b60006020828403121561511457600080fd5b813567ffffffffffffffff81111561512b57600080fd5b6112f684828501614eb7565b6020808252825182820181905260009190848201906040850190845b818110156150f657835183529284019291840191600101615153565b634e487b7160e01b600052603260045260246000fd5b634e487b7160e01b600052601160045260246000fd5b6000828210156151ad576151ad615185565b500390565b60006000198214156151c6576151c6615185565b5060010190565b60208082526028908201527f63616e6e6f742070617573652061206d61726b65742074686174206973206e6f6040820152671d081b1a5cdd195960c21b606082015260800190565b60208082526027908201527f6f6e6c7920706175736520677561726469616e20616e642061646d696e2063616040820152666e20706175736560c81b606082015260800190565b6020808252601690820152756f6e6c792061646d696e2063616e20756e706175736560501b604082015260600190565b60006020828403121561529e57600080fd5b815161158581614aa8565b6000602082840312156152bb57600080fd5b5051919050565b634e487b7160e01b600052602160045260246000fd5b6000602082840312156152ea57600080fd5b815161158581614abd565b634e487b7160e01b600052600160045260246000fd5b6000806000806080858703121561532157600080fd5b505082516020840151604085015160609095015191969095509092509050565b634e487b7160e01b600052603160045260246000fd5b6000821982111561536a5761536a615185565b500190565b600081600019048311821515161561538957615389615185565b500290565b6000826153ab57634e487b7160e01b600052601260045260246000fd5b500490565b600060208083528351808285015260005b818110156153dd578581018301518582016040015282016153c1565b818111156153ef576000604083870101525b50601f01601f191692909201604001939250505056fea2646970667358221220e8ebe49b2e7b498ccb9b786dc415308a311b4018cfe83d434e848377b0108e7964736f6c634300080a0033",
  "devdoc": {
    "author": "Compound",
    "kind": "dev",
    "methods": {
      "_grantComp(address,uint256)": {
        "details": "Note: If there is not enough COMP, we do not perform the transfer all.",
        "params": {
          "amount": "The amount of COMP to (possibly) transfer",
          "recipient": "The address of the recipient to transfer COMP to"
        }
      },
      "_setBorrowCapGuardian(address)": {
        "params": {
          "newBorrowCapGuardian": "The address of the new Borrow Cap Guardian"
        }
      },
      "_setCloseFactor(uint256)": {
        "details": "Admin function to set closeFactor",
        "params": {
          "newCloseFactorMantissa": "New close factor, scaled by 1e18"
        },
        "returns": {
          "_0": "uint 0=success, otherwise a failure"
        }
      },
      "_setCollateralFactor(address,uint256)": {
        "details": "Admin function to set per-market collateralFactor",
        "params": {
          "cToken": "The market to set the factor on",
          "newCollateralFactorMantissa": "The new collateral factor, scaled by 1e18"
        },
        "returns": {
          "_0": "uint 0=success, otherwise a failure. (See ErrorReporter for details)"
        }
      },
      "_setCompSpeeds(address[],uint256[],uint256[])": {
        "params": {
          "borrowSpeeds": "New borrow-side COMP speed for the corresponding market.",
          "cTokens": "The markets whose COMP speed to update.",
          "supplySpeeds": "New supply-side COMP speed for the corresponding market."
        }
      },
      "_setContributorCompSpeed(address,uint256)": {
        "params": {
          "compSpeed": "New COMP speed for contributor",
          "contributor": "The contributor whose COMP speed to update"
        }
      },
      "_setLiquidationIncentive(uint256)": {
        "details": "Admin function to set liquidationIncentive",
        "params": {
          "newLiquidationIncentiveMantissa": "New liquidationIncentive scaled by 1e18"
        },
        "returns": {
          "_0": "uint 0=success, otherwise a failure. (See ErrorReporter for details)"
        }
      },
      "_setMarketBorrowCaps(address[],uint256[])": {
        "details": "Admin or borrowCapGuardian function to set the borrow caps. A borrow cap of 0 corresponds to unlimited borrowing.",
        "params": {
          "cTokens": "The addresses of the markets (tokens) to change the borrow caps for",
          "newBorrowCaps": "The new borrow cap values in underlying to be set. A value of 0 corresponds to unlimited borrowing."
        }
      },
      "_setPauseGuardian(address)": {
        "params": {
          "newPauseGuardian": "The address of the new Pause Guardian"
        },
        "returns": {
          "_0": "uint 0=success, otherwise a failure. (See enum Error for details)"
        }
      },
      "_setPriceOracle(address)": {
        "details": "Admin function to set a new price oracle",
        "returns": {
          "_0": "uint 0=success, otherwise a failure (see ErrorReporter.sol for details)"
        }
      },
      "_supportMarket(address)": {
        "details": "Admin function to set isListed and add support for the market",
        "params": {
          "cToken": "The address of the market (token) to list"
        },
        "returns": {
          "_0": "uint 0=success, otherwise a failure. (See enum Error for details)"
        }
      },
      "borrowAllowed(address,address,uint256)": {
        "params": {
          "borrowAmount": "The amount of underlying the account would borrow",
          "borrower": "The account which would borrow the asset",
          "cToken": "The market to verify the borrow against"
        },
        "returns": {
          "_0": "0 if the borrow is allowed, otherwise a semi-opaque error code (See ErrorReporter.sol)"
        }
      },
      "borrowVerify(address,address,uint256)": {
        "params": {
          "borrowAmount": "The amount of the underlying asset requested to borrow",
          "borrower": "The address borrowing the underlying",
          "cToken": "Asset whose underlying is being borrowed"
        }
      },
      "checkMembership(address,address)": {
        "params": {
          "account": "The address of the account to check",
          "cToken": "The cToken to check"
        },
        "returns": {
          "_0": "True if the account is in the asset, otherwise false."
        }
      },
      "claimComp(address)": {
        "params": {
          "holder": "The address to claim COMP for"
        }
      },
      "claimComp(address,address[])": {
        "params": {
          "cTokens": "The list of markets to claim COMP in",
          "holder": "The address to claim COMP for"
        }
      },
      "claimComp(address[],address[],bool,bool)": {
        "params": {
          "borrowers": "Whether or not to claim COMP earned by borrowing",
          "cTokens": "The list of markets to claim COMP in",
          "holders": "The addresses to claim COMP for",
          "suppliers": "Whether or not to claim COMP earned by supplying"
        }
      },
      "enterMarkets(address[])": {
        "params": {
          "cTokens": "The list of addresses of the cToken markets to be enabled"
        },
        "returns": {
          "_0": "Success indicator for whether each corresponding market was entered"
        }
      },
      "exitMarket(address)": {
        "details": "Sender must not have an outstanding borrow balance in the asset,  or be providing necessary collateral for an outstanding borrow.",
        "params": {
          "cTokenAddress": "The address of the asset to be removed"
        },
        "returns": {
          "_0": "Whether or not the account successfully exited the market"
        }
      },
      "getAccountLiquidity(address)": {
        "returns": {
          "_0": "(possible error code (semi-opaque), account liquidity in excess of collateral requirements,          account shortfall below collateral requirements)"
        }
      },
      "getAllMarkets()": {
        "details": "The automatic getter may be used to access an individual market.",
        "returns": {
          "_0": "The list of market addresses"
        }
      },
      "getAssetsIn(address)": {
        "params": {
          "account": "The address of the account to pull assets for"
        },
        "returns": {
          "_0": "A dynamic list with the assets the account has entered"
        }
      },
      "getCompAddress()": {
        "returns": {
          "_0": "The address of MARE"
        }
      },
      "getHypotheticalAccountLiquidity(address,address,uint256,uint256)": {
        "params": {
          "account": "The account to determine liquidity for",
          "borrowAmount": "The amount of underlying to hypothetically borrow",
          "cTokenModify": "The market to hypothetically redeem/borrow in",
          "redeemTokens": "The number of tokens to hypothetically redeem"
        },
        "returns": {
          "_0": "(possible error code (semi-opaque), hypothetical account liquidity in excess of collateral requirements,          hypothetical account shortfall below collateral requirements)"
        }
      },
      "isDeprecated(address)": {
        "details": "All borrows in a deprecated cToken market can be immediately liquidated",
        "params": {
          "cToken": "The market to check if deprecated"
        }
      },
      "liquidateBorrowAllowed(address,address,address,address,uint256)": {
        "params": {
          "borrower": "The address of the borrower",
          "cTokenBorrowed": "Asset which was borrowed by the borrower",
          "cTokenCollateral": "Asset which was used as collateral and will be seized",
          "liquidator": "The address repaying the borrow and seizing the collateral",
          "repayAmount": "The amount of underlying being repaid"
        }
      },
      "liquidateBorrowVerify(address,address,address,address,uint256,uint256)": {
        "params": {
          "actualRepayAmount": "The amount of underlying being repaid",
          "borrower": "The address of the borrower",
          "cTokenBorrowed": "Asset which was borrowed by the borrower",
          "cTokenCollateral": "Asset which was used as collateral and will be seized",
          "liquidator": "The address repaying the borrow and seizing the collateral"
        }
      },
      "liquidateCalculateSeizeTokens(address,address,uint256)": {
        "details": "Used in liquidation (called in cToken.liquidateBorrowFresh)",
        "params": {
          "actualRepayAmount": "The amount of cTokenBorrowed underlying to convert into cTokenCollateral tokens",
          "cTokenBorrowed": "The address of the borrowed cToken",
          "cTokenCollateral": "The address of the collateral cToken"
        },
        "returns": {
          "_0": "(errorCode, number of cTokenCollateral tokens to be seized in a liquidation)"
        }
      },
      "mintAllowed(address,address,uint256)": {
        "params": {
          "cToken": "The market to verify the mint against",
          "mintAmount": "The amount of underlying being supplied to the market in exchange for tokens",
          "minter": "The account which would get the minted tokens"
        },
        "returns": {
          "_0": "0 if the mint is allowed, otherwise a semi-opaque error code (See ErrorReporter.sol)"
        }
      },
      "mintVerify(address,address,uint256,uint256)": {
        "params": {
          "actualMintAmount": "The amount of the underlying asset being minted",
          "cToken": "Asset being minted",
          "mintTokens": "The number of tokens being minted",
          "minter": "The address minting the tokens"
        }
      },
      "redeemAllowed(address,address,uint256)": {
        "params": {
          "cToken": "The market to verify the redeem against",
          "redeemTokens": "The number of cTokens to exchange for the underlying asset in the market",
          "redeemer": "The account which would redeem the tokens"
        },
        "returns": {
          "_0": "0 if the redeem is allowed, otherwise a semi-opaque error code (See ErrorReporter.sol)"
        }
      },
      "redeemVerify(address,address,uint256,uint256)": {
        "params": {
          "cToken": "Asset being redeemed",
          "redeemAmount": "The amount of the underlying asset being redeemed",
          "redeemTokens": "The number of tokens being redeemed",
          "redeemer": "The address redeeming the tokens"
        }
      },
      "repayBorrowAllowed(address,address,address,uint256)": {
        "params": {
          "borrower": "The account which would borrowed the asset",
          "cToken": "The market to verify the repay against",
          "payer": "The account which would repay the asset",
          "repayAmount": "The amount of the underlying asset the account would repay"
        },
        "returns": {
          "_0": "0 if the repay is allowed, otherwise a semi-opaque error code (See ErrorReporter.sol)"
        }
      },
      "repayBorrowVerify(address,address,address,uint256,uint256)": {
        "params": {
          "actualRepayAmount": "The amount of underlying being repaid",
          "borrower": "The address of the borrower",
          "cToken": "Asset being repaid",
          "payer": "The address repaying the borrow"
        }
      },
      "seizeAllowed(address,address,address,address,uint256)": {
        "params": {
          "borrower": "The address of the borrower",
          "cTokenBorrowed": "Asset which was borrowed by the borrower",
          "cTokenCollateral": "Asset which was used as collateral and will be seized",
          "liquidator": "The address repaying the borrow and seizing the collateral",
          "seizeTokens": "The number of collateral tokens to seize"
        }
      },
      "seizeVerify(address,address,address,address,uint256)": {
        "params": {
          "borrower": "The address of the borrower",
          "cTokenBorrowed": "Asset which was borrowed by the borrower",
          "cTokenCollateral": "Asset which was used as collateral and will be seized",
          "liquidator": "The address repaying the borrow and seizing the collateral",
          "seizeTokens": "The number of collateral tokens to seize"
        }
      },
      "transferAllowed(address,address,address,uint256)": {
        "params": {
          "cToken": "The market to verify the transfer against",
          "dst": "The account which receives the tokens",
          "src": "The account which sources the tokens",
          "transferTokens": "The number of cTokens to transfer"
        },
        "returns": {
          "_0": "0 if the transfer is allowed, otherwise a semi-opaque error code (See ErrorReporter.sol)"
        }
      },
      "transferVerify(address,address,address,uint256)": {
        "params": {
          "cToken": "Asset being transferred",
          "dst": "The account which receives the tokens",
          "src": "The account which sources the tokens",
          "transferTokens": "The number of cTokens to transfer"
        }
      },
      "updateContributorRewards(address)": {
        "params": {
          "contributor": "The address to calculate contributor rewards for"
        }
      }
    },
    "title": "Compound's Comptroller Contract",
    "version": 1
  },
  "userdoc": {
    "events": {
      "ActionPaused(address,string,bool)": {
        "notice": "Emitted when an action is paused on a market"
      },
      "ActionPaused(string,bool)": {
        "notice": "Emitted when an action is paused globally"
      },
      "CompAccruedAdjusted(address,uint256,uint256)": {
        "notice": "Emitted when COMP accrued for a user has been manually adjusted."
      },
      "CompBorrowSpeedUpdated(address,uint256)": {
        "notice": "Emitted when a new borrow-side COMP speed is calculated for a market"
      },
      "CompGranted(address,uint256)": {
        "notice": "Emitted when COMP is granted by admin"
      },
      "CompReceivableUpdated(address,uint256,uint256)": {
        "notice": "Emitted when COMP receivable for a user has been updated."
      },
      "CompSupplySpeedUpdated(address,uint256)": {
        "notice": "Emitted when a new supply-side COMP speed is calculated for a market"
      },
      "ContributorCompSpeedUpdated(address,uint256)": {
        "notice": "Emitted when a new COMP speed is set for a contributor"
      },
      "DistributedBorrowerComp(address,address,uint256,uint256)": {
        "notice": "Emitted when COMP is distributed to a borrower"
      },
      "DistributedSupplierComp(address,address,uint256,uint256)": {
        "notice": "Emitted when COMP is distributed to a supplier"
      },
      "MarketEntered(address,address)": {
        "notice": "Emitted when an account enters a market"
      },
      "MarketExited(address,address)": {
        "notice": "Emitted when an account exits a market"
      },
      "MarketListed(address)": {
        "notice": "Emitted when an admin supports a market"
      },
      "NewBorrowCap(address,uint256)": {
        "notice": "Emitted when borrow cap for a cToken is changed"
      },
      "NewBorrowCapGuardian(address,address)": {
        "notice": "Emitted when borrow cap guardian is changed"
      },
      "NewCloseFactor(uint256,uint256)": {
        "notice": "Emitted when close factor is changed by admin"
      },
      "NewCollateralFactor(address,uint256,uint256)": {
        "notice": "Emitted when a collateral factor is changed by admin"
      },
      "NewLiquidationIncentive(uint256,uint256)": {
        "notice": "Emitted when liquidation incentive is changed by admin"
      },
      "NewPauseGuardian(address,address)": {
        "notice": "Emitted when pause guardian is changed"
      },
      "NewPriceOracle(address,address)": {
        "notice": "Emitted when price oracle is changed"
      }
    },
    "kind": "user",
    "methods": {
      "_grantComp(address,uint256)": {
        "notice": "Transfer COMP to the recipient"
      },
      "_setBorrowCapGuardian(address)": {
        "notice": "Admin function to change the Borrow Cap Guardian"
      },
      "_setCloseFactor(uint256)": {
        "notice": "Sets the closeFactor used when liquidating borrows"
      },
      "_setCollateralFactor(address,uint256)": {
        "notice": "Sets the collateralFactor for a market"
      },
      "_setCompSpeeds(address[],uint256[],uint256[])": {
        "notice": "Set COMP borrow and supply speeds for the specified markets."
      },
      "_setContributorCompSpeed(address,uint256)": {
        "notice": "Set COMP speed for a single contributor"
      },
      "_setLiquidationIncentive(uint256)": {
        "notice": "Sets liquidationIncentive"
      },
      "_setMarketBorrowCaps(address[],uint256[])": {
        "notice": "Set the given borrow caps for the given cToken markets. Borrowing that brings total borrows to or above borrow cap will revert."
      },
      "_setPauseGuardian(address)": {
        "notice": "Admin function to change the Pause Guardian"
      },
      "_setPriceOracle(address)": {
        "notice": "Sets a new price oracle for the comptroller"
      },
      "_supportMarket(address)": {
        "notice": "Add the market to the markets mapping and set it as listed"
      },
      "accountAssets(address,uint256)": {
        "notice": "Per-account mapping of \"assets you are in\", capped by maxAssets"
      },
      "admin()": {
        "notice": "Administrator for this contract"
      },
      "allMarkets(uint256)": {
        "notice": "A list of all markets"
      },
      "borrowAllowed(address,address,uint256)": {
        "notice": "Checks if the account should be allowed to borrow the underlying asset of the given market"
      },
      "borrowVerify(address,address,uint256)": {
        "notice": "Validates borrow and reverts on rejection. May emit logs."
      },
      "checkMembership(address,address)": {
        "notice": "Returns whether the given account is entered in the given asset"
      },
      "claimComp(address)": {
        "notice": "Claim all the comp accrued by holder in all markets"
      },
      "claimComp(address,address[])": {
        "notice": "Claim all the comp accrued by holder in the specified markets"
      },
      "claimComp(address[],address[],bool,bool)": {
        "notice": "Claim all comp accrued by the holders"
      },
      "closeFactorMantissa()": {
        "notice": "Multiplier used to calculate the maximum repayAmount when liquidating a borrow"
      },
      "compAccrued(address)": {
        "notice": "The COMP accrued but not yet transferred to each user"
      },
      "compBorrowSpeeds(address)": {
        "notice": "The rate at which comp is distributed to the corresponding borrow market (per block)"
      },
      "compBorrowState(address)": {
        "notice": "The COMP market borrow state for each market"
      },
      "compBorrowerIndex(address,address)": {
        "notice": "The COMP borrow index for each market for each borrower as of the last time they accrued COMP"
      },
      "compContributorSpeeds(address)": {
        "notice": "The portion of COMP that each contributor receives per block"
      },
      "compInitialIndex()": {
        "notice": "The initial COMP index for a market"
      },
      "compRate()": {
        "notice": "The rate at which the flywheel distributes COMP, per block"
      },
      "compReceivable(address)": {
        "notice": "Accounting storage mapping account addresses to how much COMP they owe the protocol."
      },
      "compSpeeds(address)": {
        "notice": "The portion of compRate that each market currently receives"
      },
      "compSupplierIndex(address,address)": {
        "notice": "The COMP borrow index for each market for each supplier as of the last time they accrued COMP"
      },
      "compSupplySpeeds(address)": {
        "notice": "The rate at which comp is distributed to the corresponding supply market (per block)"
      },
      "compSupplyState(address)": {
        "notice": "The COMP market supply state for each market"
      },
      "comptrollerImplementation()": {
        "notice": "Active brains of Unitroller"
      },
      "enterMarkets(address[])": {
        "notice": "Add assets to be included in account liquidity calculation"
      },
      "exitMarket(address)": {
        "notice": "Removes asset from sender's account liquidity calculation"
      },
      "fixBadAccruals(address[],uint256[])": {
        "notice": "Delete this function after proposal 65 is executed"
      },
      "getAccountLiquidity(address)": {
        "notice": "Determine the current account liquidity wrt collateral requirements"
      },
      "getAllMarkets()": {
        "notice": "Return all of the markets"
      },
      "getAssetsIn(address)": {
        "notice": "Returns the assets an account has entered"
      },
      "getCompAddress()": {
        "notice": "Return the address of the MARE token"
      },
      "getHypotheticalAccountLiquidity(address,address,uint256,uint256)": {
        "notice": "Determine what the account liquidity would be if the given amounts were redeemed/borrowed"
      },
      "isComptroller()": {
        "notice": "Indicator that this is a Comptroller contract (for inspection)"
      },
      "isDeprecated(address)": {
        "notice": "Returns true if the given cToken market has been deprecated"
      },
      "lastContributorBlock(address)": {
        "notice": "Last block at which a contributor's COMP rewards have been allocated"
      },
      "liquidateBorrowAllowed(address,address,address,address,uint256)": {
        "notice": "Checks if the liquidation should be allowed to occur"
      },
      "liquidateBorrowVerify(address,address,address,address,uint256,uint256)": {
        "notice": "Validates liquidateBorrow and reverts on rejection. May emit logs."
      },
      "liquidateCalculateSeizeTokens(address,address,uint256)": {
        "notice": "Calculate number of tokens of collateral asset to seize given an underlying amount"
      },
      "liquidationIncentiveMantissa()": {
        "notice": "Multiplier representing the discount on collateral that a liquidator receives"
      },
      "markets(address)": {
        "notice": "Official mapping of cTokens -> Market metadata"
      },
      "maxAssets()": {
        "notice": "Max number of assets a single account can participate in (borrow or use as collateral)"
      },
      "mintAllowed(address,address,uint256)": {
        "notice": "Checks if the account should be allowed to mint tokens in the given market"
      },
      "mintVerify(address,address,uint256,uint256)": {
        "notice": "Validates mint and reverts on rejection. May emit logs."
      },
      "oracle()": {
        "notice": "Oracle which gives the price of any given asset"
      },
      "pauseGuardian()": {
        "notice": "The Pause Guardian can pause certain actions as a safety mechanism.  Actions which allow users to remove their own assets cannot be paused.  Liquidation / seizing / transfer can only be paused globally, not by market."
      },
      "pendingAdmin()": {
        "notice": "Pending administrator for this contract"
      },
      "pendingComptrollerImplementation()": {
        "notice": "Pending brains of Unitroller"
      },
      "proposal65FixExecuted()": {
        "notice": "Flag indicating whether the function to fix COMP accruals has been executed (RE: proposal 62 bug)"
      },
      "redeemAllowed(address,address,uint256)": {
        "notice": "Checks if the account should be allowed to redeem tokens in the given market"
      },
      "redeemVerify(address,address,uint256,uint256)": {
        "notice": "Validates redeem and reverts on rejection. May emit logs."
      },
      "repayBorrowAllowed(address,address,address,uint256)": {
        "notice": "Checks if the account should be allowed to repay a borrow in the given market"
      },
      "repayBorrowVerify(address,address,address,uint256,uint256)": {
        "notice": "Validates repayBorrow and reverts on rejection. May emit logs."
      },
      "seizeAllowed(address,address,address,address,uint256)": {
        "notice": "Checks if the seizing of assets should be allowed to occur"
      },
      "seizeVerify(address,address,address,address,uint256)": {
        "notice": "Validates seize and reverts on rejection. May emit logs."
      },
      "transferAllowed(address,address,address,uint256)": {
        "notice": "Checks if the account should be allowed to transfer tokens in the given market"
      },
      "transferVerify(address,address,address,uint256)": {
        "notice": "Validates transfer and reverts on rejection. May emit logs."
      },
      "updateContributorRewards(address)": {
        "notice": "Calculate additional accrued COMP for a contributor since last accrual"
      }
    },
    "version": 1
  },
  "storageLayout": {
    "storage": [
      {
        "astId": 13440,
        "contract": "contracts/Comptroller.sol:Comptroller",
        "label": "admin",
        "offset": 0,
        "slot": "0",
        "type": "t_address"
      },
      {
        "astId": 13443,
        "contract": "contracts/Comptroller.sol:Comptroller",
        "label": "pendingAdmin",
        "offset": 0,
        "slot": "1",
        "type": "t_address"
      },
      {
        "astId": 13446,
        "contract": "contracts/Comptroller.sol:Comptroller",
        "label": "comptrollerImplementation",
        "offset": 0,
        "slot": "2",
        "type": "t_address"
      },
      {
        "astId": 13449,
        "contract": "contracts/Comptroller.sol:Comptroller",
        "label": "pendingComptrollerImplementation",
        "offset": 0,
        "slot": "3",
        "type": "t_address"
      },
      {
        "astId": 13456,
        "contract": "contracts/Comptroller.sol:Comptroller",
        "label": "oracle",
        "offset": 0,
        "slot": "4",
        "type": "t_contract(PriceOracle)23500"
      },
      {
        "astId": 13459,
        "contract": "contracts/Comptroller.sol:Comptroller",
        "label": "closeFactorMantissa",
        "offset": 0,
        "slot": "5",
        "type": "t_uint256"
      },
      {
        "astId": 13462,
        "contract": "contracts/Comptroller.sol:Comptroller",
        "label": "liquidationIncentiveMantissa",
        "offset": 0,
        "slot": "6",
        "type": "t_uint256"
      },
      {
        "astId": 13465,
        "contract": "contracts/Comptroller.sol:Comptroller",
        "label": "maxAssets",
        "offset": 0,
        "slot": "7",
        "type": "t_uint256"
      },
      {
        "astId": 13472,
        "contract": "contracts/Comptroller.sol:Comptroller",
        "label": "accountAssets",
        "offset": 0,
        "slot": "8",
        "type": "t_mapping(t_address,t_array(t_contract(CToken)4908)dyn_storage)"
      },
      {
        "astId": 13492,
        "contract": "contracts/Comptroller.sol:Comptroller",
        "label": "markets",
        "offset": 0,
        "slot": "9",
        "type": "t_mapping(t_address,t_struct(Market)13486_storage)"
      },
      {
        "astId": 13495,
        "contract": "contracts/Comptroller.sol:Comptroller",
        "label": "pauseGuardian",
        "offset": 0,
        "slot": "10",
        "type": "t_address"
      },
      {
        "astId": 13497,
        "contract": "contracts/Comptroller.sol:Comptroller",
        "label": "_mintGuardianPaused",
        "offset": 20,
        "slot": "10",
        "type": "t_bool"
      },
      {
        "astId": 13499,
        "contract": "contracts/Comptroller.sol:Comptroller",
        "label": "_borrowGuardianPaused",
        "offset": 21,
        "slot": "10",
        "type": "t_bool"
      },
      {
        "astId": 13501,
        "contract": "contracts/Comptroller.sol:Comptroller",
        "label": "transferGuardianPaused",
        "offset": 22,
        "slot": "10",
        "type": "t_bool"
      },
      {
        "astId": 13503,
        "contract": "contracts/Comptroller.sol:Comptroller",
        "label": "seizeGuardianPaused",
        "offset": 23,
        "slot": "10",
        "type": "t_bool"
      },
      {
        "astId": 13507,
        "contract": "contracts/Comptroller.sol:Comptroller",
        "label": "mintGuardianPaused",
        "offset": 0,
        "slot": "11",
        "type": "t_mapping(t_address,t_bool)"
      },
      {
        "astId": 13511,
        "contract": "contracts/Comptroller.sol:Comptroller",
        "label": "borrowGuardianPaused",
        "offset": 0,
        "slot": "12",
        "type": "t_mapping(t_address,t_bool)"
      },
      {
        "astId": 13524,
        "contract": "contracts/Comptroller.sol:Comptroller",
        "label": "allMarkets",
        "offset": 0,
        "slot": "13",
        "type": "t_array(t_contract(CToken)4908)dyn_storage"
      },
      {
        "astId": 13527,
        "contract": "contracts/Comptroller.sol:Comptroller",
        "label": "compRate",
        "offset": 0,
        "slot": "14",
        "type": "t_uint256"
      },
      {
        "astId": 13532,
        "contract": "contracts/Comptroller.sol:Comptroller",
        "label": "compSpeeds",
        "offset": 0,
        "slot": "15",
        "type": "t_mapping(t_address,t_uint256)"
      },
      {
        "astId": 13538,
        "contract": "contracts/Comptroller.sol:Comptroller",
        "label": "compSupplyState",
        "offset": 0,
        "slot": "16",
        "type": "t_mapping(t_address,t_struct(CompMarketState)13519_storage)"
      },
      {
        "astId": 13544,
        "contract": "contracts/Comptroller.sol:Comptroller",
        "label": "compBorrowState",
        "offset": 0,
        "slot": "17",
        "type": "t_mapping(t_address,t_struct(CompMarketState)13519_storage)"
      },
      {
        "astId": 13551,
        "contract": "contracts/Comptroller.sol:Comptroller",
        "label": "compSupplierIndex",
        "offset": 0,
        "slot": "18",
        "type": "t_mapping(t_address,t_mapping(t_address,t_uint256))"
      },
      {
        "astId": 13558,
        "contract": "contracts/Comptroller.sol:Comptroller",
        "label": "compBorrowerIndex",
        "offset": 0,
        "slot": "19",
        "type": "t_mapping(t_address,t_mapping(t_address,t_uint256))"
      },
      {
        "astId": 13563,
        "contract": "contracts/Comptroller.sol:Comptroller",
        "label": "compAccrued",
        "offset": 0,
        "slot": "20",
        "type": "t_mapping(t_address,t_uint256)"
      },
      {
        "astId": 13568,
        "contract": "contracts/Comptroller.sol:Comptroller",
        "label": "borrowCapGuardian",
        "offset": 0,
        "slot": "21",
        "type": "t_address"
      },
      {
        "astId": 13572,
        "contract": "contracts/Comptroller.sol:Comptroller",
        "label": "borrowCaps",
        "offset": 0,
        "slot": "22",
        "type": "t_mapping(t_address,t_uint256)"
      },
      {
        "astId": 13580,
        "contract": "contracts/Comptroller.sol:Comptroller",
        "label": "compContributorSpeeds",
        "offset": 0,
        "slot": "23",
        "type": "t_mapping(t_address,t_uint256)"
      },
      {
        "astId": 13585,
        "contract": "contracts/Comptroller.sol:Comptroller",
        "label": "lastContributorBlock",
        "offset": 0,
        "slot": "24",
        "type": "t_mapping(t_address,t_uint256)"
      },
      {
        "astId": 13593,
        "contract": "contracts/Comptroller.sol:Comptroller",
        "label": "compBorrowSpeeds",
        "offset": 0,
        "slot": "25",
        "type": "t_mapping(t_address,t_uint256)"
      },
      {
        "astId": 13598,
        "contract": "contracts/Comptroller.sol:Comptroller",
        "label": "compSupplySpeeds",
        "offset": 0,
        "slot": "26",
        "type": "t_mapping(t_address,t_uint256)"
      },
      {
        "astId": 13604,
        "contract": "contracts/Comptroller.sol:Comptroller",
        "label": "proposal65FixExecuted",
        "offset": 0,
        "slot": "27",
        "type": "t_bool"
      },
      {
        "astId": 13609,
        "contract": "contracts/Comptroller.sol:Comptroller",
        "label": "compReceivable",
        "offset": 0,
        "slot": "28",
        "type": "t_mapping(t_address,t_uint256)"
      }
    ],
    "types": {
      "t_address": {
        "encoding": "inplace",
        "label": "address",
        "numberOfBytes": "20"
      },
      "t_array(t_contract(CToken)4908)dyn_storage": {
        "base": "t_contract(CToken)4908",
        "encoding": "dynamic_array",
        "label": "contract CToken[]",
        "numberOfBytes": "32"
      },
      "t_bool": {
        "encoding": "inplace",
        "label": "bool",
        "numberOfBytes": "1"
      },
      "t_contract(CToken)4908": {
        "encoding": "inplace",
        "label": "contract CToken",
        "numberOfBytes": "20"
      },
      "t_contract(PriceOracle)23500": {
        "encoding": "inplace",
        "label": "contract PriceOracle",
        "numberOfBytes": "20"
      },
      "t_mapping(t_address,t_array(t_contract(CToken)4908)dyn_storage)": {
        "encoding": "mapping",
        "key": "t_address",
        "label": "mapping(address => contract CToken[])",
        "numberOfBytes": "32",
        "value": "t_array(t_contract(CToken)4908)dyn_storage"
      },
      "t_mapping(t_address,t_bool)": {
        "encoding": "mapping",
        "key": "t_address",
        "label": "mapping(address => bool)",
        "numberOfBytes": "32",
        "value": "t_bool"
      },
      "t_mapping(t_address,t_mapping(t_address,t_uint256))": {
        "encoding": "mapping",
        "key": "t_address",
        "label": "mapping(address => mapping(address => uint256))",
        "numberOfBytes": "32",
        "value": "t_mapping(t_address,t_uint256)"
      },
      "t_mapping(t_address,t_struct(CompMarketState)13519_storage)": {
        "encoding": "mapping",
        "key": "t_address",
        "label": "mapping(address => struct ComptrollerV3Storage.CompMarketState)",
        "numberOfBytes": "32",
        "value": "t_struct(CompMarketState)13519_storage"
      },
      "t_mapping(t_address,t_struct(Market)13486_storage)": {
        "encoding": "mapping",
        "key": "t_address",
        "label": "mapping(address => struct ComptrollerV2Storage.Market)",
        "numberOfBytes": "32",
        "value": "t_struct(Market)13486_storage"
      },
      "t_mapping(t_address,t_uint256)": {
        "encoding": "mapping",
        "key": "t_address",
        "label": "mapping(address => uint256)",
        "numberOfBytes": "32",
        "value": "t_uint256"
      },
      "t_struct(CompMarketState)13519_storage": {
        "encoding": "inplace",
        "label": "struct ComptrollerV3Storage.CompMarketState",
        "members": [
          {
            "astId": 13516,
            "contract": "contracts/Comptroller.sol:Comptroller",
            "label": "index",
            "offset": 0,
            "slot": "0",
            "type": "t_uint224"
          },
          {
            "astId": 13518,
            "contract": "contracts/Comptroller.sol:Comptroller",
            "label": "block",
            "offset": 28,
            "slot": "0",
            "type": "t_uint32"
          }
        ],
        "numberOfBytes": "32"
      },
      "t_struct(Market)13486_storage": {
        "encoding": "inplace",
        "label": "struct ComptrollerV2Storage.Market",
        "members": [
          {
            "astId": 13477,
            "contract": "contracts/Comptroller.sol:Comptroller",
            "label": "isListed",
            "offset": 0,
            "slot": "0",
            "type": "t_bool"
          },
          {
            "astId": 13479,
            "contract": "contracts/Comptroller.sol:Comptroller",
            "label": "collateralFactorMantissa",
            "offset": 0,
            "slot": "1",
            "type": "t_uint256"
          },
          {
            "astId": 13483,
            "contract": "contracts/Comptroller.sol:Comptroller",
            "label": "accountMembership",
            "offset": 0,
            "slot": "2",
            "type": "t_mapping(t_address,t_bool)"
          },
          {
            "astId": 13485,
            "contract": "contracts/Comptroller.sol:Comptroller",
            "label": "isComped",
            "offset": 0,
            "slot": "3",
            "type": "t_bool"
          }
        ],
        "numberOfBytes": "128"
      },
      "t_uint224": {
        "encoding": "inplace",
        "label": "uint224",
        "numberOfBytes": "28"
      },
      "t_uint256": {
        "encoding": "inplace",
        "label": "uint256",
        "numberOfBytes": "32"
      },
      "t_uint32": {
        "encoding": "inplace",
        "label": "uint32",
        "numberOfBytes": "4"
      }
    }
  }
}